Orange County,"Orange County is located in the Los Angeles metropolitan area in Southern California. As of the 2020 census, the population was 3,186,989, making it the third-most populous county in California, the sixth most populous in the U.S., and more populous than 21 U.S. states. Although largely suburban, it is the second most densely populated county in the state, behind San Francisco County. The county's three most populous cities are Anaheim, Santa Ana, and Irvine, each of which has a population exceeding 300,000. Santa Ana is also the county seat. Six cities in Orange County are on the Pacific coast, including Seal Beach, Huntington Beach, Newport Beach, Laguna Beach, Dana Point, and San Clemente.Orange County is included in the Los Angeles-Long Beach-Anaheim Metropolitan Statistical Area. The county has 34 incorporated cities. Older cities like Santa Ana, Anaheim, Orange, and Fullerton have traditional downtowns dating back to the 19th century, while newer commercial development or ""edge cities"" stretch along I-5 between Disneyland and Santa Ana and between South Coast Plaza and the Irvine Business Complex, and cluster at Irvine Spectrum. Although single-family homes make up the dominant landscape for most of the county, Northern and Central Orange County is relatively more urbanized and dense as compared to those areas beyond Irvine, which are less dense, though still contiguous and primarily suburban rather than exurban.The county is a tourist center, with attractions like Disneyland, Knott's Berry Farm, Mission San Juan Capistrano, Modjeska House, Segerstrom Center for the Arts, Yost Theater, Bowers Museum, Balboa Island, Angel Stadium, Downtown Santa Ana, the Honda Center, and several popular beaches along its more than 40 miles (64 km) of coastline. It is also home to a major research university, the University of California, Irvine (UCI), along with a number of other notable colleges and universities, including Chapman University, Cal State Fullerton, and Santa Ana College."
Juneau,"The City and Borough of Juneau, more commonly known simply as Juneau ( JOO-noh; Tlingit: Dzánti K'ihéeni [ˈtsʌ́ntʰɪ̀ kʼɪ̀ˈhíːnɪ̀]), is the capital city of the state of Alaska. Located in the Gastineau Channel and the Alaskan panhandle, it is a unified municipality and the second-largest city in the United States by area. Juneau was named the capital of Alaska in 1906, when the government of what was then the District of Alaska was moved from Sitka as dictated by the U.S. Congress in 1900. The municipality unified on July 1, 1970, when the city of Juneau merged with the city of Douglas and the surrounding Greater Juneau Borough to form the current municipality, which is larger by area than both Rhode Island and Delaware.Downtown Juneau (58°18′00″N 134°24′58″W) is nestled at the base of Mount Juneau and across the channel from Douglas Island. As of the 2020 census, the City and Borough had a population of 32,255, making it the third-most populous city in Alaska after Anchorage and Fairbanks. Juneau experiences a daily influx of roughly 6,000 people from visiting cruise ships between the months of May and September.The city is named after a gold prospector from Quebec, Joe Juneau, though the place was for a time called Rockwell and then Harrisburg (after Juneau's co-prospector, Richard Harris). The Tlingit name of the town is Dzántik'i Héeni (""Base of the Flounder's River,"" dzánti 'flounder,' –kʼi 'base,' héen 'river'), and Auke Bay just north of Juneau proper is called Áak'w (""Little lake,"" áa 'lake,' -kʼ 'diminutive') in Tlingit. The Taku River, just south of Juneau, was named after the cold t'aakh wind, which occasionally blows down from the mountains.Juneau is unique among the 49 U.S. capitals on mainland North America in that there are no roads connecting the city to the rest of the state nor North America. Honolulu, Hawaii, is the only other state capital not connected by road to the rest of North America. The absence of a road network is due to the extremely rugged terrain surrounding the city. This in turn makes Juneau a de facto island city in terms of transportation, since all goods coming in and out must go by plane or boat, in spite of the city's location on the Alaskan mainland. Downtown Juneau sits at sea level, with tides averaging 16 feet (5 m), below steep mountains about 3,500 to 4,000 feet (1,100 to 1,200 m) high. Atop these mountains is the Juneau Icefield, a large ice mass from which about 30 glaciers flow; two of these, the Mendenhall Glacier and the Lemon Creek Glacier, are visible from the local road system. The Mendenhall glacier has been gradually retreating; its front face is declining in width and height.The Alaska State Capitol in downtown Juneau was built as the Federal and Territorial Building in 1931. Prior to statehood, it housed federal government offices, the federal courthouse and a post office. It also housed the territorial legislature and many other territorial offices, including that of the governor. Today, Juneau remains the home of the state legislature and the offices of the governor and lieutenant governor. Some other executive branch offices have moved elsewhere in the state."
Kahului,"Kahului Airport (IATA: OGG, ICAO: PHOG, FAA LID: OGG) is the main airport of Maui in the State of Hawaii, United States, located east of Kahului. It has offered full airport operations since 1952. Most flights into Kahului Airport originate from Daniel K. Inouye International Airport in Honolulu; the Honolulu–Kahului corridor is one of the heaviest-trafficked air routes in the US, ranking 13th in 2004 with 1,632,000 passengers.The IATA airport code OGG pays homage to aviation pioneer Bertram J. ""Jimmy"" Hogg, a Kauai native and aviation pioneer who worked for what is now Hawaiian Airlines, flying aircraft ranging from eight-passenger Sikorsky S-38 amphibians to Douglas DC-3s and DC-9s into the late 1960s.It is included in the Federal Aviation Administration (FAA) National Plan of Integrated Airport Systems for 2017–2021, in which it is categorized as a medium-hub primary commercial service facility."
Kansas City,"The Kansas City metropolitan area is a bi-state metropolitan area anchored by Kansas City, Missouri. Its 14 counties straddle the border between the U.S. states of Missouri (9 counties) and Kansas (5 counties). With 8,472 square miles (21,940 km2) and a population of more than 2.2 million people, it is the second-largest metropolitan area centered in Missouri (after Greater St. Louis) and is the largest metropolitan area in Kansas, though Wichita is the largest metropolitan area centered in Kansas. Alongside Kansas City, Missouri, these are the suburbs with populations above 100,000: Overland Park, Kansas; Kansas City, Kansas; Olathe, Kansas; Independence, Missouri; and Lee's Summit, Missouri.Business enterprises and employers include Cerner Corporation (the largest, with almost 10,000 local employees and about 20,000 global employees), AT&T, BNSF Railway, GEICO, Asurion, T-Mobile (formerly Sprint), Black & Veatch, AMC Theatres, Citigroup, Garmin, Hallmark Cards, Waddell & Reed, H&R Block, General Motors, Honeywell, a Ford Motor Company factory, The Kansas City Star, Bayer, Children's Mercy Hospital, Truman Medical Center-Hospital Hill, and Andrews McMeel Universal (representing Garfield, Calvin and Hobbes, and Doonesbury). Shopping centers include City Market, Crown Center, Country Club Plaza, Independence Center, Legends Outlets Kansas City, Oak Park Mall, Ward Parkway Center, and Zona Rosa.Cultural attractions include Union Station, the National World War I Museum, the Nelson-Atkins Museum of Art, Kemper Museum of Contemporary Art, National Agricultural Center and Hall of Fame, Arabia Steamboat Museum, Uptown Theater, Midland Theatre, the Kansas City Zoo, Swope Park (featuring Starlight Theater), Sandstone Amphitheater, the Kansas City Renaissance Festival, Worlds of Fun, Oceans of Fun, and several casinos. Sports franchises include the NFL's Chiefs, the MLB's Royals, the ECHL's Mavericks, Sporting KC & Kansas City Current. Historic features include these: the confluence of the eastern endpoints of the California, Santa Fe, and Oregon Trails in Independence; the Harry S. Truman Historic District; and the neighborhoods of Westport, 18th and Vine, and Pendleton Heights. Historic cultural origins include KC styles of jazz, vaudeville theater, barbecue, and steak.Notable people include these: cartoonists Walt Disney, Friz Freleng, and Ub Iwerks; musicians Count Basie, Melissa Etheridge, Eminem, and Tech N9ne; President Harry S. Truman, Representative Emanuel Cleaver, and historical city boss Tom Pendergast; actors Ed Asner, Ginger Rogers, Don Cheadle, Rob Riggle, Paul Rudd, Scott Foley, Tuc Watkins, and Jason Sudeikis; Kermit the Frog puppeteer Matt Vogel; West Side Story cinematographer Daniel L. Fapp; Marvel Comics writer Jason Aaron; reporter Walter Cronkite; pilot Amelia Earhart; slave turned entrepreneur Hiram Young; and writer Ernest Hemingway."
Keahole,"Ellison Onizuka Kona International Airport at Keāhole (IATA: KOA, ICAO: PHKO, FAA LID: KOA) is the busiest airport on the Island of Hawaiʻi. It is located in Kalaoa CDP, Hawaiʻi County, Hawaiʻi, United States, near the town of Kailua-Kona. The airport serves leeward (western) Hawaiʻi island, including the resorts of the North Kona and South Kohala districts. It is one of two international airports serving Hawaiʻi island, the other being Hilo International Airport on the windward side.It is included in the Federal Aviation Administration (FAA) National Plan of Integrated Airport Systems for 2017–2021, in which it is categorized as a small-hub primary commercial service facility."
New York,None
Saint Louis,None
Allentown,None
Lihue,"Lihue or Līhuʻe is an unincorporated community, census-designated place (CDP) and the county seat of Kauai County, Hawaii, United States. Lihue (pronounced [liːˈhuʔe]) is the second largest town on the Hawaiian island of Kauaʻi after Kapaʻa. As of the 2010 census, the CDP had a population of 6,455, up from 5,694 at the 2000 census."
Little Rock,"Little Rock is the capital and most populous city of the U.S. state of Arkansas. The city's population was 202,591 in 2020 according to the United States Census Bureau. As the county seat of Pulaski County, the city was incorporated on November 7, 1831, on the south bank of the Arkansas River close to the state's geographic center. The city derived its name from a rock formation along the river, named the ""Little Rock"" (French: La Petite Roche) by the French explorer Jean-Baptiste Bénard de la Harpe in the 1720s. The capital of the Arkansas Territory was moved to Little Rock from Arkansas Post in 1821.  The six-county Little Rock–North Little Rock–Conway, AR Metropolitan Statistical Area (MSA) is ranked 78th in terms of population in the United States with 738,344 residents according to the 2017 estimate by the United States Census Bureau.Little Rock is a cultural, economic, government, and transportation center within Arkansas and the South. Several cultural institutions are in Little Rock, such as the Arkansas Museum of Fine Arts, the Arkansas Repertory Theatre, the Arkansas Symphony Orchestra, and the Mosaic Templars Cultural Center, in addition to hiking, boating, and other outdoor recreational opportunities. Little Rock's history is available through history museums, historic districts or neighborhoods of Little Rock like the Quapaw Quarter, and historic sites such as Little Rock Central High School. The city is the headquarters of Dillard's, Windstream Communications, Acxiom, Stephens Inc., University of Arkansas for Medical Sciences, Heifer International, Winrock International, the Clinton Foundation, and the Rose Law Firm. Other corporations, such as Amazon, Dassault Falcon Jet, LM Wind Power, Simmons Bank, Euronet Worldwide, AT&T, and Entergy have large operations in the city. State government is a large employer, with many offices downtown. Two major Interstate highways, Interstate 30 and Interstate 40, meet in Little Rock, with the Port of Little Rock serving as a shipping hub."
Long Beach,"Long Beach is a city in Los Angeles County, California. It is the 42nd-most populous city in the United States, with a population of 466,742 as of 2020. A charter city, Long Beach is the seventh-most populous city in California.Incorporated in 1897, Long Beach lies in Southern California in the southern part of Los Angeles County. Long Beach is approximately 20 miles (32 km) south of downtown Los Angeles, and is part of the Gateway Cities region. The Port of Long Beach is the second busiest container port in the United States and is among the world's largest shipping ports. The city is over an oilfield with minor wells both directly beneath the city as well as offshore.The city is known for its waterfront attractions, including the permanently docked RMS Queen Mary and the Aquarium of the Pacific. Long Beach also hosts the Grand Prix of Long Beach, an IndyCar race and the Long Beach Pride Festival and Parade. California State University, Long Beach, one of the largest universities in California by enrollment, is within the city."
Los Angeles,"Los Angeles (US:  (listen) lawss AN-jəl-əs; Spanish: Los Ángeles [los ˈaŋxeles], lit. 'The Angels'), often referred to by its initials L.A., is the largest city in California. With a 2020 population of 3,898,747, it is the second-largest city in the United States, following New York City. Los Angeles is known for its Mediterranean climate, ethnic and cultural diversity, Hollywood film industry and sprawling metropolitan area.The City of Los Angeles lies in a basin in Southern California, adjacent to the Pacific Ocean, and extends through the Santa Monica Mountains and into the San Fernando Valley, covering a total of about 469 square miles (1,210 km2). It is the seat of Los Angeles County, which is the most populous county in the United States with just over 10 million residents in 2020.Home to the Chumash and Tongva indigenous peoples, the area that became Los Angeles was claimed by Juan Rodríguez Cabrillo for Spain in 1542. The city was founded on September 4, 1781, under Spanish governor Felipe de Neve, on the village of Yaanga. It became a part of Mexico in 1821 following the Mexican War of Independence. In 1848, at the end of the Mexican–American War, Los Angeles and the rest of California were purchased as part of the Treaty of Guadalupe Hidalgo, and thus became part of the United States. Los Angeles was incorporated as a municipality on April 4, 1850, five months before California achieved statehood. The discovery of oil in the 1890s brought rapid growth to the city. The city was further expanded with the completion of the Los Angeles Aqueduct in 1913, which delivers water from Eastern California.Los Angeles has a diverse and robust economy, and hosts businesses in a broad range of professional and cultural fields. It also has the busiest container port in the Americas. In 2018, the Los Angeles metropolitan area had a gross metropolitan product of over $1.0 trillion, making it the city with the third-largest GDP in the world, after Tokyo and New York City. Los Angeles hosted the 1932 and 1984 Summer Olympics and will host the 2028 Summer Olympics. More recently, statewide droughts in California have further strained the city's water security."
Louisville,"Louisville  ( (listen) LOO-ee-vil, US:  (listen) LOO-ə-vəl, locally  (listen) LUUV-əl) is the largest city in the Commonwealth of Kentucky and the 29th most-populous city in the United States. Louisville is the historical seat and, since 2003, the nominal seat of Jefferson County, on the Indiana border.Named after King Louis XVI of France, Louisville was founded in 1778 by George Rogers Clark, making it one of the oldest cities west of the Appalachians. With nearby Falls of the Ohio as the only major obstruction to river traffic between the upper Ohio River and the Gulf of Mexico, the settlement first grew as a portage site. It was the founding city of the Louisville and Nashville Railroad, which grew into a 6,000-mile (9,700 km) system across 13 states.Today, the city is known as the home of boxer Muhammad Ali, the Kentucky Derby, Kentucky Fried Chicken, the University of Louisville and its Cardinals, Louisville Slugger baseball bats, and three of Kentucky's six Fortune 500 companies: Humana, Kindred Healthcare, and Yum! Brands. Muhammad Ali International Airport, Louisville's main commercial airport, hosts UPS's worldwide hub.Since 2003, Louisville's borders have been the same as those of Jefferson County, after a city-county merger. The official name of this consolidated city-county government is the Louisville/Jefferson County Metro Government, abbreviated to Louisville Metro. Despite the merger and renaming, the term ""Jefferson County"" continues to be used in some contexts in reference to Louisville Metro, particularly including the incorporated cities outside the ""balance"" which make up Louisville proper. The city's total consolidated population as of the 2020 census was 782,969. However, the balance total of 633,045 excludes other incorporated places and semiautonomous towns within the county and is the population listed in most sources and national rankings.The Louisville-Jefferson County, KY-IN Metropolitan Statistical Area (MSA) includes Louisville-Jefferson County and 12 surrounding counties, seven in Kentucky and five in Southern Indiana. As of 2019, the MSA had a population of 1,265,108, ranking 46th nationally."
Lubbock,"Lubbock ( LUB-ək)is the 11th-most populous city in the U.S. state of Texas and the county seat of Lubbock County. With a population of 257,141 in 2020, the city is also the 86th-most populous in the United States. The city is in the northwestern part of the state, a region known historically and geographically as the Llano Estacado, and ecologically is part of the southern end of the High Plains, lying at the economic center of the Lubbock metropolitan area, which has an estimated population of 327,424 in 2020.Lubbock's nickname, ""Hub City"", derives from it being the economic, educational, and health-care hub of the multicounty region, north of the Permian Basin and south of the Texas Panhandle, commonly called the South Plains. The area is the largest contiguous cotton-growing region in the world and is heavily dependent on water from the Ogallala Aquifer for irrigation. Lubbock is home to Texas Tech University, the sixth-largest college by enrollment in the state. Lubbock High School has been recognized for three consecutive years by Newsweek as one of the top high schools in the United States, based in part on its International Baccalaureate program."
San Juan,"San Juan (, Spanish: [saŋ ˈxwan]; ""Saint John"") is the capital city and most-populous municipality in the Commonwealth of Puerto Rico, an unincorporated territory of the United States. As of the 2010 census, it is the 46th-largest city under the jurisdiction of the United States, with a population of 395,326. San Juan was founded by Spanish colonists in 1521, who called it Ciudad de Puerto Rico (""City of Puerto Rico"", Spanish for rich port city).Puerto Rico's capital is the third oldest European-established capital city in the Americas, after Santo Domingo, in the Dominican Republic, founded in 1496, and Panama City, in Panama, founded in 1521, and is the oldest European-established city under United States sovereignty. Several historical buildings are located in San Juan; among the most notable are the city's former defensive forts, Fort San Felipe del Morro and Fort San Cristóbal, and La Fortaleza, the oldest executive mansion in continuous use in the Americas.Today, San Juan is Puerto Rico's most important seaport and is the island's financial, cultural, and tourism center. The population of the Metropolitan Statistical Area, including San Juan and the municipalities of Bayamón, Guaynabo, Cataño, Canóvanas, Caguas, Toa Alta, Toa Baja, Carolina and Trujillo Alto, is about 2.6 million inhabitants; thus, about 80% of the population of Puerto Rico now lives and works in this area. San Juan is also a principal city of the San Juan-Caguas-Fajardo Combined Statistical Area. The city has been the host of events within the sports community, including the 1979 Pan American Games; 1966 Central American and Caribbean Games; events of the 2006, 2009 and 2013 World Baseball Classics; the Caribbean Series and the Special Olympics and MLB San Juan Series in 2010.The damage caused in 2017 by Hurricane Maria was extensive. Significant progress had been made in the capital by April 2019, and particularly by October 2019. This was significant for tourism, which had rebounded by October of that year and was close to the pre-Maria era."
Islip,None
Manchester,"Manchester () is the most-populous city and metropolitan borough in North West England and Greater Manchester, England. The city has the country's fifth-largest population at 547,627 (as of 2018),  lying within the United Kingdom's second-most populous urban area with a population of 2.7 million and the third most-populous county at around 2.8 million. It is fringed by the Cheshire Plain to the south, the Pennines to the north and east. The city is surrounded by outlying towns and the neighbouring city of Salford. These two cities and the surrounding towns form a large continuous conurbation. The local authority for the city is Manchester City Council. Manchester is one of the claimants to the unofficial title of  ""second city of the United Kingdom"".The recorded history of Manchester began with the civilian settlement associated with the Roman fort of Mamucium or Mancunium, which was established in about AD 79 on a sandstone bluff near the confluence of the rivers Medlock and Irwell. Although historically and traditionally a part of Lancashire, areas of Cheshire south of the River Mersey were incorporated into Manchester in the 20th century. The first to be included, Wythenshawe, was added to the city in 1931. Throughout the Middle Ages Manchester remained a manorial township, but began to expand ""at an astonishing rate"" around the turn of the 19th century. Manchester's unplanned urbanisation was brought on by a boom in textile manufacture during the Industrial Revolution, and resulted in it becoming the world's first industrialised city. Manchester achieved city status in 1853. The Manchester Ship Canal opened in 1894, creating the Port of Manchester and directly linking the city to the Irish Sea, 36 miles (58 km) to the west. Its fortune declined after the Second World War, owing to deindustrialisation, but the IRA bombing in 1996 led to extensive investment and regeneration. Following successful redevelopment after the IRA bombing, Manchester was the host city for the 2002 Commonwealth Games.The city is notable for its architecture, culture, musical exports, media links, scientific and engineering output, social impact, sports clubs and transport connections. Manchester Liverpool Road railway station was the world's first inter-city passenger railway station. At the University of Manchester, Ernest Rutherford first split the atom in 1917, Frederic C. Williams, Tom Kilburn and Geoff Tootill developed the world's first stored-program computer in 1948, and Andre Geim and Konstantin Novoselov isolated the first graphene in 2004."
Las Vegas,"Las Vegas (; Spanish for ""The Meadows""), often known simply as Vegas, is the 26th-most populous city in the United States, the most populous city in the state of Nevada, and the county seat of Clark County. The city anchors the Las Vegas Valley metropolitan area and is the largest city within the greater Mojave Desert. Las Vegas is an internationally renowned major resort city, known primarily for its gambling, shopping, fine dining, entertainment, and nightlife. The Las Vegas Valley as a whole serves as the leading financial, commercial, and cultural center for Nevada.The city bills itself as The Entertainment Capital of the World, and is famous for its mega casino-hotels and associated activities. It is a top three destination in the United States for business conventions and a global leader in the hospitality industry, claiming more AAA Five Diamond hotels than any other city in the world. Today, Las Vegas annually ranks as one of the world's most visited tourist destinations. The city's tolerance for numerous forms of adult entertainment earned it the title of ""Sin City"", and has made Las Vegas a popular setting for literature, films, television programs, and music videos.Las Vegas was settled in 1905 and officially incorporated in 1911. At the close of the 20th century, it was the most populated North American city founded within that century (a similar distinction was earned by Chicago in the 19th century). Population growth has accelerated since the 1960s, and between 1990 and 2000 the population nearly doubled, increasing by 85.2%. Rapid growth has continued into the 21st century, and according to the United States Census Bureau, the city had 641,903 residents in 2020, with a metropolitan population of 2,227,053.As with most major metropolitan areas, the name of the primary city (""Las Vegas"" in this case) is often used to describe areas beyond official city limits. In the case of Las Vegas, this especially applies to the areas on and near the Las Vegas Strip, which are actually located within the unincorporated communities of Paradise and Winchester. Nevada is the driest state, and Las Vegas is the driest major U.S. city. Over time and influenced by climate change, droughts in Southern Nevada have been increasing in frequency and severity, putting a further strain on Las Vegas's water security."
