David Fincher,NoneRichard Lester,"Richard Lester Liebman (born January 19, 1932), commonly referred to as Dick Lester, is an American film director based in the United Kingdom. He is best known for directing the Beatles' films A Hard Day's Night (1964) and Help! (1965), and the superhero films Superman II (1980) and Superman III (1983). His other notable films as director include The Running Jumping & Standing Still Film (1959), The Knack ...and How to Get It (1965), A Funny Thing Happened on the Way to the Forum (1966), How I Won the War (1967), Petulia (1968), The Three Musketeers (1973) and its two sequels, Robin and Marian (1976), and Butch and Sundance: The Early Days (1979).Lester is an Honorary Associate of London Film School."
Hal Ashby,"William Hal Ashby (September 2, 1929 – December 27, 1988) was an American film director and editor associated with the New Hollywood wave of filmmaking.Before his career as a director Ashby edited films for Norman Jewison, notably The Russians Are Coming, the Russians Are Coming (1966), which earned Ashby an Oscar nomination for Best Editing, and In the Heat of the Night (1967), which earned him his only Oscar for the same category.Ashby received a third Oscar nomination, this time for Best Director for Coming Home (1978).  Other films directed by Ashby include The Landlord (1970), Harold and Maude (1971), The Last Detail (1973), Shampoo (1975), Bound for Glory (1976), and Being There (1979)."
Henry Koster,"Henry Koster (born Hermann Kosterlitz, May 1, 1905 – September 21, 1988) was a German-born film director. He was the husband of actress Peggy Moran."
Michael Mann,None
Michael Lehmann,"Michael Stephen Lehmann (born March 30, 1957) is an American film and television director known for directing the black comedy Heathers."
Peter Jackson,"Sir Peter Robert Jackson  (born 31 October 1961) is a New Zealand film director, screenwriter, and film producer. He is best known as the director, writer, and producer of the Lord of the Rings trilogy (2001–2003) and the Hobbit trilogy (2012–2014), both of which are adapted from the novels of the same name by J. R. R. Tolkien. Other notable films include the critically lauded drama Heavenly Creatures (1994), the horror comedy The Frighteners (1996), the epic monster remake film King Kong (2005), the World War I documentary film They Shall Not Grow Old (2018), and the documentary The Beatles: Get Back (2021). He is the third-highest-grossing film director of all-time, his films having made over $6.5 billion worldwide.Jackson began his career with the ""splatstick"" horror comedy Bad Taste (1987) and the black comedy Meet the Feebles (1989) before filming the zombie comedy Braindead (1992). He shared a nomination for Academy Award for Best Original Screenplay with his partner Fran Walsh for Heavenly Creatures, which brought him to mainstream prominence in the film industry. Jackson has been awarded three Academy Awards for The Lord of the Rings: The Return of the King (2003), including the award for Best Director. His other awards include a Golden Globe, four Saturn Awards and three BAFTAs among others.His production company is WingNut Films, and his most regular collaborators are co-writers and producers Walsh and Philippa Boyens. Jackson was made a Companion of the New Zealand Order of Merit in 2002. He was later knighted (as a Knight Companion of the order) by Anand Satyanand, the Governor-General of New Zealand, at a ceremony in Wellington in April 2010. In December 2014, Jackson was awarded a star on the Hollywood Walk of Fame."
Stephen Frears,"Stephen Arthur Frears (born 20 June 1941) is an English director and producer of film and television often depicting real life stories as well as projects that explore social class through sharply drawn characters.Born in Leicester and educated at Gresham's School and Trinity College, Cambridge, Frears started his career working as an assistant director in theatre and film while directing numerous television plays. In 1971, he directed his first feature film, Gumshoe. After more television work, he won acclaim for the gay romance film, My Beautiful Laundrette (1985), featuring a breakout performance from a young Daniel Day-Lewis. He continued to garner praise with Prick Up Your Ears (1987), a biographical movie about British playwright Joe Orton.  He followed with the American films Dangerous Liaisons (1988) and The Grifters (1990), the latter receiving a nomination for Best Director.In 2000, Frears adaptated Nick Hornby's novel, High Fidelity, into a feature film with John Cusack, whom he had previously directed in The Grifters. In 2002, he directed the drama Dirty Pretty Things with Audrey Tautou and Chiwetel Ejiofor, which addressed the exploitation of illegal immigrant workers in London. In 2006, Frears directed The Queen, that focused on the reaction to the tragic death of Princess Diana in 1997. The film received its debut at the Venice International Film Festival to critical acclaim, with Helen Mirren eventually winning many awards for playing the title role, and Frears himself received his second Academy Award nomination for Best Director. Frears continued to work with exceptional talents such as Judi Dench in the drama Philomena (2013), based on the true story of a woman searching for a child she gave up for adoption in her youth; and Meryl Streep in Florence Foster Jenkins (2016), as a delusional socialite who embarks upon a career as opera singer despite a manifest lack of vocal talent. He also reunited with Dench in Victoria and Abdul (2017), a film about the unlikely friendship between the aging Queen Victoria and her young Indian servant, Abdul Karim.Frears is also known for his work on various television programs, including the Cold War thriller Fail Safe (2000) starring George Clooney, Richard Dreyfus, and Harvey Keitel. Frears won great acclaim for the television film The Deal (2003), about the pact made by Tony Blair and Gordon Brown revolving around the 1994 Labour Party leadership election. In 2013, Frears directed the HBO film Muhammad Ali's Greatest Fight (2013), a drama involving the legal battle over Muhammad Ali's draft-dodging conviction during the Vietnam War starring Frank Langella and Christopher Plummer. He later directed the biographical BBC One/Amazon Prime miniseries A Very English Scandal (2018), in which Hugh Grant played British politician Jeremy Thorpe, and his scandal involving Norman Scott played by Ben Whishaw. His recent work in television includes the comic series State of the Union (2019) starring Rosamund Pike, and Chris O'Dowd, as well as the miniseries Quiz (2020) starring Matthew Macfadyen, Sian Clifford and Michael Sheen, based on a true story about a man who was accused of cheating on the show Who Wants to Be a Millionaire?.He has received two Academy Award nominations and four Primetime Emmy Award nominations, with one win. He has received thirteen British Academy of Film and Television Arts Award nominations, winning three times. In 2003 he received the Lifetime Achievement Award from the Palm Springs International Film Festival. He has won numerous prizes at the Venice Film Festival including the Jaeger-LeCoultre Glory to the Filmmaker Award in 2017. In 2008, The Daily Telegraph named Frears among the 100 most influential people in British culture.In 2009 he received the Commandeur de l'Ordre des Arts et des Lettres."
Fred Zinnemann,"Alfred Zinnemann (April 29, 1907 – March 14, 1997) was an Austrian-born American film director. He won four Academy Awards for directing and producing films in various genres, including thrillers, westerns, film noir and play adaptations. He made 25 feature films during his 50-year career.He was among the first directors to insist on using authentic locations and for mixing stars with civilians to give his films more realism. Within the film industry, he was considered a maverick for taking risks and thereby creating unique films, with many of his stories being dramas about lone and principled individuals tested by tragic events. According to one historian, Zinnemann's style demonstrated his sense of ""psychological realism and his apparent determination to make worthwhile pictures that are nevertheless highly entertaining.""Among his films were The Search (1947), The Men (1950), High Noon (1952), From Here to Eternity (1953), Oklahoma! (1955),  The Nun's Story (1959), A Man For All Seasons (1966), The Day of the Jackal (1973), and Julia (1977). His films have received 65 Oscar nominations, winning 24; Zinnemann himself was nominated for ten, and won Best Director for From Here to Eternity, Best Picture and Best Director for A Man for All Seasons, and Best Documentary, Short Subjects for Benjy (1951).Zinnemann directed and introduced a number of stars in their U.S. film debuts, including Marlon Brando, Rod Steiger, Pier Angeli, Julie Harris, Brandon deWilde, Montgomery Clift, Shirley Jones and Meryl Streep. He directed 19 actors to Oscar nominations, including Frank Sinatra, Montgomery Clift, Audrey Hepburn, Glynis Johns, Paul Scofield, Robert Shaw, Wendy Hiller, Jason Robards, Vanessa Redgrave, Jane Fonda, Gary Cooper and Maximilian Schell."
Howard Hawks,"Howard Winchester Hawks (May 30, 1896 – December 26, 1977) was an American film director, producer and screenwriter of the classic Hollywood era. Critic Leonard Maltin called him ""the greatest American director who is not a household name.""A versatile film director, Hawks explored many genres such as comedies, dramas, gangster films, science fiction, film noir, war films and westerns. His most popular films include Scarface (1932), Bringing Up Baby (1938), Only Angels Have Wings (1939), His Girl Friday (1940), To Have and Have Not (1944), The Big Sleep (1946), Red River (1948), The Thing from Another World (1951), Gentlemen Prefer Blondes (1953), and Rio Bravo (1959). His frequent portrayals of strong, tough-talking female characters came to define the ""Hawksian woman"".In 1942, Hawks was nominated for the Academy Award for Best Director for Sergeant York. In 1974, he was awarded an Honorary Academy Award as ""a master American filmmaker whose creative efforts hold a distinguished place in world cinema."" His work has influenced various popular and respected directors such as Martin Scorsese, Robert Altman, Jean-Luc Godard, John Carpenter, and Quentin Tarantino."
Joel Coen,None
John McTiernan,"John Campbell McTiernan Jr. (born January 8, 1951) is an American filmmaker. He is best known for his action films, especially Predator (1987), Die Hard (1988), and The Hunt for Red October (1990). His later well-known films include the action-comedy-fantasy film Last Action Hero (1993), the action film sequel Die Hard with a Vengeance (1995), the heist-film remake The Thomas Crown Affair (1999), and The 13th Warrior (1999). His last completed feature film was the mystery-thriller Basic, released in 2003.He pleaded guilty to perjury and lying to an FBI investigator in regard to his hiring of the private investigator Anthony Pellicano in late 2000 to illegally wiretap the phone calls of two people, one of whom was Charles Roven, a co-producer of his action film remake Rollerball (2002). He was incarcerated in federal prison from April 2013 to February 2014. During his imprisonment, he filed for bankruptcy amidst foreclosure proceedings for his large ranch residence."
Robert Rossen,None
Ang Lee,None
Akira Kurosawa,"Akira Kurosawa (Japanese: 黒澤 明, Hepburn: Kurosawa Akira, March 23, 1910 – September 6, 1998) was a Japanese filmmaker and painter who directed thirty films in a career spanning over five decades. He is regarded as one of the most important and influential filmmakers in film history.Kurosawa entered the Japanese film industry in 1936, following a brief stint as a painter. After years of working on numerous films as an assistant director and scriptwriter, he made his debut as a director during World War II with the popular action film Sanshiro Sugata. After the war, the critically acclaimed Drunken Angel (1948), in which Kurosawa cast the then little-known actor Toshiro Mifune in a starring role, cemented the director's reputation as one of the most important young filmmakers in Japan. The two men would go on to collaborate on another fifteen films.Rashomon, which premiered in Tokyo, became the surprise winner of the Golden Lion at the 1951 Venice Film Festival. The commercial and critical success of that film opened up Western film markets for the first time to the products of the Japanese film industry, which in turn led to international recognition for other Japanese filmmakers. Kurosawa directed approximately one film per year throughout the 1950s and early 1960s, including a number of highly regarded (and often adapted) films, such as Ikiru (1952), Seven Samurai (1954) and Yojimbo (1961). After the 1960s he became much less prolific; even so, his later work—including two of his final films, Kagemusha (1980) and Ran (1985)—continued to receive great acclaim.In 1990, he accepted the Academy Award for Lifetime Achievement. Posthumously, he was named ""Asian of the Century"" in the ""Arts, Literature, and Culture"" category by AsianWeek magazine and CNN, cited there as being among the five people who most prominently contributed to the improvement of Asia in the 20th century. His career has been honored by many retrospectives, critical studies and biographies in both print and video, and by releases in many consumer media."
Norman Jewison,"Norman Frederick Jewison  (born July 21, 1926) is a Canadian retired film director, producer, screenwriter and founder of the Canadian Film Centre. He has directed numerous feature films and has been nominated for the Academy Award for Best Director three times in three separate decades for In the Heat of the Night (1967), Fiddler on the Roof (1971) and Moonstruck (1987). Other highlights of his directing career include The Cincinnati Kid (1965), The Russians Are Coming, the Russians Are Coming (1966), The Thomas Crown Affair (1968), Jesus Christ Superstar (1973), Rollerball (1975), F.I.S.T. (1978), ...And Justice for All (1979), A Soldier's Story (1984), Agnes of God (1985), Other People's Money (1991), The Hurricane (1999), and The Statement (2003).Jewison has addressed social and political issues throughout his filmmaking career, often making controversial or complicated subjects accessible to mainstream audiences. He has won accolades around the world, including numerous Golden Globe nominations, a BAFTA Award, the Silver Bear for Best Director at the Berlin Film Festival, Lifetime Achievement Awards from both the Directors Guild of Canada and America, and the Irving G. Thalberg Memorial Award at the 71st annual Academy Awards.In 2003, Jewison received the Governor General's Performing Arts Award for Lifetime Artistic Achievement for his multiple contributions to the film industry in Canada."
Kar Wai Wong,"Wong Kar-wai  (born 17 July 1958) is a Hong Kong film director, screenwriter, and producer. His films are characterised by nonlinear narratives, atmospheric music, and vivid cinematography involving bold, saturated colours. A pivotal figure of Hong Kong cinema, Wong is considered a contemporary auteur, and ranks third on Sight & Sound's 2002 poll of the greatest filmmakers of modern times. His films frequently appear on best-of lists domestically and internationally.Born in Shanghai, Wong emigrated to British Hong Kong as a child with his family. He began a career as a screenwriter for soap operas before transitioning to directing with his debut, the crime drama As Tears Go By (1988). While As Tears Go By was fairly successful in Hong Kong, Wong moved away from the contemporary trend of crime and action movies to embark on more personal filmmaking styles. Days of Being Wild (1990), his first venture into such direction, did not perform well at the box office. It however received critical acclaim, and won Best Film and Best Director at the 1991 Hong Kong Film Awards. His next film, Ashes of Time (1994), was met with mixed reception because of its vague plot and atypical take on the wuxia genre.The production of Ashes of Time was time-consuming and left Wong exhausted; he subsequently directed Chungking Express (1994) with hopes of reconciling with filmmaking. The film, expressing a more lighthearted atmosphere, catapulted Wong to international prominence, and won Best Film and Best Director at the 1995 Hong Kong Film Awards. Wong consolidated his worldwide reputation with the 1997 drama Happy Together, for which he won Best Director at the Cannes Film Festival.The 2000 drama In the Mood for Love, revered for its lush visuals and subtle storytelling, concretely established Wong's trademark filmmaking styles. Among his other work are 2046 (2004) and The Grandmaster (2013), both of which received awards and nominations worldwide."
Roland Emmerich,"Roland Emmerich (German: [ˈʁoːlant ˈɛməʁɪç] (listen); born 10 November 1955) is a German film director, screenwriter, and producer. He is widely known for his science fiction and disaster films and has been called a ""master of disaster"" within the industry. His films, most of which are English-language Hollywood productions, have made more than $3 billion worldwide, including just over $1 billion in the United States, making him the country's 15th-highest-grossing director of all time. He began his work in the film industry by directing the film The Noah's Ark Principle (1984) as part of his university thesis and also co-founded Centropolis Entertainment in 1985 with his sister. He is also known for directing films such as Universal Soldier (1992), Stargate (1994), Independence Day (1996), Godzilla (1998), The Patriot (2000), The Day After Tomorrow (2004), 2012 (2009), White House Down (2013), Independence Day: Resurgence (2016), Midway (2019), and most recently, Moonfall (2022). He is a collector of art and an LGBT activist, and is openly gay."
Steven Spielberg,"Steven Allan Spielberg (; born December 18, 1946) is an American film director, producer, and screenwriter. He began his career in the New Hollywood era and is currently the most commercially successful director of all time. Spielberg is the recipient of various accolades, including three Academy Awards (with two for Best Director), a Kennedy Center honor, a Cecil B. DeMille Award, and an AFI Life Achievement Award.Spielberg was born in Cincinnati, Ohio, and grew up in Phoenix, Arizona. He later moved to California and studied film in college. After directing several episodes for television including Night Gallery and Columbo, he directed the television film Duel (1971) which gained him acclaim from critics and audiences. He then made his directorial film debut with The Sugarland Express (1974). The following year he became a household name directing 1975's summer blockbuster Jaws. He then directed box office successes Close Encounters of the Third Kind (1977), E.T. the Extra-Terrestrial (1982), and the Indiana Jones series. Spielberg later explored drama in The Color Purple (1985) and Empire of the Sun (1987).After a brief hiatus, he directed back to back box office successes with the acclaimed science fiction action film Jurassic Park and the holocaust drama Schindler's List (both 1993). In 1998, he directed the World War II epic Saving Private Ryan, which was both a critical and commercial success. Spielberg continued in the 2000s with science fiction, including A.I. Artificial Intelligence (2001), Minority Report (2002), and War of the Worlds (2005). He also directed the children's adventure films The Adventures of Tintin (2011), and Ready Player One (2018), as well as the historical dramas Amistad (1997), Munich (2005), War Horse (2011), Lincoln (2012), Bridge of Spies (2015), The Post (2017), and the musical West Side Story (2021).In addition to filmmaking, he co-founded Amblin Entertainment and DreamWorks, and has served as a producer for many television series and films. Spielberg is also known for his long time collaboration with composer John Williams, with whom he has worked for all but five of his feature films. Several of Spielberg's works are among the highest-grossing films of all time and have received acclaim; seven of his films have been inducted into the National Film Registry by the Library of Congress as being ""culturally, historically, or aesthetically significant""."
Steven Spielberg,"Steven Allan Spielberg (; born December 18, 1946) is an American film director, producer, and screenwriter. He began his career in the New Hollywood era and is currently the most commercially successful director of all time. Spielberg is the recipient of various accolades, including three Academy Awards (with two for Best Director), a Kennedy Center honor, a Cecil B. DeMille Award, and an AFI Life Achievement Award.Spielberg was born in Cincinnati, Ohio, and grew up in Phoenix, Arizona. He later moved to California and studied film in college. After directing several episodes for television including Night Gallery and Columbo, he directed the television film Duel (1971) which gained him acclaim from critics and audiences. He then made his directorial film debut with The Sugarland Express (1974). The following year he became a household name directing 1975's summer blockbuster Jaws. He then directed box office successes Close Encounters of the Third Kind (1977), E.T. the Extra-Terrestrial (1982), and the Indiana Jones series. Spielberg later explored drama in The Color Purple (1985) and Empire of the Sun (1987).After a brief hiatus, he directed back to back box office successes with the acclaimed science fiction action film Jurassic Park and the holocaust drama Schindler's List (both 1993). In 1998, he directed the World War II epic Saving Private Ryan, which was both a critical and commercial success. Spielberg continued in the 2000s with science fiction, including A.I. Artificial Intelligence (2001), Minority Report (2002), and War of the Worlds (2005). He also directed the children's adventure films The Adventures of Tintin (2011), and Ready Player One (2018), as well as the historical dramas Amistad (1997), Munich (2005), War Horse (2011), Lincoln (2012), Bridge of Spies (2015), The Post (2017), and the musical West Side Story (2021).In addition to filmmaking, he co-founded Amblin Entertainment and DreamWorks, and has served as a producer for many television series and films. Spielberg is also known for his long time collaboration with composer John Williams, with whom he has worked for all but five of his feature films. Several of Spielberg's works are among the highest-grossing films of all time and have received acclaim; seven of his films have been inducted into the National Film Registry by the Library of Congress as being ""culturally, historically, or aesthetically significant""."
Michael Mann,None
Neil Jordan,"Neil Patrick Jordan (born 25 February 1950) is an Irish film director, screenwriter, novelist and short-story writer. His first book, Night in Tunisia, won a Somerset Maugham Award and the Guardian Fiction Prize in 1979. He won an Academy Award (Best Original Screenplay) for The Crying Game (1992). He has also won three Irish Film and Television Awards, as well as the Golden Lion at the Venice International Film Festival for Michael Collins (1996) and the Silver Bear for Best Director at the Berlin International Film Festival for The Butcher Boy (1997).Jordan also created The Borgias (2011 TV series) for Showtime."
D.W. Griffith,"David Wark Griffith (January 22, 1875 – July 23, 1948) was an American film director. Considered one of the most influential figures in the history of the motion picture, he pioneered many aspects of film editing and expanded the art of the narrative film.Griffith is known to modern audiences primarily for directing the film The Birth of a Nation (1915). One of the most financially successful films of all time, it made investors enormous profits, but it also attracted much controversy for its degrading portrayals of African Americans, glorification of the Ku Klux Klan, and racist viewpoint. The film led to riots in several major cities all over the United States and attempts by the NAACP to have the film banned. Griffith made his next film Intolerance (1916) as an answer to critics, who he felt unfairly maligned his work.Together with Charlie Chaplin, Mary Pickford, and Douglas Fairbanks, Griffith founded the studio United Artists in 1919 with the goal of enabling actors and directors to make films on their own terms as opposed to those of commercial studios. Several of Griffith's later films were successful, including Broken Blossoms (1919), Way Down East (1920), and Orphans of the Storm (1921), but the high costs he incurred for production and promotion often led to commercial failure. He had made roughly 500 films by the time of his final feature, The Struggle (1931), all of which but three were completely silent.     Griffith has a complicated legacy. Although far from universally so, he was a widely celebrated and respected figure in his lifetime, and modern film historians still recognize him for his technical contributions to the craft of filmmaking. Nevertheless, many critics have characterized both Griffith and his work (most notably, The Birth of a Nation) as racist, both during his life and in the decades that have followed since his death. Historians frequently cite The Birth of a Nation as a major factor in the KKK's revival in the 20th century, and it remains a polarizing work to this day."
Don Siegel,None
