David Fincher,NoneBrad Bird,"Phillip Bradley Bird (born September 24, 1957) is an American film director, animator, screenwriter, producer, and voice actor. He has had a career spanning forty years in both animation and live-action, and is best known for his films The Incredibles franchise, Ratatouille, The Iron Giant, and Mission: Impossible – Ghost Protocol. Bird was born in Montana and grew up in Oregon. He developed an interest in the art of animation early on, and completed his first short subject by age 14. Bird sent the film to Walt Disney Productions, leading to an apprenticeship from the studio's Nine Old Men. He attended the California Institute of the Arts in the late 1970s, and worked for Disney shortly thereafter.In the 1980s, he worked in film development with various studios; he wrote the screenplay for *batteries not included, and developed two episodes of Amazing Stories for Steven Spielberg, including the influential Family Dog. Afterwards, Bird joined The Simpsons as creative consultant for eight seasons. He directed the 1999 feature The Iron Giant, adapted from a book by poet Ted Hughes; though critically lauded, it was a box-office bomb. He moved to Pixar where he wrote and directed two movies, The Incredibles (2004) and Ratatouille (2007) that were worldwide critical and financial smash hits; both earned Bird two Academy Award for Best Animated Feature wins and Best Original Screenplay nominations. He transitioned to live-action filmmaking with 2011's similarly successful Mission Impossible: Ghost Protocol, but his 2015 effort Tomorrowland significantly underperformed. He returned to Pixar to develop Incredibles 2, which was released in 2018 and became the second highest-grossing animated picture of all-time.As a filmmaker, Bird has been considered an auteur; he is known to supervise his projects to a high degree of detail. The bulk of Bird's filmography has attracted widespread acclaim; with the exception of Tomorrowland, all of his movies have high aggregate scores from viewers and critics. His films' themes have been subject to interpretation by commentators due to their parallels with novelist Ayn Rand's Objectivism philosophy, an analysis Bird has dismissed. He is known as an advocate for creative freedom and the possibilities of animation, and has criticized its stereotype as children's entertainment, or classification as a genre, rather than art."
Frank Capra,"Frank Vincent Zappa (December 21, 1940 – December 4, 1993) was an American musician, singer, composer, songwriter and bandleader. His work is characterized by nonconformity, free-form improvisation, sound experiments, musical virtuosity and satire of American culture. In a career spanning more than 30 years, Zappa composed rock, pop, jazz, jazz fusion, orchestral  and musique concrète works, and produced almost all of the 60-plus albums that he released with his band the Mothers of Invention and as a solo artist. Zappa also directed feature-length films and music videos, and designed album covers. He is considered one of the most innovative and stylistically diverse musicians of his generation.As a self-taught composer and performer, Zappa had diverse musical influences that led him to create music that was sometimes difficult to categorize. While in his teens, he acquired a taste for 20th-century classical modernism, African-American rhythm and blues, and doo-wop music. He began writing classical music in high school, while at the same time playing drums in rhythm-and-blues bands, later switching to electric guitar. His 1966 debut album with the Mothers of Invention, Freak Out!, combined songs in conventional rock and roll format with collective improvisations and studio-generated sound collages. He continued this eclectic and experimental approach whether the fundamental format was rock, jazz, or classical.Zappa's output is unified by a conceptual continuity he termed ""Project/Object"", with numerous musical phrases, ideas, and characters reappearing across his albums. His lyrics reflected his iconoclastic views of established social and political processes, structures and movements, often humorously so, and he has been described as the ""godfather"" of comedy rock. He was a strident critic of mainstream education and organized religion, and a forthright and passionate advocate for freedom of speech, self-education, political participation and the abolition of censorship. Unlike many other rock musicians of his generation, he disapproved of recreational drug use, but supported decriminalization and regulation.Zappa was a highly productive and prolific artist with a controversial critical standing; supporters of his music admired its compositional complexity, while critics found it lacking emotional depth. He had greater commercial success outside the US, particularly in Europe. Though he worked as an independent artist, Zappa mostly relied on distribution agreements he had negotiated with the major record labels. He remains a major influence on musicians and composers. His many honors include his 1995 induction into the Rock and Roll Hall of Fame and the 1997 Grammy Lifetime Achievement Award."
Frank Capra,"Frank Vincent Zappa (December 21, 1940 – December 4, 1993) was an American musician, singer, composer, songwriter and bandleader. His work is characterized by nonconformity, free-form improvisation, sound experiments, musical virtuosity and satire of American culture. In a career spanning more than 30 years, Zappa composed rock, pop, jazz, jazz fusion, orchestral  and musique concrète works, and produced almost all of the 60-plus albums that he released with his band the Mothers of Invention and as a solo artist. Zappa also directed feature-length films and music videos, and designed album covers. He is considered one of the most innovative and stylistically diverse musicians of his generation.As a self-taught composer and performer, Zappa had diverse musical influences that led him to create music that was sometimes difficult to categorize. While in his teens, he acquired a taste for 20th-century classical modernism, African-American rhythm and blues, and doo-wop music. He began writing classical music in high school, while at the same time playing drums in rhythm-and-blues bands, later switching to electric guitar. His 1966 debut album with the Mothers of Invention, Freak Out!, combined songs in conventional rock and roll format with collective improvisations and studio-generated sound collages. He continued this eclectic and experimental approach whether the fundamental format was rock, jazz, or classical.Zappa's output is unified by a conceptual continuity he termed ""Project/Object"", with numerous musical phrases, ideas, and characters reappearing across his albums. His lyrics reflected his iconoclastic views of established social and political processes, structures and movements, often humorously so, and he has been described as the ""godfather"" of comedy rock. He was a strident critic of mainstream education and organized religion, and a forthright and passionate advocate for freedom of speech, self-education, political participation and the abolition of censorship. Unlike many other rock musicians of his generation, he disapproved of recreational drug use, but supported decriminalization and regulation.Zappa was a highly productive and prolific artist with a controversial critical standing; supporters of his music admired its compositional complexity, while critics found it lacking emotional depth. He had greater commercial success outside the US, particularly in Europe. Though he worked as an independent artist, Zappa mostly relied on distribution agreements he had negotiated with the major record labels. He remains a major influence on musicians and composers. His many honors include his 1995 induction into the Rock and Roll Hall of Fame and the 1997 Grammy Lifetime Achievement Award."
Quentin Tarantino,"Quentin Jerome Tarantino (born March 27, 1963) is an American filmmaker, actor, film critic and author. His films are characterized by nonlinear storylines, dark humor, stylized violence, extended dialogue, pervasive use of profanity, ensemble casts, references to popular culture, alternate history, and neo-noir.Born in Knoxville, Tennessee, Tarantino grew up in Los Angeles. He began his career as an independent filmmaker with the release of Reservoir Dogs in 1992, a crime thriller in part funded by the sale of his screenplay True Romance (1993); Empire hailed Reservoir Dogs as the ""Greatest Independent Film of All Time"". His second film, Pulp Fiction (1994), a crime comedy, was a major success among critics and audiences and won numerous awards, including the Palme d'Or and the Academy Award for Best Original Screenplay. He wrote the screenplay for From Dusk till Dawn (1996), in which he also starred, while Tarantino's third film, Jackie Brown (1997), paid homage to blaxploitation films.In 2003, Tarantino delivered Kill Bill: Volume 1, stylized in cinematic traditions of kung fu films and Japanese martial arts, the animation sequences in the film were inspired from Aalavandhan; Volume 2 followed in 2004. Tarantino then directed the exploitation slasher Death Proof (2007), part of a double feature with Robert Rodriguez released in the custom of 1970s grindhouse, under the collective title Grindhouse. His long-postponed Inglourious Basterds (2009) told an alternate history and explored subgenres of war films; it was followed by Django Unchained (2012), a Spaghetti Western, which won him his second Academy Award for Best Original Screenplay. Tarantino's eighth film, The Hateful Eight (2015), was a long-form revisionist Western thriller with a roadshow release, while his most recent film, Once Upon a Time in Hollywood (2019), was a comedy-drama which explored the transition of Old Hollywood to New Hollywood. He published his debut novel, a novelization of Once Upon a Time in Hollywood, in 2021.Tarantino's films have garnered critical and commercial success, as well as a cult following. He has received many industry awards, including two Academy Awards, two BAFTA Awards, four Golden Globe Awards, and the Palme d'Or, and has been nominated for an Emmy and five Grammys. In 2005, he was included on the annual Time 100 list of the most influential people in the world. Filmmaker and historian Peter Bogdanovich has called him ""the single most influential director of his generation""; Tarantino has received a star on the Hollywood Walk of Fame for his contributions to the film industry.Tarantino's works have been subject to controversy, including his depictions of violence and frequent inclusion of racial slurs, and alleged negligence in his handling of stunt scenes in Kill Bill: Volume 2."
Steven Spielberg,"Steven Allan Spielberg (; born December 18, 1946) is an American film director, producer, and screenwriter. He began his career in the New Hollywood era and is currently the most commercially successful director of all time. Spielberg is the recipient of various accolades, including three Academy Awards (with two for Best Director), a Kennedy Center honor, a Cecil B. DeMille Award, and an AFI Life Achievement Award.Spielberg was born in Cincinnati, Ohio, and grew up in Phoenix, Arizona. He later moved to California and studied film in college. After directing several episodes for television including Night Gallery and Columbo, he directed the television film Duel (1971) which gained him acclaim from critics and audiences. He then made his directorial film debut with The Sugarland Express (1974). The following year he became a household name directing 1975's summer blockbuster Jaws. He then directed box office successes Close Encounters of the Third Kind (1977), E.T. the Extra-Terrestrial (1982), and the Indiana Jones series. Spielberg later explored drama in The Color Purple (1985) and Empire of the Sun (1987).After a brief hiatus, he directed back to back box office successes with the acclaimed science fiction action film Jurassic Park and the holocaust drama Schindler's List (both 1993). In 1998, he directed the World War II epic Saving Private Ryan, which was both a critical and commercial success. Spielberg continued in the 2000s with science fiction, including A.I. Artificial Intelligence (2001), Minority Report (2002), and War of the Worlds (2005). He also directed the children's adventure films The Adventures of Tintin (2011), and Ready Player One (2018), as well as the historical dramas Amistad (1997), Munich (2005), War Horse (2011), Lincoln (2012), Bridge of Spies (2015), The Post (2017), and the musical West Side Story (2021).In addition to filmmaking, he co-founded Amblin Entertainment and DreamWorks, and has served as a producer for many television series and films. Spielberg is also known for his long time collaboration with composer John Williams, with whom he has worked for all but five of his feature films. Several of Spielberg's works are among the highest-grossing films of all time and have received acclaim; seven of his films have been inducted into the National Film Registry by the Library of Congress as being ""culturally, historically, or aesthetically significant""."
Cameron Crowe,None
Oliver Stone,"William Oliver Stone (born September 15, 1946) is an American film director, producer, and screenwriter. Stone won an Academy Award for Best Adapted Screenplay as writer of Midnight Express (1978), and wrote the gangster film remake Scarface (1983). Stone achieved prominence as writer and director of the war drama Platoon (1986), which won Academy Awards for Best Director and Best Picture. Platoon was the first in a trilogy of films based on the Vietnam War, in which Stone served as an infantry soldier. He continued the series with Born on the Fourth of July (1989)—for which Stone won his second Best Director Oscar—and Heaven & Earth (1993). Stone's other works include the Salvadoran Civil War-based drama Salvador (1986); the financial drama Wall Street (1987) and its sequel Wall Street: Money Never Sleeps (2010); the Jim Morrison biographical film The Doors (1991); the satirical black comedy crime film Natural Born Killers (1994); a trilogy of films based on the American Presidency: JFK (1991), Nixon (1995), and W. (2008); and Snowden (2016).Many of Stone's films focus on controversial American political issues during the late 20th century, and as such were considered contentious at the times of their releases. They often combine different camera and film formats within a single scene, as demonstrated in JFK (1991), Natural Born Killers (1994), and Nixon (1995).Like his subject matter, Stone has become a controversial figure in American filmmaking, with critics accusing him of promoting conspiracy theories, and of misrepresenting real-world events and figures in his works. He is also particularly known for his long time criticism of American foreign policy and statements regarding leaders such as Hugo Chavez and Vladimir Putin."
Fran?ois Truffaut,None
Steven Spielberg,"Steven Allan Spielberg (; born December 18, 1946) is an American film director, producer, and screenwriter. He began his career in the New Hollywood era and is currently the most commercially successful director of all time. Spielberg is the recipient of various accolades, including three Academy Awards (with two for Best Director), a Kennedy Center honor, a Cecil B. DeMille Award, and an AFI Life Achievement Award.Spielberg was born in Cincinnati, Ohio, and grew up in Phoenix, Arizona. He later moved to California and studied film in college. After directing several episodes for television including Night Gallery and Columbo, he directed the television film Duel (1971) which gained him acclaim from critics and audiences. He then made his directorial film debut with The Sugarland Express (1974). The following year he became a household name directing 1975's summer blockbuster Jaws. He then directed box office successes Close Encounters of the Third Kind (1977), E.T. the Extra-Terrestrial (1982), and the Indiana Jones series. Spielberg later explored drama in The Color Purple (1985) and Empire of the Sun (1987).After a brief hiatus, he directed back to back box office successes with the acclaimed science fiction action film Jurassic Park and the holocaust drama Schindler's List (both 1993). In 1998, he directed the World War II epic Saving Private Ryan, which was both a critical and commercial success. Spielberg continued in the 2000s with science fiction, including A.I. Artificial Intelligence (2001), Minority Report (2002), and War of the Worlds (2005). He also directed the children's adventure films The Adventures of Tintin (2011), and Ready Player One (2018), as well as the historical dramas Amistad (1997), Munich (2005), War Horse (2011), Lincoln (2012), Bridge of Spies (2015), The Post (2017), and the musical West Side Story (2021).In addition to filmmaking, he co-founded Amblin Entertainment and DreamWorks, and has served as a producer for many television series and films. Spielberg is also known for his long time collaboration with composer John Williams, with whom he has worked for all but five of his feature films. Several of Spielberg's works are among the highest-grossing films of all time and have received acclaim; seven of his films have been inducted into the National Film Registry by the Library of Congress as being ""culturally, historically, or aesthetically significant""."
Quentin Tarantino,"Quentin Jerome Tarantino (born March 27, 1963) is an American filmmaker, actor, film critic and author. His films are characterized by nonlinear storylines, dark humor, stylized violence, extended dialogue, pervasive use of profanity, ensemble casts, references to popular culture, alternate history, and neo-noir.Born in Knoxville, Tennessee, Tarantino grew up in Los Angeles. He began his career as an independent filmmaker with the release of Reservoir Dogs in 1992, a crime thriller in part funded by the sale of his screenplay True Romance (1993); Empire hailed Reservoir Dogs as the ""Greatest Independent Film of All Time"". His second film, Pulp Fiction (1994), a crime comedy, was a major success among critics and audiences and won numerous awards, including the Palme d'Or and the Academy Award for Best Original Screenplay. He wrote the screenplay for From Dusk till Dawn (1996), in which he also starred, while Tarantino's third film, Jackie Brown (1997), paid homage to blaxploitation films.In 2003, Tarantino delivered Kill Bill: Volume 1, stylized in cinematic traditions of kung fu films and Japanese martial arts, the animation sequences in the film were inspired from Aalavandhan; Volume 2 followed in 2004. Tarantino then directed the exploitation slasher Death Proof (2007), part of a double feature with Robert Rodriguez released in the custom of 1970s grindhouse, under the collective title Grindhouse. His long-postponed Inglourious Basterds (2009) told an alternate history and explored subgenres of war films; it was followed by Django Unchained (2012), a Spaghetti Western, which won him his second Academy Award for Best Original Screenplay. Tarantino's eighth film, The Hateful Eight (2015), was a long-form revisionist Western thriller with a roadshow release, while his most recent film, Once Upon a Time in Hollywood (2019), was a comedy-drama which explored the transition of Old Hollywood to New Hollywood. He published his debut novel, a novelization of Once Upon a Time in Hollywood, in 2021.Tarantino's films have garnered critical and commercial success, as well as a cult following. He has received many industry awards, including two Academy Awards, two BAFTA Awards, four Golden Globe Awards, and the Palme d'Or, and has been nominated for an Emmy and five Grammys. In 2005, he was included on the annual Time 100 list of the most influential people in the world. Filmmaker and historian Peter Bogdanovich has called him ""the single most influential director of his generation""; Tarantino has received a star on the Hollywood Walk of Fame for his contributions to the film industry.Tarantino's works have been subject to controversy, including his depictions of violence and frequent inclusion of racial slurs, and alleged negligence in his handling of stunt scenes in Kill Bill: Volume 2."
Quentin Tarantino,"Quentin Jerome Tarantino (born March 27, 1963) is an American filmmaker, actor, film critic and author. His films are characterized by nonlinear storylines, dark humor, stylized violence, extended dialogue, pervasive use of profanity, ensemble casts, references to popular culture, alternate history, and neo-noir.Born in Knoxville, Tennessee, Tarantino grew up in Los Angeles. He began his career as an independent filmmaker with the release of Reservoir Dogs in 1992, a crime thriller in part funded by the sale of his screenplay True Romance (1993); Empire hailed Reservoir Dogs as the ""Greatest Independent Film of All Time"". His second film, Pulp Fiction (1994), a crime comedy, was a major success among critics and audiences and won numerous awards, including the Palme d'Or and the Academy Award for Best Original Screenplay. He wrote the screenplay for From Dusk till Dawn (1996), in which he also starred, while Tarantino's third film, Jackie Brown (1997), paid homage to blaxploitation films.In 2003, Tarantino delivered Kill Bill: Volume 1, stylized in cinematic traditions of kung fu films and Japanese martial arts, the animation sequences in the film were inspired from Aalavandhan; Volume 2 followed in 2004. Tarantino then directed the exploitation slasher Death Proof (2007), part of a double feature with Robert Rodriguez released in the custom of 1970s grindhouse, under the collective title Grindhouse. His long-postponed Inglourious Basterds (2009) told an alternate history and explored subgenres of war films; it was followed by Django Unchained (2012), a Spaghetti Western, which won him his second Academy Award for Best Original Screenplay. Tarantino's eighth film, The Hateful Eight (2015), was a long-form revisionist Western thriller with a roadshow release, while his most recent film, Once Upon a Time in Hollywood (2019), was a comedy-drama which explored the transition of Old Hollywood to New Hollywood. He published his debut novel, a novelization of Once Upon a Time in Hollywood, in 2021.Tarantino's films have garnered critical and commercial success, as well as a cult following. He has received many industry awards, including two Academy Awards, two BAFTA Awards, four Golden Globe Awards, and the Palme d'Or, and has been nominated for an Emmy and five Grammys. In 2005, he was included on the annual Time 100 list of the most influential people in the world. Filmmaker and historian Peter Bogdanovich has called him ""the single most influential director of his generation""; Tarantino has received a star on the Hollywood Walk of Fame for his contributions to the film industry.Tarantino's works have been subject to controversy, including his depictions of violence and frequent inclusion of racial slurs, and alleged negligence in his handling of stunt scenes in Kill Bill: Volume 2."
John Woo,None
Roland Joff?,Ted Atherton is a Canadian actor. He is best known as Myles Leland III in the TV series Sue Thomas: F.B.Eye.
