David Fincher,None
Richard Attenborough,"Richard Samuel Attenborough, Baron Attenborough  (; 29 August 1923 – 24 August 2014) was an English actor, filmmaker, and entrepreneur. He was the president of the Royal Academy of Dramatic Art (RADA) and the British Academy of Film and Television Arts (BAFTA), as well as the life president of Chelsea FC. He joined the Royal Air Force during the Second World War and served in the film unit, going on several bombing raids over Europe and filming the action from the rear gunner's position. He was the older brother of broadcaster Sir David Attenborough and motor executive John Attenborough. He was married to actress Sheila Sim from 1945 until his death.For his directorial debut, 1969's Oh! What a Lovely War, Attenborough was nominated for the BAFTA Award for Best Direction, and he was nominated for his films Young Winston, A Bridge Too Far, and Cry Freedom. He won two Academy Awards for Gandhi in 1983: Best Picture and Best Director. The BFI ranked Gandhi the 34th greatest British film of the 20th century. Attenborough also won four BAFTA Awards, four Golden Globe Awards, and the 1983 BAFTA Fellowship for lifetime achievement. As an actor, he is best remembered for his roles in Brighton Rock (1948), I'm All Right Jack (1959), The Great Escape (1963), The Sand Pebbles (1966), Doctor Dolittle (1967), 10 Rillington Place (1971), Jurassic Park (1993), and Miracle on 34th Street (1994)."
Andrew Niccol,None
Clyde Bruckman and Buster Keaton,"Clyde Adolf Bruckman (June 30, 1894: 131  – January 4, 1955) was an American writer and director of comedy films during the late silent era as well as the early sound era of cinema. Bruckman collaborated with such comedians as Buster Keaton, Monty Banks, W. C. Fields, Laurel and Hardy, The Three Stooges, Abbott and Costello, and Harold Lloyd.Hollywood chronicler Kenneth Anger considers Bruckman to have been one of the key figures in the history of American screen comedy."
Jerry Zucker,"Jerry Gordon Zucker (born March 11, 1950) is an American film producer, director, and writer known for his role in directing comedy spoof films such as Airplane! and Top Secret!, and the Best Picture-nominated supernatural drama film Ghost. He and his older brother, David Zucker, collaborated on several films."
Terry Zwigoff,"Terry Zwigoff (born May 18, 1949) is an American filmmaker whose work often deals with misfits, antiheroes, and themes of alienation. He first garnered attention for his work in documentary filmmaking with Louie Bluie (1985) and Crumb (1995). After Crumb, Zwigoff moved on to write and direct fiction feature films, including the Academy Award-nominated Ghost World (2001) and Bad Santa (2003)."
Ivan Reitman,"Ivan Reitman  (October 27, 1946 – February 12, 2022) was a Czechoslovak-born Canadian film and television director, producer and screenwriter. He was best known for his comedy work, especially in the 1980s and 1990s. He was the owner of The Montecito Picture Company, founded in 1998.Films he directed include Meatballs (1979), Stripes (1981), Ghostbusters (1984), Ghostbusters II (1989), Twins (1988), Kindergarten Cop (1990), Dave (1993), and Junior (1994). Reitman also served as producer for such films as Animal House (1978), Beethoven (1992), Space Jam (1996), and Private Parts (1997)."
Ridley Scott,None
James Foley,"James Wright Foley (October 18, 1973 – c. August 19, 2014) was an American journalist and video reporter. While working as a freelance war correspondent during the Syrian Civil War, he was abducted on November 22, 2012, in northwestern Syria. He was beheaded in August 2014 purportedly as a response to American airstrikes in Iraq, thus becoming the first American citizen killed by the Islamic State of Iraq and Syria (ISIS).Before becoming a journalist, Foley was an instructor for Teach For America. In 2008, he became an embedded journalist with USAID-funded development projects in Iraq, and in 2011 he wrote for the military newspaper Stars and Stripes in Afghanistan, and GlobalPost in Libya. There, he was captured by Gaddafi loyalist forces and held for 44 days. The next year, Foley was captured in Syria while he was working for Agence France-Presse and GlobalPost."
Edward Zwick,"Edward M. Zwick (born October 8, 1952) is an American filmmaker and producer of film and television. He has worked primarily in the comedy-drama and epic historical film genres, including About Last Night, Glory, Legends of the Fall, and The Last Samurai. He is also the co-creator of the television series thirtysomething and Once and Again.Zwick's body of work has earned numerous accolades, including an Academy Award and BAFTA Award for Best Picture as a producer, and Primetime Emmy Awards for Outstanding Drama Series, Outstanding Writing in a Limited Series, and Outstanding Dramatic Special. He has additionally been nominated for multiple Golden Globe Awards."
Francis Ford Coppola,"Francis Ford Coppola (; Italian: [ˈkɔppola]; born April 7, 1939) is an American film director, producer, and screenwriter. He was a central figure in the New Hollywood filmmaking movement of the 1960s and 1970s. His accolades include five Academy Awards, six Golden Globe Awards, two Palmes d'Or, and a British Academy Film Award.After directing The Rain People in 1969, Coppola co-wrote Patton (1970), earning the Academy Award for Best Original Screenplay along with Edmund H. North. Coppola's reputation as a filmmaker was cemented with the release of The Godfather (1972), which revolutionized movie-making in the gangster genre and had a strong commercial and critical reception. The Godfather won three Academy Awards: Best Picture, Best Actor, and Best Adapted Screenplay (shared with Mario Puzo).The Godfather Part II, which followed in 1974, became the first sequel to win the Academy Award for Best Picture. Highly regarded by critics, the film brought Coppola three more Academy Awards—Best Adapted Screenplay, Best Director, and Best Picture—making him the second director (after Billy Wilder) to be so honored three times for the same film. The Conversation, which Coppola directed, produced and wrote, was released that same year, winning the Palme d'Or at the Cannes Film Festival. His next film, Apocalypse Now (1979), which notoriously had a lengthy and strenuous production, was widely acclaimed for vividly depicting the Vietnam War. The film won the Palme d'Or, making Coppola one of only eight filmmakers to have won that award twice.His best-known films released since the start of the 1980s are the 1983 dramas The Outsiders and Rumble Fish, the crime dramas The Cotton Club (1984) and The Godfather Part III (1990), and the 1992 romantic-horror film Bram Stoker's Dracula, based on the novel of the same name. A number of Coppola's relatives and children have become famous actors and filmmakers in their own right: his sister Talia Shire is an actress, his daughter Sofia and granddaughter Gia are directors, his son Roman is a screenwriter, and his nephews Jason Schwartzman and Nicolas Cage are actors. Coppola resides in Napa, California, and since the 2010s has been a vintner, owning a family-brand as well as a winery of his own."
Francis Ford Coppola,"Francis Ford Coppola (; Italian: [ˈkɔppola]; born April 7, 1939) is an American film director, producer, and screenwriter. He was a central figure in the New Hollywood filmmaking movement of the 1960s and 1970s. His accolades include five Academy Awards, six Golden Globe Awards, two Palmes d'Or, and a British Academy Film Award.After directing The Rain People in 1969, Coppola co-wrote Patton (1970), earning the Academy Award for Best Original Screenplay along with Edmund H. North. Coppola's reputation as a filmmaker was cemented with the release of The Godfather (1972), which revolutionized movie-making in the gangster genre and had a strong commercial and critical reception. The Godfather won three Academy Awards: Best Picture, Best Actor, and Best Adapted Screenplay (shared with Mario Puzo).The Godfather Part II, which followed in 1974, became the first sequel to win the Academy Award for Best Picture. Highly regarded by critics, the film brought Coppola three more Academy Awards—Best Adapted Screenplay, Best Director, and Best Picture—making him the second director (after Billy Wilder) to be so honored three times for the same film. The Conversation, which Coppola directed, produced and wrote, was released that same year, winning the Palme d'Or at the Cannes Film Festival. His next film, Apocalypse Now (1979), which notoriously had a lengthy and strenuous production, was widely acclaimed for vividly depicting the Vietnam War. The film won the Palme d'Or, making Coppola one of only eight filmmakers to have won that award twice.His best-known films released since the start of the 1980s are the 1983 dramas The Outsiders and Rumble Fish, the crime dramas The Cotton Club (1984) and The Godfather Part III (1990), and the 1992 romantic-horror film Bram Stoker's Dracula, based on the novel of the same name. A number of Coppola's relatives and children have become famous actors and filmmakers in their own right: his sister Talia Shire is an actress, his daughter Sofia and granddaughter Gia are directors, his son Roman is a screenwriter, and his nephews Jason Schwartzman and Nicolas Cage are actors. Coppola resides in Napa, California, and since the 2010s has been a vintner, owning a family-brand as well as a winery of his own."
Francis Ford Coppola,"Francis Ford Coppola (; Italian: [ˈkɔppola]; born April 7, 1939) is an American film director, producer, and screenwriter. He was a central figure in the New Hollywood filmmaking movement of the 1960s and 1970s. His accolades include five Academy Awards, six Golden Globe Awards, two Palmes d'Or, and a British Academy Film Award.After directing The Rain People in 1969, Coppola co-wrote Patton (1970), earning the Academy Award for Best Original Screenplay along with Edmund H. North. Coppola's reputation as a filmmaker was cemented with the release of The Godfather (1972), which revolutionized movie-making in the gangster genre and had a strong commercial and critical reception. The Godfather won three Academy Awards: Best Picture, Best Actor, and Best Adapted Screenplay (shared with Mario Puzo).The Godfather Part II, which followed in 1974, became the first sequel to win the Academy Award for Best Picture. Highly regarded by critics, the film brought Coppola three more Academy Awards—Best Adapted Screenplay, Best Director, and Best Picture—making him the second director (after Billy Wilder) to be so honored three times for the same film. The Conversation, which Coppola directed, produced and wrote, was released that same year, winning the Palme d'Or at the Cannes Film Festival. His next film, Apocalypse Now (1979), which notoriously had a lengthy and strenuous production, was widely acclaimed for vividly depicting the Vietnam War. The film won the Palme d'Or, making Coppola one of only eight filmmakers to have won that award twice.His best-known films released since the start of the 1980s are the 1983 dramas The Outsiders and Rumble Fish, the crime dramas The Cotton Club (1984) and The Godfather Part III (1990), and the 1992 romantic-horror film Bram Stoker's Dracula, based on the novel of the same name. A number of Coppola's relatives and children have become famous actors and filmmakers in their own right: his sister Talia Shire is an actress, his daughter Sofia and granddaughter Gia are directors, his son Roman is a screenwriter, and his nephews Jason Schwartzman and Nicolas Cage are actors. Coppola resides in Napa, California, and since the 2010s has been a vintner, owning a family-brand as well as a winery of his own."
Charles Chaplin,None
Guy Hamilton,"Mervyn Ian Guy Hamilton, DSC (16 September 1922 – 20 April 2016) was an English film director. He directed 22 films from the 1950s to the 1980s, including four James Bond films."
Victor Fleming,"Victor Lonzo Fleming (February 23, 1889 – January 6, 1949) was an American film director, cinematographer, and producer. His most popular films were Gone with the Wind, for which he won an Academy Award for Best Director, and The Wizard of Oz (both 1939). Fleming has those same two films listed in the top 10 of the American Film Institute's 2007 AFI's 100 Years...100 Movies list."
Gus Van Sant,"Gus Green Van Sant Jr. (born July 24, 1952) is an American film director, producer, photographer, and musician who has earned acclaim as both an independent and mainstream filmmaker. His films typically deal with themes of marginalized subcultures, in particular homosexuality; Van Sant is considered one of the most prominent auteurs of the New Queer Cinema movement.Van Sant's early career was devoted to directing television commercials in the Pacific Northwest. He made his feature-length cinematic directorial debut with Mala Noche (1985). His second feature, Drugstore Cowboy (1989), was highly acclaimed, and earned him screenwriting awards from the Los Angeles Film Critics Association and New York Film Critics Circle and the award for Best Director from the National Society of Film Critics. His next film, My Own Private Idaho (1991), was similarly praised, as was the black comedy To Die For (1995), the drama Good Will Hunting (1997), and the biographical film Milk (2008); for the latter two, Van Sant was nominated for the Academy Award for Best Director and both films received Best Picture nominations.In 2003, Van Sant's film about the Columbine High School massacre, Elephant, won the Palme d'Or at the Cannes Film Festival. Van Sant also received the festival's Best Director Award that same year, making him one of only two filmmakers—the other being Joel Coen—to win both accolades at the festival in the same year. Though most of Van Sant's other films received favourable reviews, such as Finding Forrester (2000) and Paranoid Park (2007), some of his efforts, such as the art house production Last Days (2005) and the environmental drama Promised Land (2012), have received more mixed reviews from critics, while his adaptation of Tom Robbins's Even Cowgirls Get the Blues (1993), his 1998 remake of Alfred Hitchcock's Psycho, and The Sea of Trees (2015), were critical and commercial failures.In addition to directing, Van Sant has written the screenplays for several of his earlier works, and is the author of a novel, Pink. A book of his photography, 108 Portraits, has also been published, and he has released two musical albums.He is gay and lives in the Los Feliz section of Los Angeles, California."
Sergio Leone,None
Martin Scorsese,"Martin Charles Scorsese (; Italian: [skorˈseːze, -se]; born November 17, 1942) is an American film director, producer, and screenwriter. He is the recipient of many accolades, including an Academy Award, three Primetime Emmy Awards, a Grammy Award, four British Academy Film Awards, three Golden Globe Awards, and two Directors Guild of America Awards. Scorsese has received various honors including the AFI Life Achievement Award in 1997, the Kennedy Center Honor in 2007, and the BAFTA Fellowship in 2012. Five of his films have been inducted into the National Film Registry by the Library of Congress as ""culturally, historically or aesthetically significant"". Scorsese received an MA from New York University's Steinhardt School of Culture, Education, and Human Development in 1968. His directorial debut, Who's That Knocking at My Door (1967), was accepted into the Chicago Film Festival. In the 1970s and 1980s decades, Scorsese emerged as one of the major figures of the New Hollywood era. Scorsese's films, much influenced by his Italian-American background and upbringing in New York City, center on macho-posturing insecure men and explore crime, machismo, nihilism, and Catholic concepts of guilt and redemption. His trademark styles include extensive use of slow motion and freeze frames, graphic depictions of extreme violence, and liberal use of profanity.His 1973 crime film Mean Streets, dealing with machismo and violence, and exploring Catholic concepts of guilt and redemption, was a blueprint for his filmmaking styles. Scorsese won the Palme d'Or at Cannes with his 1976 psychological thriller Taxi Driver, which starred Robert De Niro, who became associated with Scorsese through eight more films including New York, New York (1977), Raging Bull (1980) The King of Comedy (1982), Goodfellas (1990), and Casino (1995). In the 2000s and 2010s decades, Scorsese garnered critical acclaim and box office success with a series of collaborations with Leonardo DiCaprio. These films include Gangs of New York (2002), The Aviator (2004), The Departed (2006), Shutter Island (2010) and The Wolf of Wall Street (2013). Returning to his familiar territory of crime films, Scorsese collaborated with De Niro again on The Irishman (2019). Scorsese's other film work includes the black comedy After Hours (1985), the romantic drama The Age of Innocence (1993), the children's adventure drama Hugo (2011), and the religious epics The Last Temptation of Christ (1988), Kundun (1997) and Silence (2016). In addition to film, Scorsese has directed episodes for some television series including Boardwalk Empire (2011-2015), and Vinyl (2016), and the documentaries Public Speaking (2010), and Pretend It's a City (2021). He is also known for several rock music documentaries including The Last Waltz (1978), No Direction Home (2005), Shine a Light (2008), and George Harrison: Living in the Material World (2011). An advocate for film preservation and restoration, he founded three nonprofit organizations: the Film Foundation in 1990, the World Cinema Foundation in 2007, and the African Film Heritage Project in 2017."
Richard Donner,"Richard Donner (born Richard Donald Schwartzberg; April 24, 1930 – July 5, 2021) was an American filmmaker whose notable works included some of the most financially-successful films during the New Hollywood era. According to film historian Michael Barson, Donner was ""one of Hollywood's most reliable makers of action blockbusters"". His career spanned over 50 years, crossing multiple genres and filmmaking trends.Donner began his career in 1957 as a television director, helming episodes of series like The Man from U.N.C.L.E., The Fugitive, and The Twilight Zone. He made his film debut with the low-budget aviation drama X-15 in 1961, but had his critical and commercial breakthrough with the horror film The Omen in 1976. He directed the landmark superhero film Superman in 1978, which provided an inspiration for the fantasy film genre to eventually gain artistic respectability and commercial dominance. Donner later went on to direct films in the 1980s such as The Goonies and Scrooged, while reinvigorating the buddy film genre with the Lethal Weapon series.Donner and his wife, Lauren, owned their production company The Donners' Company (formerly Donner/Shuler Donner Productions), best known for producing the Free Willy and X-Men franchises. Donner also produced the Tales from the Crypt television series, and co-wrote several comic books for Superman publisher DC Comics. In 2000, Donner received the President's Award from the Academy of Science Fiction, Fantasy & Horror Films."
Mike Nichols,None
Jean Renoir,None
John Ford,None
Isao Takahata,"Isao Takahata (高畑 勲, Takahata Isao, October 29, 1935 – April 5, 2018) was a Japanese director, screenwriter and producer. A co-founder of Studio Ghibli, he has earned international critical acclaim for his work as a director of Japanese animated feature films. Born in Ujiyamada, Mie Prefecture, Takahata joined Toei Animation after graduating from the University of Tokyo in 1959. He worked as an assistant director, holding various positions over the years and collaborating with colleague Hayao Miyazaki, eventually directing his own film, The Great Adventure of Horus, Prince of the Sun (1969). He continued his partnership with Miyazaki, and under Nippon Animation directed the television series Heidi, Girl of the Alps (1974), 3000 Leagues in Search of Mother (1976), and Anne of Green Gables (1979). Takahata, Miyazaki and others formed Studio Ghibli in 1985, where he would direct Grave of the Fireflies (1988), Only Yesterday (1991), Pom Poko (1994), and My Neighbors the Yamadas (1999). His last film as director was The Tale of the Princess Kaguya (2013), which was nominated for an Oscar in the category of Best Animated Feature Film at the 87th Academy Awards."
Randal Kleiser,"John Randal Kleiser (born July 20, 1946) is an American film and television director, producer, screenwriter and actor, best known for directing the 1978 musical romantic-comedy film Grease."
Charles Chaplin,None
John Sturges,None
Erich von Stroheim,"Erich Oswald Hans Carl Maria von Stroheim (born Erich Oswald Stroheim; September 22, 1885 – May 12, 1957) was an Austrian-American director, actor and producer, most noted as a film star and avant-garde, visionary director of the silent era. His 1924 film Greed (an adaptation of Frank Norris's 1899 novel McTeague) is considered one of the finest and most important films ever made. After clashes with Hollywood studio bosses over budget and workers' rights issues, Stroheim was banned for life as a director and subsequently became a well-respected character actor, particularly in French cinema.For his early innovations as a director, Stroheim is still celebrated as one of the first of the auteur directors. He helped introduce more sophisticated plots and noirish sexual and psychological undercurrents into cinema. He died of prostate cancer in France in 1957, at the age of 71. Beloved by Parisian neo-Surrealists known as Letterists, he was honored by Letterist Maurice Lemaître with a 70-minute 1979 film titled Erich von Stroheim."
Frank Darabont,"Frank Árpád Darabont (born Ferenc Árpád Darabont, January 28, 1959) is an American film director, screenwriter and producer. He has been nominated for three Academy Awards and a Golden Globe Award. In his early career, he was primarily a screenwriter for such horror films as A Nightmare on Elm Street 3: Dream Warriors (1987), The Blob (1988) and The Fly II (1989). As a director, he is known for his film adaptations of Stephen King novellas and novels, such as The Shawshank Redemption (1994), The Green Mile (1999), and The Mist (2007).Darabont also developed and executive produced the first season and first half of the second season of the AMC horror series The Walking Dead (2010–2011)."
George Armitage,"George Brendan Armitage (born March 2, 1942) is an American film director, screenwriter and producer. He directed the films Miami Blues (1990) and Grosse Pointe Blank (1997). He worked with frequently with Roger Corman."
Harold Ramis,None
John Carpenter,"John Howard Carpenter (born January 16, 1948) is an American filmmaker, actor and composer. Although Carpenter has worked with various film genres, he is associated most commonly with horror, action, and science fiction films of the 1970s and 1980s. Carpenter is generally recognized as one of the greatest masters of the horror genre. At the 2019 Cannes Film Festival, the French Directors' Guild presented Carpenter with the Golden Coach Award, lauding him as ""a creative genius of raw, fantastic, and spectacular emotions.""Most films of Carpenter's career were initially commercial and critical failures, with the notable exceptions of Halloween (1978), The Fog (1980), Escape from New York (1981), and Starman (1984). However, many of Carpenter's films from the 1970s and the 1980s have come to be considered as cult classics, and he has been acknowledged as an influential filmmaker. The cult classics that Carpenter has directed include Dark Star (1974), Assault on Precinct 13 (1976), The Thing (1982), Christine (1983), Big Trouble in Little China (1986), Prince of Darkness (1987), They Live (1988), and In the Mouth of Madness (1994). He returned to the Halloween franchise as both composer and executive producer for the sequel Halloween (2018).Carpenter composed or co-composed most of his films' music. He won a Saturn Award for Best Music for the film Vampires (1998). Carpenter has released four studio albums, titled Lost Themes (2015), Lost Themes II (2016), Anthology: Movie Themes 1974–1998 (2017) and Lost Themes III: Alive After Death (2021)."
Woody Allen,None
Todd Solondz,"Todd Solondz (; born October 15, 1959) is an American filmmaker and playwright known for his style of dark, socially conscious satire. Solondz's work has received critical acclaim for its commentary on the ""dark underbelly of middle class American suburbia,"" a reflection of his own background in New Jersey. His work includes Welcome to the Dollhouse (1995), Happiness (1998), Storytelling (2001),  Palindromes (2004), Life During Wartime (2009), Dark Horse (2011), and Wiener-Dog (2016)."
Dennis Dugan,"Dennis Barton Dugan (born September 5, 1946) is an American director, actor, writer, artist and comedian. He is known for his partnership with comedic actor Adam Sandler, with whom he directed the films Happy Gilmore (1996), Big Daddy (1999), I Now Pronounce You Chuck & Larry (2007), You Don't Mess with the Zohan (2008), Grown Ups (2010), Just Go with It (2011), Jack and Jill (2011), and Grown Ups 2 (2013). Dugan is a four-time Golden Raspberry Award for Worst Director nominee, winning once."
John Woo,None
