Gears of War 2,"Gears of War 2 is a third-person shooter video game developed by Epic Games and published by Microsoft Studios for the Xbox 360. It is the second installment of the Gears of War series, with lead design by Cliff Bleszinski. The game was released in North America, Europe and Australia on November 7, 2008, and was released in Japan on July 30, 2009. The game expands technically on the previous game by using a modified Unreal Engine 3. The development team brought in comic book writer Joshua Ortega to help write the plot for the game.In Gears of War 2, the COG continues its fight against the Locust, who are attempting to sink all of the cities on the planet Sera. Sergeant Marcus Fenix leads Delta Squad into the depths of the planet to try to stop the Locust during the assault upon Locust territory. The player controls Fenix in the main mission campaign, with the ability to play cooperatively with a second player controlling Fenix's best friend and fellow Squad member Dominic ""Dom"" Santiago. The game includes several existing and new multiplayer modes including five-on-five battles between human and Locust forces, and a ""Horde"" mode that challenges up to five players against waves of Locust forces with ever-increasing strength. New weapons and gameplay mechanics such as ""chainsaw duels"" and the ability to use downed foes as ""human shields"" were added to the game.On its release weekend, Gears of War 2 sold over two million copies, and within two months of release, had sold four million copies. It was the seventh best selling video game of 2009 and received several accolades. The game received similar praise as its predecessor, with the new gameplay and multiplayer modes seen as outstanding additions. It was followed by Gears of War 3 in 2011."
Ghostbusters: The Video Game,"Ghostbusters: The Video Game is a 2009 action-adventure game based on the Ghostbusters media franchise. Terminal Reality developed the Windows, PlayStation 3, and Xbox 360 versions, while Red Fly Studio developed the PlayStation 2, PlayStation Portable, and Wii versions. The game was released after several delays in development and multiple publisher changes. In North America, all versions of the game were published by Atari, while in Europe, the PlayStation 2, PlayStation Portable, and PlayStation 3 versions were published by Sony Computer Entertainment. A separate game for the Nintendo DS with the same title was developed by Zen Studios and released at the same time, albeit with substantial differences in the gameplay and story.The game follows the player's character as a recruit in the Ghostbusters, a team of parapsychologists who pursue and capture ghosts. The game features elements of typical third-person shooters, but instead of a traditional gun, each player is equipped with a Proton Pack, and other technological means of fighting and capturing ghosts. The game's plot is set two years after Ghostbusters II, in 1991, with the Ghostbusters team training the player's character while investigating paranormal activities in New York City.Many of the principal cast members from the films were involved in the game's production. Each of the actors who portrayed the Ghostbusters in the films (Dan Aykroyd, Harold Ramis, Bill Murray, and Ernie Hudson) lent their voices and likenesses to the in-game characters. It is also Ramis's final portrayal as Egon Spengler and story to the Ghostbusters franchise before his death in 2014. Aykroyd and Ramis, who wrote the films, also aided in script doctoring for the game. Other film cast members to reprise their roles were William Atherton, Annie Potts, and Max von Sydow. Ghostbusters: The Video Game contains the soundtrack from the original Ghostbusters film, along with various characters, locations, and props featured in the films. Aykroyd later described the game as being ""essentially the third movie."" The game received generally favorable reviews from critics, and more than three million copies were sold. A remastered version for Microsoft Windows, Nintendo Switch, PlayStation 4, and Xbox One, developed by Saber Interactive and published by Mad Dog Games, was released on October 4, 2019."
G.I. Joe,"G.I. Joe is an American media franchise and a line of action figures owned and produced by the toy company Hasbro. The initial product offering represented four of the branches of the U.S. armed forces with the Action Soldier (U.S. Army), Action Sailor (U.S. Navy), Action Pilot (U.S. Air Force), Action Marine (U.S. Marine Corps) and later on, the Action Nurse. The name is derived from the usage of ""G.I. Joe"" for the generic U.S. soldier, itself derived from the more general term ""G.I."".  The development of G.I. Joe led to the coining of the term ""action figure"". G.I. Joe's appeal to children has made it an American icon among toys.The G.I. Joe trademark has been used by Hasbro for several different toy lines, although only two have been successful.  The original 12-inch (30 cm) line introduced on February 2, 1964, centered on realistic action figures.  In the United Kingdom, this line was licensed to Palitoy and known as Action Man.  In 1982 the line was relaunched in a 3.75-inch (9.5 cm) scale complete with vehicles, playsets, and a complex background story involving an ongoing struggle between the G.I. Joe Team and the evil Cobra organization which seeks to take over the Free World through terrorism. As the American line evolved into the Real American Hero series, Action Man also changed, by using the same molds and being renamed as Action Force. Although the members of the G.I. Joe team are not superheroes, they all had expertise in areas such as martial arts, weapons, and explosives.G.I. Joe was inducted into the National Toy Hall of Fame at The Strong in Rochester, New York, in 2004 and into the Pop Culture Hall of Fame in 2017."
Grand Theft Auto IV,"Grand Theft Auto V is a 2013 action-adventure game developed by Rockstar North and published by Rockstar Games. It is the seventh main entry in the Grand Theft Auto series, following 2008's Grand Theft Auto IV, and the fifteenth instalment overall. Set within the fictional state of San Andreas, based on Southern California, the single-player story follows three protagonists—retired bank robber Michael De Santa, street gangster Franklin Clinton, and drug dealer and gunrunner Trevor Philips—and their attempts to commit heists while under pressure from a corrupt government agency and powerful criminals. The open world design lets players freely roam San Andreas' open countryside and the fictional city of Los Santos, based on Los Angeles.The game is played from either a third-person or first-person perspective, and its world is navigated on foot and by vehicle. Players control the three lead protagonists throughout single-player and switch among them, both during and outside missions. The story is centred on the heist sequences, and many missions involve shooting and driving gameplay. A ""wanted"" system governs the aggression of law enforcement response to players who commit crimes. Grand Theft Auto Online, the game's online multiplayer mode, lets up to 30 players engage in a variety of different cooperative and competitive game modes.The game's development began around the time of Grand Theft Auto IV's release and was shared between many of Rockstar's studios worldwide. The development team drew influence from many of their previous projects such as Red Dead Redemption and Max Payne 3 and designed the game around three lead protagonists to innovate on the core structure of its predecessors. Much of the development work constituted the open world's creation, and several team members conducted field research around California to capture footage for the design team. The game's soundtrack features an original score composed by a team of producers who collaborated over several years. It was released in September 2013 for the PlayStation 3 and Xbox 360, in November 2014 for the PlayStation 4 and Xbox One, and April 2015 for Microsoft Windows. PlayStation 5 and Xbox Series X/S versions are scheduled for release in March 2022.Extensively marketed and widely anticipated, the game broke industry sales records and became the fastest-selling entertainment product in history, earning $800 million in its first day and $1 billion in its first three days. It received critical acclaim, with praise directed at its multiple protagonist design, open world, presentation and gameplay. However, it caused controversies related to its depiction of violence and women. Considered one of seventh and eighth generation console gaming's most significant titles and among the best video games ever made, it won year-end accolades including Game of the Year awards from several gaming publications. It is the second best-selling video game of all time with over 160 million copies shipped, and as of April 2018, one of the most financially successful entertainment products of all time, with about $6 billion in worldwide revenue."
Gray Matter,"Gray matter is a major component of the central nervous system, consisting of neuronal cell bodies, neuropil (dendrites and unmyelinated axons), glial cells (astrocytes and oligodendrocytes), synapses, and capillaries. Grey matter is distinguished from white matter in that it contains numerous cell bodies and relatively few myelinated axons, while white matter contains relatively few cell bodies and is composed chiefly of long-range myelinated axons. The colour difference arises mainly from the whiteness of myelin. In living tissue, grey matter actually has a very light grey colour with yellowish or pinkish hues, which come from capillary blood vessels and neuronal cell bodies."
GRID,None
Guilty Gear 2: Overture,"Guilty Gear 2: Overture (ギルティギア2オーヴァチュア, Giruti Gia Tsū Ōvachua) is a video game in the Guilty Gear series made by Arc System Works for the Xbox 360; unlike the previous games, however, Overture is not a fighting game. The fourth main installment in the series, Guilty Gear 2 makes use of 3D graphics, unlike its predecessors. The Xbox Live demo of Guilty Gear 2 describes the game as, ""a mix between the action and real-time strategy genre."" A playable demo featuring three modes of gameplay was released in Japan via Xbox Live on 30 October 2007. A North American version was released on October 7, 2008 released by Aksys Games. A port for Microsoft Windows was released on March 31, 2016 worldwide by Arc System Works."
Gun,None
Halo 3,None
Halo: Reach,"Halo: Reach is a 2010 first-person shooter video game developed by Bungie and published by Microsoft Game Studios, originally for the Xbox 360. The fifth installment in the Halo series and a direct prequel to Halo: Combat Evolved, Reach was released worldwide in September 2010. The game takes place in the year 2552, where humanity is locked in a war with the alien Covenant. Players control Noble Six, a member of an elite supersoldier squad, when the human world known as Reach falls under Covenant attack.After releasing Halo 3 in 2007, Bungie split into teams to develop two different games—what would become Halo 3: ODST and Reach. The developers decided to create a prequel to the original Halo game trilogy, freeing themselves from the obligation of addressing old story threads. As the game would take place on a human world doomed to be destroyed, they focused on making the environment a character unto itself. Longtime Halo composers Martin O'Donnell and Michael Salvatori returned to compose Reach's music, aiming for a more somber sound to match the story.Reach was announced at the Electronic Entertainment Expo 2009 in Los Angeles, California, and the first in-engine trailer was shown at the 2009 Spike Video Game Awards. Players who purchased ODST were eligible to participate in a Reach multiplayer beta in May 2010; the beta allowed Bungie to gain player feedback for fixing bugs and making gameplay tweaks before shipping the final version. Microsoft gave Reach its biggest game marketing budget yet and created award-winning live-action commercials, action figures, and interactive media to promote the game.The game grossed US$200 million on its launch day, setting a new record for the franchise. Reach sold well in most territories, moving more than three million units its first month in North America. Critical reception was positive; reviewers from publications such as GamePro, IGN, and Official Xbox Magazine called it the best Halo title yet. Critics generally praised the game's graphics and sound, but the plot and characters were less positively received. Reach was Bungie's final Halo game; subsequent games have been overseen by Microsoft subsidiary 343 Industries. The game was released for Microsoft Windows and Xbox One as part of the Halo: The Master Chief Collection in December 2019."
Halo Wars,"Halo Wars is a real-time strategy (RTS) video game developed by Ensemble Studios and published by Microsoft Game Studios for the Xbox 360 video game console. It was released in Australia on February 26, 2009; in Europe on February 27; and in North America on March 3. The game is set in the science fiction universe of the Halo series in the year 2531, 21 years before the events of Halo: Combat Evolved. The player leads human soldiers aboard the warship Spirit of Fire in an effort to stop an ancient fleet of ships from falling into the hands of the genocidal alien Covenant.Halo Wars was unveiled at the X06 Xbox show in 2006. Ensemble designed the game specifically for the Xbox 360 controller, in an attempt to circumvent issues present in previous console RTS titles. Ensemble was closed by Microsoft before the game's release, but soon after Robot Entertainment was founded by many of Ensemble's former employees; this new company continued to support Halo Wars with updates and downloadable content.Halo Wars received generally positive reviews. Reviewers lauded the game's pre-rendered cinematics, attention to detail in replicating the Halo universe, and intuitive control scheme. Complaints against the game included the lack of an option to play as the Covenant faction in campaign mode as well as the lack of strategic options during play. Critics from GameSpot and USA Today wrote that experienced RTS players would find the strategic elements of the title shallow. The game sold one million units worldwide through March 2009, making it the best-selling console real-time strategy game to date. An enhanced version of the game—Halo Wars: Definitive Edition—was released for Windows and Xbox One in December 2016. Halo Wars 2, a sequel developed by 343 Industries and Creative Assembly was released in February 2017."
Hasbro Family Game Night 3,Hasbro Family Game Night is a series of video games that adapt board games manufactured by Hasbro.
Hellboy: The Science of Evil,"Hellboy: The Science of Evil is a video game adapted from the 2004 Hellboy film by Guillermo del Toro, based on the comic book character of the same name. It was released for the PlayStation 3, Xbox 360 and PlayStation Portable on June 24, 2008 in North America, followed by an August 15 release in Europe and August 22 release in Australia.All versions follow the same story line, however the PSP version of the game differs from the Xbox 360 and PlayStation versions. There are 3 playable characters: Hellboy, Abe Sapien, and Liz Sherman. Lobster Johnson was planned to be included as a playable character, voiced by Bruce Campbell, but the DLC was never released. Herman von Klempt (voiced by Jürgen Prochnow) is the game's main villain, along with several of his 'kriegaffen'. The game has online and offline multiplayer co-op for up to 2 players.The game was created under the creative direction of both the comic book's creator, Mike Mignola, and the film's director, Guillermo del Toro. Ron Perlman, Selma Blair and Doug Jones reprise their roles from the film as Hellboy, Liz Sherman and Abe Sapien respectively, providing voice-overs."
Heroes Over Europe,"Heroes Over Europe is an arcade flying video game developed by Transmission Games and published by Ubisoft. It is the sequel to Heroes of the Pacific.Heroes Over Europe follows three pilots - an American (Captain Tom Forester) who flies with first the British and later the Americans, a Briton (Captain Danny Miller), and a New Zealander (Flight Lieutenant Will West)- through fourteen missions during World War II beginning in June 1940 and ending in January 1945.  The game features over 40 World War II planes and online support for 16 players in Dogfight, Team Dogfight, Survivor, and Team Survivor game modes.The game was originally planned to be published by Atari, but the company dropped out of publishing the title and instead sold it to Ubisoft in July 2009."
Hitman: Blood Money,"Hitman: Blood Money is a 2006 stealth video game developed by IO Interactive and published by Eidos Interactive. It was released in May 2006 for Microsoft Windows, PlayStation 2, Xbox and Xbox 360. It is the fourth installment in the Hitman video game series, and the sequel to 2004's Hitman: Contracts. The single-player story follows cloned assassin Agent 47's efforts to bring down the Franchise, a rival contract killing organization that is threatening his employers, the International Contract Agency (ICA), and seeking to obtain the same cloning technology that created 47. Meanwhile, a frame story presents 47's life and various contracts he carried out, as narrated by a former FBI director to a journalist.Blood Money was a critical and commercial success, selling more than 2.1 million copies. It has gained a cult following and is now considered by many publications and critics as one of the greatest video games ever made. High-definition ports of Blood Money and two of its predecessors, Hitman 2: Silent Assassin and Contracts, were released on PlayStation 3 and Xbox 360 in January 2013 as the Hitman HD Trilogy. A sequel, Hitman: Absolution, was released in 2012, and 4K remastered ports of both Blood Money and Absolution were released by Warner Bros. Interactive Entertainment in 2019 on the PlayStation 4 and Xbox One as part of the Hitman HD Enhanced Collection."
Homefront,"Home front is an English language term with analogues in other languages. It is commonly used to describe the full participation of the British public in World War I who suffered Zeppelin raids and endured food rations as part of what came to be called the ""Home Front"".Civilians are traditionally uninvolved in combat, except when the hostilities happen to reach their residential areas. However, the expanded destructive capabilities of modern warfare posed an increased direct threat to civilian populations. With the rapid increase of military technology, the term ""military effort"" has changed to include the ""home front"" as a reflection of both a civilian ""sector"" capacity to produce arms, as well as the structural or policy changes which deal with its vulnerability to direct attack.This continuity of ""military effort"" from fighting combat troops to manufacturing facilities has profound effects for the concept of ""total war"". By this logic, if factories and workers producing material are part of the war effort, they become legitimate targets for attack, rather than protected non-combatants. Hence, in practice, both sides in a conflict attack civilians and civilian infrastructure, with the understanding that they are legitimate and lawful targets in war. This military view of civilian targets has effects on the equity of applied legal principles on which the prosecution of crimes against humanity are based.The concept of civilians' involvement in war also developed in connection with general development and change of the ideological attitude to the state. In feudal society and also in absolute monarchy the state was perceived as essentially belonging to the monarch and the aristocracy, ruling over a mass of passive commoners; wars were perceived as a contest between rival rulers, conducted ""above the head"" of the commoners, who were expected to submit to the victor. However even given this, in feudal societies the income of estates and nations, and therefore the wealth and power of monarchs and aristocrats, was proportional to the number of commoners available to work the land. By killing, terrorizing, destroying property and driving away a nobleman's serfs, a tactic known as chevauchée, an attacker could hope either to diminish the strength of an opponent or to force an opponent to give battle.In contrast, since the French Revolution, the state was increasingly perceived as belonging to ""the People"", a perception shared—though in different forms—by democracy, communism and fascism. A logical conclusion was that war has become everybody's business and that also those not taken into the military must still ""do their part"" and ""fight on the home front""."
"Idolmaster, TheThe Idolmaster","The Idolmaster is a Japanese media franchise that began with a raising simulation and rhythm video game series created by Bandai Namco Entertainment (formerly Namco). The series primarily centers on the career of a producer who works with a group of prospective pop idols at the talent agency 765 Production. Originally released as an arcade game in 2005, the franchise has grown to numerous ports, sequels and spin-offs across multiple video game consoles, including several social network games. The series includes a variety of other media such as anime, printed media, audio dramas, a Korean drama, and radio shows."
"Idolmaster: Live For You!, TheThe Idolmaster: Live For You!","The Idolmaster is a Japanese media franchise that began with a raising simulation and rhythm video game series created by Bandai Namco Entertainment (formerly Namco). The series primarily centers on the career of a producer who works with a group of prospective pop idols at the talent agency 765 Production. Originally released as an arcade game in 2005, the franchise has grown to numerous ports, sequels and spin-offs across multiple video game consoles, including several social network games. The series includes a variety of other media such as anime, printed media, audio dramas, a Korean drama, and radio shows."
IL-2 Sturmovik: Birds of Prey,"IL-2 Sturmovik: Birds of Prey, or Wings of Prey on Windows, is a combat flight simulation video game. As with previous installments of the series IL-2 Sturmovik, it depicts combat aircraft from World War II, although with less focus on realistic simulation than other entries in the series. The game has a campaign mode in which players are able to fly the Allies against the Axis, and also a multiplayer mode in which they are able to select either faction. A demo of the game launched on the PSN and Xbox 360's Xbox Live on 29 July 2009.Birds of Prey is based around the large-scale aerial combat and ground military operations of World War II. Players can participate in some of the war's most famous battles, piloting fighters, attack aircraft and heavy bombers across a range of missions. There are six theatres of war to engage in: Battle of Britain, Stalingrad, Berlin, Sicily, Korsun and the Battle of the Bulge, representing the main airborne battles of World War II in Europe.Birds of Prey has a new damage effects engine. Players can see real-time damage to the aircraft such as holes in the wings and trail lines during dog fights. IL-2 Sturmovik: Birds of Prey features hundreds of aircraft taking part in air battles. The environmental engine also produces high-detail, realistic landscapes that allow players to easily see ground support actions.The game was developed by Gaijin Entertainment, who subsequently developed Birds of Steel, also exclusively for consoles. Birds of Steel shares many traits with Birds of Prey (including HUD, aircraft models, controls, and menu design) but differentiates itself by concentrating primarily on US–Japanese aerial battles of the Pacific theater."
James Bond 007: Blood Stone,"James Bond 007: Blood Stone is a 2010 third-person shooter video game developed by Bizarre Creations and published by Activision for Microsoft Windows, Nintendo DS, PlayStation 3 and Xbox 360. It is the 24th game in the James Bond series and is the first game since James Bond 007: Everything or Nothing to have an original story, set between Quantum of Solace (2008) and Skyfall (2012). The game was confirmed by Activision on 16 July 2010 and was released on 2 November 2010 in North America and released on 5 November 2010 in Europe. Activision's remake of GoldenEye 007 was released on the same day respectively in each region. Blood Stone features the voices and likenesses of Daniel Craig, Judi Dench and Joss Stone.The game received mixed reviews from critics upon release. It was also the final game developed by Bizarre Creations as the studio was closed just a few months later on 18 February 2011. It was praised particularly directed at the game's production value, visuals, soundtrack, setting, and characterization, while receiving criticism regarding the game's length, story, mission design, and loss of loyalty compared to other games in the franchise. In the years since Blood Stone release, the game has undergone positive critical re-evaluations, and is retrospectively considered to be an underrated and under-appreciated title in the James Bond series.The game was nominated for several awards during the Spike Video Game Awards 2010, 7th British Academy Games Awards, GoldSpirit Awards 2010, and International Film Music Critics Association Awards by International Film Music Critics Association, winning the Best Original Composition (Video Games) Award at Music + Sound Awards in 2012. A sequel, developed by Raven Software, was reportedly planned but never produced, most likely due to Blood Stone's poor sales upon release."
