11eyes CrossOver,"11eyes: Tsumi to Batsu to Aganai no Shōjo (Japanese: 11eyes -罪と罰と贖いの少女-, lit. 11eyes: Sin, Damnation, and the Atonement Girl), known simply as 11eyes in its anime adaptation, is a Japanese adult visual novel developed and published by Lass first released on April 25, 2008, for a Microsoft Windows PC as a DVD; 11 eyes is Lass' fourth game. A port playable on the Xbox 360 entitled 11eyes CrossOver was released on April 2, 2009, published by 5pb. A manga adaptation illustrated by Naoto Ayano began serialization in the October 2009 issue of Kadokawa Shoten's Comp Ace magazine. An anime television series adaptation by Doga Kobo aired in Japan from October to December 2009. A fan disc for Windows entitled 11eyes -Resona Forma- was planned for release at Fall 2010. The anime has been licensed in North America by Sentai Filmworks; distributor Section23 Films announced that it would release the complete box set on January 11, 2011."
50 Cent: Blood on the Sand,"50 Cent: Blood on the Sand is a third-person shooter video game developed by Swordfish Studios and published by THQ for the PlayStation 3 and Xbox 360. It serves as the sequel to 50 Cent: Bulletproof, and was released in February 2009. The game centers around a fictional 50 Cent and G-Unit concert, set in an unspecified location in the Middle East. After the group's payment, a diamond-encrusted skull, is stolen, they must fight to retrieve it back from the thieves.Blood on the Sand came out of a Covert-One cancelled project at Swordfish Studios, which was tweaked to be less serious. In 2008, Vivendi Games, the initial publisher, merged with Activision. That resulted in the company dropping support for the title, with an uncertain future regarding its release. Shortly after, THQ took over the publishing rights for the game.The game was positively received upon release, with praise directed at 50 Cent's involvement. Despite being noted as an improvement over Bulletproof, it was a commercial failure, which led to the closure of Swordfish Studios in 2010."
A-Train HX,"In rail transport, a train is a series of connected vehicles that run along a railway track and transport people or freight. The word train comes from the Old French trahiner, derived from the Latin trahere meaning ""to pull, to draw"". Trains are typically pulled or pushed by locomotives (often known simply as ""engines""), though some are self-propelled, such as multiple units. Passengers and cargo are carried in railroad cars, also known as wagons. Trains are designed to a certain gauge, or distance between rails. Most trains operate on steel tracks with steel wheels, the low friction of which makes them more efficient than other forms of transport.Trains have their roots in wagonways, which used railway tracks and were powered by horses or pulled by cables. Following the invention of the steam locomotive in the United Kingdom in 1804, trains rapidly spread around the world, allowing freight and passengers to move over land faster and cheaper than ever possible before. Rapid transit and trams were first built in the late 1800s to transport large numbers of people in and around cities. Beginning in the 1920s, and accelerating following World War II, diesel and electric locomotives replaced steam as the means of motive power. Following the development of cars, trucks, and extensive networks of highways which offered greater mobility, as well as faster airplanes, trains declined in importance and market share, and many rail lines were abandoned. The spread of buses led to the closure of many rapid transit and tram systems during this time as well.Since the 1970s, governments, environmentalists, and train advocates have promoted increased use of trains due to their greater fuel efficiency and lower greenhouse gas emissions compared to other modes of land transport. High-speed rail, first built in the 1960s, has proven competitive with cars and planes over short to medium distances. Commuter rail has grown in importance since the 1970s as an alternative to congested highways and a means to promote development, as has light rail in the 21st century. Freight trains remain important for the transport of bulk commodities such as coal and grain, as well as being a means of reducing road traffic congestion by freight trucks.While conventional trains operate on relatively flat tracks with two rails, a number of specialized trains exist which are significantly different in their mode of operation. Monorails operate on a single rail, while funiculars and rack railways are uniquely designed to traverse steep slopes. Experimental trains such as high speed maglevs, which use magnetic levitation to float above a guideway, are under development in the 2020s and offer higher speeds than even the fastest conventional trains. Development of trains which use alternative fuels such as natural gas and hydrogen is another 21st century development."
Absolute: Blazing Infinity,"Blazing Souls (ブレイジングソウルズ, Bureijin Souruzu) is a tactical role-playing game developed by Idea Factory and released for the PlayStation 2 in 2006. It was ported to the Xbox 360 in 2007 as Absolute: Blazing Infinity (アブソリュート ブレイジング インフィニティ, Abusoryūto Burejin Infiniti) and to the PlayStation Portable in 2009 as Blazing Souls Accelate (ブレイジングソウルズ アクセレイト, Bureijin Souruzu Akusereito). The latter version was published in North America by Aksys Games in 2010 and 2012 in Europe by Rising Star Games."
Adrenalin Misfits,None
Akatsuki no Amaneka to Aoi Kyojin,None
Alan Wake,None
Alice: Madness Returns,"Alice: Madness Returns is a psychological horror hack and slash action-adventure platform video game developed by independent studio Spicy Horse and released by Electronic Arts for Microsoft Windows, PlayStation 3 and Xbox 360. It is the sequel to American McGee's Alice (2000). American McGee, a video game designer who is most famous for working on the Doom series, was involved in the development.Alice: Madness Returns follows Alice Liddell, a girl suffering from trauma caused by the death of her family in a fire. Alice was discharged from a psychiatric clinic and now lives in an orphanage for mentally traumatized orphans under the care of Dr. Angus Bumby. To get rid of the trauma and learn the truth about her past, she once again falls into Wonderland, where a new evil force has corrupted it.The game was released worldwide beginning in North America on June 14, 2011, followed by Europe on June 16, 2011, the United Kingdom on June 17, 2011, and Japan on July 21, 2011. The game is also backwards compatible with the Xbox One, and Xbox Series X/S."
Alone in the Dark,"Alone in the Dark is a survival horror video game series, originally developed by Infogrames. In most of the games, the player controls private investigator Edward Carnby, who goes to investigate a haunted mansion or town that is full of undead creatures.The series, particularly for its debut game, is widely acknowledged as a grandfather of survival horror and is often credited with the creation of the genre. The original story was based on the writings of H. P. Lovecraft, although later games in the series drew inspiration from other sources including voodoo, the Wild West, and the works of H. R. Giger. Six installments of the series have been created, with various themes and locations. Two comic books and two films were created based upon the games.In September 2018, Atari, Inc. sold the Alone in the Dark franchise to THQ Nordic."
Apache: Air Assault,"Apache: Air Assault is a combat flight simulator video game for Microsoft Windows, PlayStation 3 and Xbox 360.  It was developed by Russian developer Gaijin Entertainment, which is most famous for its World War II MMO-game War Thunder and published by Activision.The game is a combat flight simulator where players may pilot several types of Apache attack helicopters. The primary goal of most missions is to stop terrorist attacks in fictional, volatile war-ravaged regions."
Apocalypse: Desire Next,"Idea Factory Co., Ltd. (アイディアファクトリー株式会社, Aidia Fakutorī Kabushiki-gaisha) is a Japanese video game developer and publisher founded by former Data East employees in October 1994. A division of the company makes otome games under the name of Otomate. An international branch, Idea Factory International, was opened in California in 2013."
Armored Core 4,"Armored Core 4 is a 2006 third-person shooter mecha video game developed by FromSoftware for the PlayStation 3 and Xbox 360 consoles. It is the twelfth entry in the Armored Core series. Armored Core 4 reboots the franchise with a new storyline and new mechanics.The game is set in the future where a great war has left the nations of Earth devastated and their respective governments have been taken over by corporations. Conflicts begin to break out between the corporations, who use massive combat robots, Armored Cores, to fight each other. The player is a Lynx, a name given to pilots of highly advanced NEXT Armored Cores.Armored Core 4 streamlines many of the features of previous entries while retaining its highly complex customization system. Players take on missions from various clients in return for credits, which they can spend on unlockable parts and weapons. In addition to system link and split-screen multiplayer, players can engage in online battles with 7 other players."
Armored Core: For Answer,Armored Core: For Answer is a 3D vehicular combat mecha-based video game developed by FromSoftware and published by Ubisoft for the PlayStation 3 and Xbox 360. It is the 13th installment of FromSoftware's Armored Core series. Armored Core: For Answer is the direct sequel to Armored Core 4 and takes place around ten years later.
Army of Two,"Army of Two is a third-person shooter video game series developed by EA Montreal. The first game in the series, Army of Two, was released on March 6, 2008 for the Xbox 360 and PlayStation 3 consoles. Focusing on cooperative strategies, Army of Two's main feature is the necessity to use coordinated teamwork to accomplish the game's goals. While the game is meant to be played with another human as a partner, a ""Partner Artificial Intelligence"" (PAI) is also included and programmed to follow the player's strategies. Dependence on a partner (whether human or PAI) is so pronounced that most objectives are impossible to complete without it. A sequel, Army of Two: The 40th Day, was released in January 2010 in North America and Europe. The third game in the series, Army of Two: The Devil's Cartel, was released on March 26, 2013 by Electronic Arts for the Xbox 360 and PlayStation 3."
Army of Two: The 40th Day,"Army of Two: The 40th Day is a third-person shooter video game developed by EA Montreal and published by Electronic Arts for PlayStation 3 and Xbox 360. The game was also released for PlayStation Portable, which was developed by Buzz Monkey. It is the sequel to Army of Two. Army of Two: The 40th Day was released in January 2010 worldwide.The 40th Day focuses on two-player cooperative play and employs a cover system. It features Tyson Rios and Elliot Salem, the two protagonists from the original game, as combatant partners who, with the assistance of their handler Alice Murray, must fight to survive and prevail over invading forces that have engulfed Shanghai, China in a devastating terrorist attack.A sequel to The 40th Day, entitled Army of Two: The Devil's Cartel, has been developed by EA Montreal and Visceral Games and was released on March 26, 2013."
Ashes Cricket 2009,"Ashes Cricket 2009 is a cricket video game developed by Transmission Games and published by Codemasters in the UK and by Namco Bandai in Australia. It has been released for the PlayStation 3, Xbox 360 and Microsoft Windows. A Wii version, developed by Gusto Games, has also been released. The Wii version was released simply as Cricket in Australia. A sequel, International Cricket 2010 was released on 18 June 2010.The game is licensed by the ECB (England and Wales Cricket Board), Cricket Australia and the Marylebone Cricket Club (MCC), owners of the Ashes Urn. It includes all the official players of the Australian cricket team and the England cricket team, however the other teams are not licensed."
Assassin\u0027s Creed,"The Tribunal of the Holy Office of the Inquisition (Spanish: Tribunal del Santo Oficio de la Inquisición), commonly known as the Spanish Inquisition (Spanish: Inquisición española), was established in 1478 by the Catholic Monarchs, King Ferdinand II of Aragon and Queen Isabella I of Castile. It was intended to maintain Catholic orthodoxy in their kingdoms and to replace the Medieval Inquisition, which was under Papal control. It became the most substantive of the three different manifestations of the wider Catholic Inquisition along with the Roman Inquisition and Portuguese Inquisition. The ""Spanish Inquisition"" may be defined broadly as operating in Spain and in all Spanish colonies and territories, which included the Canary Islands, the Kingdom of Naples, and all Spanish possessions in North, Central, and South America. According to modern estimates, around 150,000 people were prosecuted for various offences during the three-century duration of the Spanish Inquisition, of whom between 3,000 and 5,000 were executed (~2.7% of all cases).The Inquisition was originally intended primarily to identify heretics among those who converted from Judaism and Islam to Catholicism. The regulation of the faith of newly converted Catholics was intensified after the royal decrees issued in 1492 and 1502 ordering Jews and Muslims to convert to Catholicism or leave Castile, resulting in hundreds of thousands of forced conversions, the persecution of conversos and moriscos, and the mass expulsions of Jews and of Muslims from Spain. The Inquisition was not definitively abolished until 1834, during the reign of Isabella II, after a period of declining influence in the preceding century."
Assassin\u0027s Creed II,"The Tribunal of the Holy Office of the Inquisition (Spanish: Tribunal del Santo Oficio de la Inquisición), commonly known as the Spanish Inquisition (Spanish: Inquisición española), was established in 1478 by the Catholic Monarchs, King Ferdinand II of Aragon and Queen Isabella I of Castile. It was intended to maintain Catholic orthodoxy in their kingdoms and to replace the Medieval Inquisition, which was under Papal control. It became the most substantive of the three different manifestations of the wider Catholic Inquisition along with the Roman Inquisition and Portuguese Inquisition. The ""Spanish Inquisition"" may be defined broadly as operating in Spain and in all Spanish colonies and territories, which included the Canary Islands, the Kingdom of Naples, and all Spanish possessions in North, Central, and South America. According to modern estimates, around 150,000 people were prosecuted for various offences during the three-century duration of the Spanish Inquisition, of whom between 3,000 and 5,000 were executed (~2.7% of all cases).The Inquisition was originally intended primarily to identify heretics among those who converted from Judaism and Islam to Catholicism. The regulation of the faith of newly converted Catholics was intensified after the royal decrees issued in 1492 and 1502 ordering Jews and Muslims to convert to Catholicism or leave Castile, resulting in hundreds of thousands of forced conversions, the persecution of conversos and moriscos, and the mass expulsions of Jews and of Muslims from Spain. The Inquisition was not definitively abolished until 1834, during the reign of Isabella II, after a period of declining influence in the preceding century."
Assassin\u0027s Creed: Brotherhood,"The Tribunal of the Holy Office of the Inquisition (Spanish: Tribunal del Santo Oficio de la Inquisición), commonly known as the Spanish Inquisition (Spanish: Inquisición española), was established in 1478 by the Catholic Monarchs, King Ferdinand II of Aragon and Queen Isabella I of Castile. It was intended to maintain Catholic orthodoxy in their kingdoms and to replace the Medieval Inquisition, which was under Papal control. It became the most substantive of the three different manifestations of the wider Catholic Inquisition along with the Roman Inquisition and Portuguese Inquisition. The ""Spanish Inquisition"" may be defined broadly as operating in Spain and in all Spanish colonies and territories, which included the Canary Islands, the Kingdom of Naples, and all Spanish possessions in North, Central, and South America. According to modern estimates, around 150,000 people were prosecuted for various offences during the three-century duration of the Spanish Inquisition, of whom between 3,000 and 5,000 were executed (~2.7% of all cases).The Inquisition was originally intended primarily to identify heretics among those who converted from Judaism and Islam to Catholicism. The regulation of the faith of newly converted Catholics was intensified after the royal decrees issued in 1492 and 1502 ordering Jews and Muslims to convert to Catholicism or leave Castile, resulting in hundreds of thousands of forced conversions, the persecution of conversos and moriscos, and the mass expulsions of Jews and of Muslims from Spain. The Inquisition was not definitively abolished until 1834, during the reign of Isabella II, after a period of declining influence in the preceding century."
Avatar: The Last Airbender ? The Burning Earth,"Avatar: The Last Airbender – The Burning Earth (known as Avatar: The Legend of Aang – The Burning Earth in Europe) is a 2007 video game for Game Boy Advance, Nintendo DS, PlayStation 2, Wii, and Xbox 360 based on the animated television series Avatar: The Last Airbender. It was one of the last games released for the Game Boy Advance in North America and Europe. It is the sequel to the 2006 game Avatar: The Last Airbender. The game was followed by a sequel, Avatar: The Last Airbender – Into the Inferno, in 2008.The game is known for its easy Xbox 360 1000G Achievement score, which can quickly be unlocked in under five minutes."
Backbreaker,"Backbreaker refers to a kind of professional wrestling move which sees a wrestler dropping an opponent so that the opponent's back impacts or is bent backwards against a part of the wrestler's body, usually the knee. The standard version of the move sees the wrestler scoop their opponent horizontally before dropping to one knee, slamming the opponent's back on their other knee."
Backyard Sports: Rookie Rush,"This article describes the video game. For the underlying sport, see Street football (American).Backyard Football is a series of video games for various systems. The series was developed by Humongous Entertainment and published by Infogrames, Atari and The Evergreen Group. It is one of several sub-series in the Backyard Sports series, and is the first to feature professional players as kids, examples being Steve Young and Barry Sanders. The series currently has eleven titles.Backyard Football attempts to recreate the experience of playing American football as children."
Backyard Sports: Sandlot Sluggers,"Backyard Sports (originally branded as Junior Sports) is a series of video games released for consoles, computers and mobile devices. The series is best known for starring kid-sized versions of popular professional sports stars, such as Albert Pujols, Paul Pierce, Barry Bonds, Tim Duncan, Clint Mathis, Kevin Garnett, Tom Brady, David Ortiz, Joe Thornton and Andy Macdonald. The Backyard Sports series is licensed by the leading professional U.S. sports leagues: Major League Baseball (MLB), the National Basketball Association (NBA), the National Football League (NFL), the National Hockey League (NHL), and Major League Soccer (MLS).The series includes Backyard Baseball, Backyard Basketball, Backyard Football (American football), Backyard Soccer, Backyard Hockey (Ice hockey), and Backyard Skateboarding. In the games, players form a team consisting of Backyard Kids and pro players, which they take through a ""Backyard League"" season, attempting to become the champions. Players can create their own athletes, starting in Backyard Football (1999). Another aspect of the games is the use of Power-Ups, allowing players to gain ""super-abilities"". For instance, ""Super Dunk"" allows a basketball player to make an incredible dunk from nearly anywhere on the court, ""Leap Frog"" allows a football player to jump over the entire defensive line, and ""Ice Cream Truck"" causes the other team to be completely distracted for a brief period of time.Some of these games are playable with the ScummVM emulator."
Baja: Edge of Control,"Baja: Edge of Control is an off road racing video game developed by American studio 2XL Games and published by THQ for PlayStation 3 and Xbox 360. The game gets its name from the real life Baja 1000 off-road race in Baja California, Mexico, on which it is based. The game is set on over 95 different tracks, including 3 different Baja 250 courses, 2 Baja 500 courses, 1 Baja 1000 course, and has 9 open world environments. The game was released September 22, 2008 in North America and September 26, 2008 in Europe."
Bakugan,"Bakugan Battle Brawlers (爆丸 バトルブローラーズ, Bakugan Batoru Burōrāzu) is a Japanese-Canadian anime adventure television series produced by TMS Entertainment, Dentsu Inc., and Nelvana Limited under the direction of Mitsuo Hashimoto. The story centers on the lives of creatures called Bakugan and the ""battle brawlers"" who possess them. The Bakugan franchise itself is a joint venture between Sega Toys and Spin Master.Although originally broadcast by TV Tokyo in Japan, follow-up seasons (New Vestroia and Gundalian Invaders) premiered in Canada and the US before Japan. The fourth and final season, Mechtanium Surge, was never broadcast in Japan and instead aired in North American markets. However, a Japan-exclusive manga series, Baku Tech! Bakugan, ran from August 15, 2010 to January 15, 2014. This received an anime adaption aired on TV Tokyo from April 7, 2012 to March 30, 2013, followed by a second season called Baku Tech! Bakugan Gachi which ran from April 6, 2013 to December 28, 2013.In 2015, Spin Master revealed plans to relaunch Bakugan. The relaunch was later announced on November 30, 2017 to occur in the first quarter of 2019, with the series title announced as Bakugan: Battle Planet. The new series premiered on Cartoon Network in the United States on December 23, 2018, while Canada's Teletoon premiered the series on December 31, 2018."
Banjo-Kazooie: Nuts \u0026 Bolts,None
