Minecraft,"Minecraft is a sandbox video game developed by the Swedish video game developer Mojang Studios. The game was created by Markus ""Notch"" Persson in the Java programming language. Following several early private testing versions, it was first made public in May 2009 before fully releasing in November 2011, with Jens ""Jeb"" Bergensten then taking over development. Minecraft has since been ported to several other platforms and is the best-selling video game of all time, with over 238 million copies sold and nearly 140 million monthly active users as of 2021.In Minecraft, players explore a blocky, procedurally generated 3D world with virtually infinite terrain, and may discover and extract raw materials, craft tools and items, and build structures, earthworks and simple machines. Depending on game mode, players can fight computer-controlled mobs, as well as cooperate with or compete against other players in the same world. Game modes include a survival mode, in which players must acquire resources to build the world and maintain health, and a creative mode, where players have unlimited resources and access to flight. Players can modify the game to create new gameplay mechanics, items, and assets.Early versions of the game received critical acclaim, winning several awards and being cited as one of the greatest video games of all time. Social media, parodies, adaptations, merchandise, and the annual Minecon conventions played large roles in popularizing the game. The game has also been used in educational environments to teach chemistry, computer-aided design, and computer science. In 2014, Mojang and the Minecraft intellectual property were purchased by Microsoft for US$2.5 billion. A number of spin-off games have also been produced, such as Minecraft: Story Mode, Minecraft Dungeons, and the mobile game Minecraft Earth."
Call of Duty: Modern Warfare 3,"Call of Duty: Modern Warfare 3 is a 2011 first-person shooter video game, jointly developed by Infinity Ward and Sledgehammer Games and published by Activision. The game was released worldwide in November 2011 for Microsoft Windows, the Xbox 360, PlayStation 3, and Wii. It is the third and final installment in the original Modern Warfare saga, a direct sequel to 2009's Call of Duty: Modern Warfare 2, and the eighth Call of Duty installment overall. A separate version for the Nintendo DS was developed by n-Space, while Treyarch developed the game's Wii port. In Japan, Square Enix published the game with a separate subtitled and dubbed version.The game's campaign follows Modern Warfare 2 and begins right after the events of its final mission. Similar to Modern Warfare 2, it is centered around the Task Force 141, which contains Captain Price, Soap MacTavish, and Yuri, one of the playable characters. Alongside the Delta Force and Special Air Service, they hunt Vladimir Makarov (the main antagonist of the trilogy), a Russian terrorist who leads the Russian Ultranationalist party. He leads several terror attacks across Europe, triggering a large-scale war between the Ultranationalists and friendly forces. For the game's multiplayer mode, new mode types and killstreak choices were brought in. Improvements were also made to the mode that solved issues that appeared in Modern Warfare 2.Using an enhanced version of Modern Warfare 2's IW engine, development for the game began in 2010 with more than one developer. Prior to development, Infinity Ward co-founders Jason West and Vince Zampella left the company to form Respawn Entertainment. Other members had been fired or had left the company following the duo's departure. Sledgehammer Games had joined the Modern Warfare 3 development force, with Raven Software also developing the game's multiplayer mode. Following a large leak containing detailed information about the game, multiple teaser trailers were released, with each showcasing a location featured in the game's campaign, leading up to a full reveal.Modern Warfare 3 received positive reviews from critics, with praise for its gameplay, campaign, and multiplayer, although there was some criticism for its story and lack of innovation. It won the award for Best Shooter at the 2011 Spike Video Game Awards. It was a massive commercial success. Within 24 hours of going on sale, the game sold 6.5 million copies in the United States and United Kingdom and grossed $400 million, making it at the time the largest entertainment launch ever."
Katawa Shoujo,"Katawa Shoujo (Japanese: かたわ少女, Hepburn: Katawa Shōjo, lit. ""Cripple Girls"", translated ""Disability Girls"") is a bishōjo-style visual novel by Four Leaf Studios that tells the story of a young man and five young women living with varying disabilities. The game uses a traditional text and sprite-based visual novel model with an ADV-style text box running on the Ren'Py visual novel engine. The game is licensed under the Creative Commons CC-BY-NC-ND.The majority of the story takes place at the boarding school Yamaku High School for disabled students, located in an unnamed city somewhere in modern, northern Japan. The player takes the role of Hisao Nakai, an ordinary boy whose life changes dramatically after a heart attack caused by his long-dormant cardiac arrhythmia. After a lengthy hospitalization, he is forced to transfer to a school specialized in providing education and healthcare for students with disabilities. Over the course of the narrative, Hisao has the opportunity to come to grips with his condition and adjust to his new life.The gameplay of Katawa Shoujo is choice-based, in which the player reads through text and occasionally has the chance to respond to prompts with a variety of preset responses. The decisions made initiate possible events or dialogue within the story. Depending on the choices made by the player, the story branches into multiple forks. Each of these paths chronicle Hisao's deepening and eventually romantic relationship (or lack thereof) with one of the five main female characters; these may variously end well, badly, or neutrally."
Fallout: New Vegas,None
Gears of War 3,"Gears of War 3 is a third-person shooter video game developed by Epic Games and published by Microsoft Studios for the Xbox 360. It is the third installment of the Gears of War series. Originally due for release on April 8, 2011, the game was delayed and eventually released on September 20, 2011. The story was written by science fiction author Karen Traviss.Like its predecessors, Gears of War 3 received widespread critical acclaim from critics. Critics praised its story, voice acting, visuals, and music, but criticized its lack of innovation. Gears of War 3 sold over 3 million copies and was the second best selling game in the U.S.A sequel, not developed by Epic Games titled Gears of War 4, was announced in June 2015 and was released on October 11, 2016."
Dark Souls,"Dark Souls is a 2011 action role-playing game developed by FromSoftware and published by Namco Bandai Games. A spiritual successor to FromSoftware's Demon's Souls, the game is the second installment in the Souls series. Dark Souls takes place in the kingdom of Lordran, where players assume the role of a cursed undead character who begins a pilgrimage to discover the fate of their kind. A port for Microsoft Windows was released in August 2012, which featured additional content not seen in the original PlayStation 3 and Xbox 360 versions. In October 2012, the new content was released for consoles under the subtitle Artorias of the Abyss.Dark Souls has been cited as amongst the greatest video games of all time. Critics praised the depth of its combat, intricate level design, and use of flavor text. However, the game's difficulty received mixed reviews, with some criticizing it for being too unforgiving. The original Windows version of the game was less well-received, with criticism directed at several technical issues. By April 2013, the game had sold over two million copies worldwide. Two sequels were released in the mid-2010s, while a remastered version was released in 2018."
Final Fantasy XII,"Final Fantasy XIII is a science fantasy role-playing video game developed and published by Square Enix for the PlayStation 3 and Xbox 360 consoles and later for the Microsoft Windows operating system. Released in Japan in December 2009 and international in March 2010, it is the thirteenth title in the mainline Final Fantasy series. The game includes fast-paced combat, a new system for the series for determining which abilities are developed for the characters called ""Crystarium"", and a customizable ""Paradigm"" system to control which abilities are used by the characters. Final Fantasy XIII includes elements from the previous games in the series, such as summoned monsters, chocobos, and airships.The game takes place in the fictional floating world of Cocoon, whose government, the Sanctum, is ordering a purge of civilians who have supposedly come into contact with Pulse, the much-feared world below. The former soldier Lightning begins her fight against the government in order to save her sister who has been branded as an unwilling servant to a god-like being from Pulse, making her an enemy of Cocoon. Lightning is soon joined by a band of allies, and together the group also become marked by the same Pulse creature. They rally against the Sanctum while trying to discover their assigned task and whether they can avoid being turned into monsters or crystals at the completion.Development began in 2004, and the game was first announced at Electronic Entertainment Expo (E3) 2006. Final Fantasy XIII is the flagship title of the Fabula Nova Crystallis collection of Final Fantasy games and is the first game to use Square Enix's Crystal Tools engine. Final Fantasy XIII received mostly positive reviews from video game publications, which praised the game's graphics, presentation, and battle system. The game's story received a mixed response from reviewers, and its linearity compared to previous games in the series was mostly criticized. Selling 1.7 million copies in Japan in 2009, Final Fantasy XIII became the fastest-selling title in the history of the series. As of 2017, the game has sold over 7 million copies worldwide on consoles. The Microsoft Windows version has sold over 746,000 copies according to SteamSpy. A sequel, titled Final Fantasy XIII-2, was released in December 2011 in Japan and in February 2012 in North America and PAL regions. A second sequel, titled Lightning Returns: Final Fantasy XIII, which concludes Lightning's story and the Final Fantasy XIII series, was released in November 2013 in Japan and in February 2014 in North America and PAL regions. In September 2014, Square Enix announced the Final Fantasy XIII series has been widely successful and has shipped over 11 million copies worldwide.On November 13, 2018, it was added to Xbox One Backward Compatibility along with its sequels making it playable on the console. It is also Xbox One X Enhanced allowing it to run at a higher resolution."
WWE \u002712,None
Kingdoms of Amalur: Reckoning,None
Team Fortress 2,"Team Fortress 2 is a multiplayer first-person shooter game developed and published by Valve Corporation. It is the sequel to the 1996 Team Fortress mod for Quake and its 1999 remake, Team Fortress Classic. The game was released in October 2007 as part of The Orange Box for Windows and the Xbox 360, and ported to the PlayStation 3 in December 2007. It was released as a standalone game for Windows in April 2008, and updated to support Mac OS X in June 2010 and Linux in February 2013. It is distributed online through Valve's digital retailer Steam, with Electronic Arts managing retail and console editions.Players join one of two teams, RED and BLU, and choose one of nine character classes to play as in game modes such as capture the flag and king of the hill. Development was led by John Cook and Robin Walker, the developers of the original Team Fortress mod. Team Fortress 2 was announced in 1998 under the name Team Fortress 2: Brotherhood of Arms. Initially, the game had more realistic, militaristic visuals and gameplay, but this changed over the protracted nine years of development. After Valve released no information for six years, Team Fortress 2 regularly featured in Wired News' annual vaporware list among other ignominies. The finished Team Fortress 2 has cartoon-like visuals influenced by the art of J. C. Leyendecker, Dean Cornwell, and Norman Rockwell, and uses Valve's Source game engine.Team Fortress 2 has received critical acclaim for its art direction, gameplay, humor, and use of character in a wholly multiplayer game. Valve continues to release new content on a seasonal basis in the form of submissions made through the Steam Workshop. In June 2011, the game became free-to-play, supported by microtransactions for in-game cosmetics. A 'drop system' was also added and refined, allowing free-to-play users to periodically receive in-game equipment and items. Though the game has had an unofficial competitive scene since its release, both support for official competitive play through ranked matchmaking and an overhauled casual experience were added in July 2016."
Assassin\u0027s Creed: Revelations,None
Starcraft II: Wings of Liberty,"StarCraft II: Wings of Liberty is a science fiction real-time strategy video game developed and published by Blizzard Entertainment. It was released worldwide in July 2010 for Microsoft Windows and Mac OS X. A sequel to the 1998 video game StarCraft and the Brood War expansion pack, the game is best known as the original installment of StarCraft II which was later followed by a number of expansion packs. Wings of Liberty has been free-to-play since November 2017.Like its predecessor, the game revolves around three species: the Terrans (humans), the Zerg (a super-species of assimilated life forms), and the Protoss (a technologically advanced species with vast psionic powers). Wings of Liberty focuses on the Terrans, while the expansions, Heart of the Swarm and Legacy of the Void, would focus on the Zerg and Protoss, respectively. The game is set four years after the events of 1998's Brood War, and follows the exploits of Jim Raynor as he leads an insurgent group against the autocratic Terran Dominion. The game includes new and returning characters and locations from the original game.The game was met with critical acclaim, receiving an aggregated score of 93% from Metacritic, and it has been cited as one of the greatest video games ever made. Similar to its predecessor, StarCraft II was praised for its engaging gameplay, as well as its introduction of new features and improved storytelling. The game was criticized for lacking features that existed in the original StarCraft game including LAN play and the ability to switch between multiplayer regions. At the time of its release, StarCraft II became the fastest-selling real-time strategy game, with over three million copies sold worldwide in the first month."
Final Fantasy X,None
Twisted Metal,None
Naruto Shippuden: Ultimate Ninja Storm Generations,"Naruto Shippuden: Ultimate Ninja Storm Revolution, known in Japan as Naruto Shippūden: Narutimate Storm Revolution (NARUTO (ナルト) 疾風伝 ナルティメットストーム レボリューション), is a fighting video game developed by CyberConnect2 and published by Bandai Namco Games as part of the Naruto: Ultimate Ninja video game series, based on the manga Naruto by Masashi Kishimoto. It is a sequel to the 2013 game Naruto Shippuden: Ultimate Ninja Storm 3. The game was released in September 2014 in Japan, North America, and Europe for the PlayStation 3 and Xbox 360.The game features a revamped fighting system. It includes new ways of forming teams based on their skills as well as counterattacks and guard breaks. Masashi Kishimoto worked in the game by providing the new character Mecha-Naruto as well as new designs for the characters belonging to the organization Akatsuki whose back-stories are being told in this game. The game also includes a tournament mode where the player can battle against three CPU fighters at the same time, in an all-out battle royale format. Players are also able to customize characters."
Diablo II: Lord of Destruction,"Diablo II: Lord of Destruction is an expansion pack for the hack and slash action role-playing game Diablo II. Unlike the original Diablo's expansion pack, Diablo: Hellfire, it is a first-party expansion developed by Blizzard North.Lord of Destruction added content in the form of two new character classes, new weapons and an addition of a fifth act, and also dramatically revamped the gameplay of the existing Diablo II for solo and especially multiplayer."
Pokemon FireRed Version,"Pokémon FireRed Version and Pokémon LeafGreen Version are 2004 remakes of the 1996 Game Boy role-playing video games Pokémon Red and Blue. They were developed by Game Freak, published by The Pokémon Company and Nintendo for the Game Boy Advance. FireRed and LeafGreen were first released in Japan in January 2004 and in North America and Europe in September and October 2004 respectively. The games are part of the third generation of the Pokémon video game series and hold the distinction of being the first enhanced remakes of previous games within the franchise.As in previous games, the player controls the player character from an overhead perspective and participates in turn-based battles. Throughout the games, the player captures and raises Pokémon for use in battle. New features include a contextual help menu and a new region the player may access after a certain point in the story. The games have compatibility with the Game Boy Advance Wireless Adapter, which originally came bundled with the games.The games received mostly positive reviews, obtaining an aggregate score of 81 percent on Metacritic. Most critics praised the fact that the games introduced new features while still maintaining the traditional gameplay of the series. Reception of the graphics and audio was more mixed, with some reviewers complaining that they were too simplistic and lacked improvement compared to the previous games, Pokémon Ruby and Sapphire. FireRed and LeafGreen were commercial successes, selling a total of around 12 million copies worldwide. Nearly two years after their original release, Nintendo re-marketed them as Player's Choice titles."
Saints Row: The Third,"Saints Row: The Third is a 2011 action-adventure game developed by Volition and published by THQ. It is the sequel to 2008's Saints Row 2 and the third installment in the Saints Row series. It was released on November 15, 2011 for Microsoft Windows, PlayStation 3, and Xbox 360, and May 10, 2019 for the Nintendo Switch. A remastered version of Saints Row: The Third, titled Saints Row: The Third Remastered, was released by Deep Silver on May 22, 2020 for Windows, PlayStation 4, and Xbox One, March 5, 2021 for Stadia, May 25, 2021 for Xbox Series X and S and PlayStation 5, and July 29, 2021 for Luna.The game is set in the fictional city of Steelport (based on New York City), and continues the story of the 3rd Street Saints, once again putting players in the role of the gang's leader, who is fully customizable. Five years after the events of Saints Row 2, the Saints have grown from their humble origins as a street gang into a large media and consumer empire with their own brand, while many of the gang's members have become celebrities and pop culture icons. After being stranded in Steelport, which is firmly ruled by an international crime organization known as the Syndicate, the Saints must rebuild their forces once more to take over the city and defeat the Syndicate, as well as S.T.A.G., a violent paramilitary contracted with restoring order to Steelport.Development of Saints Row: The Third began in late 2008, shortly after the release of Saints Row 2. There was high staff turnover from the previous Saints Row team, with only one-fifth of the final 100-person staff having worked on a previous title in the series. They aimed to improve on the series by giving the game a coherent tone, and found it in films such as Hot Fuzz and the game's signature sex toy bat. Saints Row: The Third was built using a proprietary engine known as Core Technology Group and the Havok physics engine.The game received generally positive reviews from critics, who praised its general zaniness and customization options. Criticism was aimed at the new setting, which many critics felt was flat and underdeveloped compared to the previous games' Stilwater, and the lackluster humor. On the contrary, others thought the game perfected the Saints Row formula. It was a nominee for Best Narrative at the 2012 Game Developers Conference, an IGN Editor's Choice, and a recipient of perfect scores from GamesRadar and G4. A complete edition including the three downloadable content packs was released in 2012, and its planned Enter the Dominatrix expansion became the game's sequel, Saints Row IV, released in 2013."
Battlefield 3,"Battlefield 1 is a first-person shooter game developed by DICE and published by Electronic Arts. It is the fifteenth installment in the Battlefield series and the first main entry in the series since Battlefield 4 (2013), and was released for Microsoft Windows, PlayStation 4 and Xbox One in October 2016.Battlefield 1 received positive reviews from critics, who saw it as an improvement over the series' previous installments, Battlefield 4 and Battlefield Hardline. Most of the praise was directed towards its World War I setting, single-player campaigns, multiplayer modes, visuals, and sound design.The game was a commercial success, selling over 15 million copies, and was followed by Battlefield V in 2018."
Final Fantasy VIII,"Final Fantasy VII is a 1997 role-playing video game developed by Square for the PlayStation console. It is the seventh main installment in the Final Fantasy series. Published in Japan by Square, it was released in other regions by Sony Computer Entertainment and is the first in the main series with a PAL release. The game's story follows Cloud Strife, a mercenary who joins an eco-terrorist organization to stop a world-controlling megacorporation from using the planet's life essence as an energy source. Events send Cloud and his allies in pursuit of Sephiroth, a former member of the corporation who seeks to destroy the planet. During the journey, Cloud builds close friendships with his party members, including Aerith Gainsborough, who holds the secret to saving their world.Development began in 1994, originally for the  Super Famicom. After delays and technical difficulties from experimenting on several real-time rendering platforms, Square moved production to pre-rendered video, necessitating the huge capacity of the CD-ROM format and therefore departing Nintendo for the PlayStation. Veteran Final Fantasy staff returned, including series creator and producer Hironobu Sakaguchi, director Yoshinori Kitase, and composer Nobuo Uematsu. The game is the first in the series to use full motion video and 3D computer graphics, superimposing real-time 3D character models over pre-rendered CGI backgrounds. Final Fantasy VII introduced more widespread science fiction elements and a more realistic presentation, while the gameplay systems remained largely similar to previous entries, with the addition of new elements such as Materia, Limit Breaks, and new minigames. The staff of more than 100 had a combined development and marketing budget of around $80 million.Assisted by a large promotional campaign, Final Fantasy VII was a commercial success and received critical acclaim, selling more than 13.3 million copies worldwide. It is regarded as a landmark game and as one of the most influential and greatest video games. It won numerous Game of the Year awards, and was acknowledged for boosting sales of the PlayStation and popularizing console role-playing games worldwide. Critics praised its graphics, gameplay, music, and story, although its original English localization received criticism. Its success has led to enhanced ports on various platforms, a multimedia sub-series called the Compilation of Final Fantasy VII, and the ongoing multipart high-definition Final Fantasy VII Remake, the first installment of which was released in 2020."
Gran Turismo 5,None
Battlefield 3,"Battlefield 1 is a first-person shooter game developed by DICE and published by Electronic Arts. It is the fifteenth installment in the Battlefield series and the first main entry in the series since Battlefield 4 (2013), and was released for Microsoft Windows, PlayStation 4 and Xbox One in October 2016.Battlefield 1 received positive reviews from critics, who saw it as an improvement over the series' previous installments, Battlefield 4 and Battlefield Hardline. Most of the praise was directed towards its World War I setting, single-player campaigns, multiplayer modes, visuals, and sound design.The game was a commercial success, selling over 15 million copies, and was followed by Battlefield V in 2018."
