,None
Roberto Alomar,"Roberto ""Robbie"" Alomar Velázquez (; Spanish pronunciation: [aloˈmaɾ]; born February 5, 1968)is a Puerto Rican former Major League Baseball player for the San Diego Padres, Toronto Blue Jays, Baltimore Orioles, Cleveland Indians, New York Mets, Chicago White Sox, and Arizona Diamondbacks (1988–2004). He is regarded as one of the greatest second basemen and all-around players. During his career, the 12-time All-Star won more Gold Glove Awards (10) than any other second baseman in baseball history, in addition to winning four Silver Slugger Awards for his hitting. Among second basemen, he ranks third in games played (2,320), fifth in stolen bases (474), sixth in plate appearances (10,400), seventh in doubles (504) and assists (6,524), and eighth in hits (2,724), runs (1,508), at bats (9,073), and double plays turned (1,407). In 2011, Alomar was inducted into the National Baseball Hall of Fame, becoming the first Hall of Fame member to be depicted as a Blue Jays player on his plaque.The son of MLB second baseman Sandy Alomar Sr., Alomar followed in his father's footsteps, signing with the Padres as an amateur free agent in 1985. He made his major league debut with the team three years later, establishing himself as an exceptional base-stealing, hitting, and fielding threat before becoming an All-Star in 1990. He was traded to the Blue Jays the following off-season, leading the team to three consecutive American League Championship Series (ALCS) appearances and being named the 1992 ALCS Most Valuable Player (MVP), culminating in back-to-back World Series championships in 1992 and 1993. Alomar signed with the Orioles after the 1995 season, led the team to two ALCS appearances, and won the 1998 All-Star Game MVP Award in his final year with the team. He then joined the Indians for three seasons and had the most productive years of his career in 1999 and 2001, again leading his team to the playoffs and becoming an AL MVP Award finalist both years. Alomar spent the final years of his career with the Mets, White Sox, and Diamondbacks before retiring at spring training in 2005.A switch hitter, Alomar finished his career with a .300 batting average. Shortly after his 2011 Hall of Fame induction, the Blue Jays retired his number 12. In 2020, Alomar became the owner of RA12, an expansion team in the Liga de Béisbol Profesional Roberto Clemente. He also became a member of the LBPRC Board of Directors. In 2021, Alomar was banned from baseball by MLB following an independent investigation into allegations of sexual misconduct, dating back to 2014. In April 2021, the Blue Jays also announced that Alomar would be removed from the Level of Excellence and his retired number banner would be taken down at Rogers Centre."
Bert Blyleven,"Bert Blyleven (born Rik Aalbert Blijleven, April 6, 1951) is a Dutch-American former professional baseball pitcher who played 22 seasons in Major League Baseball (MLB) from 1970 to 1992, primarily with the Minnesota Twins. Blyleven recorded 3,701 career strikeouts, the fifth-most in MLB history. He won 287 games, 27th-most all-time and pitched 4,970 innings, 14th-most all-time. A renowned curveball pitcher, Blyleven was also a two-time All-Star and World Series champion. He was inducted into the Baseball Hall of Fame in 2011 in his second-to-last year of eligibility after struggling in the early years of his campaign.Blyleven made his major league debut at age 19 for the Twins. In the middle of the 1976 season, he was traded to the Texas Rangers, where he threw a no-hitter in his final start for the team. He won his first World Series with the Pittsburgh Pirates in 1979. Upon being traded to the Cleveland Indians, he struggled with injuries but had a late-career resurgence in his second stint with the Twins, becoming the tenth member of the 3,000-strikeout club in 1986 and carrying Minnesota to a World Series title in 1987. He played three seasons for the California Angels before retiring.Blyleven became the first Dutch-born player to earn induction into the Baseball Hall of Fame. He served as the pitching coach for the Netherlands national baseball team in the 2009, 2013 and 2017 World Baseball Classic. From 1996 to 2020, he was a color analyst for Minnesota Twins television broadcasts."
Pat Gillick,"Lawrence Patrick David Gillick (born August 22, 1937) is an American professional baseball executive. He previously served as the general manager of four MLB teams: the Toronto Blue Jays (1978–1994), Baltimore Orioles (1996–1998), Seattle Mariners (2000–2003), and Philadelphia Phillies (2006–2008). He guided the Blue Jays to World Series championships in 1992 and 1993, and later with the Phillies in 2008.He won a national championship in college while pitching for the University of Southern California (USC). Gillick was inducted into the Canadian Baseball Hall of Fame in 1997, the National Baseball Hall of Fame on July 24, 2011, the Ontario Sports Hall of Fame in 2013, and the Phillies Wall of Fame in 2018."
Andre Dawson,None
Doug Harvey,None
Whitey Herzog,"Dorrel Norman Elvert ""Whitey"" Herzog (; born November 9, 1931) is an American former professional baseball outfielder and manager, most notable for his Major League Baseball (MLB) managerial career.Born in New Athens, Illinois, Herzog made his MLB debut as a player in 1956 with the Washington Senators. After his playing career ended in 1963, Herzog went on to perform a variety of roles in Major League Baseball, including scout, manager, coach, general manager, and farm system director. As a big-league manager, he led the Kansas City Royals to three consecutive playoff appearances from 1976 to 1978. Hired by Gussie Busch in 1980 to helm the St. Louis Cardinals, the Cardinals won the 1982 World Series over the Milwaukee Brewers and made two other World Series appearances, in 1985 and 1987 under Herzog's direction. He was inducted into the Baseball Hall of Fame on July 25, 2010, and was inducted into the St. Louis Cardinals Hall of Fame Museum on August 16, 2014."
Joe Gordon,"Joseph Lowell Gordon (February 18, 1915 – April 14, 1978), nicknamed ""Flash"" in reference to the comic-book character Flash Gordon, was an American second baseman, coach and manager in Major League Baseball who played for the New York Yankees and Cleveland Indians from 1938 to 1950. He was inducted into the Baseball Hall of Fame in 2009.Gordon was the outstanding player at his position during the 1940s, winning the 1942 American League MVP Award and being named to The Sporting News Major League All-Star Team in nine of his eleven seasons. Known for his acrobatic defense, he led the AL in assists four times and in double plays three times. He was the first AL second baseman to hit 20 home runs in a season, doing so seven times, is second all-time for career home runs at second base (246) behind Robinson Canó, and he held the single-season record until 2001. He played a major role on the 1948 champion Indians, leading the team in homers and runs batted in. He ranked sixth in major league history in double plays (1,160) upon retiring, and was sixth in AL history in games (1,519), putouts (3,600), assists (4,706) and total chances (8,566) and seventh in fielding percentage (.970)."
Rickey Henderson,"Ricky John Henderson (born 11 September 1988) is a former Australian rules footballer who played for the Adelaide Football Club and the Hawthorn Football Club in the Australian Football League (AFL). Henderson was Adelaide's first selection in the 2009 rookie draft, taken at pick 10."
Jim Rice,"James Edward Rice (born March 8, 1953), nicknamed ""Jim Ed"", is a former Major League Baseball left fielder and designated hitter. He was inducted into the Baseball Hall of Fame on July 26, 2009, as the 103rd member voted in by the BBWAA. Rice played his entire 16-year baseball career for the Boston Red Sox.Rice was an eight-time American League (AL) All-Star and was named the AL's Most Valuable Player in 1978 after becoming the first major league player in 19 years to hit for 400 total bases. He went on to become the ninth player to lead the major leagues in total bases in consecutive seasons. He joined Ty Cobb as one of two players to lead the AL in total bases three years in a row. He batted .300 seven times, collected 100 runs batted in (RBI) eight times and 200 hits four times, and had 11 seasons with 20 home runs. He also led the league in home runs three times, RBIs and slugging percentage twice each.From 1975 through 1980 he was part of one of the sport's great outfields along with Fred Lynn and Dwight Evans (who was his teammate for his entire career); Rice continued the tradition of his predecessors Ted Williams and Carl Yastrzemski as a power-hitting left fielder who played his entire career for the Red Sox. He ended his career with a .502 slugging percentage, and then ranked tenth in AL history with 382 home runs; his career marks in homers, hits (2,452), RBI (1,451) and total bases (4,129) remain Red Sox records for a right-handed hitter, with Evans eventually surpassing his Boston records for career runs scored, at bats and extra base hits by a right-handed hitter. When Rice retired, his 1,503 career games in left field ranked seventh in AL history."
Barney Dreyfuss,"Bernhard ""Barney"" Dreyfuss (February 23, 1865 – February 5, 1932) was an executive in Major League Baseball who owned the Pittsburgh Pirates franchise from 1900 to his death. He was inducted into the National Baseball Hall of Fame in 2008.Dreyfuss is often credited with the creation of the modern baseball World Series. He also built one of baseball's first modern steel and concrete baseball parks, Forbes Field, in 1909. During his period of ownership, the Pirates won six National League pennants and World Series titles in 1909 and 1925; only the New York Giants won more NL championships (10) during the same period."
Rich Gossage,None
Bowie Kuhn,"Bowie Kent Kuhn (; October 28, 1926 – March 15, 2007) was an American lawyer and sports administrator who served as the fifth Commissioner of Major League Baseball from February 4, 1969, to September 30, 1984. He served as legal counsel for Major League Baseball owners for almost 20 years prior to his election as commissioner.Kuhn was inducted into the National Baseball Hall of Fame in 2008."
Walter O\u0027Malley,"Maryland (US:  (listen) MERR-il-ənd) is a state in the Mid-Atlantic region of the United States. It shares borders with Virginia, West Virginia, and the District of Columbia to its south and west; Pennsylvania to its north; and Delaware and the Atlantic Ocean to its east. Baltimore is the largest city in the state, and the capital is Annapolis. Among its occasional nicknames are Old Line State, the Free State, and the Chesapeake Bay State. It is named after the English Queen Henrietta Maria, known in England as Queen Mary, who was the French wife of King Charles I.Before its coastline was explored by Europeans in the 16th century, Maryland was inhabited by several groups of Native Americans – mostly by the Algonquin, and, to a lesser degree, by the Iroquois and Siouian. As one of the original Thirteen Colonies of England, Maryland was founded by George Calvert, 1st Baron Baltimore, a Catholic convert who sought to provide a religious haven for Catholics persecuted in England. In 1632, Charles I of England granted Lord Baltimore a colonial charter, naming the colony after his wife, Queen Mary (Henrietta Maria of France). Unlike the Pilgrims and Puritans, who rejected Catholicism in their settlements, Lord Baltimore envisioned a colony where people of different religious sects would coexist under the principle of toleration. Accordingly, in 1649 the Maryland General Assembly passed an Act Concerning Religion, which enshrined this principle by penalizing anyone who ""reproached"" a fellow Marylander based on religious affiliation. Nevertheless, religious strife was common in the early years, and Catholics remained a minority, albeit in greater numbers than in any other English colony.Maryland's early settlements and population centers clustered around rivers and other waterways that empty into the Chesapeake Bay. Its economy was heavily plantation-based and centered mostly on the cultivation of tobacco. Great Britain's need for cheap labor led to a rapid expansion of indentured servants, penal labor, and African slaves. In 1760, Maryland's current boundaries took form following the settlement of a long-running border dispute with Pennsylvania. Maryland was an active participant in the events leading up to the American Revolution, and by 1776, its delegates signed the Declaration of Independence. Many of its citizens subsequently played key political and military roles in the war. In 1790, the state ceded land for the establishment of the U.S. capital of Washington, D.C.Although then a slave state, Maryland remained in the Union during the American Civil War, its strategic location giving it a significant role in the conflict. After the Civil War, Maryland took part in the Industrial Revolution, driven by its seaports, railroad networks, and mass immigration from Europe. Since the 1940s, the state's population has grown rapidly, to approximately six million residents, and it is among the most densely populated U.S. states. As of 2015, Maryland had the highest median household income of any state, owing in large part to its proximity to Washington, D.C., and a highly diversified economy spanning manufacturing, retail services, public administration,  real estate, higher education, information technology, defense contracting, health care, and biotechnology. The state's central role in U.S. history is reflected by its hosting of some of the highest numbers of historic landmarks per capita.Sixteen of Maryland's twenty-three counties, as well as the city of Baltimore, border the tidal waters of the Chesapeake Bay estuary and its many tributaries, which combined total more than 4,000 miles of shoreline. Although one of the smallest states in the U.S., it features a variety of climates and topographical features that have earned it the moniker of America in Miniature. In a similar vein, Maryland's geography, culture, and history combine elements of the Mid-Atlantic, Northeastern, and Southern regions of the country."
Billy Southworth,"William Harold Southworth (March 9, 1893 – November 15, 1969) was an American outfielder and manager in Major League Baseball (MLB). As a player in 1913 and 1915 and from 1918 to 1929 for five big-league teams, Southworth took part in almost 1,200 games, fell just short of 1,300 hits and batted .297 lifetime.  Southworth managed in 1929 and from 1940 through 1951.  He oversaw three pennant-winning St. Louis Cardinals teams, winning two World Series, and another pennant with the Boston Braves, the last National League title in Boston baseball history.  As manager of the Cardinals, his .642 winning percentage is the second-highest in franchise history and the highest since 1900.Late in life, Southworth served as a scout for the Braves. He endured a great deal of tragedy in his baseball career, first experiencing the stillbirth of his twin babies and the deaths of his wife and his adult son. He died in 1969. He was inducted into the Baseball Hall of Fame in 2008. Six years later, the Cardinals inducted him into the St. Louis Cardinals Hall of Fame Museum. He also belongs to the Alabama Sports Hall of Fame. Southworth had a son, Billy Southworth Jr., and a cousin, Bill Southworth, who both played professional baseball."
Dick Williams,"Richard Hirschfeld Williams (May 7, 1929 – July 7, 2011) was an American left fielder, third baseman, manager, coach and front office consultant in Major League Baseball. Known especially as a hard-driving, sharp-tongued manager from 1967 to 1969 and from 1971 to 1988, he led teams to three American League pennants, one National League pennant, and two World Series triumphs. He is one of nine managers to win pennants in both major leagues, and joined Bill McKechnie in becoming only the second manager to lead three franchises to the Series. He and Lou Piniella are the only managers in history to lead four teams to seasons of 90 or more wins. Williams was inducted into the National Baseball Hall of Fame in 2008 following his election by the Veterans Committee."
Tony Gwynn,"Anthony Keith Gwynn Sr. (May 9, 1960 – June 16, 2014), nicknamed ""Mr. Padre"", was an American professional baseball right fielder, who played 20 seasons (1982–2001) in Major League Baseball (MLB) for the San Diego Padres. The left-handed hitting Gwynn won eight batting titles in his career, tied for the most in National League (NL) history. He is considered one of the best and most consistent hitters in baseball history. Gwynn had a .338 career batting average, never hitting below .309 in any full season. He was a 15-time All-Star, recognized for his skills both on offense and defense with seven Silver Slugger Awards and five Gold Glove Awards. Gwynn was the rare player in his era that stayed with a single team his entire career, and he played in the only two World Series appearances in San Diego's franchise history. He was inducted into the Baseball Hall of Fame in 2007, his first year of eligibility.Gwynn attended San Diego State University (SDSU), where he played both college baseball and basketball for the Aztecs. He was an all-conference player in both sports in the Western Athletic Conference (WAC), but was honored as an All-American in baseball. Gwynn was selected by the Padres in the third round of the 1981 MLB draft, as the 58th overall pick. He made his major-league debut the following year, and captured his first batting title in 1984, when San Diego advanced to its first-ever World Series. A poor fielder in college, Gwynn's work on his defense was rewarded in 1986, when he received his first Gold Glove. The following year, he won the first of three consecutive batting titles. Beginning in 1990, Gwynn endured four straight seasons which ended prematurely due to injuries, particular to his left knee. However, he experienced a resurgence with four straight batting titles starting in 1994, when he batted a career-high .394 in a strike-shortened season. Gwynn played in his second World Series in 1998, before reaching the 3,000-hit milestone the following year. He played two more seasons, hampered by injuries in both, and retired after the 2001 season with 3,141 career hits.A contact hitter, Gwynn excelled at hitting the ball to the opposite field. After meeting Hall of Famer Ted Williams in 1992, Gwynn became more adept at pulling the ball and using the entire field, as well as hitting for more power. He could also run early in his career, when he was a stolen base threat. Widely considered the greatest player in Padres history, Gwynn regularly accepted less money to remain with the small-market team. After he retired from playing, the Padres retired his No. 19 in 2004. Gwynn became the head baseball coach at his alma mater, and also spent time as a baseball analyst. Gwynn died of salivary gland cancer in 2014 at the age of 54."
Cal Ripken,"Calvin Edwin Ripken Jr. (born August 24, 1960), nicknamed ""The Iron Man"", is an American former baseball shortstop and third baseman who played 21 seasons in Major League Baseball (MLB) for the Baltimore Orioles (1981–2001). One of his position's most offensively productive players, Ripken compiled 3,184 hits, 431 home runs, and 1,695 runs batted in during his career, and he won two Gold Glove Awards for his defense. He was a 19-time All-Star and was twice named American League (AL) Most Valuable Player (MVP). Ripken holds the record for consecutive games played, 2,632, surpassing Lou Gehrig's streak of 2,130 that had stood for 56 years and that many deemed unbreakable. In 2007, he was elected to the National Baseball Hall of Fame in his first year of eligibility with 98.53% of votes, the sixth-highest election percentage ever.Born in Maryland, Ripken grew up traveling around the United States as his father, Cal Sr., was a player and coach in the Orioles' organization. After playing at Aberdeen High School, Ripken Jr. was drafted by the Orioles in the second round of the 1978 MLB draft. He reached the major leagues in 1981 as a shortstop but moved to third base in 1982, but the following year, he was shifted to shortstop, his long-time position for Baltimore. That year, Ripken also won the AL Rookie of the Year Award and began his consecutive games played streak. In 1983, he won a World Series championship over the Philadelphia Phillies and his first AL MVP Award. One of Ripken's best years came in 1991 when he was named an All-Star, won the Home Run Derby, and was recipient of his first All-Star Game MVP Award, his second AL MVP Award, and first Gold Glove Award. He broke the consecutive games played record on September 6, 1995, in his 2,131st consecutive game, which fans voted as the league's ""most memorable moment"" in the history of the game in an MLB.com poll; Ripken voluntarily ended his 17-year streak at 2,632 games before the final home game of the 1998 season. He switched back to third base for the final five years of his career. In 2001, his final season, Ripken was named the All-Star Game MVP and was honored with the Commissioner's Historic Achievement Award.Ripken is considered one of the best shortstops in baseball history. At 6 ft 4 in (1.93 m), 225 lb (102 kg), he pioneered the way for the success of taller, larger shortstops. He holds the record for most home runs hit as a shortstop (345), breaking the record previously held by Ernie Banks, and was selected as the starting shortstop for the Major League Baseball All-Century Team. Ripken is a best-selling author and the President and CEO of Ripken Baseball, Inc., whose goal is to grow the love of baseball from a grassroots level. Since his retirement, he has purchased three minor league baseball teams. He has been active in charity work throughout his career and is still considered an ambassador of the game. He lives in Annapolis, Maryland and is married to Laura Ripken, née Kiessling, a judge on the Maryland Court of Special Appeals."
Raymond Brown,None
Willard Brown,"Willard Jessie Brown (June 26, 1915 – August 4, 1996), nicknamed ""Home Run"" Brown, was an American baseball player who played outfielder in the Negro leagues for the Kansas City Monarchs and in Major League Baseball (MLB) for the St. Louis Browns. For the Monarchs, he led the Negro American League in hits for eight seasons (1937–39, 1941–43, 1946, 1948) and runs batted in (RBI) seven times during his career. His eight times leading a league in hits is tied with Ty Cobb for most in baseball history while his seven times leading in RBI for a league is tied for second-most in baseball history with Josh Gibson; Gibson and Brown also finished in the top two in batting average in five seasons each, most in Negro league history. He is a member of the National Baseball Hall of Fame and Museum."
Andy Cooper,"Andrew Lewis Cooper (April 24, 1898 – June 3, 1941), nicknamed ""Lefty"", was an American left-handed pitcher in baseball's Negro leagues. He was elected to the Baseball Hall of Fame in 2006. An alumnus of Paul Quinn College, Cooper played nine seasons for the Detroit Stars and ten seasons for the Kansas City Monarchs, and briefly played for the Chicago American Giants. The Texan was 6 feet 2 inches (188 cm) tall and weighed 220 pounds (100 kg; 16 st).In defiance of a threatened five-year Negro league ban for contract jumping, Cooper joined a 1927 barnstorming team that toured Hawaii and Japan. He spent most of his later career with the Monarchs. Cooper is the Negro league record holder for career saves. In a 1937 playoff game, he pitched 17 innings. Cooper served as manager or player-manager for the Monarchs from 1937 to 1940, leading the team to the pennant three times during those four seasons."
Frank Grant,"Ulysses Franklin Grant (August 1, 1865 – May 27, 1937) was an American baseball player in the 19th century. Early in his career, he was a star player in the International League, shortly before race-based restrictions were imposed that banned African-American players from organized baseball. Grant then became a pioneer in the early Negro leagues, starring for several of the top African-American teams of the late 19th and early 20th centuries. He is widely considered to have been the greatest African-American player of the 19th century. In 2006, Grant was elected to the National Baseball Hall of Fame."
Pete Hill,"John Preston ""Pete"" Hill (October 12, 1882 – November 19, 1951) was an American outfielder and manager in baseball's Negro leagues from 1899 to 1925. He played for the Philadelphia Giants, Leland Giants, Chicago American Giants, Detroit Stars, Milwaukee Bears, and Baltimore Black Sox. Hill starred for teams owned by Negro league executive Rube Foster for much of his playing career.He was elected to the Baseball Hall of Fame in 2006."
