,NoneHank Greenberg,"Henry Benjamin Greenberg (born Hyman Greenberg; January 1, 1911 – September 4, 1986), nicknamed ""Hammerin' Hank"", ""Hankus Pankus"", or ""The Hebrew Hammer"", was an American professional baseball player and team executive. He played in Major League Baseball (MLB), primarily for the Detroit Tigers as a first baseman in the 1930s and 1940s. A member of the Baseball Hall of Fame and a two-time Most Valuable Player (MVP) Award winner, he was one of the premier power hitters of his generation and is widely considered one of the greatest sluggers in baseball history. He had 47 months of military service including service in World War II, all of which took place during what would have been prime years in his major league career.Greenberg played the first twelve of his 13 major league seasons for Detroit. He was an American League (AL) All-Star for four seasons and an AL MVP in 1935 (first baseman) and 1940 (left fielder). He had a batting average over .300 in eight seasons, and won two World Series championships with the Tigers (1935 and 1945). He was the AL home run leader four times and his 58 home runs for the Tigers in 1938 equaled Jimmie Foxx's 1932 mark for the most in one season by anyone other than Babe Ruth, and tied Foxx for the most home runs between Ruth's record 60 in 1927 and Roger Maris' record 61 in 1961. Greenberg was the first major league player to hit 25 or more home runs in a season in each league, and remains the AL record-holder for most runs batted in in a single season by a right-handed batter (183 in 1937, a 154-game schedule). His career statistics would have certainly been higher had he not served in the armed services during wartime. In 1947, Greenberg signed a contract for a record $85,000 salary before being sold to the Pittsburgh Pirates, where he played his final MLB season that year. After retiring from playing, Greenberg continued to work in baseball as a team executive for the Cleveland Indians and Chicago White Sox.Greenberg was the first Jewish superstar in American team sports. He attracted national attention in 1934 in the middle of a pennant race when he had to decide whether to play baseball on two major Jewish holidays; after consultation with his rabbi, he agreed to play on Rosh Hashanah, but on Yom Kippur he spent the day at his synagogue, even though he was not particularly observant religiously. Having endured his share of anti-semitic abuse in his career, Greenberg was one of the few opposing players to publicly welcome African-American player Jackie Robinson to the major leagues in 1947."
Home Run Baker,"John Franklin ""Home Run"" Baker (March 13, 1886 – June 28, 1963) was an American professional baseball player. A third baseman, Baker played in Major League Baseball from 1908 to 1922 for the Philadelphia Athletics and New York Yankees. Although he never hit more than a dozen home runs in a season (Ned Williamson hit 27 in 1884) and hit only 96 homers in his career (Roger Connor hit 138), Baker has been called the ""original home run king of the majors"".Baker was a member of the Athletics' $100,000 infield. He helped the Athletics win the 1910, 1911 and 1913 World Series. After a contract dispute, the Athletics sold Baker to the Yankees, where he and Wally Pipp helped the Yankees' offense. Baker appeared with the Yankees in the 1921 and 1922 World Series, though the Yankees lost both series, before retiring.Baker led the American League in home runs from 1911 to 1914. He had a batting average over .300 in six seasons, had three seasons with more than 100 runs batted in, and had two seasons with over 100 runs scored. Baker's legacy has grown over the years, and he is regarded by many as one of the best power hitters of the deadball era. During his 13 years as a major league player, Baker never played a single inning at any position other than third base. Baker was elected to the National Baseball Hall of Fame by the Veterans Committee in 1955."
Joe DiMaggio,"John William DiMaggio (; born September 4, 1968) is an American actor. His various voice roles include Bender on Futurama, Jake the Dog on Adventure Time, Marcus Fenix in the Gears of War series, Dr. Drakken on Kim Possible, Hak Foo in Jackie Chan Adventures, The Scotsman on Samurai Jack, Brother Blood on Teen Titans, Shnitzel on Chowder, Fu Dog on American Dragon: Jake Long, Hammerhead and Sandman on The Spectacular Spider-Man, Aquaman on Batman: The Brave and the Bold, King Zøg on Disenchantment, Wakka and Kimahri in Final Fantasy X, Rath and Aggregor on Ben 10, and Gonza in Princess Mononoke."
Gabby Hartnett,"Charles Leo ""Gabby"" Hartnett (December 20, 1900 – December 20, 1972), nicknamed ""Old Tomato Face"", was an American professional baseball player and manager. He played almost his entire career in Major League Baseball as a catcher with the Chicago Cubs, from 1922 to 1940. He spent the final season of his career as a player-coach with the New York Giants in 1941. After his playing career, Hartnett continued his involvement in baseball as a coach and as a minor league manager.Hartnett was an all-around player, performing well both offensively and defensively. Known for his strong and accurate throwing arm, he routinely led the National League's catchers in caught stealing percentage and was the first major league catcher to hit more than 20 home runs in a season. During the course of his career, Hartnett took part in some of the more memorable events in Major League Baseball history including; Babe Ruth's Called Shot during the 1932 World Series, Carl Hubbell's strike-out performance in the 1934 All-Star Game and Dizzy Dean's career-altering injury during the 1937 All-Star Game. However, the greatest moment of Hartnett's career came with one week left in the 1938 season, when he hit a game-winning home run in the bottom of the ninth inning to put the Cubs in first place. The event, which occurred as darkness descended onto Wrigley Field, became immortalized as the ""Homer in the Gloamin'"".Prior to Johnny Bench, Hartnett was considered the greatest catcher in the history of the National League. A six-time All-Star, he appeared in four World Series during his playing career. At the time of his retirement, Hartnett held the career records for catchers in home runs, runs batted in, hits, doubles and most games played as a catcher. Hartnett was inducted into the Baseball Hall of Fame in 1955."
Ted Lyons,"Theodore Amar Lyons (December 28, 1900 – July 25, 1986) was an American professional baseball starting pitcher, manager and coach in Major League Baseball (MLB). He played in 21 MLB seasons, all with the Chicago White Sox. He is the franchise leader in wins. Lyons won 20 or more games three times (in 1925, 1927, and 1930) and became a fan favorite in Chicago.Lyons was inducted into the Baseball Hall of Fame in 1955. He has the fourth-highest career ERA among Hall of Fame pitchers, and is the only Hall of Fame pitcher to have more walks than strikeouts. In 1981 Lawrence Ritter and Donald Honig included Lyons in their book The 100 Greatest Baseball Players of All Time."
Ray Schalk,"Raymond William Schalk (August 12, 1892 – May 19, 1970) was an American professional baseball player, coach, manager and scout. He played as a catcher in Major League Baseball for the Chicago White Sox for the majority of his career. Known for his fine handling of pitchers and outstanding defensive ability, Schalk was considered the greatest defensive catcher of his era. He revolutionized the way the catching position was played by using his speed and agility to expand the previously accepted defensive capabilities for his position. Schalk was elected to the Baseball Hall of Fame in 1955."
Dazzy Vance,"Charles Arthur ""Dazzy"" Vance (March 4, 1891 – February 16, 1961) was an American professional baseball player. He played as a pitcher for five different franchises in Major League Baseball (MLB) in a career that spanned twenty years. Known for his impressive fastball, Vance was the only pitcher to lead the National League in strikeouts seven consecutive seasons. Vance was inducted into the Baseball Hall of Fame in 1955."
Bill Dickey,"William Malcolm Dickey (June 6, 1907 – November 12, 1993) was an American professional baseball catcher and manager. He played in Major League Baseball with the New York Yankees for 19 seasons. Dickey managed the Yankees as a player-manager in 1946 in his last season as a player.Dickey played with the Yankees from 1928 through 1943. After serving in the United States Navy during World War II, Dickey returned to the Yankees in 1946 as a player and manager. He retired after the 1946 season, but returned in 1949 as a coach, where he taught Yogi Berra the finer points of catching.During Dickey's playing career, the Yankees went to the World Series nine times, winning eight championships. He was named to 11 All-Star Games. As a manager and coach, he led the Yankees to another six World Series titles. Dickey was elected to the Baseball Hall of Fame in 1954."
Rabbit Maranville,None
Bill Terry,"William Harold Terry (October 30, 1898 – January 9, 1989) was an American professional baseball first baseman and manager. He played in Major League Baseball (MLB) for the New York Giants from 1923 to 1936 and managed the Giants from 1932 to 1941. Terry was inducted into the Baseball Hall of Fame in 1954. In 1999, he ranked number 59 on The Sporting News list of the 100 Greatest Baseball Players, and was a nominee for the Major League Baseball All-Century Team. The Giants retired Terry's uniform number 3 in 1984; it is posted on the facade of the upper deck in the left field corner of Oracle Park. Nicknamed ""Memphis Bill"", he is most remembered for being the last National League player to hit .400, a feat he accomplished by batting .401 in 1930."
Ed Barrow,"Edward Grant Barrow (May 10, 1868 – December 15, 1953) was an American manager and front office executive in Major League Baseball. He served as the field manager of the Detroit Tigers and Boston Red Sox. He served as business manager (de facto general manager) of the New York Yankees from 1921 to 1939 and as team president from 1939 to 1945, and is credited with building the Yankee dynasty. Barrow was elected to the Baseball Hall of Fame in 1953.Born in a covered wagon in Springfield, Illinois, Barrow worked as a journalist and soap salesman before entering the business of baseball by selling concessions at games. From there, Barrow purchased minor league baseball teams, also serving as team manager, and served as president of the Atlantic League. After managing the Tigers in 1903 and 1904 and returning to the minor leagues, Barrow became disenchanted with baseball, and left the game to operate a hotel.Barrow returned to baseball in 1910 as president of the Eastern League. After a seven-year tenure, Barrow managed the Red Sox from 1918 through 1920, leading the team to victory in the 1918 World Series. When Red Sox owner Harry Frazee began to sell his star players, Barrow joined the Yankees.  During his quarter-century as their baseball operations chief, the Yankees won 14 AL pennants and 10 World Series titles."
Chief Bender,"Charles Albert ""Chief"" Bender (May 5, 1884 – May 22, 1954) was a pitcher in Major League Baseball during the 1900s and 1910s. In 1911, Bender tied a record by pitching three complete games in a single World Series. He finished his career with a 212–127 win–loss record for a .625 winning percentage and a career 2.46 earned run average (ERA).After his major league playing career, Bender filled multiple baseball roles, including service as a major league coach, minor league manager and player-manager, college manager and professional scout. He was elected to the Baseball Hall of Fame in 1953 and he died not long before his induction ceremony the following year."
Tommy Connolly,"Thomas Henry Connolly (December 31, 1870 – April 28, 1961) was an English-American umpire in Major League Baseball. He officiated in the National League from 1898 to 1900, followed by 31 years of service in the American League from 1901 to 1931. In over half a century as an American League umpire and supervisor, he established the high standards for which the circuit's arbiters became known, and solidified the reputation for integrity of umpires in the major leagues."
Dizzy Dean,"Jay Hanna ""Dizzy"" Dean (January 16, 1910 – July 17, 1974), also known as Jerome Herman Dean (both the 1910 and 1920 Censuses show his name as ""Jay""), was an American professional baseball pitcher. During his Major League Baseball (MLB) career, he played for the St. Louis Cardinals, Chicago Cubs, and St. Louis Browns.A brash and colorful personality, Dean is the last National League (NL) pitcher to win 30 games in one season (1934). After his playing career, ""Ol' Diz"" became a popular television sports commentator. Dean was elected to the Baseball Hall of Fame in 1953. When the Cardinals reopened the team Hall of Fame in 2014, he was inducted in the inaugural class."
Bill Klem,"William Joseph Klem, born William Joseph Klimm (February 22, 1874 – September 16, 1951), known as the ""Old Arbitrator"" and the ""father of baseball umpires"", was a National League (NL) umpire in Major League Baseball from 1905 to 1941. He worked 18 World Series, which is a major league record. Klem was posthumously inducted into the Baseball Hall of Fame in 1953."
Al Simmons,None
Bobby Wallace,None
Harry Wright,"William Henry ""Harry"" Wright (January 10, 1835 – October 3, 1895) was an English-born American professional baseball player, manager, and developer. He assembled, managed, and played center field for baseball's first fully professional team, the 1869 Cincinnati Red Stockings.  He is credited with introducing innovations such as backing up infield plays from the outfield and shifting defensive alignments based on hitters' tendencies.  For his contributions as a manager and developer of the game, he was inducted into the Baseball Hall of Fame in 1953 by the Veterans Committee. Wright was also the first to make baseball into a business by paying his players up to seven times the pay of the average working man."
Harry Heilmann,"Harry Edwin Heilmann (August 3, 1894 – July 9, 1951), nicknamed ""Slug"", was an American baseball player and radio announcer.  He played professional baseball for 19 years between 1913 and 1932, including 17 seasons in Major League Baseball with the Detroit Tigers (1914, 1916–1929) and Cincinnati Reds (1930, 1932). He was a play-by-play announcer for the Tigers for 17 years from 1934 to 1950.Heilmann won four American League batting championships, securing the honors in 1921, 1923, 1925 and 1927. He appeared in 2,147 major league games, including 1,525 games as a right fielder and 448 as a first baseman and compiled a career batting average of .342, the 12th highest in major league history, and third highest among right-handed batters. At the time of his retirement in 1932, Heilmann ranked sixth in major league history with 542 doubles and eighth with 1,543 RBIs. He remains one of only six players in American League history to hit .400 for a season, having accomplished the feat in 1923 with a .403 batting average. He also hit .394 in 1921. At his peak from 1921 to 1927, Heilmann compiled a .380 batting average, .452 on-base percentage, .583 slugging percentage, and averaged 116 RBI, 41 doubles, 11 triples, and 104 runs scored per season. From 1919 through 1930, Heilmann hit over .300 for 12 consecutive seasons.After retiring from baseball, Heilmann ran unsuccessfully for the office of Detroit City Treasurer and operated a semipro baseball team in 1933 and, in 1934, began a career as a radio broadcaster. From 1934 to 1941, he was play-by-play announcer for the Tigers on station WXYZ and the Michigan Radio Network, covering parts of Michigan located outside metropolitan Detroit, while rival Ty Tyson called games for station WWJ in Detroit exclusively. From 1942 to 1950, Heilmann was the exclusive radio voice of the Tigers throughout the state. Heilmann died from lung cancer in July 1951; he was posthumously elected to the Baseball Hall of Fame six months later in January 1952 after garnering 86.75% of the votes."
Paul Waner,"Paul Glee Waner (April 16, 1903 – August 29, 1965), nicknamed ""Big Poison"", was an American professional baseball right fielder who played in Major League Baseball (MLB) for four teams between 1926 and 1945, most notably playing his first 15 seasons with the Pittsburgh Pirates. The greatest Pirate outfielder up to his retirement, he won the 1927 NL Most Valuable Player Award in his second season, collecting a team record 237 hits that year. Waner set the team record for doubles in a season three times, including in 1932 when he set the NL record for doubles in a season with 62. In the only postseason appearance of his career, he hit .333 in the Pirates' 1927 World Series loss against the New York Yankees. Waner won three National League (NL) batting titles, led the NL in hits twice and collected over 200 hits in eight seasons from 1926 to 1934.On June 19, 1942, Waner became the seventh member of the 3,000 hit club, with a single off of Rip Sewell. He led the NL in putouts four times and holds the career record for most putouts by a right fielder. His 191 triples are 10th all time, and his 605 doubles are 14th all time. A career .333 hitter, he was elected to the National Baseball Hall of Fame in 1952. When his younger brother Lloyd Waner got elected to the Hall of Fame they became the second pair of brothers in the National Baseball Hall of Fame, after Harry and George Wright. Paul and Lloyd also hold the record for most hits recorded by brothers (5,611). On July 21, 2007, Waner's No. 11 was retired by the Pittsburgh Pirates."
Jimmie Foxx,"James Emory Foxx (October 22, 1907 – July 21, 1967), nicknamed ""Double X"" and ""The Beast"", was an American professional baseball first baseman who played 20 seasons in Major League Baseball (MLB) for the Philadelphia Athletics, Boston Red Sox, Chicago Cubs, and Philadelphia Phillies. His most productive years were with the Philadelphia Athletics and the Boston Red Sox, where he hit 30 or more home runs in 12 consecutive seasons and drove in more than 100 runs in 13 consecutive years.Foxx was one of the greatest hitters in baseball history, capturing a vaunted Triple Crown, earning a then-record three MVPs, and becoming only the second player in MLB history to hit 500 career home runs.  For nearly 67 years, he held the record for the youngest major leaguer to reach 500 home runs. His three career MVPs are tied for second all-time. Foxx was inducted into the National Baseball Hall of Fame in 1951."
Mel Ott,None
Mordecai Brown,"Mordecai Peter Centennial Brown (October 19, 1876 – February 14, 1948), nicknamed Three Finger Brown or Miner, was an American Major League Baseball pitcher and manager during the first two decades of the 20th century (known as the ""dead-ball era""). Due to a farm-machinery accident in his youth (April 17, 1888), Brown lost parts of two fingers on his right hand, and in the process gained a colorful nickname. He turned this handicap into an advantage by learning how to grip a baseball in a way that resulted in an exceptional curveball (or knuckle curve), which broke radically before reaching the plate. With this technique he became one of the elite pitchers of his era.Brown was elected to the Baseball Hall of Fame in 1949."
Charlie Gehringer,"Charles Leonard Gehringer (May 11, 1903 – January 21, 1993), nicknamed ""The Mechanical Man"", was an American professional baseball second baseman, coach, general manager, and team vice president, who played in Major League Baseball (MLB) for the Detroit Tigers for 19 seasons (1924–1942). He was elected to the Baseball Hall of Fame in 1949."
Kid Nichols,"Charles Augustus ""Kid"" Nichols (September 14, 1869 – April 11, 1953) was an American Major League Baseball (MLB) pitcher who played for the Boston Beaneaters, St. Louis Cardinals and Philadelphia Phillies from 1890 to 1906.  A switch hitter who threw right-handed, he was listed at 5 feet 10 inches (1.78 m) and 175 pounds (79 kg). He is a member of the Baseball Hall of Fame.Nichols played minor league baseball for three teams until 1889, when he signed with the Boston Beaneaters.  After making his debut the following season and spending 12 seasons with the Beaneaters, Nichols spent a two-year sojourn in the minor leagues.  He was dealt to the St. Louis Cardinals in 1904 and subsequently played for the Philadelphia Phillies, with whom he finished his career in 1906.  He is famous for being the youngest pitcher to join the 300 win club."
Herb Pennock,"Herbert Jefferis Pennock (February 10, 1894 – January 30, 1948) was an American professional baseball pitcher and front-office executive. He played in Major League Baseball from 1912 through 1933, and is best known for his time spent with the star-studded New York Yankee teams of the mid to late 1920s and early 1930s.Connie Mack signed Pennock to his Philadelphia Athletics in 1912. After using Pennock sparingly, and questioning his competitive drive, Mack sold Pennock to the Boston Red Sox in 1915. After returning from military service in 1919, Pennock became a regular contributor for the Red Sox. The Yankees acquired Pennock from the Red Sox after the 1922 season, and he served as a key member of the pitching staff as the Yankees won four World Series championships during his tenure with the team. After retiring as a player, Pennock served as a coach and farm system director for the Red Sox, and as general manager of the Philadelphia Phillies.Pennock was regarded as one of the greatest left-handed pitchers in baseball history. Mack later called his sale of Pennock to the Red Sox his greatest mistake. Pennock died of a cerebral hemorrhage in 1948; he was posthumously inducted into the National Baseball Hall of Fame later that year."
Pie Traynor,None
Mickey Cochrane,"Gordon Stanley ""Mickey"" Cochrane (April 6, 1903 – June 28, 1962), nicknamed ""Black Mike"", was an American professional baseball player, manager and coach. He played in Major League Baseball as a catcher for the Philadelphia Athletics and Detroit Tigers. Cochrane was considered one of the best catchers in baseball history and is a member of the Baseball Hall of Fame.Cochrane was born in Massachusetts and was a multi-sport athlete at Boston University. After college, he chose baseball over basketball and football. He made his major league debut in 1925, having spent only one season in the minor leagues. He was chosen as the American League (AL) Most Valuable Player in 1928 and he appeared in the World Series from 1929 to 1931. Philadelphia won the first two of those World Series, but Cochrane was criticized for giving up stolen bases when his team lost the series in 1931. Cochrane's career batting average (.320) is still an MLB record for a catcher.Cochrane's career ended abruptly after a near-fatal head injury from a pitched ball in 1937. After his professional baseball career, he served in the United States Navy in World War II and ran an automobile business. Cochrane died of cancer in 1962. In 1999, The Sporting News ranked him 65th on its list of the 100 Greatest Baseball Players."
Frankie Frisch,"Frank Francis Frisch (September 9, 1898—March 12, 1973), nicknamed ""The Fordham Flash"" or ""The Old Flash"", was an American Major League Baseball player and manager of the first half of the twentieth century.Frisch was a switch-hitting second baseman who threw right-handed. He played for the New York Giants (1919–1926) and St. Louis Cardinals (1927–1937). He managed the Cardinals (1933–1938), Pittsburgh Pirates (1940–1946) and Chicago Cubs (1949–1951). He is a member of the National Baseball Hall of Fame and Museum and the St. Louis Cardinals Hall of Fame Museum. He is tied with Yogi Berra for most World Series doubles at 10 and holds the record for the most World Series hits at 58 for a player who never played for the New York Yankees, exceeded only by Yogi Berra and Mickey Mantle."
Lefty Grove,"Robert Moses ""Lefty"" Grove (March 6, 1900 – May 22, 1975) was an American professional baseball pitcher. After having success in the minor leagues during the early 1920s, Grove became a star in Major League Baseball with the American League's Philadelphia Athletics and Boston Red Sox. One of the greatest pitchers in history, Grove led the American League in wins in four separate seasons, in strikeouts seven years in a row, and had the league's lowest earned run average a record nine times. Over the course of the three years from 1929 to 1931, he twice won the pitcher's Triple Crown, leading the league in wins, strikeouts, and ERA, while amassing a 79–15 record and leading the Athletics to three straight AL championships. Overall, Grove won 300 games in his 17-year MLB career. He was elected to the National Baseball Hall of Fame in 1947."
Carl Hubbell,None
Jesse Burkett,"Jesse Cail Burkett (December 4, 1868 – May 27, 1953), nicknamed ""Crab"", was an American professional baseball left fielder. He played in Major League Baseball (MLB) from 1890 to 1905 for the New York Giants, Cleveland Spiders, St. Louis Perfectos / Cardinals, St. Louis Browns, and Boston Americans.Burkett batted over .400 twice, and held the major league single-season hits record for 15 years. After his playing career, Burkett managed in the minor leagues. He was elected into the National Baseball Hall of Fame in 1946. Burkett holds the record for the most inside-the-park home runs in MLB history, with 55. He is also regarded as one of the greatest bunters of all time."
