,NoneErnie Banks,"Ernest Banks (January 31, 1931 – January 23, 2015), nicknamed ""Mr. Cub"" and ""Mr. Sunshine"", was an American professional baseball player who starred in Major League Baseball (MLB) as a shortstop and first baseman for the Chicago Cubs between 1953 and 1971. He was inducted into the National Baseball Hall of Fame in 1977, and was named to the Major League Baseball All-Century Team in 1999.Banks is regarded by some as one of the greatest players of all time. He began playing professional baseball in 1950 with the Kansas City Monarchs in the Negro leagues. He served in the U.S. military for two years, played for the Monarchs again, and began his National  League career in September 1953. The following year, Banks was the National League Rookie of the Year runner-up. Beginning in 1955, Banks was a National League (NL) All-Star for 11 seasons, playing in 13 of the 15 All-Star Games held during those years. Banks was the Cubs' main attraction in the late 1950s, the National League Most Valuable Player in 1958 and 1959, and the Cubs' first Gold Glove winner in 1960.In 1962, Banks became a regular first baseman for the Cubs.  Between 1967 and 1971, he was a player-coach. In 1969, through a Chicago Sun-Times fan poll, Cubs fans voted him the greatest Cub ever. In 1970, Banks hit his 500th career home run at Wrigley Field. He retired from playing in 1971, was a coach for the Cubs in 1972, and in 1982 was the team's first player to have his uniform number retired.Banks was active in the Chicago community during and after his tenure with the Cubs. He founded a charitable organization, became the first black Ford Motor Company dealer in the United States, and made an unsuccessful bid for a local political office. In 2013, Banks was awarded the Presidential Medal of Freedom for his contribution to sports. Banks lived in the Los Angeles and Chicago areas."
Martin Dihigo,"Martín Magdaleno Dihigo Llanos (May 25, 1906 – May 20, 1971), called The Immortal, was a Cuban professional baseball player. He played in Negro league baseball and Latin American leagues from 1923 to 1936 as a two-way player, both as a pitcher and a second baseman, although he excelled at several positions."
Pop Lloyd,"John Henry Lloyd (April 25, 1884 – March 19, 1964), nicknamed ""Pop"" and ""El Cuchara"", was an American baseball shortstop and manager in the Negro leagues. During his 27-year career, he played for many teams and had a .343 batting average. Lloyd is considered to be the greatest shortstop in Negro league history, and he was inducted into the National Baseball Hall of Fame in 1977."
Al Lopez,"Alfonso Ramón López  (August 20, 1908 – October 30, 2005) was a Spanish-American professional baseball catcher and  manager. He played in Major League Baseball (MLB) for the Brooklyn Robins / Dodgers, Boston Bees, Pittsburgh Pirates, and Cleveland Indians between 1928 and 1947, and was the manager for the Cleveland Indians and the Chicago White Sox from 1951 to 1965 and during portions of the 1968 and 1969 seasons. Due to his Spanish ancestry and ""gentlemanly"" nature, he was nicknamed ""El Señor"".As a player, López was a two-time All-Star known for his defensive skills, leadership, and durability, as he established a major league record for career games played at catcher (1,918) that stood for decades. As a manager, his .584 career winning percentage ranks fourth best in major league history among managers of at least 2,000 games. His 1954 Cleveland Indians and 1959 Chicago White Sox teams were the only squads to interrupt the New York Yankees' string of American League pennants from 1949 to 1964, inclusive. Over the course of 18 full seasons as a baseball manager (15 in the major leagues and 3 in the minor leagues), López's teams never finished with a losing record. He was inducted into the Baseball Hall of Fame in 1977.Al López's parents immigrated to the United States from Spain shortly before his birth, and he grew up in the immigrant community of Ybor City in Tampa, Florida. He retired with his family to his hometown after his baseball career, and his accomplishments were commemorated in Tampa in the name of a baseball stadium (Al López Field) and a public park which bears his name and features his statue. His childhood home was moved next door to Ybor City State Museum and is being renovated to house the Tampa Baseball Museum."
Amos Rusie,"Amos Wilson Rusie (May 30, 1871 – December 6, 1942), nicknamed ""The Hoosier Thunderbolt"", was an American right-handed pitcher in Major League Baseball during the late 19th century.  He had a 10-season career in the National League (NL), which consisted of one season with the Indianapolis Hoosiers in 1889, eight with the New York Giants from 1890 to 1898, and one with the Cincinnati Reds in 1901.He is best known for the speed in which he pitched a baseball.  The velocity of his fastball was unknown, but it has been estimated that he threw it in the mid to upper 90s.  He led the league in strikeouts five times, and won 20 or more games eight times.  Though he did throw hard, he did not have good control of his pitches, leading the league in walks five times and being seventh all-time among the career pitching leaders in that category.  In 1890 he walked 289, the all-time single-season record.In 1897, one of his fastballs struck future Hall of Famer Hughie Jennings in the head, rendering him comatose for four days before recovery.  Rusie's wildness had been a catalyst for officials to change the distance from the pitching rubber to home plate from 50 feet (15 m) to the current 60 feet 6 inches (18.44 m).  This ruling was made effective for the 1893 season, at the peak of Amos Rusie's pitching prowess. The distance change did not reduce Rusie's effectiveness, as he led the league in strikeouts for three straight seasons afterward, while also winning what later would be known as the pitching triple crown in 1894.  For his accomplishments, he was inducted into the Baseball Hall of Fame in 1977 by the Veterans Committee."
Joe Sewell,"Joseph Wheeler Sewell (October 9, 1898 – March 6, 1990) was a Major League Baseball infielder for the Cleveland Indians and New York Yankees. He was elected to the Baseball Hall of Fame in 1977.Sewell holds the record for the lowest strikeout rate in major league history, striking out on average only once every 73 plate appearances, and the most consecutive games without a strikeout, at 115."
Oscar Charleston,"Oscar McKinley Charleston (October 14, 1896 – October 5, 1954) was an American center fielder and manager in Negro league baseball. In 1915, after serving three years in the U.S. Army, the Indianapolis, Indiana, native continued his baseball career as a professional with the Indianapolis ABCs; his career ended in 1954 as a player-manager for the Indianapolis Clowns. In addition to a forty-three-year career with more than a dozen teams, including the Homestead Grays and the Pittsburgh Crawfords, Negro league baseball's leading teams in the 1930s, he played nine winter seasons in Cuba and in numerous exhibition games against white major leaguers. Charleston was known for his strengths as a hitter and center fielder. Alongside Josh Gibson, he has the record for most league batting titles among players of the Negro leagues with three, and he is the only one among all nine players who won multiple titles to win batting titles in multiple leagues. He was the second player to win consecutive Triple Crowns in either batting or pitching (after Grover Cleveland Alexander), a feat matched just one time by a batter. Retroactively, he is credited with having won the Triple Crown (leading in batting average, home runs, RBI) three times, which is the most for any player in Major League Baseball. To this day, he holds the record for the second-highest batting average of all-time among major league players (behind Ty Cobb). He also has the fourth-highest career OPS.  He was inducted into the National Baseball Hall of Fame in 1976.Highlights of Charleston's career included playing in the Negro National League's inaugural doubleheader on May 20, 1920. His most productive season was with the Saint Louis Giants in 1921, when he hit fifteen home runs, twelve triples, and seventeen doubles, stole thirty-one bases, and had a .437 batting average. In 1933 Charleston played in the first Negro National League All-Star Game at Chicago's Comiskey Park and appeared in the League's 1934 and 1935 all-star games. In 1945 Charleston became manager of the Brooklyn Brown Dodgers and helped recruit black ballplayers such as Roy Campanella to join the first integrated Major League Baseball teams."
Roger Connor,"Roger Connor (July 1, 1857 – January 4, 1931) was a 19th-century Major League Baseball (MLB) player. He played for several teams, but his longest tenure was in New York, where he was responsible for the New York Gothams becoming known as the Giants. He was the player whom Babe Ruth succeeded as the all-time home run champion. Connor hit 138 home runs during his 18-year career, and his career home run record stood for 23 years after his retirement in 1897.Connor owned and managed minor league baseball teams after his playing days. He was elected to the Baseball Hall of Fame by its Veterans Committee in 1976. Largely forgotten after his retirement, Connor was buried in an unmarked grave until a group of citizens raised money for a grave marker in 2001."
Cal Hubbard,"Robert Calvin Hubbard (October 31, 1900 – October 17, 1977) was an American professional football player and Major League Baseball (MLB) umpire. After playing college football at Centenary College and Geneva College, Hubbard played in the National Football League (NFL) between 1927 and 1936 for the New York Giants, Green Bay Packers and Pittsburgh Pirates, playing the bulk of his career with the Packers. Hubbard is credited as being one of the inventors of the football position of linebacker.He was also an umpire in the American League (AL) from 1936 to 1951, then worked as an umpire supervisor until 1969. George Halas affectionately called Hubbard the ""Big Umpire.""To date, Hubbard is the only person to be enshrined in both the Pro Football Hall of Fame and Baseball Hall of Fame.  He is also a member of the College Football Hall of Fame."
Bob Lemon,None
Freddie Lindstrom,"Frederick Charles Lindstrom (November 21, 1905 – October 4, 1981) was a National League baseball player with the New York Giants, Pittsburgh Pirates, Chicago Cubs and Brooklyn Dodgers from 1924 until 1936. He was inducted into the Baseball Hall of Fame in 1976.At the age of 23, Lindstrom hit .358 for the Giants and was named The Sporting News Major League All Star team's third baseman ahead of Pittsburgh's Harold ""Pie"" Traynor.  Two years later, he repeated the honor while scoring 127 runs and batting .379, second only to Rogers Hornsby among right-handed batters in National League history.In 1930, Giants manager John McGraw ranked Lindstrom ninth among the top 20 players of the previous quarter century. Babe Ruth picked him as his NL all-star third baseman over Traynor for the decade leading up to the first inter-league All Star game in 1933. Modern-day statistics guru Bill James, who rates Lindstrom No. 43 on his all-time third basemen list, placed him among the top three under-21 players at that position and called the 1927 Giants infield of Lindstrom, Hornsby, Travis Jackson and Bill Terry the decade's best.From his rookie season in 1924 through 1930 as a Giants third baseman, a span of seven years during which he batted .328 and played brilliantly in the field, Lindstrom seemed headed for a place among the game's all-time greatest players.  ""Those hands of his (Lindstrom's) are the talk of the baseball world. Sensational playing places him among greatest in game,"" wrote sports writer Pat Robinson of the New York Daily News in the spring of 1929, after Lindstrom finished second the previous year to St. Louis Cardinal first baseman Jim Bottomley in the National League's Most Valuable Player balloting. ""The best third sacker in the National League, one of the greatest third basemen the game has ever produced,"" gushed William Hennigan in the New York World.  ""Lindstrom hit peaks of third basing never before attained during the final month of last season,"" added Ken Smith in the New York Evening Graphic. ""An outstanding individual of the game, another Hornsby, Wagner, Cobb, or Speaker, this kid, ace fielder, hitter, thinker and runner.""Joe Foley, in This Sporting Life, echoed a common theme among baseball writers during that stretch of Lindstrom's career when he named his perfect team: ""Sisler on first, Lajoie at second, Wagner at short, Lindstrom at third, Ruth, Speaker and Cobb in the outfield, Kling catching and Brown, Walsh, Bender and Mathewson taking turns pitching.""In 1931, injuries - including a chronic bad back and broken leg - brought about his switch to the outfield where for several years he remained an above-average but no longer All Star player. He retired after 13 seasons in 1936."
Robin Roberts,"Robin René Roberts (born November 23, 1960) is an American television broadcaster. Roberts is the anchor of ABC's Good Morning America. Roberts was the first woman of color and first openly LGBTQ+ woman to host the American TV game show Jeopardy!After growing up in Mississippi and attending Southeastern Louisiana University, Roberts was a sports anchor for local TV and radio stations. Roberts was a sportscaster on ESPN for 15 years (1990–2005). She became co-anchor on Good Morning America in 2005. Roberts was inducted into the Women's Basketball Hall of Fame in 2012. Her treatment for myelodysplastic syndrome was chronicled on the program, which earned a 2012 Peabody Award for the coverage."
Earl Averill,"Howard Earl Averill (May 21, 1902 – August 16, 1983) was an American professional baseball player. He played in Major League Baseball (MLB) as a center fielder from 1929 to 1941, including 11 seasons for the Cleveland Indians. He was a six-time All-Star (1933–1938) and was elected to the Baseball Hall of Fame in 1975."
Bucky Harris,"Stanley Raymond ""Bucky"" Harris (November 8, 1896 – November 8, 1977) was an American professional baseball second baseman, manager and executive. While Harris played in Major League Baseball (MLB) for the Washington Senators and Detroit Tigers, it was his long managerial career that led to his enshrinement in the Baseball Hall of Fame, elected as a manager by the Veterans Committee, in 1975. In 28 years as an MLB pilot, Harris won over 2,150 games, three league pennants and two World Series championships, with the gap between appearances/championships in the World Series being the longest in major league history."
Billy Herman,"William Jennings Bryan Herman (July 7, 1909 – September 5, 1992) was an American second baseman and manager in Major League Baseball (MLB) during the 1930s and 1940s. Known for his stellar defense and consistent batting, Herman still holds many National League (NL) defensive records for second basemen and was inducted into the National Baseball Hall of Fame in 1975."
Judy Johnson,None
Ralph Kiner,"Ralph McPherran Kiner (October 27, 1922 – February 6, 2014) was an American Major League Baseball player and broadcaster. An outfielder, Kiner played for the Pittsburgh Pirates, Chicago Cubs, and Cleveland Indians from 1946 through 1955. Following his retirement, Kiner served from 1956 through 1960 as general manager of the Pacific Coast League San Diego Padres. He also served as an announcer for the New York Mets from the team's inception until his death. Though injuries forced his retirement from active play after 10 seasons, Kiner led all of his National League contemporaries in hitting between 1946 and 1952. He was elected to the Baseball Hall of Fame in 1975.After his death, baseball writer Marty Noble named Kiner ""one of baseball's genuine and most charming gentlemen""."
Cool Papa Bell,"James Thomas ""Cool Papa"" Bell (May 17, 1903 – March 7, 1991) was an American center fielder in Negro league baseball from 1922 to 1946. He is considered to have been one of the fastest men ever to play the game. Stories demonstrating Bell's speed are still widely circulated. He was elected to the Baseball Hall of Fame in 1974. He ranked 66th on a list of the greatest baseball players published by The Sporting News in 1999."
Jim Bottomley,"James Leroy Bottomley (April 23, 1900 – December 11, 1959) was an American professional baseball player. A first baseman, Bottomley played in Major League Baseball from 1922 through 1937 for the St. Louis Cardinals, Cincinnati Reds, and St. Louis Browns. He also served as player-manager for the Browns in 1937. Playing for the Cardinals against Brooklyn at Ebbets Field on September 16, 1924, Bottomley set the all-time single game RBI record with 12.Born in Oglesby, Illinois, Bottomley grew up in Nokomis, Illinois. He dropped out of high school at the age of 16 to raise money for his family. While he was playing semi-professional baseball, the Cardinals scouted and signed Bottomley. He won the League Award, given to the most valuable player, in 1928, and was a part of World Series championship teams in 1926 and 1931. Bottomley played for the Cardinals through the 1932 season, after which he was traded to the Reds. After playing for Cincinnati for three years, he played two more seasons with the Browns.After finishing his playing career with the Browns, Bottomley joined the Chicago Cubs organization as a scout and minor league baseball manager. After suffering a heart attack, Bottomley retired to raise cattle with his wife in Missouri. Bottomley was nicknamed ""Sunny Jim"" because of his cheerful disposition. Bottomley was elected to the National Baseball Hall of Fame in 1974 by the Veterans Committee and to the Cardinals Hall of Fame in 2014."
Jocko Conlan,"John Bertrand ""Jocko"" Conlan (December 6, 1899 – April 16, 1989) was an American baseball umpire who worked in the National League (NL) from 1941 to 1965. He had a brief career as an outfielder with the Chicago White Sox before entering umpiring. He umpired in five World Series and six All-Star Games. He was elected to the Baseball Hall of Fame in 1974 by the Veterans Committee."
Whitey Ford,None
Mickey Mantle,"Mickey Charles Mantle (October 20, 1931 – August 13, 1995), nicknamed The Commerce Comet and The Mick, was an American professional baseball player. Mantle played his entire Major League Baseball (MLB) career (1951–1968) with the New York Yankees as a center fielder, right fielder, and first baseman. Mantle was one of the best players and sluggers and is regarded by many as the greatest switch hitter in baseball history. Mantle was inducted into the Baseball Hall of Fame in 1974 and was elected to the Major League Baseball All-Century Team in 1999.Mantle was one of the greatest offensive threats of any center fielder in baseball history. He has the second highest career OPS+ among center fielders, (behind Mike Trout) and he had the highest stolen base percentage in history at the time of his retirement. In addition, compared to the other four center fielders on the All-Century team, he had the lowest career rate of grounding into double plays, and he had the highest World Series on-base percentage and World Series slugging percentage. He also had an excellent .984 fielding percentage when playing center field. Mantle was able to hit for both average and power, especially tape measure home runs, a term that had its origin in a play-by-play caller reacting to one of Mantle's 1953 home runs. He hit 536 MLB career home runs, batted .300 or more ten times, and is the career leader (tied with Jim Thome) in walk-off home runs, with 13, 12 in the regular season and one in the postseason. He is the only player in history to hit 150 home runs from both sides of the plate.Mantle is 16th all-time in home runs per at bats. He is 17th in on-base percentage. He was safe three out of four times he attempted to steal a base. He won the MVP Award three times, came in second three times, and came within nine votes of winning five times.Mantle won the Triple Crown in 1956, when he led the major leagues in batting average (.353), home runs (52), and runs batted in (RBI) (130). He later wrote a book (My Favorite Summer 1956) about his best year in baseball. He was an All-Star for 16 seasons, playing in 16 of the 20 All-Star Games that were played during his career. He was an American League (AL) Most Valuable Player (MVP) three times and a Gold Glove winner once. Mantle appeared in 12 World Series including seven championships, and he holds World Series records for the most home runs (18), RBIs (40), extra-base hits (26), runs (42), walks (43), and total bases (123).Despite his accolades on the field, Mantle's private life was plagued with tumult and tragedy, including a well-publicized bout with alcoholism that led to his death from liver cancer."
Sam Thompson,"Samuel Luther ""Big Sam"" Thompson (March 5, 1860 – November 7, 1922) was an American professional baseball player from 1884 to 1898 and with a brief comeback in 1906. At 6 feet 2 inches (1.88 m), the Indiana native was one of the larger players of his day and was known for his prominent handlebar mustache. He played as a right fielder in Major League Baseball for the Detroit Wolverines (1885–1888), Philadelphia Phillies (1889–1898) and Detroit Tigers (1906). He was inducted into the Baseball Hall of Fame in 1974.Thompson had a .331 career batting average and was one of the most prolific run producers in baseball history.  His career run batted in (RBI) to games played ratio of .923 (1,305 RBIs in 1,410 games) remains the highest in major league history. In 1895, Thompson averaged 1.44 RBIs per game, and his 166 RBIs in 1887 (in only 127 games) remained the major league record until 1921 when Babe Ruth collected 168 (albeit in 152 games). Thompson still holds the major league record for most RBIs in a single month with 61 in August 1894 while playing for the Phillies. Manager Bill Watkins in 1922 called Thompson ""the greatest natural hitter of all time.""Defensively, Thompson was known to have one of the strongest arms of any outfielder in the early decades of the game.  He still ranks among the all-time major league leaders with 61 double plays from the outfield (16th all time) and 283 outfield assists (12th all time).  Thompson also had good speed on the base paths and, in 1889, he became the first major league player to reach 20 home runs and 20 stolen bases in the same season."
Roberto Clemente,None
Billy Evans,None
Monte Irvin,None
High Pockets Kelly,"George Lange Kelly (September 10, 1895 – October 13, 1984), nicknamed ""Long George"" and ""High Pockets"", was an American professional baseball first baseman. He played most of his Major League Baseball (MLB) career for the New York Giants (1915–1917, 1919–1926), but also played for the Pittsburgh Pirates (1917), Cincinnati Reds (1927–1930), Chicago Cubs (1930), and Brooklyn Dodgers (1932). Kelly threw and batted right-handed, and was listed as a lanky 6 feet 4 inches (1.93 m) tall—the source of his nicknames—and 190 pounds (86 kg).Kelly was a two-time World Series champion (1921 and 1922). He led the National League in home runs once (1921) and runs batted in twice (1920 and 1924), and was elected to the Baseball Hall of Fame in 1973. However, his selection is regarded as controversial, as many believe he was undeserving of the recognition and was only elected by the Veterans Committee because it consisted of his former teammates."
Warren Spahn,"Warren Edward Spahn (April 23, 1921 – November 24, 2003) was an American professional baseball player. He played in Major League Baseball as a left-handed pitcher in 1942 and then from 1946 until 1965, most notably for the Boston Braves, who became the Milwaukee Braves after the team moved west before the 1953 season. His baseball career was interrupted by his military service in the United States Army during the Second World War.Born and raised in Buffalo, New York, Spahn attended South Park High School.With 363 victories over the span of his 21-year baseball playing career, Spahn holds the major league record for most career wins by a left-handed pitcher, and the most by a pitcher who played his entire career in the post-1920 live-ball era. He was a 17-time All-Star player who won 20 games or more in 13 seasons, including a 23–7 record when he was age 42. Spahn won the 1957 Cy Young Award and was a three-time runner-up during the period when only one award was given for both leagues. At the time of his retirement in 1965, Spahn held the Major League Baseball record for career strikeouts by a left-handed pitcher.He was elected to the Baseball Hall of Fame in his first year of eligibility in 1973 with 82.89% of the vote. The Warren Spahn Award, given annually to the major leagues' best left-handed pitcher, is named in his honor. Regarded as a ""thinking man's"" pitcher who liked to outwit batters, Spahn once described his approach on the mound: ""Hitting is timing. Pitching is upsetting timing."""
Mickey Welch,"Michael Francis Welch (July 4, 1859 – July 30, 1941), nicknamed ""Smiling Mickey"", was a Major League Baseball pitcher. He stood 5 feet 8 inches (1.73 m) tall and weighed 160 pounds (73 kg). He was the third pitcher to accumulate 300 career victories. Welch was born in Brooklyn, New York, and played 13 seasons in the major leagues, three with the Troy Trojans, and 10 with the New York Gothams/Giants. He was very successful with an effective curveball, a change of pace, and a version of the screwball. During his 13 major league seasons, he posted 20 or more wins nine times, seven in succession."
