,NoneLee MacPhail,"Leland Stanford MacPhail Jr. (October 25, 1917 – November 8, 2012) was an American front-office executive in Major League Baseball. MacPhail was a baseball executive for 45 years, serving as the director of player personnel for the New York Yankees, the president and general manager of the Baltimore Orioles, chief aide to Commissioner of Baseball William Eckert, executive vice president and general manager of the Yankees, and president of the American League."
Bullet Rogan,"Charles Wilber ""Bullet"" Rogan, also known as ""Bullet Joe"" (July 28, 1893 – March 4, 1967), was an American pitcher, outfielder, and manager for the Kansas City Monarchs in the Negro baseball leagues from 1920 to 1938. Renowned as a two-way player who could both hit and pitch successfully, one statistical compilation shows Rogan winning more games than any other pitcher in Negro leagues history and ranking fourth highest in career batting average. He was elected to the Baseball Hall of Fame in  1998.Rogan's early baseball career took place in the U.S. Army, where he played for a famous team in the all-black 25th Infantry.  After joining the Kansas City Monarchs, he was the top pitcher and one of the best hitters on a team that won three pennants from 1923 to 1925 and the 1924 Colored World Series.  He became a playing manager in 1926 and led his team to another league title in 1929.""Charleston was everything—but Rogan was more"", said William ""Big C"" Johnson, one of Rogan's Army teammates. ""Rogan could do everything, everywhere."" ""He was the onliest pitcher I ever saw, I ever heard of in my life, was pitching and hitting in the cleanup place"", said Satchel Paige. According to Rogan's longtime catcher Frank Duncan, ""If you had to choose between Rogan and Paige, you'd pick Rogan, because he could hit. The pitching, you'd as soon have Satchel as Rogan, understand? But Rogan's hitting was so terrific. Get my point?"" Casey Stengel called Rogan ""one of the best—if not the best—pitcher that ever lived."""
Don Sutton,"Donald Howard Sutton (April 2, 1945 – January 19, 2021) was an American professional baseball pitcher. He played in Major League Baseball (MLB) for 23 seasons as a member of the Los Angeles Dodgers, Houston Astros, Milwaukee Brewers, Oakland Athletics, and California Angels. Sutton won a total of 324 games and pitched 58 shutouts including five one-hitters and ten two-hitters. He is seventh on baseball's all-time strikeout list with 3,574.Sutton was born in Clio, Alabama. He attended high school and community college in Florida before entering professional baseball. After a year in the minor leagues, Sutton joined the Dodgers. Beginning in 1966, he was in the team's starting pitching rotation with Sandy Koufax, Don Drysdale, and Claude Osteen. Sixteen of Sutton's 23 MLB seasons were spent with the Dodgers. He registered only one 20-win season, but earned 10 or more wins in every season except 1983 and 1988.Sutton became a television sports broadcaster after his retirement as a player. He worked in this capacity for several teams, the majority being with the Atlanta Braves. Sutton was inducted into the Baseball Hall of Fame in 1998."
Nellie Fox,"Jacob Nelson “Nellie” Fox (December 25, 1927 – December 1, 1975) was an American professional baseball player. Fox was one of the best second basemen of all time, and the third-most difficult hitter to strike out in Major League Baseball (MLB) history. Fox played in the big leagues from 1947 through 1965 and spent the majority of his career as a member of the Chicago White Sox; his career was bookended by multi-year stints for the Philadelphia Athletics and, later, the Houston Astros.Fox was an American League (AL) All-Star for twelve seasons, an AL Most Valuable Player (MVP) for one season, and an AL Gold Glove winner for three seasons. He had a .288 major-league career batting average with 2663 hits, 35 home runs, and 790 runs batted in. He hit .300 or more six times, and led the AL in singles eight times (seven consecutive seasons) and in fielding average six times as a second baseman. His career fielding percentage was .984. In 1959, when the ""Go Go"" Chicago White Sox won the American League Pennant championship, he hit .306 with 149 singles and 70 RBI. He coached for the Houston Astros and Texas Rangers after his playing career. He was inducted into the National Baseball Hall of Fame in 1997."
Tom Lasorda,None
Phil Niekro,None
Willie Wells,"Willie James Wells (August 10, 1906 – January 22, 1989), nicknamed ""The Devil,"" was an American baseball player. He was a shortstop who played from 1924-1948 for various teams in the Negro leagues and in Latin America.Wells was a fast base-runner who hit for both power and average. He was at his finest with his glove, committing almost no errors and having the speed to run down anything that came in his direction. He is widely considered the best black shortstop of his day. He also taught Jackie Robinson how to turn a double play.Wells was also notable as being the first player to use a batting helmet, after being hit and receiving a concussion while playing with the Newark Eagles (his first helmet was a construction helmet).Wells is a member of the National Baseball Hall of Fame."
Jim Bunning,None
Bill Foster,"Dr. William Foster, also known as Black Goliath, Giant-Man and Goliath, is a fictional character, a superhero appearing in American comic books published by Marvel Comics. He is a professor with powers similar to Hank Pym's increasing size and mass to gigantic proportions.The character has made several video game appearances and appeared in the Marvel Cinematic Universe film Ant-Man and the Wasp (2018), portrayed by Laurence Fishburne."
Ned Hanlon,None
Earl Weaver,"Earl Sidney Weaver (August 14, 1930 – January 19, 2013) was an American professional baseball manager, author, and television broadcaster. After playing in minor league baseball, he retired without playing in Major League Baseball (MLB). He became a minor league manager, and then managed in MLB for 17 years with the Baltimore Orioles (1968–1982; 1985–86). Weaver's style of managing was summed up in the quote: ""pitching, defense, and the three-run homer."" He did not believe in placing emphasis on ""small ball"" tactics such as stolen bases, hit and run plays, or sacrifice bunts. He was inducted into the Baseball Hall of Fame in 1996."
Richie Ashburn,"Don Richard Ashburn (March 19, 1927 – September 9, 1997), also known by the nicknames, ""Putt-Putt"", ""The Tilden Flash"", and ""Whitey"" (due to his light-blond hair), was an American center fielder in Major League Baseball. (Some sources give his full middle name as ""Richie"".) He was born in Tilden, Nebraska. From his youth on a farm, he grew up to become a professional outfielder and veteran broadcaster for the Philadelphia Phillies and one of the most beloved sports figures in Philadelphia history. He was inducted into the National Baseball Hall of Fame in 1995."
Leon Day,"Leon Day  (October 30, 1916 – March 13, 1995) was an American professional baseball pitcher who spent the majority of his career in the Negro leagues. Recognized as one of the most versatile athletes in the league during his prime, Day could play every position, with the exception of catcher, and often was the starting second baseman or center fielder when he was not on the mound. A right-handed pitcher with a trademark no wind-up delivery, Day excelled at striking batters out, especially with his high-speed fastball. At the same time, he was an above-average contact hitter, which, combined with his effectiveness as a baserunner and his tenacious fielding, helped cement Day as one of the most dynamic players of the era.Debuting in the Negro leagues in 1934, Day played with the Baltimore Black Sox, Newark Eagles, and Baltimore Elite Giants during his career. In 1937, Day had the best season of his career as a member of the Eagles, finishing with a perfect record of 13–0 and a batting average over .300. Day also played Puerto Rican winter ball in the offseasons. He holds both the Negro and Puerto Rican league records for strikeouts in a game, and appeared in the most East–West All-Star Games.Because of his soft-spoken demeanor, Day's accomplishments were not immediately recognized as opposed to other elite pitchers of the league like Satchel Paige. Nonetheless, Day is considered one of the best pitchers of the Negro leagues, equaling and sometimes surpassing the abilities of his rivals. In 1995, Day was elected into the Baseball Hall of Fame, just six days before his death at 78 years old."
William Hulbert,"William Ambrose Hulbert (October 23, 1832 – April 10, 1882) was one of the founders of the National League, recognized as baseball's first major league, and was also the president of the Chicago White Stockings franchise."
Mike Schmidt,"Michael Jack Schmidt (born September 27, 1949) is an American former professional baseball third baseman who played 18 seasons in Major League Baseball (MLB) for the Philadelphia Phillies. Schmidt was a 12-time All-Star and a three-time winner of the National League (NL) Most Valuable Player award (MVP), and he was known for his combination of power hitting and strong defense. As a hitter, he compiled 548 home runs and 1,595 runs batted in (RBIs), and led the NL in home runs eight times and in RBIs four times. As a fielder, Schmidt won the National League Gold Glove Award for third basemen ten times. Schmidt was elected to the Baseball Hall of Fame in 1995 and is widely considered to be the greatest third baseman in baseball history.Having an unusual batting stance, Schmidt turned his back somewhat toward the pitcher and rocked his rear end back and forth while waiting for a pitch. By standing far back in the batter's box, he made it almost impossible to jam him by pitching inside. Schmidt was one of the best athletes of his era; teammate Pete Rose once said, ""To have his body, I'd trade him mine and my wife's, and I'd throw in some cash."""
Vic Willis,"Victor Gazaway Willis (April 12, 1876 – August 3, 1947) was an American Major League Baseball (MLB) pitcher. He played for the Boston Beaneaters, Pittsburgh Pirates, and St. Louis Cardinals in 13 seasons in the National League (NL) from 1898 to 1910. In 513 career games, Willis pitched 3,996 innings and posted a win–loss record of 249–205, with 388 complete games, 50 shutouts, and a 2.63 earned run average (ERA). Nicknamed the ""Delaware Peach"", he was inducted into the National Baseball Hall of Fame in 1995."
Steve Carlton,"Steven Norman Carlton (born December 22, 1944) is an American former professional baseball player. He played in Major League Baseball as a left-handed pitcher for six different teams from 1965 to 1988, most notably as a member of the Philadelphia Phillies with whom he won four Cy Young Awards as well as the 1980 World Series. He was elected to the Baseball Hall of Fame in 1994.Nicknamed ""Lefty"", Carlton has the second-most lifetime strikeouts of any left-handed pitcher (4th overall), and the second-most lifetime wins of any left-handed pitcher (11th overall). He was the first pitcher to win four Cy Young Awards in a career. He held the lifetime strikeout record several times between 1982 and 1984, before his contemporary Nolan Ryan passed him. One of his most remarkable records was accounting for nearly half (46%) of his team's wins, when he won 27 games for the last-place (59–97) 1972 Phillies. He is the last National League pitcher to win 25 or more games in one season, as well as the last pitcher from any team to throw more than 300 innings in a season. He also holds the record with the most career balks of any pitcher, with 90 (double the second on the all-time list, Bob Welch)."
Leo Durocher,"Leo Ernest Durocher (French spelling Léo Ernest Durocher) (; July 27, 1905 – October 7, 1991), nicknamed Leo the Lip and Lippy, was an American professional baseball player, manager and coach. He played in Major League Baseball as an infielder. Upon his retirement, he ranked fifth all-time among managers with 2,008 career victories, second only to John McGraw in National League history. Durocher still ranks tenth in career wins by a manager. A controversial and outspoken character, Durocher had a stormy career dogged by clashes with authority, the baseball commissioner, the press, and umpires; his 95 career ejections as a manager trailed only McGraw when he retired, and still ranks fourth on the all-time list.Durocher was posthumously elected to the Baseball Hall of Fame in 1994."
Phil Rizzuto,"Philip Francis Rizzuto (September 25, 1917 – August 13, 2007), nicknamed ""The Scooter"", was an American Major League Baseball shortstop. He spent his entire 13-year baseball career with the New York Yankees (1941–1956), and was elected to the National Baseball Hall of Fame in 1994.A popular figure on a team dynasty that captured 10 AL titles and seven World Championships in his 13 seasons, Rizzuto holds numerous World Series records for shortstops. His best statistical season was 1950, when he was named the American League's Most Valuable Player. Despite this offensive peak, Rizzuto was a classic ""small ball"" player, noted for his strong defense in the infield.  The slick-fielding Rizzuto is also regarded as one of the best bunters in baseball history. When he retired, his 1,217 career double plays ranked second in major league history, trailing only Luke Appling's total of 1,424, and his .968 career fielding average trailed only Lou Boudreau's mark of .973 among AL shortstops.After his playing career, Rizzuto enjoyed a 40-year career as a radio and television sports announcer for the Yankees. His idiosyncratic style and unpredictable digressions charmed listeners, while his lively play-by-play brought a distinct energy to his broadcasts.  He was well known for his trademark expression ""holy cow!"""
Reggie Jackson,"Reginald Martinez Jackson (born May 18, 1946) is an American former professional baseball right fielder who played 21 seasons in Major League Baseball (MLB) for the Kansas City / Oakland Athletics, Baltimore Orioles, New York Yankees, and California Angels. Jackson was inducted into the National Baseball Hall of Fame in 1993.Jackson was nicknamed ""Mr. October"" for his clutch hitting in the postseason with the Athletics and the Yankees. He helped Oakland win five consecutive American League West divisional titles, three consecutive American League pennants and three consecutive World Series titles, from 1972 to 1974. Jackson helped New York win four American League East divisional pennants, three American League pennants and two consecutive World Series titles, in 1977 and 1978. He also helped the California Angels win two AL West divisional titles in 1982 and 1986. Jackson hit three consecutive home runs at Yankee Stadium in the clinching game six of the 1977 World Series.Jackson hit 563 career home runs and was an American League (AL) All-Star for 14 seasons. He won two Silver Slugger Awards, the AL Most Valuable Player (MVP) Award in 1973, two World Series MVP Awards, and the Babe Ruth Award in 1977. The Yankees and Athletics retired his team uniform number in 1993 and 2004. Jackson currently serves as a special advisor to the Houston Astros.Jackson led his teams to first place ten times over his 21-year career."
Rollie Fingers,"Roland Glen Fingers (born August 25, 1946) is an American retired professional baseball pitcher who played 17 seasons in Major League Baseball for the Oakland Athletics (1968–1976), San Diego Padres (1977–1980), and Milwaukee Brewers (1981–1985). Fingers's effectiveness as a relief pitcher helped redefine the value of relievers within baseball and helped usher in the modern closer role. He is a three-time World Series champion, a seven-time All-Star, a four-time Rolaids Relief Man of the Year, and a three-time MLB saves leader. Fingers won the American League's (AL) Most Valuable Player Award and Cy Young Award in 1981.Fingers retired in 1985 with 341 career saves, the most in MLB history until surpassed by Jeff Reardon in 1992. Fingers was inducted into the National Baseball Hall of Fame in 1992, making him just the second reliever elected. He is also one of only a few MLB players to have his number retired by more than one club (Oakland Athletics and Milwaukee Brewers). Fingers is also known for his neatly groomed handlebar mustache."
Bill McGowan,"William Aloysius McGowan (January 18, 1896 – December 9, 1954) was an American umpire in Major League Baseball who worked in the American League from 1925 to 1954. McGowan founded the second umpire school in the United States. He was inducted into the National Baseball Hall of Fame in 1992, the only person born in Delaware so honored."
Hal Newhouser,"Harold Newhouser (May 20, 1921 – November 10, 1998), nicknamed ""Prince Hal,"" was an American professional baseball player. In Major League Baseball (MLB), he pitched 17 seasons on the Detroit Tigers and Cleveland Indians, from 1939 through 1955. Newhouser was an All-Star for six seasons and was considered to be the most dominating pitcher of the World War II era of baseball, winning the pitching triple crown for the Tigers in 1945. To date, he is also the only pitcher in MLB history ever to win two consecutive MVP awards. Newhouser inducted into the National Baseball Hall of Fame in 1992.After his retirement from baseball, Newhouser stepped away from the sport for 20 years, serving as a bank vice president. He later worked as a scout for several MLB teams, including the Houston Astros. Angered when they rebuffed his recommendation to draft future Hall of Famer Derek Jeter in favor of Phil Nevin, he quit shortly after."
Tom Seaver,None
Rod Carew,None
Fergie Jenkins,"Ferguson Arthur ""Fergie"" Jenkins Jr. CM (born December 13, 1942) is a Canadian former professional baseball pitcher and coach. He played Major League Baseball (MLB) for the Philadelphia Phillies, Chicago Cubs, Texas Rangers and Boston Red Sox (1965–1983).Jenkins played the majority of his career for the Cubs. He was a National League (NL) and Cubs All-Star for three seasons, and in 1971, he was the first Canadian and Cubs pitcher to win a Cy Young Award. He was a 20-game winner for seven seasons, including six consecutive seasons for the Cubs. He was the NL leader in wins, in 1971, and the American League (AL) leader in wins, in 1974. Jenkins was also the NL leader in complete games in 1967, 1970, and 1971, and the AL leader in complete games in 1974. He led the NL in strikeouts in 1969 and had over 3,000 strikeouts during his career. His 284 victories are the most by a black pitcher in major league history.Jenkins also played basketball in the off-season for the Harlem Globetrotters from 1967 to 1969, and pitched two seasons in Canada for the minor league London Majors following his major league career. Jenkins became the first Canadian to be inducted into the National Baseball Hall of Fame in 1991; he remained the only one until Larry Walker's election in 2020."
Tony Lazzeri,"Anthony Michael Lazzeri (December 6, 1903 – August 6, 1946) was an American professional baseball second baseman during the 1920s and 1930s, predominantly with the New York Yankees of Major League Baseball. He was part of the famed ""Murderers' Row"" Yankee batting lineup of the late 1920s (including the 1927 team), along with Babe Ruth, Lou Gehrig, and Bob Meusel.Lazzeri was born and raised in San Francisco, California. He dropped out of school to work with his father as a boilermaker, but at the age of 18, began to play baseball professionally. After playing in minor league baseball from 1922 through 1925, Lazzeri joined the Yankees in 1926. He was a member of the original American League All-Star team in 1933. He was nicknamed ""Poosh 'Em Up"" by Italian-speaking fans, from a mistranslation of an Italian phrase meaning to ""hit it out"" (hit a home run).Lazzeri is one of only 14 major league baseball players to hit for the natural cycle (hitting a single, double, triple and home run in sequence) and the only player to complete a natural cycle with a grand slam. He also holds the American League record for the most RBI in a single game, with 11 on May 24, 1936. In that same 1936 game, he became the first major league player to hit two grand slams in one game. Lazzeri was posthumously inducted into the National Baseball Hall of Fame by the Veterans Committee in 1991."
Gaylord Perry,"Gaylord Jackson Perry (born September 15, 1938) is an American former professional baseball player. He played in Major League Baseball as a right-handed pitcher for eight different teams from 1962 to 1983. During a 22-year baseball career, Perry compiled 314 wins, 3,534 strikeouts, and a 3.11 earned run average. He was elected to the Baseball Hall of Fame in his third year of eligibility in 1991.Perry, a five-time All-Star, was the first pitcher to win the Cy Young Award in each league, winning it in the American League in 1972 with the Cleveland Indians and in the National League in 1978 with the San Diego Padres. He is also distinguished, along with his brother Jim Perry, for being part of the second-winningest brother combination in baseball history—second only to the knuckleball throwing brothers, Phil Niekro and Joe Niekro. While pitching for the Seattle Mariners in 1982, Perry became the 15th member of the 300 win club.Despite Perry's notoriety for doctoring baseballs (e.g. throwing a spitball), and perhaps even more so for making batters think he was throwing them on a regular basis – he even went so far as to title his 1974 autobiography Me and the Spitter – he was not ejected for the illegal practice until August 23, 1982, in his 21st season in the majors."
Bill Veeck,"William Louis Veeck Jr. (; February 9, 1914 – January 2, 1986), also known as ""Sport Shirt Bill"", was an American Major League Baseball franchise owner and promoter. Veeck was at various times the owner of the Cleveland Indians, St. Louis Browns and Chicago White Sox. As owner and team president of the Indians in 1947, Veeck signed Larry Doby, thus beginning the integration of the American League, and the following year won a World Series title as Cleveland's owner/president.Veeck was the last owner to purchase a baseball franchise without an independent fortune, and is responsible for many innovations and contributions to baseball.Unable to compete in the new era of salary escalation ignited by arbitration and free agency, Veeck sold his ownership interests after the 1980 Chicago White Sox season. He was inducted into the Baseball Hall of Fame in 1991."
Joe Morgan,"Joe Leonard Morgan (September 19, 1943 – October 11, 2020) was an American professional baseball second baseman who played Major League Baseball (MLB) for the Houston Colt .45s / Astros, Cincinnati Reds, San Francisco Giants, Philadelphia Phillies, and Oakland Athletics from 1963 to 1984. He won two World Series championships with the Reds in 1975 and 1976 and was also named the National League Most Valuable Player (MVP) in each of those years. Considered one of the greatest second basemen of all-time, Morgan was inducted into the Baseball Hall of Fame in 1990.After retiring as an active player, Morgan became a baseball broadcaster for the Reds, Giants, ABC, and ESPN, as well as a stint in the mid-to-late '90s on NBC's post-season telecasts, teamed with Bob Costas and Bob Uecker. He hosted a weekly nationally syndicated radio show on Sports USA, while serving as a special advisor to the Reds."
Jim Palmer,"James Alvin Palmer (born October 15, 1945) is an American former professional baseball pitcher who played 19 years in Major League Baseball (MLB) for the Baltimore Orioles (1965–1967, 1969–1984). Palmer was the winningest MLB pitcher in the 1970s, totaling 186 wins. He also won at least 20 games in eight different seasons and won three Cy Young Awards and four Gold Gloves during the decade. His 268 career victories are currently an Orioles record. A six-time American League (AL) All-Star, he was also one of the rare pitchers who never allowed a grand slam in any major league contest.Palmer appeared in the postseason eight times and was a vital member of three World Series Champions, six AL pennant winners and seven Eastern Division titleholders. He is the only pitcher in history to earn a win in a World Series game in three different decades. He is also the youngest to pitch a complete-game shutout in a World Series, doing so nine days before his 21st birthday in 1966, in which he defeated Sandy Koufax in Koufax's last appearance. He was one of the starters on the last rotation to feature four 20-game winners in a single season in 1971. He was elected to the Baseball Hall of Fame in 1990.Since his retirement as an active player in 1984, Palmer has worked as a color commentator on telecasts of MLB games for ABC and ESPN and for the Orioles on Home Team Sports (HTS), Comcast SportsNet (CSN) Mid-Atlantic and the Mid-Atlantic Sports Network (MASN). He has also been a popular spokesman, most famously for Jockey International for almost 20 years. He was nicknamed ""Cakes"" in the 1960s because of his habit of eating pancakes for breakfast on the days he pitched."
