"Houston, Texas, United States","Boston (US: , UK: ), officially the City of Boston, is the capital and most populous city of the Commonwealth of Massachusetts in the United States and 24th-most populous city in the country. The city proper covers about  48.4 square miles (125 km2) with a population of 675,647 in 2020, also making it the most populous city in New England. It is the seat of Suffolk County (although the county government was disbanded on July 1, 1999). The city is the economic and cultural anchor of a substantially larger metropolitan area known as Greater Boston, a metropolitan statistical area (MSA) home to a census-estimated 4.8 million people in 2016 and ranking as the tenth-largest MSA in the country. A broader combined statistical area (CSA), generally corresponding to the commuting area and including Providence, Rhode Island, is home to some 8.2 million people, making it the sixth most populous in the United States.Boston is one of the oldest municipalities in the United States, founded on the Shawmut Peninsula in 1630 by Puritan settlers from the English town of the same name. It was the scene of several key events of the American Revolution, such as the Boston Massacre, the Boston Tea Party, the Battle of Bunker Hill, and the siege of Boston. Upon American independence from Great Britain, the city continued to be an important port and manufacturing hub as well as a center for education and culture. The city has expanded beyond the original peninsula through land reclamation and municipal annexation. Its rich history attracts many tourists, with Faneuil Hall alone drawing more than 20 million visitors per year. Boston's many firsts include the United States' first public park (Boston Common, 1634), first public or state school (Boston Latin School, 1635) first subway system (Tremont Street subway, 1897), and first large public library (Boston Public Library, 1848).Today, Boston is a thriving center of scientific research. The Boston area's many colleges and universities make it a world leader in higher education, including law, medicine, engineering and business, and the city is considered to be a global pioneer in innovation and entrepreneurship, with nearly 5,000 startups. Boston's economic base also includes finance, professional and business services, biotechnology, information technology and government activities. Households in the city claim the highest average rate of philanthropy in the United States; businesses and institutions rank among the top in the country for environmental sustainability and investment. The city has one of the highest costs of living in the United States as it has undergone gentrification."
"Phoenix, Arizona, United States","Phoenix ( FEE-niks; Navajo: Hoozdo; Spanish: Fénix or Fínix, Walapai: Banyà:nyuwá) is the capital and most populous city in the American state of Arizona, with 1,608,139 residents as of 2020. It is the fifth-most populous city in the United States, and the only state capital with a population of more than one million residents.Phoenix is the anchor of the Phoenix metropolitan area, also known as the Valley of the Sun, which in turn is part of the Salt River Valley. The metropolitan area is the 11th largest by population in the United States, with approximately 4.85 million people as of 2020. Phoenix, the seat of Maricopa County, is the largest city in the state at 517.9 square miles (1,341 km2), and one of the largest cities in the United States. It is the largest metropolitan area, both by population and size, of the Arizona Sun Corridor megaregion.Phoenix was settled in 1867 as an agricultural community near the confluence of the Salt and Gila Rivers and was incorporated as a city in 1881. It became the capital of Arizona Territory in 1889. It is in the northeastern reaches of the Sonoran Desert and has a hot desert climate. Despite this, its canal system led to a thriving farming community with the original settlers' crops remaining important parts of the Phoenix economy for decades, such as alfalfa, cotton, citrus, and hay. Cotton, cattle, citrus, climate, and copper were known locally as the ""Five C's"" anchoring Phoenix's economy. These remained the driving forces of the city until after World War II, when high-tech companies began to move into the valley and air conditioning made Phoenix's hot summers more bearable.The city averaged a four percent annual population growth rate over a 40-year period from the mid-1960s to the mid-2000s. This growth rate slowed during the Great Recession of 2007–09, and has rebounded slowly. Phoenix is the cultural center of the state of Arizona. Phoenix is also majority minority, with 42.6% of its population identifying as Hispanic and 42.5% as ""white"" in the 2020 census."
"San Mateo County, California, United States","San Mateo County ( (listen) SAN mə-TAY-oh), officially the County of San Mateo, is a county located in  the U.S. state of California. As of the 2020 census, the population was 764,442. Redwood City is the county seat, and the third most populated city following Daly City and San Mateo.  San Mateo County is included in the San Francisco-Oakland-Berkeley, CA MSA (metropolitan statistical area), Silicon Valley, and is part of the San Francisco Bay Area, the nine counties bordering San Francisco Bay. It covers most of the San Francisco Peninsula.  San Francisco International Airport is located in the northeastern area of the county and is approximately 7 miles south of the city and county limits of San Francisco.  The county's built-up areas are mostly suburban, and are home to several corporate campuses."
"Changi, East Region, Singapore",None
"Cengkareng, Jakarta, Java, Indonesia","The Jakarta metropolitan area or Greater Jakarta, known locally as Jabodetabek (an acronym of Jakarta–Bogor–Depok–Tangerang–Bekasi), and sometimes extended to Jabodetabekjur (with the acronym extended to include part of Cianjur Regency), or Jabodetabekpunjur (further extended to include Puncak and the Cipanas district), is the most populous metropolitan area in Indonesia. It includes the national capital (Jakarta, as the core city) as well as five satellite cities and three complete regencies. The original term ""Jabotabek"" dated from the late 1970s and was revised to ""Jabodetabek"" in 1999 when ""De"" (for ""Depok"") was inserted into the name following its formation. The term ""Jabodetabekjur"" or ""Jabodetabekpunjur"" was legalised on the Presidential Regulation Number 54 of 2008, although the name Jabodetabek is more commonly used.The area comprises Jakarta and parts of West Java and Banten provinces, specifically the three regencies - Bekasi Regency and Bogor Regency in West Java, and Tangerang Regency in Banten. The area also includes the cities Bogor, Depok, Bekasi, Tangerang and South Tangerang, all of which are not included administratively in the regencies. The name of the region is taken from the first two (or three) letters of each city's name: Ja-bo-de-ta-bek from Jakarta, Bogor, Depok, Tangerang and Bekasi.The population of Jakarta metropolitan area, with an area of 6,343 km2 (2,449 sq mi), was 31.24 million according to the Indonesian 2020 Census, making it the most populous region in Indonesia, as well as the second-most populous urban area in the world after Tokyo. The population share of Jakarta metropolitan area to the national population increased from 6.1% in 1961 to 11.26% in 2010.The region is the centre of government, culture, education, and economy of Indonesia. It has pulled many people from throughout Indonesia to come, live and work. Its economic power makes Jakarta metropolitan area the country's premier centre for finance, manufacture and commerce. In 2019 data,The area has a gross domestic product of US$297.7 billion with a per capita GDP of $8,775, and a purchasing power parity of US$978.5 billion with a per capita PPP of $28,840, equal to 26.2% of economy of Indonesia.The region was established in 1976 through Presidential Instruction No. 13 in response to the needs to sustain the growing population of the capital city. Indonesia's government established the Jabotabek Cooperation Body (Badan Kerjasama Pembangunan) of the joint secretariat of Government of DKI Jakarta and West Java province."
"Huadu District, Guangzhou, Guangdong, China","Huadu District is one of 11 urban districts of the prefecture-level city of Guangzhou, the capital of Guangdong, China. It is located in the far northern suburbs of the city.Xinhua Town is the seat of local government, and of the district CCP committee.While the Cantonese dialect is universally spoken, about 1/3 of the population consists of Hakka dialect speaking peoples. The district is the ancestral home of many Overseas Chinese.Formerly known as Hua County, it was the hometown of many Taiping Rebellion leaders like Hong Xiuquan and Hong Rengan."
"Charlotte, North Carolina, United States","Charlotte ( SHAR-lət) is the most populous city in the U.S. state of North Carolina. Located in the Piedmont region, it is the county seat of Mecklenburg County. The population was 874,579 as of the 2020 census, making it the 16th-most populous city in the U.S., the second-most populous city in the Southeast behind Jacksonville, Florida, and  seventh-largest city in the Southern United States. The city is the cultural, economic, and transportation center of the Charlotte metropolitan area, whose population ranks 23rd in the U.S., and had a population of 2,660,329, in 2020.   The Charlotte metropolitan area is part of a sixteen-county market region or combined statistical area with a 2020 census-estimated population of 2,846,550.Between 2004 and 2014, Charlotte was ranked as the country's fastest-growing metro area, with 888,000 new residents. Based on U.S. Census data from 2005 to 2015, Charlotte tops the U.S. in millennial population growth. It is the third-fastest-growing major city in the United States. Residents are referred to as ""Charlotteans"".Charlotte is home to the corporate headquarters of Bank of America, Truist Financial, and the east coast headquarters of Wells Fargo, which along with other financial institutions has made it the second-largest banking center in the United States.Among Charlotte's many notable attractions, some of the most popular include the Carolina Panthers (NFL), the Charlotte Hornets (NBA), the Coca-Cola 600, the Wells Fargo Championship, the NASCAR Hall of Fame, the Charlotte Ballet, Children's Theatre of Charlotte, Carowinds amusement park, and the U.S. National Whitewater Center.Charlotte has a humid subtropical climate. It is located several miles east of the Catawba River and southeast of Lake Norman, the largest man-made lake in North Carolina. Lake Wylie and Mountain Island Lake are two smaller man-made lakes located near the city."
"Miami-Dade County, Florida, United States","Miami Gardens is a city in north-central Miami-Dade County, Florida, United States. It is 16 miles north of Downtown Miami and its boundaries stretch from I-95 and NE 2nd Avenue on the east to NW 47th and NW 57th Avenues on the west, and from the Broward County line on the north to 151st Street on the south. The city name comes from one of the major roadways through the area, Miami Gardens Drive. According the US Census Bureau, the city had a population of 110,001 as of 2019, and it is Florida's largest city with a majority African American population. It is a principal city of the Miami metropolitan area, which was home to an estimated 6,012,331 people in 2015."
"Fiumicino, Rome, Italy","Rome–Fiumicino International Airport ""Leonardo da Vinci"" (Italian: Aeroporto Internazionale di Roma–Fiumicino ""Leonardo da Vinci""; IATA: FCO, ICAO: LIRF) is an international airport in Rome, Italy.  It is the busiest airport in the country and in 2019, it ranked as the 11th busiest airport in Europe by passenger traffic with over 43.5 million passengers served.The airport served as the main hub for Alitalia, the then flag carrier and largest Italian airline, which terminated operations on 15 October 2021. It currently serves as a hub for Vueling, a Spanish low-cost carrier owned by International Airlines Group and is now the main international hub for Alitalia's successor ITA Airways, which replaced Alitalia on 15 October 2021. Based on total passenger numbers, Fiumicino was the world's 49th-busiest airport in 2018. It covers an area of 16 km2."
"Orlando, Florida, United States","SeaWorld Orlando is a  theme park and marine zoological park, in Orlando, Florida. It is owned and operated by SeaWorld Parks & Entertainment. When combined with its neighbor Discovery Cove and Aquatica, it forms SeaWorld Parks and Resorts Orlando, an entertainment complex consisting of the three parks and many hotels. In 2018, SeaWorld Orlando hosted an estimated 4.594 million guests, ranking it the 10th most visited amusement park in the United States."
"Sydney, New South Wales, Australia","Sydney ( (listen) SID-nee; Dharug: Gadi; Greater Sydney, Dharug: Eora) is the capital city of the state of New South Wales, and the most populous city in Australia and Oceania. Located on Australia's east coast, the metropolis surrounds Port Jackson and extends about 70 km (43.5 mi) on its periphery towards the Blue Mountains to the west, Hawkesbury to the north, the Royal National Park to the south and Macarthur to the south-west. Sydney is made up of 658 suburbs, spread across 33 local government areas. Residents of the city are known as ""Sydneysiders"". As of June 2020, Sydney's estimated metropolitan population was 5,367,206, meaning the city is home to approximately 66% of the state's population. Nicknames of the city include the 'Emerald City' and the 'Harbour City'.Indigenous Australians have inhabited the Sydney area for at least 30,000 years, and thousands of Aboriginal engravings remain throughout the region. During his first Pacific voyage in 1770, Lieutenant James Cook and his crew became the first Europeans to chart the eastern coast of Australia, making landfall at Botany Bay. In 1788, the First Fleet of convicts, led by Arthur Phillip, founded Sydney as a British penal colony, the first European settlement in Australia. After World War II, it experienced mass migration and became one of the most multicultural cities in the world. Furthermore, 45.4% of the population reported having been born overseas, and the city has the third-largest foreign-born population of any city in the world after London and New York City.Despite being one of the most expensive cities in the world, Sydney frequently ranks in the top ten most liveable cities in the world. It is classified as an Alpha global city by the Globalization and World Cities Research Network, indicating its influence in the region and throughout the world. Ranked eleventh in the world for economic opportunity, Sydney has an advanced market economy with strengths in finance, manufacturing and tourism. Established in 1850, the University of Sydney was Australia's first university and is regarded as one of the world's leading universities.Sydney has hosted major international sporting events such as the 2000 Summer Olympics. The city is among the top fifteen most-visited cities in the world, with millions of tourists coming each year to see the city's landmarks. Boasting over 1,000,000 ha (2,500,000 acres) of nature reserves and parks, its notable natural features include Sydney Harbour and Royal National Park. Built attractions such as the Sydney Harbour Bridge and the World Heritage-listed Sydney Opera House are also well known to international visitors. The main passenger airport serving the metropolitan area is Kingsford Smith Airport, one of the world's oldest continually operating airports."
"Newark, New Jersey, United States","Newark ( NEW-ərk, locally  NORK) is the most populous city in the U.S. state of New Jersey and the seat of Essex County and part of the New York metropolitan area. As one of the nation's major air, shipping, and rail hubs, the city had a population of 311,549 in 2020, making it the nation's 62nd-most populous municipality, after being ranked 73rd in the nation in 2010.Settled in 1666 by Puritans from New Haven Colony, Newark is one of the oldest cities in the United States. Its location at the mouth of the Passaic River (where it flows into Newark Bay) has made the city's waterfront an integral part of the Port of New York and New Jersey. Today, Port Newark–Elizabeth is the primary container shipping terminal of the busiest seaport on the U.S. East Coast. Newark Liberty International Airport was the first municipal commercial airport in the United States, and today is one of its busiest.Several leading companies have their headquarters in Newark, including Prudential, PSEG, Panasonic Corporation of North America, Audible.com, IDT Corporation, Manischewitz and AeroFarms. A number of important higher education institutions are also in the city, including the Newark campus of Rutgers University (which includes law and medical schools and the Rutgers Institute of Jazz Studies); University Hospital (formerly the University of Medicine and Dentistry of New Jersey which included the schools of medicine and dentistry now under Rutgers University); the New Jersey Institute of Technology; and Seton Hall University's law school. The U.S. District Court for the District of New Jersey sits in the city as well. Local cultural venues include the New Jersey Performing Arts Center, Newark Symphony Hall, the Prudential Center and The Newark Museum of Art.Newark is divided into five political wards (East, West, South, North and Central) and contains neighborhoods ranging in character from bustling urban districts to quiet suburban enclaves. Newark's Branch Brook Park is the oldest county park in the United States and is home to the nation's largest collection of cherry blossom trees, numbering over 5,000."
"Munich, Bavaria, Germany","Munich ( MEW-nik; German: München [ˈmʏnçn̩] (listen); Bavarian: Minga [ˈmɪŋ(ː)ɐ] (listen)) is the capital and most populous city of the German state of Bavaria. With a population of 1,558,395 inhabitants as of 31 July 2020, it is the third-largest city in Germany, after Berlin and Hamburg, and thus the largest which does not constitute its own state, as well as the 11th-largest city in the European Union. The city's metropolitan region is home to 6 million people.Straddling the banks of the River Isar (a tributary of the Danube) north of the Bavarian Alps, it is the seat of the Bavarian administrative region of Upper Bavaria, while being the most densely populated municipality in Germany (4,500 people per km2). Munich is the second-largest city in the Bavarian dialect area, after the Austrian capital of Vienna.The city was first mentioned in 1158. Catholic Munich strongly resisted the Reformation and was a political point of divergence during the resulting Thirty Years' War, but remained physically untouched despite an occupation by the Protestant Swedes. Once Bavaria was established as a sovereign kingdom in 1806, Munich became a major European centre of arts, architecture, culture and science. In 1918, during the German Revolution, the ruling house of Wittelsbach, which had governed Bavaria since 1180, was forced to abdicate in Munich and a short-lived socialist republic was declared. In the 1920s, Munich became home to several political factions, among them the NSDAP. After the Nazis' rise to power, Munich was declared their ""Capital of the Movement"". The city was heavily bombed during World War II, but has restored most of its traditional cityscape. After the end of postwar American occupation in 1949, there was a great increase in population and economic power during the years of Wirtschaftswunder, or ""economic miracle"". The city hosted the 1972 Summer Olympics and was one of the host cities of the 1974 and 2006 FIFA World Cups.Today, Munich is a global centre of art, science, technology, finance, publishing, culture, innovation, education, business, and tourism and enjoys a very high standard and quality of living, reaching first in Germany and third worldwide according to the 2018 Mercer survey, and being rated the world's most liveable city by the Monocle's Quality of Life Survey 2018. According to the Globalization and World Rankings Research Institute, Munich is considered an alpha-world city, as of 2015. It is one of the most prosperous and fastest growing cities in Germany.Munich's economy is based on high tech, automobiles, the service sector and creative industries, as well as IT, biotechnology, engineering and electronics among many others. The city houses many multinational companies, such as BMW, Siemens, MAN, Allianz and MunichRE. It is also home to two research universities, a multitude of scientific institutions, and world class technology and science museums like the Deutsches Museum and BMW Museum. Munich's numerous architectural and cultural attractions, sports events, exhibitions and its annual Oktoberfest attract considerable tourism. The city is home to more than 530,000 people of foreign background, making up 37.7% of its population."
"Crawley, West Sussex, England, United Kingdom","West Sussex is a county in South East England on the English Channel coast. The ceremonial county comprises the shire districts of Adur, Arun, Chichester, Horsham, and Mid Sussex, and the boroughs of Crawley and Worthing. Covering an area of 1,991 square kilometres (769 sq mi), West Sussex borders Hampshire to the west, Surrey to the north, and East Sussex to the east. The county town and only city in West Sussex is Chichester, located in the south-west of the county. This was legally formalised with the establishment of West Sussex Council in 1888 but within the ceremonial Sussex. After the reorganisation of local government in 1974, the ceremonial function of the historic county of Sussex was divided into two separate counties, with the western half becoming West Sussex and the eastern half East Sussex. The existing East and West Sussex councils took control respectively, with Mid Sussex and parts of Crawley being transferred to West Sussex administration from East Sussex.In the 2011 census, West Sussex recorded a population of 806,900.The county has a long history of human settlement dating back to the Lower Paleolithic era. The Romans conquered West Sussex's indigenous Britons, and incorporated the area as a Roman province. During the Early Middle Ages, the Saxons settled the area, establishing the Kingdom of Sussex in 477, which lasted until c. 827 when the kingdom was annexed by Wessex.West Sussex has a range of scenery, including wealden, downland and coastal. The highest point of the county is Blackdown, at 280 metres (919 ft). It has a number of stately homes including Goodwood, Petworth House and Uppark, and castles such as Arundel Castle and Bramber Castle. Over half the county is protected countryside, offering walking, cycling and other recreational opportunities."
"Fort Snelling, Minnesota, United States","Fort Snelling is an unorganized territory of Hennepin County in the U.S. state of Minnesota. It is named after historic Fort Snelling, which is located within its boundaries.  The district also includes Coldwater Spring park, Minneapolis-Saint Paul International Airport, parts of the Mississippi National River and Recreation Area, and several government facilities. As of the 2020 census the territory had a population of 322 people."
"Narita, Chiba, Japan","Narita (成田市, Narita-shi) is a city in Chiba Prefecture, Japan. As of 30 November 2020, the city had an estimated population of 131,852 in 63,098 households and a population density of 620 persons per km². The total area of the city is 213.84 square kilometres (82.56 sq mi). It is the site of Narita International Airport, one of the two main international airports serving the Greater Tokyo Area."
"Pudong, Shanghai, China","Pudong (浦东) is a district of Shanghai located east of the Huangpu River across from the historic city center of Shanghai in Puxi. The name refers to its historic position as ""The East Bank"" of the Huangpu River, which flows through central Shanghai, although it is now administered as the Pudong New Area, a state-level new area which extends all the way to the East China Sea.The traditional area of Pudong is now home to the Lujiazui Finance and Trade Zone and the Shanghai Stock Exchange and many of Shanghai's best-known buildings, such as the Oriental Pearl Tower, the Jin Mao Tower, the Shanghai World Financial Center, and the Shanghai Tower. These modern skyscrapers directly face Puxi's historic Bund, a remnant of former foreign concessions in China. The rest of the new area includes the Port of Shanghai, the Shanghai Expo and Century Park, Zhangjiang Hi-Tech Park, Shanghai Pudong International Airport, the Jiuduansha Wetland Nature Reserve, Nanhui New City, and the Shanghai Disney Resort."
