Constantius Chlorus,"Flavius Valerius Constantius ""Chlorus"" (c. 250 – 25 July 306), also called Constantius I, was a Roman emperor as one of the four original members of the ""Tetrarchy"" established by Diocletian in 293. He was a junior-ranking emperor, or Caesar, from 293 to 305, and senior emperor, Augustus, from 305 to 306. Constantius was also father of Constantine the Great, the first Christian emperor of Rome. The nickname Chlorus (Greek: Χλωρός, lit. ""the Green"") was first popularized by Byzantine-era historians and not used during the emperor's lifetime.Of humble origin, Constantius had a distinguished military career and rose to the top ranks of the army. Around 289 he set aside Helena, Constantine's mother, to marry a daughter of Emperor Maximian, and in 293 was added to the imperial college by Maximian's colleague, Diocletian. Assigned to rule Gaul, Constantius defeated the usurper Carausius there and his successor Allectus in Britain, and campaigned extensively along the Rhine frontier, defeating the Alamanni and Franks. When the Diocletianic Persecution was announced in 303, Constantius ordered the demolition of churches but did not actively hunt down Christians in his domain. Upon becoming senior emperor in May 305, Constantius launched a successful punitive campaign against the Picts beyond the Antonine Wall. He died suddenly at Eboracum (York) in July the following year.After Constantius's death, the army, perhaps at his own instigation, immediately acclaimed his son Constantine as emperor. This act contributed to the collapse of the Diocletianic tetrarchy, sparking a series of civil wars which only ended when Constantine finally united the whole Roman Empire under his rule in 324. According to the Oxford Classical Dictionary, ""Constantinian propaganda bedevils assessment of Constantius, yet he appears to have been an able general and a generous ruler"". His descendants, the Constantinian dynasty, ruled the Empire until the death of his grandson Julian the Apostate in 363."
Galerius Maximianus,"Gaius Galerius Valerius Maximianus (; c. 258 – May 311) was Roman emperor from 305 to 311. During his reign he campaigned, aided by Diocletian, against the Sassanid Empire, sacking their capital Ctesiphon in 299. He also campaigned across the Danube against the Carpi, defeating them in 297 and 300. Although he was a staunch opponent of Christianity, Galerius ended the Diocletianic Persecution when he issued an Edict of Toleration in Serdica in 311."
Constantine I. (including “ Urbs Roma” and “Constantinopolis “),"The Romans (Latin: Rōmānī; Ancient Greek: Ῥωμαῖοι, romanized: Rhōmaîoi) were a cultural group, variously referred to as an ethnicity or a nationality, that in classical antiquity, from the 2nd century BC to the 5th century AD, came to rule the Near East, North Africa, and large parts of Europe through conquests made during the Roman Republic and the later Roman Empire. Originally only referring to the Italic Latin citizens of Rome itself, the meaning of ""Roman"" underwent considerable changes throughout the long history of Roman civilisation as the borders of the Roman state expanded and contracted. At times, different groups within Roman society also had different ideas as to what it meant to be Roman. Aspects such as geography, language, and ethnicity could be seen as important by some, whereas others saw Roman citizenship and culture or behaviour as more important. At the height of the Roman Empire, Roman identity was a collective geopolitical identity, extended to nearly all subjects of the Roman emperors and encompassing vast regional and ethnic diversity.As the land under Roman rule increased from the 4th century BC onwards, Roman citizenship was gradually extended to the various peoples under Roman dominion. Citizenship grants, demographic growth, and settler and military colonies rapidly increased the number of Roman citizens. The increase achieved its peak with Emperor Caracalla's AD 212 Antonine Constitution, which extended citizenship rights to all free inhabitants of the empire. It is for the most part not clear to what extent the majority of Roman citizens in antiquity regarded themselves as being Roman. Most likely, local identities were prominent throughout the Roman Empire due to its vast geographical extent, but Roman identity provided a larger sense of common identity and became important when distinguishing from non-Romans, such as barbarian settlers and invaders. Roman culture was far from homogeneous; though there was a predominant Hellenistic-inspired cultural idiom, one of the strengths of the Roman Empire was also its ability to incorporate traditions from other cultures. Rome's cultural flexibility precluded the development of a strong Roman 'core identity' in Italy, but also contributed to the empire's longevity.The Roman Empire affected the personal identities of its subject peoples to a considerable extent and Roman identity lasted throughout the lands of the empire until long after the Roman Empire itself had faded away. The collapse of the Western Roman Empire in the 5th century ended the political domination of the Roman Empire in Western Europe, but Roman identity survived in the west as an important political resource. Through the failures of the surviving Eastern Roman Empire, also called the Byzantine Empire, of reconquering and keeping control of the west and suppression from the new Germanic kingdoms, Roman identity faded away in the west, more or less disappearing in the 8th and 9th centuries. Increasingly, Western Europeans only began applying the designation of Roman to the citizens of the city of Rome itself. In the Greek-speaking east, still under imperial control, Roman identity survived until the fall of the Byzantine Empire in 1453 and beyond, though it increasingly transformed into an ethnic identity, marked by Greek language and adherence to Orthodox Christianity, a precursor to modern Greek ethnic identity. The two major groups still clinging to Roman identity throughout the Middle Ages—the Byzantine Greeks of the eastern empire and the citizens of Rome itself—drifted apart linguistically and religiously and eventually ceased to recognise each other as Roman.Whereas Roman identity faded away in most of the lands where it was once prominent, for some regions and peoples it proved considerably more tenacious. 'Romans' has been consistently used since antiquity to describe the citizens of Rome itself, who identify and are described as such to this day. The Greeks continued to identify as Romioi, or related names, after the fall of the Eastern Roman Empire, though most identify as Hellenes today. In the Alps, Roman identity survived uninterrupted, despite Frankish efforts at suppression. Today, the names of two groups in Switzerland still evokes their descent from these populations: the Romands and the Romansh people. Several ethnonyms of the Balkan Romance peoples, whose descent in most cases is unclear, evoke Roman identity. Several names derive from the Latin Romani (such as the Romanians, Aromanians and Istro-Romanians), or from the Germanic walhaz (a term originally referring to the Romans; adopted in the form 'Vlach' as the self-designation of the Megleno-Romanians)."
Fausta,None
Crispus,"Flavius Julius Crispus (; c. 303 – 326) was the eldest son of the Roman emperor Constantine the Great and his junior emperor (caesar) from March 317 until his execution by his father in 326. The grandson of the augustus Constantius I, Crispus was the elder half-brother of the future augustus Constantine II and became co-caesar with him and with his cousin Licinius II at Serdica, part of the settlement ending the Cibalensean War between Constantine and his father's rival Licinius I. Crispus ruled from Augusta Treverorum (Trier) in Roman Gaul between 318 and 323 and defeated the navy of Licinius I at the Battle of the Hellespont in 324, which with the land Battle of Chrysopolis won by Constantine forced the resignation of Licinius and his son, leaving Constantine the sole augustus and the Constantinian dynasty in control of the entire empire. It is unclear what was legal status of the relationship Crispus's mother Minervina had with Constantine; Crispus may have been an illegitimate son.Crispus's tutor in rhetoric was the Late Latin historian of Early Christianity, Lactantius. Crispus may be the young prince depicted on the Gemma Constantiniana, a great cameo depicting Constantine and his wife Fausta, though the depiction may instead be of Fausta's own son, the future augustus Constantius II. While at Augusta Treverorum, Crispus's praetorian prefect for the prefecture of Gaul was the great Junius Annius Bassus. After his elevation to imperial rank, at which point he was also entitled princeps iuventutis (""Prince of Youth""), the Latin rhetorician Nazarius composed a panegyric preserved in the Panegyrici Latini, which honoured Crispus's military victories over the Franks in c. 319. Crispus was three times Roman consul, for the years 318, 321, and 324.Within two years of the defeat and surrender of Licinius, Constantine had not only put his brother-in-law and former co-augustus to death, but also executed his nephew Licinius II, the son of his sister Flavia Julia Constantia. According to the Latin histories of Ammianus Marcellinus and Aurelius Victor, after a trial whose real circumstances are mysterious, Constantine executed Crispus at Pola (Pula) in 326. Fausta, whose son Constantius II became caesar in November 324, was also put to death, and the Late Greek historian Zosimus and the Byzantine Greek writer Joannes Zonaras wrote that Constantine had accused Crispus of incest with his stepmother. After his death, Crispus was subjected to damnatio memoriae."
Constantine II.,"Constantine, son of Áed (Medieval Gaelic: Causantín mac Áeda; Modern Gaelic: Còiseam mac Aoidh, known in most modern regnal lists as Constantine II; born no later than 879; died 952) was an early King of Scotland, known then by the Gaelic name Alba. The Kingdom of Alba, a name which first appears in Constantine's lifetime, was situated in modern-day Scotland.The core of the kingdom was formed by the lands around the River Tay. Its southern limit was the River Forth, northwards it extended towards the Moray Firth and perhaps to Caithness, while its western limits are uncertain. Constantine's grandfather Kenneth I of Scotland (Cináed mac Ailpín, died 858) was the first of the family recorded as a king, but as king of the Picts. This change of title, from king of the Picts to king of Alba, is part of a broader transformation of Pictland and the origins of the Kingdom of Alba are traced to Constantine's lifetime.His reign, like those of his predecessors, was dominated by the actions of Viking rulers in the British Isles, particularly the Uí Ímair (""the grandsons of Ímar"", or Ivar the Boneless). During Constantine's reign the rulers of the southern kingdoms of Wessex and Mercia, later the Kingdom of England, extended their authority northwards into the disputed kingdoms of Northumbria. At first, the southern rulers allied with him against the Vikings, but in 934 Æthelstan, unprovoked, invaded Scotland both by sea and land with a huge retinue that included four Welsh Kings. He ravaged southern Alba but there is no record of any battles. He had withdrawn by September. Three years later in 937, probably in retaliation for the invasion of Alba, King Constantine allied with Olaf Guthfrithson, King of Dublin, and Owain, King of Strathclyde, but they were defeated at the battle of Brunanburh. In 943 Constantine abdicated the throne and retired to the Céli Dé (Culdee) monastery of St Andrews where he died in 952. He was succeeded by his predecessor's son Malcolm I (Máel Coluim mac Domnaill).Constantine's reign of 43 years, exceeded in Scotland only by that of King William the Lion before the Union of the Crowns in 1603, is believed to have played a defining part in the gaelicisation of Pictland, in which his patronage of the Irish Céli Dé monastic reformers was a significant factor. During his reign the words ""Scots"" and ""Scotland"" (Old English: Scottas, Scotland) are first used to mean part of what is now Scotland. The earliest evidence for the ecclesiastical and administrative institutions which would last until the Davidian Revolution also appears at this time."
Constans,None
Constantius II,"Flavius Julius Constantius (Greek: Κωνστάντιος; 7 August 317 – 3 November 361), known as Constantius II, was Roman emperor from 337 to 361. His reign saw constant warfare on the borders against the Sasanian Empire and Germanic peoples, while internally the Roman Empire went through repeated civil wars, court intrigues and usurpations. His religious policies inflamed domestic conflicts that would continue after his death.Constantius was a son of Constantine the Great, who elevated him to the imperial rank of caesar on 8 November 324 and after whose death Constantius became augustus together with his brothers, Constantine II and Constans on 9 September 337. He promptly oversaw the massacre of his father-in-law, an uncle and several cousins, consolidating his hold on power. The brothers divided the empire among themselves, with Constantius receiving Greece, Thrace, the Asian provinces and Egypt in the east. For the following decade a costly and inconclusive war against Persia took most of Constantius's time and attention. In the meantime, his brothers Constantine and Constans warred over the western provinces of the empire, leaving the former dead in 340 and the latter as sole ruler of the west. The two remaining brothers maintained an uneasy peace with each other until, in 350, Constans was overthrown and assassinated by the usurper Magnentius.Unwilling to accept Magnentius as co-ruler, Constantius waged a civil war against the usurper, defeating him at the battles of Mursa Major in 351 and Mons Seleucus in 353. Magnentius committed suicide after the latter battle, leaving Constantius as sole ruler of the empire. In 351, Constantius elevated his cousin Constantius Gallus to the subordinate rank of caesar to rule in the east, but had him executed three years later after receiving scathing reports of his violent and corrupt nature. Shortly thereafter, in 355, Constantius promoted his last surviving cousin, Gallus' younger half-brother Julian, to the rank of caesar.As emperor, Constantius promoted Arian heresy, banned pagan sacrifices, and issued laws against Jews. His military campaigns against Germanic tribes were successful: he defeated the Alamanni in 354 and campaigned across the Danube against the Quadi and Sarmatians in 357. The war against the Sasanians, which had been in a lull since 350, erupted with renewed intensity in 359 and Constantius traveled to the east in 360 to restore stability after the loss of several border fortresses. However, Julian claimed the rank of augustus in 360, leading to war between the two after Constantius' attempts to persuade Julian to back down failed. No battle was fought, as Constantius became ill and died of fever on 3 November 361 in Mopsuestia, allegedly naming Julian as his rightful successor before his death."
Magnentius,"Marcus Aurelius Valerius Maxentius (c. 283 – 28 October 312) was a Roman emperor, who reigned from 306 until his death in 312. Despite ruling in Italy and North Africa, and having the recognition of the Senate in Rome, he was not recognized as a legitimate emperor by his fellow emperors.He was the son of former Emperor Maximian and the son-in-law of Emperor Galerius. The latter part of his reign was preoccupied with civil war, allying with Maximinus against Licinius and Constantine. The latter defeated him at the Battle of the Milvian Bridge in 312, where Maxentius, with his army in flight, purportedly perished by drowning in the Tiber river.Maxentius was the last emperor to permanently reside in Rome. He attempted to embellish, restore and improve the ancient capital, carrying out important building works, including the Temple of the Divine Romulus (dedicated to his deceased son), the Basilica of Maxentius, which was completed by Constantine, the villa and the circus of Maxentius."
Valentinian I.,None
Valens,"Flavius Valens (Ancient Greek: Οὐάλης) (328– 9 August 378) was Roman emperor from 364 to 378. He was the younger brother of the emperor Valentinian I, who gave Valens the eastern half of the Roman Empire to rule. Before 364, Valens had a largely unremarkable military career. In 378, Valens was defeated and killed at the Battle of Adrianople against the invading Goths, which astonished contemporaries and marked the beginning of barbarian encroachment into Roman territory.As emperor Valens continually faced threats both internal and external. He defeated, after some dithering, the usurper Procopius in 366, and campaigned against the Goths across the Danube in 367 and 369. In the following years, Valens focused on the eastern frontier, where he faced the perennial threat of Persia, particularly in Armenia, as well as additional conflicts with the Saracens and Isaurians. Domestically, he inaugurated the Aqueduct of Valens in Constantinople, which was longer than all the aqueducts of Rome. In 376–77, the Gothic War broke out, following a mismanaged attempt to settle the Goths in the Balkans. Valens returned from the east to fight the Goths in person, but lack of coordination with his nephew, the western emperor Gratian (Valentinian I's son), as well as poor battle tactics, led to Valens and much of the eastern Roman army dying at a battle near Adrianople in 378.Although Valens is described as indecisive, impressionable, a mediocre general and overall ""utterly undistinguished"", he was also a conscientious and capable administrator, and a notable achievement of his was to significantly relieve the burden of taxation on the population. At the same time, his suspicious and fearful disposition, and excessive concern for personal safety, resulted in numerous treason trials and executions, which heavily stained his reputation. In religious matters, Valens favored a compromise between Nicene Christianity and the various non-trinitarian Christian sects, and interfered little in the affairs of the pagans."
Gratian,"Gratian (; Latin: Flavius Gratianus; 18 April 359 – 25 August 383) was emperor of the western part of the Roman Empire from 367 to 383. The eldest son of Valentinian I, Gratian accompanied his father on several campaigns along the Rhine and Danube frontiers and was raised to the rank of augustus in 367. Upon the death of Valentinian in 375, Gratian took over government of the west while his half-brother Valentinian II was also acclaimed emperor in Pannonia. Gratian governed the western provinces of the empire, while his uncle Valens was already the emperor over the east.Gratian subsequently led a campaign across the Rhine, attacked the Lentienses, and forced the tribe to surrender. That same year, the eastern emperor Valens was killed fighting the Goths at the Battle of Adrianople, which led to Gratian elevating Theodosius to replace him in 379. Gratian favoured Nicene Christianity over traditional Roman religion, issuing the Edict of Thessalonica, refusing the office of pontifex maximus, and removing the Altar of Victory from the Roman Senate's Curia Julia. The city of Cularo on the Isère river in Roman Gaul was renamed Latin: Gratianopolis after him, which later evolved to Grenoble.In 383, faced with rebellion by the usurper Magnus Maximus, Gratian marched his army towards Lutetia (Paris). His army deserted him. He fled to Lyon and was later murdered."
