Consular (“Acisculus.” Valeria gens).,"The gens Valeria was a patrician family at ancient Rome, prominent from the very beginning of the Republic to the latest period of the Empire.  Publius Valerius Poplicola was one of the consuls in 509 BC, the year that saw the overthrow of the Tarquins, and the members of his family were among the most celebrated statesmen and generals at the beginning of the Republic.  Over the next ten centuries, few gentes produced as many distinguished men, and at every period the name of Valerius was constantly to be found in the lists of annual magistrates, and held in the highest honour.  Several of the emperors claimed descent from the Valerii, whose name they bore as part of their official nomenclature.A number of unusual privileges attached to this family, including the right to burial within the city walls, and a special place for its members in the Circus Maximus, where the unique honour of a throne was granted them.  The house built by Poplicola at the foot of the Velian Hill was the only one whose doors were permitted to open into the street.  The historian Niebuhr conjectured that, during the transition from the monarchy to the Republic, the Valerii were entitled to exercise royal power on behalf of the Titienses, one of the three Romulean tribes that made up the Roman people.Although one of the most noble and illustrious families of the Roman aristocracy, from the very beginning the Valerii were notable for their advocacy of plebeian causes, and many important laws protecting the rights of the plebeians were sponsored by the Valerii.  As with many other ancient patrician houses, the family also acquired plebeian branches, which must have been descended either from freedmen of the Valerii, or from members of the family who, for one reason or another, had gone over to the plebeians."
,None
Domitian,None
Trajan,None
Hadrian,"Hadrian (; Latin: Caesar Traianus Hadrianus [ˈkae̯sar trajˈjaːnʊs (h)adriˈjaːnʊs]; 24 January 76 – 10 July 138) was Roman emperor from 117 to 138. He was born into a Roman Italo-Hispanic family, which settled in Spain from the Italian city of Atri in Picenum. His father was of senatorial rank and was a first cousin of Emperor Trajan. Hadrian married Trajan's grand-niece Vibia Sabina early in his career, before Trajan became emperor and possibly at the behest of Trajan's wife Pompeia Plotina. Plotina and Trajan's close friend and adviser Lucius Licinius Sura were well disposed towards Hadrian. When Trajan died, his widow claimed that he had nominated Hadrian as emperor immediately before his death.Rome's military and Senate approved Hadrian's succession, but four leading senators were unlawfully put to death soon after. They had opposed Hadrian or seemed to threaten his succession, and the Senate held him responsible for their deaths and never forgave him. He earned further disapproval among the elite by abandoning Trajan's expansionist policies and territorial gains in Mesopotamia, Assyria, Armenia, and parts of Dacia. Hadrian preferred to invest in the development of stable, defensible borders and the unification of the empire's disparate peoples. He is known for building Hadrian's Wall, which marked the northern limit of Britannia.Hadrian energetically pursued his own Imperial ideals and personal interests. He visited almost every province of the Empire, accompanied by an Imperial retinue of specialists and administrators. He encouraged military preparedness and discipline, and he fostered, designed, or personally subsidised various civil and religious institutions and building projects. In Rome itself, he rebuilt the Pantheon and constructed the vast Temple of Venus and Roma. In Egypt, he may have rebuilt the Serapeum of Alexandria. He was an ardent admirer of Greece and sought to make Athens the cultural capital of the Empire, so he ordered the construction of many opulent temples there. His intense relationship with Greek youth Antinous and the latter's untimely death led Hadrian to establish a widespread cult late in his reign. He suppressed the Bar Kokhba revolt in Judaea, but his reign was otherwise peaceful.Hadrian's last years were marred by chronic illness. He saw the Bar Kokhba revolt as the failure of his panhellenic ideal. He executed two more senators for their alleged plots against him, and this provoked further resentment. His marriage to Vibia Sabina had been unhappy and childless; he adopted Antoninus Pius in 138 and nominated him as a successor, on the condition that Antoninus adopt Marcus Aurelius and Lucius Verus as his own heirs. Hadrian died the same year at Baiae, and Antoninus had him deified, despite opposition from the Senate. Edward Gibbon includes him among the Empire's ""Five Good Emperors"", a ""benevolent dictator""; Hadrian's own Senate found him remote and authoritarian. He has been described as enigmatic and contradictory, with a capacity for both great personal generosity and extreme cruelty and driven by insatiable curiosity, self-conceit, and ambition."
Antoninus Pius,"Titus Aelius Hadrianus Antoninus Pius (19 September 86 – 7 March 161) was Roman emperor from 138 to 161. He was one of the Five Good Emperors from the Nerva–Antonine dynasty.Born into a senatorial family, Antoninus held various offices during the reign of Emperor Hadrian. He married Hadrian's niece Faustina, and Hadrian adopted him as his son and successor shortly before his death. Antoninus acquired the cognomen Pius after his accession to the throne, either because he compelled the Senate to deify his adoptive father, or because he had saved senators sentenced to death by Hadrian in his later years. His reign is notable for the peaceful state of the Empire, with no major revolts or military incursions during this time. A successful military campaign in southern Scotland early in his reign resulted in the construction of the Antonine Wall.Antoninus was an effective administrator, leaving his successors a large surplus in the treasury, expanding free access to drinking water throughout the Empire, encouraging legal conformity, and facilitating the enfranchisement of freed slaves. He died of illness in 161 and was succeeded by his adopted sons Marcus Aurelius and Lucius Verus as co-emperors."
Faustina senr.,None
Faustina junr.,None
Septimius Severus,"Lucius Septimius Severus (Latin: [sɛˈweːrʊs]; 11 April 145 – 4 February 211) was Roman emperor from 193 to 211. He was born in Leptis Magna (present day Al-Khums, Libya) in the Roman province of Africa. As a young man he advanced through the customary succession of offices under the reigns of Marcus Aurelius and Commodus. Severus seized power after the death of the emperor Pertinax in 193 during the Year of the Five Emperors.After deposing and killing the incumbent emperor Didius Julianus, Severus fought his rival claimants, the Roman generals Pescennius Niger and Clodius Albinus. Niger was defeated in 194 at the Battle of Issus in Cilicia. Later that year Severus waged a short punitive campaign beyond the eastern frontier, annexing the Kingdom of Osroene as a new province. Severus defeated Albinus three years later at the Battle of Lugdunum in Gaul.After consolidating his rule over the western provinces, Severus waged another brief, more successful war in the east against the Parthian Empire, sacking their capital Ctesiphon in 197 and expanding the eastern frontier to the Tigris. He then enlarged and fortified the Limes Arabicus in Arabia Petraea. In 202, he campaigned in Africa and Mauretania against the Garamantes, capturing their capital Garama and expanding the Limes Tripolitanus along the southern desert frontier of the empire. He proclaimed as augusti (co-emperors) his elder son Caracalla in 198 and his younger son Geta in 209, both born of his second wife Julia Domna.Severus travelled to Britain in 208, strengthening Hadrian's Wall and reoccupying the Antonine Wall. In AD 209 he invaded Caledonia (modern Scotland) with an army of 50,000 men but his ambitions were cut short when he fell fatally ill of an infectious disease in late 210. He died in early 211 at Eboracum (today York, England), and was succeeded by his sons, who were advised by their mother and his powerful wife Julia Domna, thus founding the Severan dynasty. It was the last dynasty of the Roman Empire before the Crisis of the Third Century."
Geta,"Geta (下駄) (pl. geta) are traditional Japanese footwear resembling flip-flops. A kind of sandal, geta have a flat wooden base elevated with up to three (though commonly two) ""teeth"", held on the foot with a fabric thong, which keeps the foot raised above the ground."
Blagabalus,None
Julia Soaemias,"Julia Soaemias Bassiana (180 – 11 March 222) was a Syrian noblewoman and the mother of Roman emperor Elagabalus, who ruled over the Roman Empire from 218 to 222. She was one of his chief advisors, initially with the support and accompaniment of her mother Julia Maesa. She and her mother guided the young emperor until growing unrest and a family division led to her son's replacement by her nephew Severus Alexander. Julia Soaemias was killed along with her son by the Praetorian Guard. Julia Soaemias was born and raised in Emesa, Syria and through her mother was related to the Royal family of Emesa, and through marriage, to the Severan dynasty of Ancient Rome."
Julia Maesa.,"Julia Maesa (7 May before 160 AD – c. 224 AD) was a member of the Severan dynasty of the Roman Empire who was the grandmother of emperors Elagabalus and Severus Alexander, elder sister of empress Julia Domna, and mother of Julia Soaemias and Julia Mamaea. She wielded influence during the reigns of her grandsons as Augusta of the Empire from 218 to her death, especially on their elevation to emperors.Born in Emesa, Syria (modern day Homs), to an Arab family of priests of the deity Elagabalus, Maesa and her sister Domna were the daughters of Julius Bassianus. Through her sister's marriage, Maesa became sister-in-law to Septimius Severus and aunt of Caracalla and Geta, who all became emperors. She married fellow Syrian Julius Avitus, who was of consular rank. She bore him two daughters, Soaemias and Mamaea, who became mothers of Elagabalus and Severus Alexander, respectively.As one of the Severan dynasty's prominent women, Maesa sought to return to power after her sister's suicide. She was closely involved in raising her grandson Elagabalus, and after his murder, another grandson, Severus Alexander, as emperors, which resulted in the restoration of the Severan dynasty to the Roman throne after the assassination of Caracalla and the usurpation of the throne by Macrinus. Sometime after Alexander's accession, she died in Rome. She was later deified in Syria along with her sister."
Severus Alexander,"Marcus Aurelius Severus Alexander (1 October 208 – 21/22 March 235) was a Roman emperor, who reigned from 222 until 235. He was the last emperor from the Severan dynasty. He succeeded his slain cousin Elagabalus in 222. Alexander himself was eventually assassinated, and his death marked the beginning of the events of the Third Century Crisis, which included nearly fifty years of civil war, foreign invasion, and the collapse of the monetary economy.Alexander was the heir to his cousin, the 18-year-old Emperor Elagabalus. The latter had been murdered along with his mother Julia Soaemias by his own guards, who, as a mark of contempt, had their remains cast into the Tiber river. Alexander and his cousin were both grandsons of Julia Maesa, the sister of empress Julia Domna, who had arranged for Elagabalus's acclamation as emperor by the Third Gallic Legion.Alexander's 13-year reign was the longest reign of a sole emperor since Antoninus Pius. He was also the second-youngest ever sole legal Roman emperor during the existence of the united empire, the youngest being Gordian III. Alexander's peacetime reign was prosperous. However, Rome was militarily confronted with the rising Sassanid Empire and growing incursions from the tribes of Germania. He managed to check the threat of the Sassanids. But when campaigning against Germanic tribes, Alexander attempted to bring peace by engaging in diplomacy and bribery. This alienated many in the Roman army, leading to a conspiracy that resulted in the assassination of Alexander, his mother Julia Avita Mamaea, and his advisors. After their deaths, the accession of Maximinus Thrax followed. Alexander's death marked the epoch event for the Crisis of the Third Century."
Julia Mamma,"Mamma Mia! (promoted as Benny Andersson & Björn Ulvaeus' Mamma Mia!) is a jukebox musical written by British playwright Catherine Johnson, based on the songs of ABBA composed by Benny Andersson and Björn Ulvaeus, members of the band. The title of the musical is taken from the group's 1975 chart-topper ""Mamma Mia"". Ulvaeus and Andersson, who composed the original music for ABBA, were involved in the development of the show from the beginning. Singer Anni-Frid Lyngstad was involved financially in the production and she was also present at many of the premieres around the world.The musical includes such hits as ""Super Trouper"", ""Lay All Your Love on Me"", ""Dancing Queen"", ""Knowing Me, Knowing You"", ""Take a Chance on Me"", ""Thank You for the Music"", ""Money, Money, Money"", ""The Winner Takes It All"", ""Voulez-Vous"", ""SOS"" and ""Mamma Mia"". Over 65 million people have seen the show, which has grossed $4 billion worldwide since its 1999 debut. A film adaptation starring Meryl Streep, Colin Firth, Pierce Brosnan, Amanda Seyfried, Christine Baranski, Stellan Skarsgård and Julie Walters was released in 2008.As of 2020, the show has productions in London's West End, where it is the sixth longest-running show in West End history, as well as various international productions. Its Broadway incarnation closed on September 12, 2015, after a 14-year run, making it the ninth longest-running show in Broadway history."
Gordianus III.,None
Valerianus I.,"Valerian (; Latin: Publius Licinius Valerianus; c. 199 – 260 or 264) was Roman emperor from 253 to spring 260 AD. He persecuted Christians and was later taken captive by the Persian emperor Shapur I after the Battle of Edessa, becoming the first Roman emperor to be captured as a prisoner of war, causing shock and instability throughout the Roman Empire.The unprecedented event and the unknown fate of the captured emperor generated a variety of different reactions and ""new narratives about the Roman Empire in diverse contexts""."
Gallienus,"Publius Licinius Egnatius Gallienus (; c. 218 – September 268) was Roman emperor with his father Valerian from 253 to 260 and alone from 260 to 268. He ruled during the Crisis of the Third Century that nearly caused the collapse of the empire. He won a number of military victories against usurpers and Germanic tribes, but was unable to prevent the secession of important provinces. His 15-year reign was the longest in half a century.Born into a wealthy and traditional senatorial family, Gallienus was the son of Valerian and Mariniana. Valerian became Emperor in September 253 and had the Roman senate elevate Gallienus to the ranks of Caesar and Augustus. Valerian divided the empire between him and his son, with Valerian ruling the east and his son the west. Gallienus defeated the usurper Ingenuus in 258 and destroyed an Alemanni army at Mediolanum in 259.The defeat and capture of Valerian at Edessa in 260 by the Sasanian Empire threw the Roman Empire into the chaos of civil war. Control of the whole empire passed to Gallienus. He defeated the eastern usurpers Macrianus Major and Lucius Mussius Aemilianus in 261–262 but failed to stop the formation of the breakaway Gallic Empire under general Postumus. Aureolus, another usurper, proclaimed himself emperor in Mediolanum in 268 but was defeated outside the city by Gallienus and besieged inside. While the siege was ongoing, Gallienus was assassinated, stabbed to death by the officer Cecropius, as part of a conspiracy."
Salonina,"Julia Cornelia Salonina (died 268, Mediolanum) was an Augusta of the Roman Empire, married to Roman Emperor Gallienus and mother of Valerian II, Saloninus, and Marinianus."
Claudius Gothicus,"Marcus Aurelius Claudius ""Gothicus"" (10 May 214 – January/April 270), also known as Claudius II, was Roman emperor from 268 to 270. During his reign he fought successfully against the Alemanni and decisively defeated the Goths at the Battle of Naissus. He died after succumbing to a ""pestilence"", possibly the Plague of Cyprian that had ravaged the provinces of the Empire."
Postumus,None
Victorinus I.,"Marcus Piavonius Victorinus was emperor in the Gallic provinces from 268 to 270 or 269 to 271, following the brief reign of Marius. He was murdered by a jealous husband whose wife he had tried to seduce."
Marius,None
Tetricus I.,"Gaius Pius Esuvius Tetricus was the emperor of the Gallic Empire from 271 to 274 AD. He was originally the praeses (governor) of Gallia Aquitania and became emperor after the murder of Emperor Victorinus in 271, with the support of Victorinus's mother, Victoria. During his reign, he faced external pressure from Germanic raiders, who pillaged the eastern and northern parts of his empire, and the Roman Empire, from which the Gallic Empire had seceded. He also faced increasing internal pressure, which led him to declare his son, Tetricus II, caesar in 273 and possibly co-emperor in 274, although this is debated. The Roman emperor Aurelian invaded in 273 or 274, leading to the Battle of Châlons, at which Tetricus surrendered. Whether this capitulation was the result of a secret agreement between Tetricus and Aurelian or necessary after his defeat is debated. Aurelian spared Tetricus, and even made him a senator and corrector (governor) of Lucania et Bruttium. Tetricus died of natural causes a few years after 274."
Tetricus II.,"Gaius Pius Esuvius Tetricus (also known as Tetricus II) was the son of Tetricus I, Emperor of the Gallic Empire (270/271-273/274).In 273, he was raised to the rank of Caesar, with the title of princeps iuventutis, and in January 274 he started his first consulship, together with his father. After the defeat and deposition of his father in the autumn of 274 by the Emperor Aurelian, he and his father appeared as prisoners in Aurelian's triumph, but the emperor spared their lives. According to some sources, Tetricus II also kept his senatorial rank."
Tacitus,"Titus Caesar Vespasianus ( TY-təs; 30 December 39 – 13 September 81 AD) was Roman emperor from 79 to 81. A member of the Flavian dynasty, Titus succeeded his father Vespasian upon his death.Before becoming emperor, Titus gained renown as a military commander, serving under his father in Judea during the First Jewish–Roman War. The campaign came to a brief halt with the death of emperor Nero in 68, launching Vespasian's bid for the imperial power during the Year of the Four Emperors. When Vespasian was declared Emperor on 1 July 69, Titus was left in charge of ending the Jewish rebellion. In 70, he besieged and captured Jerusalem, and destroyed the city and the Second Temple. For this achievement Titus was awarded a triumph; the Arch of Titus commemorates his victory to this day.During his father's rule, Titus gained notoriety in Rome serving as prefect of the Praetorian Guard, and for carrying on a controversial relationship with the Jewish queen Berenice. Despite concerns over his character, Titus ruled to great acclaim following the death of Vespasian in 79, and was considered a good emperor by Suetonius and other contemporary historians.As emperor, Titus is best known for completing the Colosseum and for his generosity in relieving the suffering caused by two disasters, the eruption of Mount Vesuvius in AD 79 and a fire in Rome in 80. After barely two years in office, Titus died of a fever on 13 September 81. He was deified by the Roman Senate and succeeded by his younger brother Domitian."
Probus,"Marcus Aurelius Probus (; 19 August 232 – September 282) was Roman emperor from 276 to 282. Probus was an active and successful general as well as a conscientious administrator, and in his reign of six years he secured prosperity for the inner provinces while withstanding repeated invasions of barbarian tribes on almost every sector of the frontier.After repelling the foreign enemies of the empire Probus was forced to handle several internal revolts, but demonstrated leniency and moderation to the vanquished wherever possible. In his reign the constitutional authority of the Roman Senate was fastidiously maintained, and the victorious Emperor, who had carried his army to victory over the Rhine, professed himself dependent on the sanction of the Senate.Upon defeating the Germans, Probus re-erected the ancient fortifications of emperor Hadrian between the Rhine and Danube rivers, protecting the Agri Decumates, and exacted from the vanquished a tribute of manpower to resettle depopulated provinces within the empire and provide for adequate defense of the frontiers. Despite his widespread popularity, Probus was killed in a mutiny of the soldiers while in the middle of preparations for the Persian war, which would be carried out under his successor Carus."
Diocletian,"Diocletian (; Latin: Gaius Aurelius Valerius Diocletianus; c. 242/245 – 311/312) was Roman emperor from 284 to 305. Born to a family of low status in Dalmatia, originally named Diocles, Diocletian rose through the ranks of the military to become a cavalry commander of the Emperor Carus's army. After the deaths of Carus and his son Numerian on campaign in Persia, Diocletian was proclaimed emperor by the troops. The title was also claimed by Carus's surviving son, Carinus, but Diocletian defeated him in the Battle of the Margus.Diocletian's reign stabilized the empire and ended the Crisis of the Third Century. He appointed fellow officer Maximian as Augustus, co-emperor, in 286. Diocletian reigned in the Eastern Empire, and Maximian reigned in the Western Empire. Diocletian delegated further on 1 March 293, appointing Galerius and Constantius as junior co-emperors (each with the title Caesar), under himself and Maximian respectively. Under the Tetrarchy, or ""rule of four"", each emperor would rule over a quarter-division of the empire. Diocletian secured the empire's borders and purged it of all threats to his power. He defeated the Sarmatians and Carpi during several campaigns between 285 and 299, the Alamanni in 288, and usurpers in Egypt between 297 and 298. Galerius, aided by Diocletian, campaigned successfully against Sassanid Persia, the empire's traditional enemy. In 299 he sacked their capital, Ctesiphon. Diocletian led the subsequent negotiations and achieved a lasting and favourable peace.Diocletian separated and enlarged the empire's civil and military services and reorganized the empire's provincial divisions, establishing the largest and most bureaucratic government in the history of the empire. He established new administrative centres in Nicomedia, Mediolanum, Sirmium, and Trevorum, closer to the empire's frontiers than the traditional capital at Rome. Building on third-century trends towards absolutism, he styled himself an autocrat, elevating himself above the empire's masses with imposing forms of court ceremonies and architecture. Bureaucratic and military growth, constant campaigning, and construction projects increased the state's expenditures and necessitated a comprehensive tax reform. From at least 297 on, imperial taxation was standardized, made more equitable, and levied at generally higher rates.Not all of Diocletian's plans were successful: the Edict on Maximum Prices (301), his attempt to curb inflation via price controls, was counterproductive and quickly ignored. Although effective while he ruled, Diocletian's tetrarchic system collapsed after his abdication under the competing dynastic claims of Maxentius and Constantine, sons of Maximian and Constantius respectively. The Diocletianic Persecution (303–312), the empire's last, largest, and bloodiest official persecution of Christianity, failed to eliminate Christianity in the empire. After 324, Christianity became the empire's preferred religion under Constantine. Despite these failures and challenges, Diocletian's reforms fundamentally changed the structure of Roman imperial government and helped stabilize the empire economically and militarily, enabling the empire to remain essentially intact for another 150 years despite being near the brink of collapse in Diocletian's youth. Weakened by illness, Diocletian left the imperial office on 1 May 305, becoming the first Roman emperor to abdicate the position voluntarily. He lived out his retirement in his palace on the Dalmatian coast, tending to his vegetable gardens. His palace eventually became the core of the modern-day city of Split in Croatia."
Carausius,"Marcus Aurelius Mausaeus Carausius (died 293) was a military commander of the Roman Empire in the 3rd century. He was a Menapian from Belgic Gaul, who usurped power in 286, during the Carausian Revolt, declaring himself emperor in Britain and northern Gaul (Imperium Britanniarum). He did this only 13 years after the Gallic Empire of the Batavian Postumus was ended in 273. He held power for seven years, fashioning the name ""Emperor of the North"" for himself, before being assassinated by his finance minister Allectus."
Allectus,Allectus (died 296) was a Roman-Britannic usurper-emperor in Britain and northern Gaul from 293 to 296.
