Jacobus Henricus van \u0027t Hoff,"Leonid (Russian: Леонид [lʲɪɐˈnʲit]; Ukrainian: Леонід [leoˈn⁽ʲ⁾id]; Belarusian: Леанід, romanized: Ljeaníd [lʲɛaˈnʲit]) is a Slavic version of the given name Leonidas. The French version is Leonide. People with the name include:Leonid Andreyev (1871–1919), Russian playwright and short-story writer who led the Expressionist movement in the national literatureLeonid Brezhnev (1906–1982), leader of the USSR from 1964 to 1982Leonid Buryak (b. 1953), USSR/Ukraine-born Olympic-medal-winning soccer player and coachLeonid Bykov (1928–1979), Soviet and Ukrainian actor, film director, and script writerLeonid Mikhailovich Volkov (род.1980), Russian opposition politician, IT specialist, Alexei  Navalny аssociateLeonid Desyatnikov (b. 1955), Soviet and Russian opera and film composerLeonid Feodorov (1879–1935), a bishop and Exarch for the Russian Catholic Church, and survivor of the GulagLeonid Filatov (1946–2003), Soviet and Russian actor, director, poet, and pamphleteerLeonid Gaidai, (1923–1993), Soviet comedy film directorLeonid Geishtor (b. 1936), USSR (Belarus)-born Olympic champion Canadian pairs sprint canoerLeonid Gobyato (1875–1915), Russian lieutenant-general and designer of the modern, man-portable mortarLeonid Hurwicz (1917–2008), Russian-born American economist and mathematician who shared the 2007 Nobel Prize in EconomicsLeonid Ivanov (disambiguation), several peopleLeonid Kadeniuk (b. 1951), first and only astronaut of independent Ukraine to fly into outer spaceLeonid Kharitonov (singer) (1933–2017), Soviet and Russian bass-baritone singerLeonid Khrushchev (1917–1943), missing aviatorLeonid Kogan (1924–1982), Soviet and Russian violinistLeonid Kantorovich (1912–1986) Soviet and Russian mathematician, economist, and only winner from the USSR of the Nobel Prize in EconomicsLeonid Kolumbet (b. 1937), Soviet and Ukrainian Olympic cyclistLeonid Kostandov (1915–1984), Soviet politicianLeonid Krasin (1870–1926), Soviet and Russian engineer and politicianLeonid Kravchuk (b. 1934), Ukrainian politician and first President of UkraineLeonid Kuchma (b. 1938), second President of UkraineLeonid Kuravlyov (b. 1936), Soviet and Russian actorLeonid Levin (b. 1948), Soviet-American computer scientistLeonid Fyodorovich Myasin, French transliteration: Léonide Massine (1896–1979), Russian choreographer and ballet dancerLeonid Mezheritski (1930–2007), Soviet and Israeli still-life, portrait and landscape painterLeonid Moseyev (b. 1952), Soviet and Russian long-distance runnerLeonid Pasternak (1862–1945), Russian Impressionist painterLeonid Reiman (or Reyman) (b. 1957), Russian businessman and government official, currently Minister of Communications and Information Technologies of the Russian FederationLeonid Rozhetskin, (1966–20??), Russian-American financier and lawyer who disappeared in 2008; remains found in 2013Leonid Sagayduk (1929–1998), Soviet swimmerLeonid Sobinov (1872–1934), Russian opera singerLeonid Stadnyk (1970–2014), Ukrainian man named ""world's tallest living man"" by Guinness World Records 2008Leonid Stein (b. 1934), Soviet Grandmaster chess player from Ukraine among the top ten players in the 1960sLeonid Taranenko (b. 1956), 1980 Olympic weightlifting champion for the Soviet UnionLeonid Teyf, Russian-Israeli businessmanLeonid Toptunov (1960–1986), reactor control engineer killed in the Chernobyl disasterLeonid Utyosov (Leyzer (Lazar) Vaysbeyn, or Weissbein) (1895–1982), Soviet and Russian jazz singer and comic actorLeonid Alexandrovich Voskresenskiy (1913–1965), Soviet rocket engineer and launch director for SputnikLeonid Yakubovich (b. 1945), Russian television hostLeonid Zhabotinsky (1938–2016), Soviet weightlifter and Olympic gold medalistFictional characters include:Leonid, the protagonist in Alexander Bogdanov’s 1908 Russian science fiction novel Red StarLeonid, the protagonist in the Labyrinth trilogy of cyberpunk novels written in the late 1990s by Russian science fiction writer Sergei Lukyanenko (Labyrinth of Reflections, False Mirrors, and Transparent Stained-Glass Windows).Leonid Gorbovsky, in Arkady and Boris Strugatsky's series of science fiction novels set in the Noon UniverseLeonid Kovar, Russian superhero also known as Red StarLeonid McGill, Manhattan private detective in fiction written by Walter MosleyLeonid Pavel, Russian nuclear scientist in The Dark Knight Rises"
Hermann Emil Fischer,"Hermann Emil Louis Fischer FRS FRSE FCS (German pronunciation: [ˈeːmiːl ˈfɪʃɐ] (listen); 9 October 1852 – 15 July 1919) was a German chemist and 1902 recipient of the Nobel Prize in Chemistry. He discovered the Fischer esterification. He also developed the Fischer projection, a symbolic way of drawing asymmetric carbon atoms. He also hypothesized lock and key mechanism of enzyme action. He never used his first given name, and was known throughout his life simply as Emil Fischer."
Svante August Arrhenius,"Svante August Arrhenius ( ə-REE-nee-əs, -⁠RAY-, Swedish: [ˈsvânːtɛ aˈrěːnɪɵs]; 19 February 1859 – 2 October 1927) was a Swedish scientist. Originally a physicist, but often referred to as a chemist, Arrhenius was one of the founders of the science of physical chemistry. He received the Nobel Prize for Chemistry in 1903, becoming the first Swedish Nobel laureate. In 1905, he became director of the Nobel Institute, where he remained until his death.Arrhenius was the first to use principles of physical chemistry to estimate the extent to which increases in atmospheric carbon dioxide are responsible for the Earth's increasing surface temperature. In the 1960s, Charles David Keeling demonstrated that the quantity of human-caused carbon dioxide emissions into the air is enough to cause global warming.The Arrhenius equation, Arrhenius acid, Arrhenius base, lunar crater Arrhenius, Martian crater Arrhenius, the mountain of Arrheniusfjellet, and the Arrhenius Labs at Stockholm University were so named to commemorate his contributions to science."
Sir William Ramsay,None
Johann Friedrich Wilhelm Adolf von Baeyer,None
Henri Moissan,Ferdinand Frédéric Henri Moissan (28 September 1852 – 20 February 1907) was a French chemist and pharmacist who won the 1906 Nobel Prize in Chemistry for his work in isolating fluorine from its compounds. Moissan was one of the original members of the International Atomic Weights Committee.
Eduard Buchner,"Eduard Buchner (German pronunciation: [ˈeːduaʁt ˈbuːxnɐ] (listen); 20 May 1860 – 13 August 1917) was a German chemist and zymologist, awarded the 1907 Nobel Prize in Chemistry for his work on fermentation."
Ernest Rutherford,"Ernest Rutherford, 1st Baron Rutherford of Nelson,  (30 August 1871 – 19 October 1937) was a New Zealand physicist who came to be known as the father of nuclear physics. Encyclopædia Britannica considers him to be the greatest experimentalist since Michael Faraday (1791–1867). Apart from his work in his homeland, he spent a substantial amount of his career abroad, in both Canada and the United Kingdom.In early work, Rutherford discovered the concept of radioactive half-life, the radioactive element radon, and differentiated and named alpha and beta radiation. This work was performed at McGill University in Montreal, Quebec, Canada. It is the basis for the Nobel Prize in Chemistry he was awarded in 1908 ""for his investigations into the disintegration of the elements, and the chemistry of radioactive substances"", for which he was the first Oceanian Nobel laureate, and the first to perform the awarded work in Canada. In 1904, he was elected as a member to the American Philosophical Society.Rutherford moved in 1907 to the Victoria University of Manchester (today University of Manchester) in the UK, where he and Thomas Royds proved that alpha radiation is helium nuclei.  Rutherford performed his most famous work after he became a Nobel laureate. In 1911, although he could not prove that it was positive or negative, he theorized that atoms have their charge concentrated in a very small nucleus, and thereby pioneered the Rutherford model of the atom, through his discovery and interpretation of Rutherford scattering by the gold foil experiment of Hans Geiger and Ernest Marsden. He performed the first artificially induced nuclear reaction in 1917 in experiments where nitrogen nuclei were bombarded with alpha particles. As a result, he discovered the emission of a subatomic particle which, in 1919, he called the ""hydrogen atom"" but, in 1920, he more accurately named the proton.Rutherford became Director of the Cavendish Laboratory at the University of Cambridge in 1919. Under his leadership the neutron was discovered by James Chadwick in 1932 and in the same year the first experiment to split the nucleus in a fully controlled manner was performed by students working under his direction, John Cockcroft and Ernest Walton. After his death in 1937, he was buried in Westminster Abbey near Sir Isaac Newton. The chemical element rutherfordium (element 104) was named after him in 1997."
Wilhelm Ostwald,None
Otto Wallach,Otto Wallach (German pronunciation: [ˈɔto ˈvalax] (listen); 27 March 1847 – 26 February 1931) was a German chemist and recipient of the 1910 Nobel Prize in Chemistry for his work on alicyclic compounds.
"Marie Curie, n?e Sklodowska",None
Victor Grignard,"Francois Auguste Victor Grignard (6 May 1871 – 13 December 1935) was a French chemist who won the Nobel Prize for his discovery of the eponymously named Grignard reagent and Grignard reaction, both of which are important in the formation of carbon–carbon bonds."
France,"France (French: [fʁɑ̃s] ), officially the French Republic (French: République française), is a transcontinental country spanning Western Europe and overseas regions and territories in the Americas and the Atlantic, Pacific and Indian Oceans. Its metropolitan area extends from the Rhine to the Atlantic Ocean and from the Mediterranean Sea to the English Channel and the North Sea; overseas territories include French Guiana in South America, Saint Pierre and Miquelon in the North Atlantic, the French West Indies, and many islands in Oceania and the Indian Ocean. Due to its several coastal territories, France has the largest exclusive economic zone in the world. France borders Belgium, Luxembourg, Germany, Switzerland, Monaco, Italy, Andorra and Spain in Europe, as well as the Netherlands, Suriname and Brazil in the Americas. Its eighteen integral regions (five of which are overseas) span a combined area of 643,801 km2 (248,573 sq mi) and over 67 million people (as of May 2021). France is a unitary semi-presidential republic with its capital in Paris, the country's largest city and main cultural and commercial centre; other major urban areas include Marseille, Lyon, Toulouse, Lille, Bordeaux, and Nice.Inhabited since the Palaeolithic era, the territory of Metropolitan France was settled by Celtic tribes known as Gauls during the Iron Age. Rome annexed the area in 51 BC, leading to a distinct Gallo-Roman culture that laid the foundation of the French language. The Germanic Franks  formed the Kingdom of Francia, which became the heartland of the Carolingian Empire. The Treaty of Verdun of 843 partitioned the empire, with West Francia becoming the Kingdom of France in 987. In the High Middle Ages, France was a powerful but highly decentralised feudal kingdom. Philip II successfully strengthened royal power and defeated his rivals to double the size of the crown lands; by the end of his reign, France had emerged as the most powerful state in Europe. From the mid-14th to the mid-15th century, France was plunged into a series of dynastic conflicts involving England, collectively known as the Hundred Years' War, and a distinct French identity emerged as a result. The French Renaissance saw art and culture flourish, conflict with the House of Habsburg, and the establishment of a global colonial empire, which by the 20th century would become the second-largest in the world. The second half of the 16th century was dominated by religious civil wars between Catholics and Huguenots that severely weakened the country. France again emerged as Europe's dominant power in the 17th century under Louis XIV following the Thirty Years' War. Inadequate economic policies, inequitable taxes and frequent wars (notably a defeat in the Seven Years' War and costly involvement in the American War of Independence), left the kingdom in a precarious economic situation by the end of the 18th century. This precipitated the French Revolution of 1789, which overthrew the Ancien Régime and produced the Declaration of the Rights of Man, which expresses the nation's ideals to this day.France reached its political and military zenith in the early 19th century under Napoleon Bonaparte, subjugating much of continental Europe and establishing the First French Empire. The French Revolutionary and Napoleonic Wars shaped the course of European and world history. The collapse of the empire initiated a period of relative decline, in which France endured a tumultuous succession of governments until the founding of the French Third Republic during the Franco-Prussian War in 1870. Subsequent decades saw a period of optimism, cultural and scientific flourishing, as well as economic prosperity known as the Belle Époque. France was one of the major participants of World War I, from which it emerged victorious at great human and economic cost. It was among the Allied powers of World War II, but was soon occupied by the Axis in 1940. Following liberation in 1944, the short-lived Fourth Republic was established and later dissolved in the course of the Algerian War. The current Fifth Republic was formed in 1958 by Charles de Gaulle. Algeria and most French colonies became independent in the 1960s, with the majority retaining close economic and military ties with France.France retains its centuries-long status as a global centre of art, science and philosophy. It hosts the fifth-largest number of UNESCO World Heritage Sites and is the world's leading tourist destination, receiving over 89 million foreign visitors in 2018. France is a developed country with the world's seventh-largest economy by nominal GDP and ninth-largest by PPP; in terms of aggregate household wealth, it ranks fourth in the world. France performs well in international rankings of education, health care, life expectancy and human development. It remains a great power in global affairs, being one of the five permanent members of the United Nations Security Council and an official nuclear-weapon state. France is a founding and leading member of the European Union and the Eurozone, as well as a key member of the Group of Seven, North Atlantic Treaty Organization (NATO), Organisation for Economic Co-operation and Development (OECD) and La Francophonie."
Alfred Werner,"Alfred Werner (12 December 1866 – 15 November 1919) was a Swiss chemist who was a student at ETH Zurich and a professor at the University of Zurich. He won the Nobel Prize in Chemistry in 1913 for proposing the octahedral configuration of transition metal complexes. Werner developed the basis for modern coordination chemistry. He was the first inorganic chemist to win the Nobel prize, and the only one prior to 1973."
Theodore William Richards,"Theodore William Richards (January 31, 1868 – April 2, 1928) was the first American scientist to receive the Nobel Prize in Chemistry, earning the award ""in recognition of his exact determinations of the atomic weights of a large number of the chemical elements."""
Richard Martin Willst?tter,None
,None
,None
Fritz Haber,"Fritz Haber (German pronunciation: [ˈfʁɪt͡s ˈhaːbɐ] (listen); 9 December 1868 – 29 January 1934) was a German chemist who received the Nobel Prize in Chemistry in 1918 for his invention of the Haber–Bosch process, a method used in industry to synthesize ammonia from nitrogen gas and hydrogen gas. This invention is of importance for the large-scale synthesis of fertilizers and explosives. It is estimated that two thirds of annual global food production uses nitrogen from the Haber–Bosch process, and that this supports nearly half the world population. Haber, along with Max Born, proposed the Born–Haber cycle as a method for evaluating the lattice energy of an ionic solid. Haber is also considered the ""father of chemical warfare"" for his years of pioneering work developing and weaponizing chlorine and other poisonous gases during World War I, especially his actions during the Second Battle of Ypres."
,None
Walther Hermann Nernst,"Walther Hermann Nernst  (German pronunciation: [ˈvaltɐ ˈnɛʁnst] (listen); 25 June 1864 – 18 November 1941) was a German chemist known for his work in thermodynamics, physical chemistry, electrochemistry, and solid state physics. His formulation of the Nernst heat theorem helped pave the way for the third law of thermodynamics, for which he won the 1920 Nobel Prize in Chemistry. He is also known for developing the Nernst equation in 1887."
Frederick Soddy,"Frederick Soddy FRS (2 September 1877 – 22 September 1956) was an English radiochemist who explained, with Ernest Rutherford, that radioactivity is due to the transmutation of elements, now known to involve nuclear reactions. He also proved the existence of isotopes of certain radioactive elements. He was a polymath who mastered chemistry, nuclear physics, statistical mechanics, finance and economics."
Francis William Aston,"Francis William Aston FRS (1 September 1877 – 20 November 1945) was a British chemist and physicist who won the 1922 Nobel Prize in Chemistry for his discovery, by means of his mass spectrograph, of isotopes in many non-radioactive elements and for his enunciation of the whole number rule. He was a fellow of the Royal Society and Fellow of Trinity College, Cambridge."
Fritz Pregl,"Fritz Pregl (Slovene: Friderik Pregl; 3 September 1869 – 13 December 1930), was a Slovenian-Austrian chemist and physician from a mixed Slovene-German-speaking background. He won the Nobel Prize in Chemistry in 1923 for making important contributions to quantitative organic microanalysis, one of which was the improvement of the combustion train technique for elemental analysis."
,None
Richard Adolf Zsigmondy,"Richard Adolf Zsigmondy (Hungarian: Zsigmondy Richárd Adolf; 1 April 1865 – 23 September 1929) was an ethnic Hungarian chemist from Austria. He was known for his research in colloids, for which he was awarded the Nobel Prize in chemistry in 1925. The crater Zsigmondy on the Moon is named in his honour."
The (Theodor) Svedberg,"Theodor Svedberg (30 August 1884 – 25 February 1971) was a Swedish chemist and Nobel laureate for his research on colloids and proteins using the ultracentrifuge. Svedberg was active at Uppsala University from the mid 1900s to late 1940s. While at Uppsala, Svedberg started as a docent before becoming the university's physical chemistry head in 1912. After leaving Uppsala in 1949, Svedberg was in charge of the Gustaf Werner Institute until 1967. Apart from his 1926 Nobel Prize, Svedberg was named a Foreign Member of the Royal Society in 1944 and became part of the National Academy of Sciences in 1945."
Heinrich Otto Wieland,Heinrich Otto Wieland (German pronunciation: [ˈhaɪ̯nʁɪç ˈviːlant] (listen); 4 June 1877 – 5 August 1957) was a German chemist. He won the 1927 Nobel Prize in Chemistry for his research into the bile acids.
Adolf Otto Reinhold Windaus,Adolf Otto Reinhold Windaus (German pronunciation: [ˈaːdɔlf ˈvɪndaʊ̯s] (listen); 25 December 1876 – 9 June 1959) was a German chemist who won a Nobel Prize in Chemistry in 1928 for his work on sterols and their relation to vitamins. He was the doctoral advisor of Adolf Butenandt who also won a Nobel Prize in Chemistry in 1939.
Arthur Harden,"Sir Arthur Harden, FRS (12 October 1865 – 17 June 1940) was a British biochemist. He shared the Nobel Prize in Chemistry in 1929 with Hans Karl August Simon von Euler-Chelpin for their investigations into the fermentation of sugar and fermentative enzymes. He was a founding member of the Biochemical Society and editor of its journal for 25 years."
Germany,"Germany (German: Deutschland, pronounced [ˈdɔʏtʃlant] (listen)), officially the Federal Republic of Germany, is a country in Central Europe. It is the second most populous country in Europe after Russia, and the most populous member state of the European Union. Germany is situated between the Baltic and North seas to the north, and the Alps to the south; it covers an area of 357,022 square kilometres (137,847 sq mi), with a population of over 83 million within its 16 constituent states. Germany borders Denmark to the north, Poland and the Czech Republic to the east, Austria and Switzerland to the south, and France, Luxembourg, Belgium, and the Netherlands to the west. The nation's capital and largest city is Berlin, and its financial centre is Frankfurt; the largest urban area is the Ruhr.Various Germanic tribes have inhabited the northern parts of modern Germany since classical antiquity. A region named Germania was documented before AD 100. In the 10th century, German territories formed a central part of the Holy Roman Empire. During the 16th century, northern German regions became the centre of the Protestant Reformation. Following the Napoleonic Wars and the dissolution of the Holy Roman Empire in 1806, the German Confederation was formed in 1815. In 1871, Germany became a nation-state when most of the German states unified into the Prussian-dominated German Empire. After World War I and the German Revolution of 1918–1919, the Empire was replaced by the semi-presidential Weimar Republic.The Nazi seizure of power in 1933 led to the establishment of a dictatorship, World War II, and the Holocaust. After the end of World War II in Europe and a period of Allied occupation, Germany was divided into the Federal Republic of Germany, generally known as West Germany, and the German Democratic Republic, East Germany. The Federal Republic of Germany was a founding member of the European Economic Community and the European Union, while the German Democratic Republic was a communist Eastern Bloc state and member of the Warsaw Pact. After the fall of communism, German reunification saw the former East German states join the Federal Republic of Germany on 3 October 1990—becoming a federal parliamentary republic.Germany is a great power with a strong economy; it has the largest economy in Europe, the world's fourth-largest economy by nominal GDP, and the fifth-largest by PPP. As a global leader in several industrial, scientific and technological sectors, it is both the world's third-largest exporter and importer of goods. As a developed country, which ranks very high on the Human Development Index, it offers social security and a universal health care system, environmental protections, and a tuition-free university education. Germany is a member of the United Nations, NATO, the G7, the G20, and the OECD. It has the third-greatest number of UNESCO World Heritage Sites."
Hans Fischer,"Hans Fischer (German pronunciation: [ˈhans ˈfɪʃɐ] (listen); 27 July 1881 – 31 March 1945) was a German organic chemist and the recipient of the 1930 Nobel Prize for Chemistry ""for his researches into the constitution of haemin and chlorophyll and especially for his synthesis of haemin."""
Carl Bosch,"Carl Bosch (German pronunciation: [kaʁl ˈbɔʃ] (listen); 27 August 1874 – 26 April 1940) was a German chemist and engineer and Nobel Laureate in Chemistry. He was a pioneer in the field of high-pressure industrial chemistry and founder of IG Farben, at one point the world's largest chemical company."
