Gil Junger,NoneGeorge Lucas,"George Walton Lucas Jr. (born May 14, 1944) is an American film director, producer, screenwriter, and entrepreneur. Lucas is best known for creating the Star Wars and Indiana Jones franchises and founding Lucasfilm, Lucasfilm Games, and Industrial Light & Magic. He served as chairman of Lucasfilm before selling it to The Walt Disney Company in 2012. Lucas is one of history's most financially successful filmmakers and has been nominated for four Academy Awards. His films are among the 100 highest-grossing movies at the North American box office, adjusted for ticket-price inflation. Lucas is considered one of the most significant figures of the 20th-century New Hollywood movement, and a pioneer of the modern blockbuster.After graduating from the University of Southern California in 1967, Lucas co-founded American Zoetrope with filmmaker Francis Ford Coppola. Lucas wrote and directed THX 1138 (1971), based on his student short Electronic Labyrinth: THX 1138 4EB, which was a critical success but a financial failure. His next work as a writer-director was the film American Graffiti (1973), inspired by his youth in the early 1960s Modesto, California, and produced through the newly founded Lucasfilm. The film was critically and commercially successful and received five Academy Award nominations, including Best Director and Best Picture.Lucas's next film, the epic space opera Star Wars (1977), had a troubled production but was a surprise hit, becoming the highest-grossing film at the time, winning six Academy Awards and sparking a cultural phenomenon. Lucas produced and co-wrote the sequels The Empire Strikes Back (1980) and Return of the Jedi (1983). With director Steven Spielberg, he created, produced, and co-wrote the Indiana Jones films Raiders of the Lost Ark (1981), The Temple of Doom (1984), The Last Crusade (1989) and The Kingdom of the Crystal Skull (2008). Lucas is also known for his collaboration with composer John Williams, who was recommended to him by Spielberg, and with whom he has worked for all the films in both of these franchises. He also produced and wrote a variety of films and television series through Lucasfilm between the 1970s and the 2010s.In 1997, Lucas re-released the Star Wars Trilogy as part of a special edition featuring several alterations; home media versions with further changes were released in 2004 and 2011. He returned to directing with a Star Wars prequel trilogy comprising Star Wars: Episode I – The Phantom Menace (1999), Star Wars: Episode II – Attack of the Clones (2002) and Star Wars: Episode III – Revenge of the Sith (2005). He last collaborated on the CGI-animated television series Star Wars: The Clone Wars (2008–2014, 2020), the war film Red Tails (2012), and the CGI film Strange Magic (2015)."
George Lucas,"George Walton Lucas Jr. (born May 14, 1944) is an American film director, producer, screenwriter, and entrepreneur. Lucas is best known for creating the Star Wars and Indiana Jones franchises and founding Lucasfilm, Lucasfilm Games, and Industrial Light & Magic. He served as chairman of Lucasfilm before selling it to The Walt Disney Company in 2012. Lucas is one of history's most financially successful filmmakers and has been nominated for four Academy Awards. His films are among the 100 highest-grossing movies at the North American box office, adjusted for ticket-price inflation. Lucas is considered one of the most significant figures of the 20th-century New Hollywood movement, and a pioneer of the modern blockbuster.After graduating from the University of Southern California in 1967, Lucas co-founded American Zoetrope with filmmaker Francis Ford Coppola. Lucas wrote and directed THX 1138 (1971), based on his student short Electronic Labyrinth: THX 1138 4EB, which was a critical success but a financial failure. His next work as a writer-director was the film American Graffiti (1973), inspired by his youth in the early 1960s Modesto, California, and produced through the newly founded Lucasfilm. The film was critically and commercially successful and received five Academy Award nominations, including Best Director and Best Picture.Lucas's next film, the epic space opera Star Wars (1977), had a troubled production but was a surprise hit, becoming the highest-grossing film at the time, winning six Academy Awards and sparking a cultural phenomenon. Lucas produced and co-wrote the sequels The Empire Strikes Back (1980) and Return of the Jedi (1983). With director Steven Spielberg, he created, produced, and co-wrote the Indiana Jones films Raiders of the Lost Ark (1981), The Temple of Doom (1984), The Last Crusade (1989) and The Kingdom of the Crystal Skull (2008). Lucas is also known for his collaboration with composer John Williams, who was recommended to him by Spielberg, and with whom he has worked for all the films in both of these franchises. He also produced and wrote a variety of films and television series through Lucasfilm between the 1970s and the 2010s.In 1997, Lucas re-released the Star Wars Trilogy as part of a special edition featuring several alterations; home media versions with further changes were released in 2004 and 2011. He returned to directing with a Star Wars prequel trilogy comprising Star Wars: Episode I – The Phantom Menace (1999), Star Wars: Episode II – Attack of the Clones (2002) and Star Wars: Episode III – Revenge of the Sith (2005). He last collaborated on the CGI-animated television series Star Wars: The Clone Wars (2008–2014, 2020), the war film Red Tails (2012), and the CGI film Strange Magic (2015)."
George Lucas,"George Walton Lucas Jr. (born May 14, 1944) is an American film director, producer, screenwriter, and entrepreneur. Lucas is best known for creating the Star Wars and Indiana Jones franchises and founding Lucasfilm, Lucasfilm Games, and Industrial Light & Magic. He served as chairman of Lucasfilm before selling it to The Walt Disney Company in 2012. Lucas is one of history's most financially successful filmmakers and has been nominated for four Academy Awards. His films are among the 100 highest-grossing movies at the North American box office, adjusted for ticket-price inflation. Lucas is considered one of the most significant figures of the 20th-century New Hollywood movement, and a pioneer of the modern blockbuster.After graduating from the University of Southern California in 1967, Lucas co-founded American Zoetrope with filmmaker Francis Ford Coppola. Lucas wrote and directed THX 1138 (1971), based on his student short Electronic Labyrinth: THX 1138 4EB, which was a critical success but a financial failure. His next work as a writer-director was the film American Graffiti (1973), inspired by his youth in the early 1960s Modesto, California, and produced through the newly founded Lucasfilm. The film was critically and commercially successful and received five Academy Award nominations, including Best Director and Best Picture.Lucas's next film, the epic space opera Star Wars (1977), had a troubled production but was a surprise hit, becoming the highest-grossing film at the time, winning six Academy Awards and sparking a cultural phenomenon. Lucas produced and co-wrote the sequels The Empire Strikes Back (1980) and Return of the Jedi (1983). With director Steven Spielberg, he created, produced, and co-wrote the Indiana Jones films Raiders of the Lost Ark (1981), The Temple of Doom (1984), The Last Crusade (1989) and The Kingdom of the Crystal Skull (2008). Lucas is also known for his collaboration with composer John Williams, who was recommended to him by Spielberg, and with whom he has worked for all the films in both of these franchises. He also produced and wrote a variety of films and television series through Lucasfilm between the 1970s and the 2010s.In 1997, Lucas re-released the Star Wars Trilogy as part of a special edition featuring several alterations; home media versions with further changes were released in 2004 and 2011. He returned to directing with a Star Wars prequel trilogy comprising Star Wars: Episode I – The Phantom Menace (1999), Star Wars: Episode II – Attack of the Clones (2002) and Star Wars: Episode III – Revenge of the Sith (2005). He last collaborated on the CGI-animated television series Star Wars: The Clone Wars (2008–2014, 2020), the war film Red Tails (2012), and the CGI film Strange Magic (2015)."
George Lucas,"George Walton Lucas Jr. (born May 14, 1944) is an American film director, producer, screenwriter, and entrepreneur. Lucas is best known for creating the Star Wars and Indiana Jones franchises and founding Lucasfilm, Lucasfilm Games, and Industrial Light & Magic. He served as chairman of Lucasfilm before selling it to The Walt Disney Company in 2012. Lucas is one of history's most financially successful filmmakers and has been nominated for four Academy Awards. His films are among the 100 highest-grossing movies at the North American box office, adjusted for ticket-price inflation. Lucas is considered one of the most significant figures of the 20th-century New Hollywood movement, and a pioneer of the modern blockbuster.After graduating from the University of Southern California in 1967, Lucas co-founded American Zoetrope with filmmaker Francis Ford Coppola. Lucas wrote and directed THX 1138 (1971), based on his student short Electronic Labyrinth: THX 1138 4EB, which was a critical success but a financial failure. His next work as a writer-director was the film American Graffiti (1973), inspired by his youth in the early 1960s Modesto, California, and produced through the newly founded Lucasfilm. The film was critically and commercially successful and received five Academy Award nominations, including Best Director and Best Picture.Lucas's next film, the epic space opera Star Wars (1977), had a troubled production but was a surprise hit, becoming the highest-grossing film at the time, winning six Academy Awards and sparking a cultural phenomenon. Lucas produced and co-wrote the sequels The Empire Strikes Back (1980) and Return of the Jedi (1983). With director Steven Spielberg, he created, produced, and co-wrote the Indiana Jones films Raiders of the Lost Ark (1981), The Temple of Doom (1984), The Last Crusade (1989) and The Kingdom of the Crystal Skull (2008). Lucas is also known for his collaboration with composer John Williams, who was recommended to him by Spielberg, and with whom he has worked for all the films in both of these franchises. He also produced and wrote a variety of films and television series through Lucasfilm between the 1970s and the 2010s.In 1997, Lucas re-released the Star Wars Trilogy as part of a special edition featuring several alterations; home media versions with further changes were released in 2004 and 2011. He returned to directing with a Star Wars prequel trilogy comprising Star Wars: Episode I – The Phantom Menace (1999), Star Wars: Episode II – Attack of the Clones (2002) and Star Wars: Episode III – Revenge of the Sith (2005). He last collaborated on the CGI-animated television series Star Wars: The Clone Wars (2008–2014, 2020), the war film Red Tails (2012), and the CGI film Strange Magic (2015)."
Irvin Kershner,"Irvin Kershner (born Isadore Kershner; April 29, 1923 – November 27, 2010) was an American director, actor, and producer of film and television.He gained notice early in his career as a filmmaker for directing quirky, independent drama films, while working as an influential lecturer at the University of Southern California. Later in his career, he transitioned to high-budget blockbusters such as The Empire Strikes Back, the James Bond adaptation Never Say Never Again, and RoboCop 2. Through the course of his career, he received numerous accolades, and was nominated for both a Primetime Emmy Award and a Palme d'Or."
Richard Marquand,"Richard Alfred Marquand (22 September 1937 – 4 September 1987) was a Welsh film and television director active in both US and UK film productions, best known for directing 1983's Star Wars Episode VI: Return of the Jedi. He also directed the critically acclaimed 1981 drama film Eye of the Needle, the quiet Paris set romance Until September, and the hit 1985 thriller Jagged Edge."
George Lucas,"George Walton Lucas Jr. (born May 14, 1944) is an American film director, producer, screenwriter, and entrepreneur. Lucas is best known for creating the Star Wars and Indiana Jones franchises and founding Lucasfilm, Lucasfilm Games, and Industrial Light & Magic. He served as chairman of Lucasfilm before selling it to The Walt Disney Company in 2012. Lucas is one of history's most financially successful filmmakers and has been nominated for four Academy Awards. His films are among the 100 highest-grossing movies at the North American box office, adjusted for ticket-price inflation. Lucas is considered one of the most significant figures of the 20th-century New Hollywood movement, and a pioneer of the modern blockbuster.After graduating from the University of Southern California in 1967, Lucas co-founded American Zoetrope with filmmaker Francis Ford Coppola. Lucas wrote and directed THX 1138 (1971), based on his student short Electronic Labyrinth: THX 1138 4EB, which was a critical success but a financial failure. His next work as a writer-director was the film American Graffiti (1973), inspired by his youth in the early 1960s Modesto, California, and produced through the newly founded Lucasfilm. The film was critically and commercially successful and received five Academy Award nominations, including Best Director and Best Picture.Lucas's next film, the epic space opera Star Wars (1977), had a troubled production but was a surprise hit, becoming the highest-grossing film at the time, winning six Academy Awards and sparking a cultural phenomenon. Lucas produced and co-wrote the sequels The Empire Strikes Back (1980) and Return of the Jedi (1983). With director Steven Spielberg, he created, produced, and co-wrote the Indiana Jones films Raiders of the Lost Ark (1981), The Temple of Doom (1984), The Last Crusade (1989) and The Kingdom of the Crystal Skull (2008). Lucas is also known for his collaboration with composer John Williams, who was recommended to him by Spielberg, and with whom he has worked for all the films in both of these franchises. He also produced and wrote a variety of films and television series through Lucasfilm between the 1970s and the 2010s.In 1997, Lucas re-released the Star Wars Trilogy as part of a special edition featuring several alterations; home media versions with further changes were released in 2004 and 2011. He returned to directing with a Star Wars prequel trilogy comprising Star Wars: Episode I – The Phantom Menace (1999), Star Wars: Episode II – Attack of the Clones (2002) and Star Wars: Episode III – Revenge of the Sith (2005). He last collaborated on the CGI-animated television series Star Wars: The Clone Wars (2008–2014, 2020), the war film Red Tails (2012), and the CGI film Strange Magic (2015)."
David Koepp,"David Koepp (; born June 9, 1963) is an American screenwriter and film director. Koepp is the ninth most successful screenwriter of all time in terms of U.S. box office receipts with a total gross of over $2.3 billion.Koepp has achieved both critical and commercial success in a wide variety of genres: thriller, science fiction, comedy, action, drama, crime, superhero, horror, adventure, and fantasy.Some of the best known films he has written include the sci-fi adventure films Jurassic Park (1993), The Lost World: Jurassic Park (1997), and Indiana Jones and the Kingdom of the Crystal Skull (2008); the crime film Carlito's Way (1993); the action spy films Mission: Impossible (1996) and Jack Ryan: Shadow Recruit (2014); the superhero film Spider-Man (2002); the sci-fi disaster film War of the Worlds (2005) and the mystery thriller Angels & Demons (2009). Koepp has directed seven feature films over the course of his career: The Trigger Effect (1996), Stir of Echoes (1999), Secret Window (2004), Ghost Town (2008), Premium Rush (2012), Mortdecai (2015), and You Should Have Left (2020)."
Marc Forster,None
Morgan Spurlock,"Morgan Valentine Spurlock (born November 7, 1970) is an American documentary filmmaker, humorist, television producer, screenwriter and playwright.Spurlock's films include Super Size Me (2004), Where in the World Is Osama bin Laden? (2008), POM Wonderful Presents: The Greatest Movie Ever Sold (2011), Comic-Con Episode IV: A Fan's Hope (2011), One Direction: This Is Us (2013) and Super Size Me 2 (2017). He was the executive producer and star of the reality television series 30 Days (2005–2008). In June 2013, Spurlock became host and producer of the CNN show Morgan Spurlock Inside Man (2013–2016). He is also the co-founder of short-film content marketing company Cinelan, which produced the Focus Forward campaign for GE."
Jay Chandrasekhar,"Jayanth Jambulingam Chandrasekhar (born April 9, 1968) is an American comedian, film director, screenwriter, and actor. He is best known for his work with the sketch comedy group Broken Lizard and for directing and starring in the Broken Lizard films Super Troopers, Club Dread, Beerfest and Super Troopers 2. Since 2001, he has also worked frequently as a television director, directing many episodes of Community and The Goldbergs, among dozens of other comedy series. He has also occasionally worked as a film director outside of Broken Lizard projects, most notably on the 2005 film The Dukes of Hazzard."
Dominic Sena,None
Anthony Minghella,"Anthony Minghella,  (6 January 1954 – 18 March 2008) was a British film director, playwright and screenwriter. He was chairman of the board of Governors at the British Film Institute between 2003 and 2007.He won the Academy Award for Best Director for The English Patient (1996). In addition, he received three more Academy Award nominations; he was nominated for Best Adapted Screenplay for both The English Patient (1996) and The Talented Mr. Ripley (1999), and was posthumously nominated for Best Picture for The Reader (2008), as a co-producer."
Adam McKay,"Adam McKay (born April 17, 1968) is an American film director, producer, screenwriter and comedian. McKay began his career in the 1990s as a head writer for the NBC sketch comedy show Saturday Night Live (SNL) for two seasons and is the co-founder of the comedy group Upright Citizens Brigade. He rose to fame in the 2000s for his collaborations with comedian Will Ferrell and co-wrote his films Anchorman, Talladega Nights, and The Other Guys. Ferrell and McKay later co-wrote and co-produced numerous television series and films, and produced their website Funny or Die through their company Gary Sanchez Productions.McKay began venturing into more dramatic territory in the 2010s. The Big Short was McKay's first film he directed without Ferrell in the cast. For this film, he was nominated for several awards including two Academy Awards, Best Director and Best Adapted Screenplay (with co-writer Charles Randolph), and two British Academy Film Awards, Best Director and Best Adapted Screenplay. He and Randolph won Best Adapted Screenplay at the Academy Awards, the BAFTA Film Awards, and the WGA Awards. For his work on the Dick Cheney biographical film Vice, McKay received Academy Award nominations for Best Picture, Best Director and Best Original Screenplay. In 2019, McKay founded Hyperobject Industries. In 2022, he received Academy Award nominations for Best Picture and Best Original Screenplay for his latest work on the apocalyptic comedy film Don't Look Up."
Liam Lynch,"Liam Lynch (Irish: Liam Ó Loingsigh; 20 November 1892 – 10 April 1923) was an officer in the Irish Republican Army during the Irish War of Independence of 1919-1921. During much of the Irish Civil War, he was chief of staff of the Irish Republican Army. On 10 April 1923, Lynch was killed whilst trying to escape an encirclement by Free State troops in south Tipperary."
Tom Gianas,"Tom Gianas is an American comedy writer, director and producer.  Gianas was the showrunner for the MTV sketch comedy series Human Giant.  He has collaborated with and directed Bob Odenkirk in Half My Face is A Clown; Sarah Silverman in Jesus is Magic, which was adapted to Sarah Silverman: Jesus Is Magic; and Jack Black in Tenacious D.  Tom was also a writer and director on Saturday Night Live and Nick Swardson's Pretend Time on Comedy Central, which he co-created with Nick Swardson."
Jason Reitman,"Jason R. Reitman ( ; born October 19, 1977) is a Canadian-American actor and filmmaker, best known for directing the films Thank You for Smoking (2005), Juno (2007), Up in the Air (2009), Young Adult (2011), and Ghostbusters: Afterlife (2021). He has received one Grammy Award, one Golden Globe, and four Academy Award nominations, two of which are for Best Director. Reitman is a dual citizen of Canada and the United States. He is the son of director Ivan Reitman."
Paul Thomas Anderson,"Paul Thomas Anderson (born June 26, 1970) is an American film director, producer, screenwriter and cinematographer. He developed an interest in filmmaking from a young age. He made his feature-film debut with Hard Eight (1996). He found critical and commercial success with Boogie Nights (1997), set in the Golden Age of Porn, and received further accolades with Magnolia (1999), an ensemble piece set in the San Fernando Valley, and Punch-Drunk Love (2002), a romantic comedy-drama film.Anderson's fifth film, There Will Be Blood (2007), about an oil prospector during the Southern California oil boom, achieved major critical and commercial success, and is often cited as one of the greatest films of the 2000s. This was followed by The Master (2012) and Inherent Vice (2014). Anderson's eighth film, Phantom Thread, was released in 2017. His ninth film, Licorice Pizza, was released in 2021, to almost unanimously positive critical reception.He has directed music videos for artists, including Fiona Apple, Radiohead, Haim, Joanna Newsom, Aimee Mann, Jon Brion and Michael Penn. Anderson directed a documentary, Junun (2015), about the making of the album of the same name in India. In 2019, he directed a short film accompanying Thom Yorke's Anima, released on Netflix and in select IMAX theatres.Anderson's films are often psychological dramas and characterized by depictions of flawed and desperate characters, explorations of themes such as dysfunctional families, alienation, loneliness and redemption, and a bold visual style that uses moving camera and long takes. He is noted for his frequent collaborations with actors Philip Baker Hall, Philip Seymour Hoffman, Julianne Moore, Melora Walters, John C. Reilly, Joaquin Phoenix and Daniel Day-Lewis, cinematographer Robert Elswit, costume designer Mark Bridges, and composers Jon Brion and Jonny Greenwood.His films have consistently garnered critical acclaim. Anderson has been nominated for eleven Academy Awards, one Golden Globe Award, and eight BAFTA Awards (winning one), and has won a Best Director Award at Cannes, both a Golden and a Silver Bear at Berlin, and a Silver Lion at Venice."
Rob Reiner,None
John McTiernan,"John Campbell McTiernan Jr. (born January 8, 1951) is an American filmmaker. He is best known for his action films, especially Predator (1987), Die Hard (1988), and The Hunt for Red October (1990). His later well-known films include the action-comedy-fantasy film Last Action Hero (1993), the action film sequel Die Hard with a Vengeance (1995), the heist-film remake The Thomas Crown Affair (1999), and The 13th Warrior (1999). His last completed feature film was the mystery-thriller Basic, released in 2003.He pleaded guilty to perjury and lying to an FBI investigator in regard to his hiring of the private investigator Anthony Pellicano in late 2000 to illegally wiretap the phone calls of two people, one of whom was Charles Roven, a co-producer of his action film remake Rollerball (2002). He was incarcerated in federal prison from April 2013 to February 2014. During his imprisonment, he filed for bankruptcy amidst foreclosure proceedings for his large ranch residence."
Robert Mulligan,None
Tom Green,"Michael Thomas Green (born July 30, 1971) is a Canadian comedian and actor. Known for shock comedy, he found mainstream prominence via his MTV show, The Tom Green Show (1994–2000). Green has also appeared in the Hollywood films Road Trip (2000), Charlie's Angels (2000), Freddy Got Fingered (2001; directed by Green himself), Stealing Harvard (2002), and Shred (2008). He was briefly married to actress Drew Barrymore (2001–2002), who co-starred with him in Charlie's Angels and Freddy Got Fingered.In June 2003, Green served as a guest host on Late Show with David Letterman, which led to him hosting his own late-night talk show on MTV titled The New Tom Green Show (2003 only). From 2006 until 2011, he hosted his internet talk show Tom Green's House Tonight from his living room, and returned to performing stand-up comedy in 2010. From October 2013 to November 2014, Green hosted the weekly talk show Tom Green Live on American cable network AXS TV."
