Dustin Lance Black,"Dustin Lance Black (born June 10, 1974) is an American screenwriter, director, film and television producer, and LGBT rights activist. He is known for writing the film Milk, for which he won the Academy Award for Best Original Screenplay.Black is a founding board member of the American Foundation for Equal Rights and writer of 8, a staged reenactment of the federal trial that led to a federal court's overturn of California's Proposition 8."
Eric Guggenheim,"Eric Guggenheim (born October 22, 1973) is an American screenwriter. He graduated from NYU's Tisch School of the Arts in 1995. Two years later he sold a script, Trim, to Fox 2000 at age 23.  Following that, he wrote an unproduced drama for Warner Bros. and a one-hour drama pilot for USA Network. In 2004, Guggenheim wrote the feature film Miracle. Guggenheim is currently a writer, executive producer and co-showrunner of the CBS series Hawaii Five-0 and Magnum P.I., he was announced as the showrunner after co-creator Peter Lenkov was fired by CBS. Before that he spent four seasons as a writer on the NBC series Parenthood. His brothers are screenwriters Marc Guggenheim and David Guggenheim. His family is Jewish."
David Koepp,"David Koepp (; born June 9, 1963) is an American screenwriter and film director. Koepp is the ninth most successful screenwriter of all time in terms of U.S. box office receipts with a total gross of over $2.3 billion.Koepp has achieved both critical and commercial success in a wide variety of genres: thriller, science fiction, comedy, action, drama, crime, superhero, horror, adventure, and fantasy.Some of the best known films he has written include the sci-fi adventure films Jurassic Park (1993), The Lost World: Jurassic Park (1997), and Indiana Jones and the Kingdom of the Crystal Skull (2008); the crime film Carlito's Way (1993); the action spy films Mission: Impossible (1996) and Jack Ryan: Shadow Recruit (2014); the superhero film Spider-Man (2002); the sci-fi disaster film War of the Worlds (2005) and the mystery thriller Angels & Demons (2009). Koepp has directed seven feature films over the course of his career: The Trigger Effect (1996), Stir of Echoes (1999), Secret Window (2004), Ghost Town (2008), Premium Rush (2012), Mortdecai (2015), and You Should Have Left (2020)."
Mitch Hedberg,None
Graham Chapman,"Graham Chapman (8 January 1941 – 4 October 1989) was an English actor, comedian and writer. He was one of the six members of the surreal comedy group Monty Python. He portrayed authority figures such as the Colonel and the lead role in two Python films, Holy Grail (1975) and Life of Brian (1979).Chapman was born in Leicester and was raised in Melton Mowbray. He enjoyed science, acting and comedy and, after graduating from Emmanuel College, Cambridge and St Bartholomew's Hospital Medical College, he turned down a career as a doctor to be a comedian instead. Chapman eventually established a writing partnership with John Cleese, which reached its critical peak with Monty Python during the 1970s. He subsequently left Britain for Los Angeles, where he attempted to be a success on American television, speaking on the college circuit and producing the pirate film Yellowbeard (1983), before returning to Britain in the early 1980s.In his personal life, Chapman was openly homosexual and a strong supporter of gay rights, and was in a long-term partnership with David Sherlock. He was an alcoholic during his time at Cambridge and the Python years; he quit drinking shortly before working on Life of Brian. He later became an enthusiast and patron of the Dangerous Sports Club. Chapman died in 1989, on the Pythons' 20th anniversary, of tonsil cancer which had spread to his spine. His life and legacy were commemorated at a private memorial service at St Bartholomew's with the other five Pythons."
Graham Chapman,"Graham Chapman (8 January 1941 – 4 October 1989) was an English actor, comedian and writer. He was one of the six members of the surreal comedy group Monty Python. He portrayed authority figures such as the Colonel and the lead role in two Python films, Holy Grail (1975) and Life of Brian (1979).Chapman was born in Leicester and was raised in Melton Mowbray. He enjoyed science, acting and comedy and, after graduating from Emmanuel College, Cambridge and St Bartholomew's Hospital Medical College, he turned down a career as a doctor to be a comedian instead. Chapman eventually established a writing partnership with John Cleese, which reached its critical peak with Monty Python during the 1970s. He subsequently left Britain for Los Angeles, where he attempted to be a success on American television, speaking on the college circuit and producing the pirate film Yellowbeard (1983), before returning to Britain in the early 1980s.In his personal life, Chapman was openly homosexual and a strong supporter of gay rights, and was in a long-term partnership with David Sherlock. He was an alcoholic during his time at Cambridge and the Python years; he quit drinking shortly before working on Life of Brian. He later became an enthusiast and patron of the Dangerous Sports Club. Chapman died in 1989, on the Pythons' 20th anniversary, of tonsil cancer which had spread to his spine. His life and legacy were commemorated at a private memorial service at St Bartholomew's with the other five Pythons."
Graham Chapman,"Graham Chapman (8 January 1941 – 4 October 1989) was an English actor, comedian and writer. He was one of the six members of the surreal comedy group Monty Python. He portrayed authority figures such as the Colonel and the lead role in two Python films, Holy Grail (1975) and Life of Brian (1979).Chapman was born in Leicester and was raised in Melton Mowbray. He enjoyed science, acting and comedy and, after graduating from Emmanuel College, Cambridge and St Bartholomew's Hospital Medical College, he turned down a career as a doctor to be a comedian instead. Chapman eventually established a writing partnership with John Cleese, which reached its critical peak with Monty Python during the 1970s. He subsequently left Britain for Los Angeles, where he attempted to be a success on American television, speaking on the college circuit and producing the pirate film Yellowbeard (1983), before returning to Britain in the early 1980s.In his personal life, Chapman was openly homosexual and a strong supporter of gay rights, and was in a long-term partnership with David Sherlock. He was an alcoholic during his time at Cambridge and the Python years; he quit drinking shortly before working on Life of Brian. He later became an enthusiast and patron of the Dangerous Sports Club. Chapman died in 1989, on the Pythons' 20th anniversary, of tonsil cancer which had spread to his spine. His life and legacy were commemorated at a private memorial service at St Bartholomew's with the other five Pythons."
Patrick Sheane Duncan,"Patrick Sheane Duncan (born 1947) is an American writer, film producer and director.A graduate of Grand Valley State University in Allendale Charter Township, Michigan, Duncan's career has been influenced by his Vietnam War experiences, which inspired the television mini-series Vietnam War Story (1987) and its sequel Vietnam War Story: The Last Days (1989) and the films 84C MoPic (1989) and Courage Under Fire (1996). Additional writing credits include A Home of Our Own (1993), The Pornographer (1994), Nick of Time (1995), Mr. Holland's Opus (1995), and the television movies A Painted House (2003), Elvis (2005), and the Little Red Wagon (2012).Duncan is a winner of the CableACE Award for Writing for a Dramatic Series for Vietnam War Story: The Last Days and a Christopher Award for Mr. Holland's Opus, which also garnered him a Golden Globe nomination. He was nominated for the Grand Jury Prize at the Sundance Film Festival for 84C MoPic and The Pornographer and the Independent Spirit Award for Best First Feature and Best Screenplay for 84C MoPic.Duncan's play, Souls on Fire, was produced by Danny Glover's theatre company, Robey Theatre Company in Los Angeles."
Sally Robinson,"Sally Robinson (born 1952) is an English-born Australian artist. She has had a long career as a portrait artist and designer, painter and printmaker, teacher and lecturer. Her work is represented in private and public collections around Australia."
Nora Ephron,"Nora Ephron ( EF-rən; May 19, 1941 – June 26, 2012) was an American journalist, writer, and filmmaker. She is best known for her romantic comedy films and was nominated three times for both the Writer’s Guild of America Award and the Academy Award for Best Original Screenplay for Silkwood (1983), When Harry Met Sally... (1989), and Sleepless in Seattle (1993). She won the BAFTA Award for Best Original Screenplay for When Harry Met Sally..., which the Writers Guild of America ranked as the 40th greatest screenplay of all time.Ephron's first produced play, Imaginary Friends (2002), was honored as one of the 10 best plays of the 2002–03 New York theatre season. She also co-authored the Drama Desk Award–winning theatrical production Love, Loss, and What I Wore. In 2013, Ephron received a posthumous Tony Award nomination for Best Play for Lucky Guy.Ephron also directed films, usually from her own screenplays, including Sleepless in Seattle (1993) and You've Got Mail (1998), both starring Meg Ryan and Tom Hanks."
Dale Launer,"Dale Launer (born May 19, 1952) is an American comedy screenwriter. His films include Ruthless People, Blind Date, Dirty Rotten Scoundrels and My Cousin Vinny."
David E. Kelley,None
Jared Hess,"Jared Lawrence Hess (born July 18, 1979) and Jerusha Elizabeth Hess (née Demke; born May 12, 1980) are husband-and-wife American filmmakers best known for their work on Napoleon Dynamite (2004), Nacho Libre (2006) and Gentlemen Broncos (2009), all of which they co-wrote and which were directed by Jared (Nacho Libre was co-written with Mike White).They also produced music videos for The Postal Service's third single, ""We Will Become Silhouettes"", and The Killers' Christmas charity single ""Boots""."
Michael G. Bender,"Not Another Teen Movie is a 2001 American teen parody film directed by Joel Gallen and written by Mike Bender, Adam Jay Epstein, Andrew Jacobson, Phil Beauman, and Buddy Johnson. It features an ensemble cast including Chyler Leigh, Chris Evans, Jaime Pressly, Eric Christian Olsen, Eric Jungmann, Mia Kirshner, Deon Richmond, Cody McMains, Sam Huntington, Samm Levine, Cerina Vincent, Ron Lester, Randy Quaid, Lacey Chabert, Riley Smith and Samaire Armstrong.Released on December 14, 2001, by Columbia Pictures, the film is a parody of teen films. While the general plot is based on She's All That, as well as Varsity Blues, 10 Things I Hate About You, Can't Hardly Wait and  Pretty in Pink, the film is also filled with allusions to teenage and college-age films from the 1980s and 1990s, such as Bring It On, American Pie, Cruel Intentions, American Beauty, Never Been Kissed, Ferris Bueller's Day Off, Can't Buy Me Love, Jawbreaker, Sixteen Candles, Dazed and Confused, Lucas, Rudy, The Breakfast Club, Grease, and Road Trip."
Jeremy Leven,"Jeremy Leven (born August 16, 1941) is an American screenwriter, director, producer, and novelist. Born in South Bend, Indiana, Leven lives in Woodbridge, Connecticut, Paris, and New York City."
Greg Daniels,None
Mike Judge,"Michael Craig Judge (born October 17, 1962) is an American actor, animator, writer, producer, director and musician. He is the creator of the animated television series Beavis and Butt-Head (1993–1997, 2011, 2021–present), and co-creator of the television series King of the Hill (1997–2010), The Goode Family (2009), Silicon Valley (2014–2019), and Mike Judge Presents: Tales from the Tour Bus (2017–2018). He also wrote and directed the films Beavis and Butt-Head Do America (1996), Office Space (1999), Idiocracy (2006), and Extract (2009).Judge was born in Guayaquil, Ecuador, and raised in the U.S. state of New Mexico. He graduated from the University of California, San Diego, where he studied physics. After losing interest in a career in science, Judge began to focus on animation and creating short films. One of these (Frog Baseball) was developed into the successful MTV series Beavis and Butt-Head, which eventually spawned a 1996 feature film, as well as the spin-off series Daria (with which Judge had no involvement).In 1995, Judge and former The Simpsons writer Greg Daniels developed King of the Hill, which debuted on Fox in 1997 and quickly became a hit with both critics and audiences; running for 13 seasons, it became one of the longest-running American animated series. During the run of the show, Judge took some time off to write and direct Office Space, Idiocracy, and Extract. As King of the Hill was coming to an end, Judge created his third show, ABC's The Goode Family, which received mixed reviews and was cancelled after 13 episodes. After a four-year hiatus, he created his fourth show, the live-action Silicon Valley for HBO, which has received critical acclaim since its premiere. In 2017, Judge's fourth animated series, the music-themed Tales from the Tour Bus, premiered on Cinemax, to critical and audience acclaim.Judge has won a Primetime Emmy Award and two Annie Awards for King of the Hill and two Critics' Choice Television Awards and Satellite Awards for Silicon Valley."
Lawrence Hauben,"Lawrence Alan Hauben (3 March 1931 – 22 December 1985) was an American actor and screenwriter. Born in New York, he won the Academy Award for Best Adapted Screenplay along with Bo Goldman for One Flew Over the Cuckoo's Nest (1975) at the 48th Academy Awards. He also won a Golden Globe and a Writers Guild of America Award.He had a small role as a car salesman in Point Blank. He died on 22 December 1985, in Santa Barbara, California"
Kathleen Knuten Rowell,None
Adam Dubin,"Adam C. Dubin (born January 10, 1964) is an American filmmaker who co-directed the Beastie Boys music videos ""(You Gotta) Fight for Your Right (To Party!)"" and ""No Sleep till Brooklyn"" with Ric Menello. ""Fight for Your Right"" is number three on MTV's all time funniest music videos. In 2007, Fuse interviewed Dubin when it aired a 30-minute episode about ""Fight for Your Right"" as part of their series Videos That Rocked the World.A graduate of the NYU film program, Dubin was roommates at NYU with record producer Rick Rubin.Dubin directed A Year and a Half in the Life of Metallica feature-length documentary for heavy metal band Metallica and their music video ""Nothing Else Matters"". Dubin has directed several short comedy films with comedians Lewis Black and Jim Norton. In 2009, Dubin directed the concert film Stark Raving Black starring comedian Lewis Black. In 2012, he directed the concert film In God We Rust, also starring Black. In 2013, Dubin directed the documentary film Hit The Lights: The Making of Metallica Through the Never, starring Metallica and actor Dane DeHaan."
Randall Wallace,"Randall Wallace (born July 28, 1949) is an American screenwriter, film director, producer, and songwriter who came to prominence by writing the screenplay for the historical drama film Braveheart (1995). His work on the film earned him a nomination for the Academy Award for Best Original Screenplay and a Writers Guild of America Award in the same category. He has since directed films such as The Man in the Iron Mask (1998), We Were Soldiers (2002), Secretariat (2010) and Heaven Is for Real (2014)."
Phil Hartman,None
Andrew Lloyd Webber,"Andrew Lloyd Webber, Baron Lloyd-Webber,  (born 22 March 1948) is an English composer and impresario of musical theatre. Several of his musicals have run for more than a decade both in the West End and on Broadway. He has composed 21 musicals, a song cycle, a set of variations, two film scores, and a Latin Requiem Mass. Several of his songs have been widely recorded and were successful outside of their parent musicals, such as ""Memory"" from Cats, ""The Music of the Night"" and ""All I Ask of You"" from The Phantom of the Opera, ""I Don't Know How to Love Him"" from Jesus Christ Superstar, ""Don't Cry for Me Argentina"" from Evita, and ""Any Dream Will Do"" from Joseph and the Amazing Technicolor Dreamcoat. In 2001, The New York Times referred him as ""the most commercially successful composer in history"". The Daily Telegraph ranked him the ""fifth most powerful person in British culture"" in 2008, with lyricist Don Black writing ""Andrew more or less single-handedly reinvented the musical.""He has received a number of awards, including a knighthood in 1992, followed by a peerage from Queen Elizabeth II for services to the Arts, six Tonys, three Grammys (as well as the Grammy Legend Award), an Academy Award, fourteen Ivor Novello Awards, seven Olivier Awards, a Golden Globe, a Brit Award, the 2006 Kennedy Center Honors, the 2008 Classic Brit Award for Outstanding Contribution to Music, and an Emmy Award. He is one of sixteen people to have won an Oscar, an Emmy, a Grammy, and a Tony. He has a star on the Hollywood Walk of Fame, is an inductee into the Songwriter's Hall of Fame, and is a fellow of the British Academy of Songwriters, Composers, and Authors.His company, the Really Useful Group, is one of the largest theatre operators in London. Producers in several parts of the UK have staged productions, including national tours, of the Lloyd Webber musicals under licence from the Really Useful Group. Lloyd Webber is also the president of the Arts Educational Schools, London, a performing arts school located in Chiswick, West London. He is involved in a number of charitable activities, including the Elton John AIDS Foundation, Nordoff Robbins, Prostate Cancer UK and War Child. In 1992, he started the Andrew Lloyd Webber Foundation which supports the arts, culture, and heritage of the UK."
Darren Aronofsky,"Darren Aronofsky (born February 12, 1969) is an American film director, producer, and screenwriter. His films are noted for their surrealism, melodramatic, and disturbing elements, often based in psychological fictions.Aronofsky attended Harvard University, where he studied film and social anthropology, and then the American Film Institute where he studied directing. He won several film awards after completing his senior thesis film, Supermarket Sweep, which went on to become a National Student Academy Award finalist. Aronofsky's feature debut, the surrealist psychological thriller Pi, was shot in November 1997. The low-budget, $60,000 production, starring Sean Gullette, was sold to Artisan Entertainment for $1 million, and grossed over $3 million; Aronofsky won the Directing Award at the 1998 Sundance Film Festival and an Independent Spirit Award for Best First Screenplay.Aronofsky's follow-up, the psychological drama Requiem for a Dream, was based on the novel of the same name by Hubert Selby Jr. The film garnered strong reviews and received an Academy Award nomination for Ellen Burstyn's performance. After writing the World War II horror film Below, Aronofsky began production on his third film, the romantic fantasy sci-fi drama The Fountain. The film received mixed reviews and performed poorly at the box-office, but has since garnered a cult following.His fourth film, the sports drama The Wrestler, was released to critical acclaim and both of the film's stars, Mickey Rourke and Marisa Tomei, received Academy Award nominations. In 2010, his fifth feature film, the psychological horror film Black Swan, received further critical acclaim and many accolades, being nominated for five Academy Awards, including Best Picture and Best Director; Natalie Portman won Best Actress for her performance in the film. Aronofsky also received nominations for Best Director at the Golden Globes, and a Directors Guild of America Award nomination for his work on Black Swan. Aronofsky's sixth film, the biblically inspired epic Noah, was released in 2014, becoming Aronofsky's first film to open at No.1 at the box office. His seventh film, the psychological horror mother! (2017), sparked controversy upon release due to its biblical allegories and depiction of violence, and polarized audiences."
Martyn Burke,"Martyn Burke (born 1952) is a Canadian director, novelist and screenwriter from Toronto, Ontario."
David E. Kelley,None
David E. Kelley,None
Jonathan Nolan,"Jonathan Nolan (born 6 June 1976) is a British-American screenwriter, television producer, director and author. He is the creator of the CBS science fiction series Person of Interest (2011–2016) and co-creator of the HBO science fiction western series Westworld (2016–present).Nolan has collaborated on several films with his brother, director Christopher Nolan, who adapted Jonathan's short story ""Memento Mori"" into the neo-noir thriller film Memento (2000). Together, the siblings co-wrote the mystery thriller film The Prestige (2006), the superhero films The Dark Knight (2008) and The Dark Knight Rises (2012), and the science fiction film Interstellar (2014).Nolan was nominated for the Academy Award for Best Original Screenplay for Memento, and for the Primetime Emmy Award for Outstanding Writing for a Drama Series and Outstanding Directing for a Drama Series for Westworld, among a number of other awards."
Mel Brooks,None
Paul Haggis,"Paul Edward Haggis (born March 10, 1953) is a Canadian screenwriter, film producer, and director of film and television. He is best known as screenwriter and producer for consecutive Best Picture Oscar winners: Million Dollar Baby (2004) and Crash (2005), the latter of which he also directed. Haggis also co-wrote the war film Flags of Our Fathers (2006) and the James Bond films Casino Royale (2006) and Quantum of Solace (2008). He is the creator of the television series Due South (1994–1999) and co-creator of Walker, Texas Ranger (1993–2001), among others. Haggis is a two-time Academy Award winner, two-time Emmy Award winner, and seven-time Gemini Award winner. He also assisted in the making of ""We Are the World 25 for Haiti."""
N/A,"N/A or sometimes n/a is a common abbreviation in tables and lists for the phrase not applicable, not available,  not assessed,  or no answer. It is used to indicate when information in a certain table cell is not provided, either because it does not apply to a particular case in question or because the answer is not available. Such a notation can be used on many different types of forms.The notation was in use at least as early as the 1920s, with a 1925 guide to conducting community surveys instructing those asking questions for the survey:Some of the questions on the card are of course not applicable at all times. For instance, a household composed of two widowed sisters living on their income has no wage earner. The survey director should request that the initials ""n a"" (""not applicable"") be written down opposite such questions. No space should be left blank.The guide goes on to indicate that every blank should be filled, even if only to indicate that the blank is not applicable, so that those processing the surveys would be able to see that the blank had not merely been overlooked. An Information Circular from the U.S. Department of the Interior, Bureau of Mines, from the same year specified that it used ""NA"" to indicate that information was ""not available"" and ""NAp"" to indicate that a category information was ""Not applicable"".In the early years of computer programming, computerized forms that required fields to be filled in could cause problems where the field was one for which no answer would be applicable to certain persons filling out the form. Before programmers became aware of a problem with a particular field, persons filling out that field might fill it in with a term such as this, which the program processing the form would misinterpret as an intent to provide the requested information. For example, if a form contained a field for a middle name, and the person filling out the form put ""N/A"", the computer might interpret this as ""N/A"" being the person's middle name; this in turn might result in the person receiving mail from the company that produced the form with ""N/A"" where a middle name would normally appear."
Paul Schrader,None
Ronald Bass,"Ronald Jay Bass (born March 26, 1942), sometimes credited as Ron Bass, is an American screenwriter and film producer. He won an Academy Award for writing the screenplay for Barry Levinson's film Rain Man, and films that Bass is associated with are regularly nominated for multiple motion picture awards. His films have grossed over $2 billion."
Gregory Allen Howard,"Gregory Allen Howard (born 1962) is an American screenwriter. He is best known for writing the screenplay to Remember the Titans (2000), a Disney film about an undefeated high school football team credited with healing the racial divide in Alexandria, Virginia, in 1971."
Claude Lelouch,"Claude Barruck Joseph Lelouch (French: [ləluʃ]; born 30 October 1937) is a French film director, writer, cinematographer, actor and producer. Lelouch grew up in an Algerian Jewish Family. He emerged as a prominent director in the 1960s. Lelouch gained critical acclaim for his 1966 romantic melodrama film A Man and A Woman. At the 39th Academy Awards in 1967, A Man and a Woman won Best Original Screenplay and Best Foreign Language Film. Lelouch was also nominated for Best Director. While his films have gained him international recognition since the 1960s, Lelouch's methods and style of film are known for attracting criticism."
