Gil Junger,NoneSofia Coppola,"Sofia Carmina Coppola (; born May 14, 1971) is an American filmmaker and actress. The youngest child and only daughter of filmmakers Eleanor and Francis Ford Coppola, she made her film debut as an infant in her father's acclaimed crime drama film The Godfather (1972). Coppola later appeared in several music videos, as well as a supporting role in Peggy Sue Got Married (1986). Coppola then portrayed Mary Corleone, the daughter of Michael Corleone, in The Godfather Part III (1990). After her performance drew criticism, she turned her attention to filmmaking.Coppola made her feature-length directorial debut with the coming-of-age drama The Virgin Suicides (1999). It was the first of her collaborations with actress Kirsten Dunst. In 2004, Coppola received the Academy Award for Best Original Screenplay for the comedy-drama Lost in Translation and became the third woman to be nominated for an Academy Award for Best Director. In 2006, Coppola directed the historical drama Marie Antoinette, starring Dunst as the title character. In 2010, with the drama Somewhere, Coppola became the first American woman (and fourth American filmmaker) to win the Golden Lion, the top prize at the Venice Film Festival. In 2013, she directed the satirical crime film The Bling Ring, based on the crime ring of the same name which drew from the Vanity Fair article ""The Suspects Wore Louboutins"" by Nancy Jo Sales about the real group of burglarizing teens who were ""motivated by vanity and worship.""  The film premiered at the Cannes Film Festival.In 2015, Coppola released the Christmas musical comedy special A Very Murray Christmas, starring Bill Murray, on Netflix. It earned her a nomination for the Primetime Emmy Award for Outstanding Television Movie. At the 2017 Cannes Film Festival, she won Best Director for her work on the drama film The Beguiled, becoming the second woman in the festival's history to win the award. Her latest film, On the Rocks received a limited theatrical release in October 2020 by A24 as well as a streaming release on AppleTV+."
Kevin Smith,"Kevin Patrick Smith (born August 2, 1970) is an American filmmaker, actor, comedian, comic book writer, author, YouTuber, and podcaster. He came to prominence with the low-budget comedy buddy film Clerks (1994), which he wrote, directed, co-produced, and acted in as the character Silent Bob of stoner duo Jay and Silent Bob. Jay and Silent Bob also appeared in Smith's later films Mallrats, Chasing Amy, Dogma, Jay and Silent Bob Strike Back, Clerks II and Jay and Silent Bob Reboot, which are set primarily in his home state of New Jersey. While not strictly sequential, the films have crossover plot elements, character references, and a shared canon known as the ""View Askewniverse"", named after Smith's production company View Askew Productions, which he co-founded with Scott Mosier.Since 2011, Smith has mostly made horror films, including Red State (2011) and the ""comedy horror films"" Tusk (2014) and Yoga Hosers (2016), two in a planned series of three such films set in Canada dubbed the True North trilogy. He has also served as a director-for-hire for material he did not write, including the buddy cop action comedy Cop Out (2010) and various television series episodes.Smith owns Jay and Silent Bob's Secret Stash in Red Bank, New Jersey, a comic book store which became the setting for the reality television show Comic Book Men (2012—2018). He also hosts the movie-review TV show Spoilers. As a podcaster, Smith co-hosts several shows on his SModcast Podcast Network, including SModcast, Fatman Beyond, and the live show Hollywood Babble-On. He is known for participating in long, humorous Q&A sessions that are often filmed for DVD release, beginning with An Evening with Kevin Smith ""Kevin Smith"". The New York Times. Retrieved January 30, 2015.Since 1999, he has been married to Actresses and former reporter Jennifer Schwalbach Smith, and with whom he has one child, Harley Quinn Smith named after the Batman character of the same name."
Milos Forman,None
Brothers Wachowski,"Lana Wachowski (born June 21, 1965, formerly known as Larry Wachowski) and Lilly Wachowski (born December 29, 1967, formerly known as Andy Wachowski) are American film and television directors, writers and producers. The sisters are both trans women.Collectively known as the Wachowskis (), the sisters have worked as a writing and directing team through most of their careers. They made their directing debut in 1996 with Bound, and achieved fame with their second film The Matrix (1999), a major box office success for which they won the Saturn Award for Best Director. They wrote and directed its two sequels, The Matrix Reloaded and The Matrix Revolutions (both in 2003), and were involved in the writing and production of other works in the Matrix franchise.Following the commercial success of the Matrix series, the Wachowskis wrote and produced the 2005 film V for Vendetta (an adaptation of the graphic novel by Alan Moore and David Lloyd), and in 2008 released the film Speed Racer, a live-action adaptation of the Japanese anime series. Their next film, Cloud Atlas, based on the novel by David Mitchell and co-written and co-directed by Tom Tykwer, was released in 2012. Their film Jupiter Ascending and the Netflix series Sense8, which they co-created with J. Michael Straczynski, debuted in 2015; the second season of Sense8 ended the series in 2018 and was Lana's first major creative undertaking without Lilly.Since the series finale of Sense8, the Wachowskis have been working separately on different projects: Lilly directed, wrote, and executive-produced several episodes of Showtime's Work in Progress (2019) with creators Abby McEnany and Tim Mason, while Lana filmed The Matrix Resurrections, written with Mitchell and Aleksandar Hemon, which was released in December 2021."
Grant Gee,"Grant Robert Gee (born 24 October 1964) is a British film maker, photographer and cinematographer. He is most noted for his 1998 documentary Meeting People Is Easy about the British alternative rock group Radiohead."
Christopher Nolan,None
Barry Sonnenfeld,"Barry Sonnenfeld  (born April 1, 1953) is an American filmmaker and television director. He originally worked as a cinematographer for the Coen brothers before directing films such as The Addams Family (1991) and its sequel Addams Family Values (1993), Get Shorty (1995), the Men in Black trilogy (1997–2012), and Wild Wild West (1999)."
Paul Gross,"Paul Michael Gross OC (born April 30, 1959) is a Canadian actor, producer, director, musician, and writer born in Calgary, Alberta. He is known for his lead role as Constable Benton Fraser in the television series Due South as well as his 2008 war film Passchendaele, which he wrote, produced, directed, and starred in. Gross acted as executive producer on Due South in addition to starring, wrote seven episodes including the two-part series finale, and wrote and sang songs for the show, some of which can be found on the two Due South soundtracks. He later found success with another Canadian TV series, Slings & Arrows. He also produced one film with Akshay Kumar called Breakaway starring Camilla Belle and Vinay Virmani."
Stephen Herek,"Stephen Robert Herek (born November 10, 1958) is an American film director. Herek was born in San Antonio, Texas. He attended the University of Texas at Austin."
Gus Van Sant,"Gus Green Van Sant Jr. (born July 24, 1952) is an American film director, producer, photographer, and musician who has earned acclaim as both an independent and mainstream filmmaker. His films typically deal with themes of marginalized subcultures, in particular homosexuality; Van Sant is considered one of the most prominent auteurs of the New Queer Cinema movement.Van Sant's early career was devoted to directing television commercials in the Pacific Northwest. He made his feature-length cinematic directorial debut with Mala Noche (1985). His second feature, Drugstore Cowboy (1989), was highly acclaimed, and earned him screenwriting awards from the Los Angeles Film Critics Association and New York Film Critics Circle and the award for Best Director from the National Society of Film Critics. His next film, My Own Private Idaho (1991), was similarly praised, as was the black comedy To Die For (1995), the drama Good Will Hunting (1997), and the biographical film Milk (2008); for the latter two, Van Sant was nominated for the Academy Award for Best Director and both films received Best Picture nominations.In 2003, Van Sant's film about the Columbine High School massacre, Elephant, won the Palme d'Or at the Cannes Film Festival. Van Sant also received the festival's Best Director Award that same year, making him one of only two filmmakers—the other being Joel Coen—to win both accolades at the festival in the same year. Though most of Van Sant's other films received favourable reviews, such as Finding Forrester (2000) and Paranoid Park (2007), some of his efforts, such as the art house production Last Days (2005) and the environmental drama Promised Land (2012), have received more mixed reviews from critics, while his adaptation of Tom Robbins's Even Cowgirls Get the Blues (1993), his 1998 remake of Alfred Hitchcock's Psycho, and The Sea of Trees (2015), were critical and commercial failures.In addition to directing, Van Sant has written the screenplays for several of his earlier works, and is the author of a novel, Pink. A book of his photography, 108 Portraits, has also been published, and he has released two musical albums.He is gay and lives in the Los Feliz section of Los Angeles, California."
Gavin O\u0027Connor,"Contemporary climate change includes both global warming and its impacts on Earth's weather patterns. There have been previous periods of climate change, but the current changes are distinctly more rapid and not due to natural causes. Instead, they are caused by the emission of greenhouse gases, mostly carbon dioxide (CO2) and methane. Burning fossil fuels for energy use creates most of these emissions. Agriculture, steelmaking, cement production, and forest loss are additional sources. Greenhouse gases are transparent to sunlight, allowing it through to heat the Earth's surface. When the Earth emits that heat as infrared radiation the gases absorb it, trapping the heat near the Earth's surface. As the planet heats up it causes changes like the loss of sunlight-reflecting snow cover, amplifying global warming.On land, temperatures have risen about twice as fast as the global average. Deserts are expanding, while heat waves and wildfires are becoming more common. Increased warming in the Arctic has contributed to melting permafrost, glacial retreat and sea ice loss. Higher temperatures are also causing more intense storms and other weather extremes. Rapid environmental change in mountains, coral reefs, and the Arctic is forcing many species to relocate or become extinct. Climate change threatens people with food and water scarcity, increased flooding, extreme heat, more disease, and economic loss. Human migration and conflict can be a result. The World Health Organization calls climate change the greatest threat to global health in the 21st century. Even if efforts to minimise future warming are successful, some effects will continue for centuries. These include sea level rise, and warmer, more acidic oceans.Many of these impacts are already felt at the current level of warming (1.2 °C). Additional warming will increase these impacts and may trigger tipping points, such as the melting of the Greenland ice sheet. Under the 2015 Paris Agreement, nations collectively agreed to keep warming ""well under 2 °C"". However, with pledges made under the Agreement, global warming would still reach about 2.7 °C by the end of the century. Limiting warming to 1.5 °C will require halving emissions by 2030 and achieving net-zero emissions by 2050.Making deep cuts in emissions will require switching away from burning fossil fuels and towards using electricity generated from low-carbon sources. This includes phasing out coal-fired power plants, vastly increasing use of wind and solar power, switching to electric vehicles, switching to heat pumps in buildings, and taking measures to conserve energy. Carbon can also be removed from the atmosphere, for instance by increasing forest cover. While communities may adapt to climate change through efforts like better coastline protection, they cannot avert the risk of severe, widespread, and permanent impacts."
Brian De Palma,None
Comedy Central,"Comedy Central  is an American basic cable channel owned by Paramount Global through its network division's MTV Entertainment Group unit, based in Manhattan. The channel is geared towards young adults aged 18–34 and carries comedy programming in the form of both original, licensed, and syndicated series, stand-up comedy specials, and feature films. It is available to approximately 86.723 million households in the United States as of September 2018.Since the early 2000s, Comedy Central has expanded globally with localized channels in Europe (including the UK), India, Southeast Asia, Latin America, Australia and New Zealand, Middle East, and Africa. The international channels are operated by Paramount International Networks."
Terry Gilliam,"Terrence Vance Gilliam (; born 22 November 1940) is an American-born British film director, screenwriter, animator, actor, comedian and former member of the Monty Python comedy troupe.Gilliam has directed 13 feature films, including Time Bandits (1981), Brazil (1985), The Adventures of Baron Munchausen (1988), The Fisher King (1991), 12 Monkeys (1995), Fear and Loathing in Las Vegas (1998), The Brothers Grimm (2005), Tideland (2005), and The Imaginarium of Doctor Parnassus (2009). The only Monty Python member not born in Britain, he became a naturalised British subject in 1968 and formally renounced his American citizenship in 2006.Gilliam was born in Minnesota, but spent his high school and college years in Los Angeles. He started his career as an animator and strip cartoonist. He joined Monty Python as the animator of their works, but eventually became a full member and was given acting roles. He became a feature film director in the 1970s. Most of his films explore the theme of imagination and its importance to life, express his opposition to bureaucracy and authoritarianism, and feature characters facing dark or paranoid situations. His own scripts feature black comedy and tragicomedic elements, as well as surprise endings.In 1988, Gilliam and the other Monty Python members received the BAFTA Award for Outstanding British Contribution to Cinema. In 2009, Gilliam received the BAFTA Fellowship for lifetime achievement."
Terry Jones,"Terence Graham Parry Jones (1 February 1942 – 21 January 2020) was a Welsh actor, author, comedian, director, historian, poet, presenter, writer, and member of the Monty Python comedy team.After graduating from Oxford University with a degree in English, Jones and writing partner Michael Palin wrote and performed for several high-profile British comedy programmes, including Do Not Adjust Your Set and The Frost Report, before creating Monty Python's Flying Circus with Cambridge graduates Graham Chapman, John Cleese, and Eric Idle and American animator-filmmaker Terry Gilliam. Jones was largely responsible for the programme's innovative, surreal structure, in which sketches flowed from one to the next without the use of punch lines. He made his directorial debut with the Python film Holy Grail, which he co-directed with Gilliam, and also directed the subsequent Python films Life of Brian and The Meaning of Life.Jones co-created and co-wrote with Palin the anthology series Ripping Yarns. He also wrote an early draft of Jim Henson's film Labyrinth, though little of his work remained in the final cut. Jones was a well-respected medieval historian, having written several books and presented television documentaries about the period, as well as a prolific children's book author. In 2016, Jones received a Lifetime Achievement award at the BAFTA Cymru Awards for his outstanding contribution to television and film. After living for several years with a degenerative aphasia, he gradually lost the ability to speak and died in 2020 from frontotemporal dementia."
Terry Jones,"Terence Graham Parry Jones (1 February 1942 – 21 January 2020) was a Welsh actor, author, comedian, director, historian, poet, presenter, writer, and member of the Monty Python comedy team.After graduating from Oxford University with a degree in English, Jones and writing partner Michael Palin wrote and performed for several high-profile British comedy programmes, including Do Not Adjust Your Set and The Frost Report, before creating Monty Python's Flying Circus with Cambridge graduates Graham Chapman, John Cleese, and Eric Idle and American animator-filmmaker Terry Gilliam. Jones was largely responsible for the programme's innovative, surreal structure, in which sketches flowed from one to the next without the use of punch lines. He made his directorial debut with the Python film Holy Grail, which he co-directed with Gilliam, and also directed the subsequent Python films Life of Brian and The Meaning of Life.Jones co-created and co-wrote with Palin the anthology series Ripping Yarns. He also wrote an early draft of Jim Henson's film Labyrinth, though little of his work remained in the final cut. Jones was a well-respected medieval historian, having written several books and presented television documentaries about the period, as well as a prolific children's book author. In 2016, Jones received a Lifetime Achievement award at the BAFTA Cymru Awards for his outstanding contribution to television and film. After living for several years with a degenerative aphasia, he gradually lost the ability to speak and died in 2020 from frontotemporal dementia."
Stephen Herek,"Stephen Robert Herek (born November 10, 1958) is an American film director. Herek was born in San Antonio, Texas. He attended the University of Texas at Austin."
Jeff Bleckner,"Jeff Bleckner (born August 12, 1943) is an American theatre and television director."
Herbert Ross,"Herbert David Ross (May 13, 1927 – October 9, 2001) was an American actor, choreographer, director and producer who worked predominantly in theater and film."
Jonathan Lynn,"Jonathan Lynn (born 3 April 1943) is an English stage and film director, producer, writer, and actor. He is known for directing comedy films such as Clue (1985), Nuns on the Run (1990), My Cousin Vinny (1992) and  The Whole Nine Yards (2000). He co-created and co-wrote the television series Yes Minister (1980–1984, 2013) and Yes, Prime Minister (1986–1988)."
Jay Roach,None
Jared Hess,"Jared Lawrence Hess (born July 18, 1979) and Jerusha Elizabeth Hess (née Demke; born May 12, 1980) are husband-and-wife American filmmakers best known for their work on Napoleon Dynamite (2004), Nacho Libre (2006) and Gentlemen Broncos (2009), all of which they co-wrote and which were directed by Jared (Nacho Libre was co-written with Mike White).They also produced music videos for The Postal Service's third single, ""We Will Become Silhouettes"", and The Killers' Christmas charity single ""Boots""."
Joel Gallen,"Joel Gallen is an American television and film director, producer, screenwriter, and founder and president of Tenth Planet Productions. He is a graduate of the University of Rhode Island, and currently serves on the University's Harrington School of Communication and Media Executive Advisory Board.Gallen has produced and directed many live television events and has won numerous awards, including an Emmy, Peabody, PGA and DGA award for producing and directing America: A Tribute to Heroes immediately following the 9/11 attacks. He has executive produced and directed the last fourteen Comedy Central Roasts, including Justin Bieber, Bruce Willis, and Pam Anderson.  Gallen has directed and produced 19 Rock and Roll Hall of Fame induction ceremonies between 1993 and 2021, and executive produced and directed the multiple Emmy winning 25th Anniversary Rock and Roll Hall of Fame Concert at Madison Square Garden in 2009. From 2007 through 2010, Gallen was the executive producer and director of CNN Heroes. Gallen executive produced and directed the Stand Up to Cancer live multi-network broadcasts in 2012 and 2014. The 2014 broadcast raised more than 100 million dollars for new clinical trials. He also produced and directed The Concert for Valor for HBO in November 2014 held on the Mall in Washington, D.C. In March, 2022, Gallen will executive produce and direct the Independent Spirit Awards for the eighth consecutive year. Joel produced and directed Chris Rock’s HBO Special “Never Scared” and also produced and directed both HBO Specials for Ellen DeGeneres in the early 2000s. He more recently executive produced and directed Ellen's first stand-up special in 15 years—Relatable—which premiered on Netflix in December 2018.In January of 2019 Gallen produced ""I Am The Highway:  A Tribute to Chris Cornell"", a 5-hour concert event hosted by Jimmy Kimmel with special guests including Foo Fighters, Metallica, Miley Cyrus, Brandi Carlile, Brad Pitt, Chris Stapleton, Jack Black, Miguel, Taylor Momsen, Josh Brolin, Perry Farrell, Audioslave, Temple of the Dog and Soundgarden.  Joel will executive produce the iHeart Radio Music Awards for the 3rd consecutive year live on Fox in March.2022.  In March 2020, Joel executive produced and directed the first live event broadcast in reaction to the Covid pandemic - ""The iHeart Living Room Concert for America"".  In November 2021, Joel executive produced and directed The 2021 Rock and Roll Hall of Fame Induction Ceremony, marking the 19th time he's helmed that show.Gallen was the executive producer of two prime-time reality-competition series: The Sing-Off, an a cappella competition series for NBC for 3 seasons (2009–11); and America's Best Dance Crew, a dance competition series for MTV for 7 seasons (2008-2012). More recently, Gallen executive produced and directed 8 episodes of The Comedy Jam for Comedy Central (2017), and also 14 episodes of Roast Battle (2016–18).Gallen was an executive at MTV in the early 90s where he created and produced a number of popular shows and specials including the MTV Movie Awards. He went on to produce 14 of the first 15 MTV Movie Awards shows between 1992 and 2006. Gallen returned to helm the MTV Movie and TV Awards in 2018 and 2019 and the show's ratings were the highest in years. Gallen conceived and directed many of the Movie Award short comedic films that featured Ben Stiller, Tom Cruise, Jack Black, Will Ferrell, Justin Timberlake, Jimmy Fallon and Tiffany Haddish.Gallen produced a short film for Zoolander while producing the VH-1 Fashion Awards in the late 1990s and executive produced the movie for Paramount in 2001. He directed the hit comedy Not Another Teen Movie for Sony Pictures that same year.Gallen lives in Los Angeles with his son Max."
Nick Cassavetes,"Nicholas David Rowland Cassavetes (born May 21, 1959) is an American actor, director, and writer. He has directed such films as She's So Lovely (1997), John Q. (2002), The Notebook (2004), Alpha Dog (2006), and My Sister's Keeper (2009). His acting credits include an uncredited role in Husbands (1970)—which was directed by his father, John Cassavetes—as well as roles in the films The Wraith (1986), Face/Off (1997), and Blow (2001)."
Ken Kwapis,"Kenneth William Kwapis (born August 17, 1957) is an American film and television director, screenwriter, and author. He specialized in the single-camera sitcom in the 1990s and 2000s and has directed feature films such as Sesame Street Presents: Follow That Bird (1985), The Sisterhood of the Traveling Pants (2005), and He's Just Not That Into You (2009)."
