Schlesinger,"Schlesinger is a German surname (in part also Jewish) meaning ""Silesian""  and may refer to:Adam Schlesinger (1967–2020), American composer and musicianAdolf Martin Schlesinger (1769–1838), German founder of A.M. Schlesingers MusikhandlungAlan Schlesinger (born 1960), American politician and Republican candidate for the U.S. Senate in Connecticut in 2006Alice Schlesinger (born 1988), Israeli Olympic judokaArthur Meier Schlesinger, Sr. (1888–1965), American historian and professor at Harvard UniversityArthur Meier Schlesinger, Jr. (1917–2007), son of the above, American historian, social critic and former John F. Kennedy associateBruno Schlesinger (1876–1962), American German-born conductor and composer who changed his name to ""Bruno Walter"" in 1911Carl Schlesinger (1813–1871), Austrian cellistChristina Schlesinger, American artistCory Schlesinger (born 1972), American football playerDavid Schlesinger (born 1960), American journalist who is the Editor-in-Chief of ReutersDon Schlesinger, American gaming mathematician, author, lecturer and famous blackjack playerElyakim Schlesinger, English rabbiFrank Schlesinger (1871–1943), American astronomerHanan Schlesinger, Israeli rabbiHermann Irving Schlesinger (1882–1960), American chemistJames R. Schlesinger (1929–2014), U.S. Secretary of Defense (1973–1974) and first Secretary of Energy (1977-1979)Joe Schlesinger (born 1928), Canadian television journalist and authorJohn Schlesinger (1926–2003), British film directorKatharine Schlesinger, British actressKathleen Schlesinger, British musicologist (1862 Holywood near Belfast - 1953 London)Kurt Schlesinger (1902-1964), a war criminal, head of the Jewish Security Service in Westerbork transit campLeon Schlesinger (1884–1949), American Looney Tunes producerLeonard Schlesinger, American economistLudwig Schlesinger (1864–1933), Hungarian-German mathematicianMarcus Schlesinger, Israeli swimmerPiero Schlesinger (1930–2020), Italian banker and lawyerRudolf Schlesinger (1909–1996), German-born Professor of Comparative Law at Cornell University, Director of the Cornell Common Core ProjectT.E. (Ed) Schlesinger, American engineer and physicistWalter Schlesinger (1908–1984), German historianThings that are named after people with this surname:Leon Schlesinger Productions, the 1933 founding name of The Warner Bros. animation division, named after Leon SchlesingerSchlesinger (crater), a lunar impact crater on the far side of the MoonSchlesinger Building, a skyscraper in Braamfontein, Johannesburg, South AfricaSchlesinger institute, Research institute for Jewish medical ethics, named after Falk Schlesinger M.D.Schlesinger Library, a research library at the Radcliffe Institute for Advanced Study, Harvard University, named after Arthur M. Schlesinger, Sr."
Cassavetes,"John Nicholas Cassavetes ( KASS-ə-VET-eez; Greek: Ιωάννης Νικόλαος Κασσαβέτης, romanized: Ioánnis Nikólaos Kassavétis; December 9, 1929 – February 3, 1989) was a Greek-American actor, film director, and screenwriter. First known as a television and film actor, Cassavetes also helped pioneer American independent cinema, writing and directing movies financed partly by income from his acting work. AllMovie called him ""an iconoclastic maverick,"" while The New Yorker suggested in 2013 that he ""may be the most influential American director of the last half century.""As an actor, Cassavetes starred in notable Hollywood films throughout the 1950s and 1960s, including Edge of the City (1957), The Dirty Dozen (1967), and Rosemary's Baby (1968). He began his directing career with the 1959 independent feature Shadows and followed with independent productions such as Faces (1968), Husbands (1970), A Woman Under the Influence (1974), Opening Night (1977), and Love Streams (1984). He intermittently continued to work on studio projects such as Elaine May's Mikey and Nicky (1976) and his own Gloria (1980).Cassavetes's films employed an actor-centered approach which prioritized raw character examination and ""small feelings"" over traditional Hollywood storytelling or stylized production values. His films became associated with an improvisational, cinéma vérité aesthetic. He collaborated frequently with a rotating group of friends, crew members, and actors, including his wife Gena Rowlands, Peter Falk, Ben Gazzara, and Seymour Cassel. Many of his films were shot and edited in his and Rowland's own Los Angeles home.For his role in The Dirty Dozen, Cassavetes received a nomination for the Academy Award for Best Supporting Actor. As a filmmaker, he was nominated for the Academy Award for Best Original Screenplay for Faces (1968)and the Academy Award for Best Director  for A Woman Under the Influence (1974). The Independent Spirit Awards named the John Cassavetes Award in his honor."
Harron,"Mary Harron (born January 12, 1953) is a Canadian filmmaker and screenwriter, and former entertainment critic. She gained recognition for her role in writing and directing several independent films, including I Shot Andy Warhol (1996), American Psycho (2000), and The Notorious Bettie Page (2005). She co-wrote American Psycho and The Notorious Bettie Page with Guinevere Turner."
Kurosawa,"Akira Kurosawa (Japanese: 黒澤 明, Hepburn: Kurosawa Akira, March 23, 1910 – September 6, 1998) was a Japanese filmmaker and painter who directed thirty films in a career spanning over five decades. He is regarded as one of the most important and influential filmmakers in film history.Kurosawa entered the Japanese film industry in 1936, following a brief stint as a painter. After years of working on numerous films as an assistant director and scriptwriter, he made his debut as a director during World War II with the popular action film Sanshiro Sugata. After the war, the critically acclaimed Drunken Angel (1948), in which Kurosawa cast the then little-known actor Toshiro Mifune in a starring role, cemented the director's reputation as one of the most important young filmmakers in Japan. The two men would go on to collaborate on another fifteen films.Rashomon, which premiered in Tokyo, became the surprise winner of the Golden Lion at the 1951 Venice Film Festival. The commercial and critical success of that film opened up Western film markets for the first time to the products of the Japanese film industry, which in turn led to international recognition for other Japanese filmmakers. Kurosawa directed approximately one film per year throughout the 1950s and early 1960s, including a number of highly regarded (and often adapted) films, such as Ikiru (1952), Seven Samurai (1954) and Yojimbo (1961). After the 1960s he became much less prolific; even so, his later work—including two of his final films, Kagemusha (1980) and Ran (1985)—continued to receive great acclaim.In 1990, he accepted the Academy Award for Lifetime Achievement. Posthumously, he was named ""Asian of the Century"" in the ""Arts, Literature, and Culture"" category by AsianWeek magazine and CNN, cited there as being among the five people who most prominently contributed to the improvement of Asia in the 20th century. His career has been honored by many retrospectives, critical studies and biographies in both print and video, and by releases in many consumer media."
Hill,"A still is an apparatus used to distill liquid mixtures by heating to selectively boil and then cooling to condense the vapor. A still uses the same concepts as a basic distillation apparatus, but on a much larger scale. Stills have been used to produce perfume and medicine, water for injection (WFI) for pharmaceutical use, generally to separate and purify different chemicals, and to produce distilled beverages containing ethanol."
Demme,None
Lynch,None
Zwick,"Edward M. Zwick (born October 8, 1952) is an American filmmaker and producer of film and television. He has worked primarily in the comedy-drama and epic historical film genres, including About Last Night, Glory, Legends of the Fall, and The Last Samurai. He is also the co-creator of the television series thirtysomething and Once and Again.Zwick's body of work has earned numerous accolades, including an Academy Award and BAFTA Award for Best Picture as a producer, and Primetime Emmy Awards for Outstanding Drama Series, Outstanding Writing in a Limited Series, and Outstanding Dramatic Special. He has additionally been nominated for multiple Golden Globe Awards."
Caton-Jones,"Michael Caton-Jones (born Michael Jones; 15 October 1957) is a Scottish director and producer of film and television. His credits include Memphis Belle, a World War II film, the romantic comedy Doc Hollywood, the biographical drama This Boy's Life, the historical epic Rob Roy, the action thriller The Jackal, and an erotic thriller sequel, Basic Instinct 2. He also helmed the Channel 4 miniseries World Without End."
Stockwell,"Stockwell is a district in South West London, England, located in the London Borough of Lambeth. It is situated 2.4 miles (3.9 km) south of Charing Cross. Battersea, Brixton, Clapham, South Lambeth, Oval and Kennington all border Stockwell."
Keaton,"Joseph Frank ""Buster"" Keaton (October 4, 1895 – February 1, 1966) was an American actor, comedian and filmmaker. He is best known for his silent films, in which his trademark was physical comedy with a consistently stoic, deadpan expression that earned him the nickname ""The Great Stone Face"". Critic Roger Ebert wrote of Keaton's ""extraordinary period from 1920 to 1929"" when he ""worked without interruption"" as having made him ""the greatest actor-director in the history of the movies"". In 1996, Entertainment Weekly recognized Keaton as the seventh-greatest film director, and in 1999 the American Film Institute ranked him as the 21st-greatest male star of classic Hollywood cinema.Working with independent producer Joseph M. Schenck, Keaton made a series of successful two-reel comedies in the early 1920s, including One Week (1920), The Playhouse (1921), Cops (1922), and The Electric House (1922). He then moved to feature-length films; several of them, such as Sherlock Jr. (1924), The General (1926), and The Cameraman (1928), remain highly regarded. The General is widely viewed as his masterpiece: Orson Welles considered it ""the greatest comedy ever made...and perhaps the greatest film ever made"". His career declined when he signed with Metro-Goldwyn-Mayer and lost his artistic independence. His wife divorced him, and he descended into alcoholism. He recovered in the 1940s, remarried, and revived his career as an honored comic performer for the rest of his life, earning an Academy Honorary Award in 1959."
Rosenberg,None
Ramis,None
Zemeckis,"Robert Lee Zemeckis (born May 14, 1951) is an American film director, producer, and screenwriter. He first came to public attention as the director of the action-adventure romantic comedy Romancing the Stone (1984), the science-fiction comedy Back to the Future film trilogy (1985–90), and the live-action/animated comedy Who Framed Roger Rabbit (1988). He subsequently directed the satirical black comedy Death Becomes Her (1992) and then diversified into more dramatic fare, including Forrest Gump (1994), for which he won the Academy Award for Best Director and the film won Best Picture. He has directed films across a wide variety of genres, for both adults and families.Zemeckis is regarded as an innovator in visual effects. His exploration of state-of-the-art special effects includes the early use of insertion of computer graphics into live-action footage in Back to the Future Part II (1989) and Forrest Gump, the insertion of hand-drawn animation into live-action footage in Who Framed Roger Rabbit, and the pioneering performance capture techniques seen in The Polar Express (2004), Monster House (2006), Beowulf (2007), A Christmas Carol (2009), and Welcome to Marwen (2018). Though interest in Zemeckis has at times been solely limited to his work with special effects, his work has been praised by several film critics, including David Thomson, who wrote that ""no other contemporary director has used special effects to more dramatic and narrative purpose."""
Meyer,"The metre (Commonwealth spelling) or meter (American spelling; see spelling differences) (from the French unit mètre, from the Greek noun μέτρον, ""measure"") is the base unit of length in the International System of Units (SI). The SI unit symbol is m.The metre is currently defined as the length of the path travelled by light in a vacuum in 1/299 792 458 of a second.The metre was originally defined in 1793 as one ten-millionth of the distance from the equator to the North Pole along a great circle, so the Earth's circumference is approximately 40000 km. In 1799, the metre was redefined in terms of a prototype metre bar (the actual bar used was changed in 1889). In 1960, the metre was redefined in terms of a certain number of wavelengths of a certain emission line of krypton-86. The current definition was adopted in 1983 and modified slightly in 2002 to clarify that the metre is a measure of proper length."
Rogers,"Roger  is a given name, usually masculine, and a surname. The given name is derived from the Old French personal names Roger and Rogier. These names are of Germanic origin, derived from the elements hrōd, χrōþi (""fame"", ""renown"", ""honour"") and gār, gēr (""spear"", ""lance"") (Hrōþigēraz). The name was introduced into England by the Normans. In Normandy,the Frankish name had been reinforced by the Old Norse cognate Hróðgeirr. The name introduced into England replaced the Old English cognate Hroðgar. Roger became a very common given name during the Middle Ages. A variant form of the given name Roger that is closer to the name’s origin is Rodger."
DeSica,"Vittorio De Sica ( də SEE-kə, Italian: [vitˈtɔːrjo de ˈsiːka]; 7 July 1901 – 13 November 1974) was an Italian director and actor, a leading figure in the neorealist movement.Four of the films he directed won Academy Awards: Sciuscià and Bicycle Thieves (honorary), while Yesterday, Today and Tomorrow and Il giardino dei Finzi Contini won the Academy Award for Best Foreign Language Film. Indeed, the great critical success of Sciuscià (the first foreign film to be so recognized by the Academy of Motion Picture Arts and Sciences) and Bicycle Thieves helped establish the permanent Best Foreign Film Award. These two films are considered part of the canon of classic cinema. Bicycle Thieves was cited by Turner Classic Movies as one of the 15 most influential films in cinema history.De Sica was also nominated for the 1957 Oscar for Best Supporting Actor for playing Major Rinaldi in American director Charles Vidor's 1957 adaptation of Ernest Hemingway's A Farewell to Arms, a movie that was panned by critics and proved a box office flop. De Sica's acting was considered the highlight of the film."
Levinson,"Levinson is an Ashkenazi Jewish surname meaning ""son of Levi"". Notable people with the surname include:André Levinson (1887–1933), French dance journalistArik Levinson, American economistArthur D. Levinson (born 1950), American businessmanDaniel Levinson (1920–1994), American psychologistEric L. Levinson, American judgeFeodor Levinson-Lessing (1861–1939), Russian geologistGerald Levinson (born 1951), American composerHarold Levinson, American dyslexia researcherHorace Clifford Levinson (1895–1968), American mathematicianJerrold Levinson (born 1948), American philosophy professorJessica Levinson, American law professorJoel Moss Levinson (born 1979/1980), American comedianJonathan Levinson, fictional character (Buffy the Vampire Slayer)Mark LevinsonMark Levinson (born 1946), American audio equipment designer (Mark Levinson Audio Systems)Mark Levinson, American film directorNathan Levinson (1888–1952), American sound engineerNorman Levinson (1912–1975), American mathematicianPaul Levinson (born 1947), American authorRichard Levinson (1934–1987), American writer and producerRobert Levinson (born 1948; disappeared 2007), American DEA and FBI agentRonald B. Levinson (1896–1980), American philosopherSam Levinson (born 1985), American actorSanford Levinson (born 1941), American law professorStephen C. Levinson (born 1947), British linguistSteven H. Levinson (born 1946), American judgeThe variants Levinsohn and Lewinsohn may refer to:Isaac Baer Levinsohn (1788–1860), Ukrainian-Hebrew scholar and writerJoshua Lewinsohn (born 1833; death date unknown), Russian teacher and writerRoss Levinsohn, American media executive"
Lee,None
Reggio,"Reggio di Calabria (Southern Calabrian: Riggiu; Calabrian Greek: Ρήγι, romanized: Rìji), usually referred to as Reggio Calabria, or simply Reggio by its inhabitants, is the largest city in Calabria. It has an estimated population of nearly 200,000 and is the twenty-first most populous city in Italy, after Modena, and the 100th most populated city in Europe. Reggio Calabria is located in the exact center of the Mediterranean and is known for its climate, ethnic and cultural diversity. It is the third economic centre of mainland Southern Italy. About 560,000 people live in the metropolitan area, recognised in 2015 by Italian Republic as a metropolitan city.Reggio is located on the ""toe"" of the Italian Peninsula and is separated from the island of Sicily by the Strait of Messina. It is situated on the slopes of the Aspromonte, a long, craggy mountain range that runs up through the centre of the region.As a major functional pole in the region, it has strong historical, cultural and economic ties with the city of Messina, which lies across the strait in Sicily, forming a metro city of less than 1 million people.Reggio is the oldest city in the region, and during ancient times, it was an important and flourishing colony of Magna Graecia. Reggio has a modern urban system, set up after the catastrophic earthquake of 1908, which destroyed most of the city. Before that seismic event, the region has been subject to several other previous earthquakes.It is a major economic centre for regional services and transport on the southern shores of the Mediterranean. Reggio, with Naples and Taranto, is home to one of the most important archaeological museums, the prestigious National Archaeological Museum of Magna Græcia, dedicated to Ancient Greece (which houses the Bronzes of Riace, rare example of Greek bronze sculpture, which became one of the symbols of the city). Reggio is the seat, since 1907, of the Archeological Superintendence of Bruttium and Lucania. The city is home to football club Reggina, that previously played in the Italian top flight.The city centre, consisting primarily of Liberty buildings, has a linear development along the coast with parallel streets, and the promenade is dotted with rare magnolias and exotic palms. Reggio has commonly used popular nicknames: The ""city of Bronzes"", after the Bronzes of Riace that are testimonials of its Greek origins; the ""city of bergamot"", which is exclusively cultivated in the region; and the ""city of Fatamorgana"", an optical phenomenon visible in Italy only from the Reggio seaside."
Coen,None
Winkler,"Henry Franklin Winkler (born October 30, 1945) is an American actor, comedian, author, executive producer, and director. Initially rising to fame as Arthur ""Fonzie"" Fonzarelli on the American television series Happy Days, Winkler has distinguished himself as  a character actor for roles such as Arthur Himbry in Scream, Coach Klein in Adam Sandler's The Waterboy, Barry Zuckerkorn in Arrested Development, Dr. Saperstein in Parks and Recreation, Eddie R. Lawson in Royal Pains, Fritz in Monsters at Work, Uncle Joe in The French Dispatch, and Gene Cousineau in Barry. He is the recipient of a number of accolades, including a Primetime Emmy, two Daytime Emmys, two Golden Globe Awards, and one Critics Choice Award.As a child, Winkler struggled at P.S. 87 on West 78th Street, Manhattan and the McBurney School, where he was berated for his poor academic performance. He then studied theater at both Emerson College and the Yale School of Drama, spent a year and half with the Yale Repertory Theater, did regional theater and commercial work, and appeared in two independent films. After saving enough money, he traveled to California in September 1973, and won a small role on The Mary Tyler Moore Show. He also auditioned for Happy Days and won the part of Arthur ""Fonzie"" Fonzarelli, a role he portrayed for the next ten years. During his time on Happy Days, Winkler was diagnosed as dyslexic.After the end of Happy Days, Winkler found himself typecast and moved into producing and directing. In this capacity, he was directly involved in the development of the original MacGyver and worked on programs such as  Sightings and The Hollywood Squares. He also directed the theatrical releases Memories of Me with Billy Crystal and Cop and a Half with Burt Reynolds. In 2003, he drew upon his childhood struggles with dyslexia to co-write the Hank Zipzer series of children's books with children's literature author Lin Oliver. Winkler also appeared as Mr. Rock in the BBC adaptation of the series. Winkler and Oliver next created the prequel series Here's Hank, the Ghost Buddy series, and the Alien Superstar series. In 2016, he became a reality television star on the NBC series, Better Late Than Never.Winkler has been honored both for his role as ""The Fonz"", and for his work with dyslexia through the Hank Zipzer series. In 1980, he donated one of Fonzie's leather jackets to the National Museum of American History, Smithsonian Institution. In 1981, he received a star on the Hollywood Walk of Fame, and in 2008, The Bronze Fonz was unveiled along the Milwaukee Riverwalk. In 2011, he was appointed an Honorary Officer of the Order of the British Empire  by Queen Elizabeth, and was named one of the United Kingdom's Top 10 Literacy Heroes in 2013."
Romanek,"Mark Romanek (; born September 18, 1959) is an American filmmaker whose directing work includes feature films, television, music videos and commercials. Romanek wrote and directed the 2002 film One Hour Photo and directed the 2010 film Never Let Me Go. His most notable music videos include ""Hurt"" (Johnny Cash), ""Closer"" (Nine Inch Nails), ""Can't Stop"" (Red Hot Chili Peppers), ""Rain"" (Madonna), ""Bedtime Story"" (Madonna), ""Scream"" (Michael & Janet Jackson), ""Criminal"" (Fiona Apple), and ""Shake It Off"" (Taylor Swift). He also co-directed ""Sandcastles"" from Beyoncé’s Lemonade album. Romanek's music videos have won 20 MTV Video Music Awards, including Best Direction for Jay-Z's ""99 Problems"", and he has won three Grammy Awards for Best Short Form Music Video – more than any other director."
Morris,None
Farrelly,"Peter John Farrelly (born December 17, 1956) is an American film director, screenwriter, producer and novelist. Along with his brother Bobby, the Farrelly brothers are mostly famous for directing and producing quirky comedy and romantic comedy films such as Dumb and Dumber; Shallow Hal; Me, Myself and Irene; There's Something About Mary; and the 2007 remake of The Heartbreak Kid. On his own in 2018 Farrelly co-wrote and directed the comedy-drama Green Book, which won the Audience Award at the Toronto International Film Festival in 2018. For his work on the film, he also won the Golden Globe Award for Best Screenplay and the Academy Awards for Best Picture and Best Original Screenplay."
Demme,None
