class\u003dxl36 style\u003d\u0027mso-ignore:colspan\u0027\u003e,None
Gosnell,"Kermit Barron Gosnell (born February 9, 1941) is an American former physician and convicted murderer. Gosnell was convicted of the murders of three infants who were born alive after using drugs to induce birth, was convicted of manslaughter in connection with the death of one woman during an abortion procedure, and was convicted of several other medically related crimes.Gosnell, based in the Mantua neighborhood of Philadelphia, Pennsylvania, owned and operated the Women's Medical Society Clinic, a non-compliant abortion clinic that was dubbed a ""house of horrors"" during the trial. He was a prolific prescriber of OxyContin. In 2011, Gosnell, his wife Pearl and eight employees were charged with a total of 32 felonies and 227 misdemeanors in connection with deaths, illegal medical services and regulatory violations. Pearl and the eight employees pleaded guilty to various charges in 2011 while Gosnell pleaded not guilty and sought a jury trial.In May 2013, Gosnell was convicted of first degree murder in the deaths of three of the infants and involuntary manslaughter in the death of Karnamaya Mongar, an adult patient at the clinic following an abortion procedure. Gosnell was also convicted of 21 felony counts of illegal late-term abortion, and 211 counts of violating Pennsylvania's 24-hour informed consent law. After his conviction, Gosnell waived his right to appeal in exchange for an agreement by prosecutors not to seek the death penalty. He was sentenced to life in prison without parole. Gosnell was sentenced to an additional 30 years in prison for federal drug charges."
Aronofsky,"Darren Aronofsky (born February 12, 1969) is an American film director, producer, and screenwriter. His films are noted for their surrealism, melodramatic, and disturbing elements, often based in psychological fictions.Aronofsky attended Harvard University, where he studied film and social anthropology, and then the American Film Institute where he studied directing. He won several film awards after completing his senior thesis film, Supermarket Sweep, which went on to become a National Student Academy Award finalist. Aronofsky's feature debut, the surrealist psychological thriller Pi, was shot in November 1997. The low-budget, $60,000 production, starring Sean Gullette, was sold to Artisan Entertainment for $1 million, and grossed over $3 million; Aronofsky won the Directing Award at the 1998 Sundance Film Festival and an Independent Spirit Award for Best First Screenplay.Aronofsky's follow-up, the psychological drama Requiem for a Dream, was based on the novel of the same name by Hubert Selby Jr. The film garnered strong reviews and received an Academy Award nomination for Ellen Burstyn's performance. After writing the World War II horror film Below, Aronofsky began production on his third film, the romantic fantasy sci-fi drama The Fountain. The film received mixed reviews and performed poorly at the box-office, but has since garnered a cult following.His fourth film, the sports drama The Wrestler, was released to critical acclaim and both of the film's stars, Mickey Rourke and Marisa Tomei, received Academy Award nominations. In 2010, his fifth feature film, the psychological horror film Black Swan, received further critical acclaim and many accolades, being nominated for five Academy Awards, including Best Picture and Best Director; Natalie Portman won Best Actress for her performance in the film. Aronofsky also received nominations for Best Director at the Golden Globes, and a Directors Guild of America Award nomination for his work on Black Swan. Aronofsky's sixth film, the biblically inspired epic Noah, was released in 2014, becoming Aronofsky's first film to open at No.1 at the box office. His seventh film, the psychological horror mother! (2017), sparked controversy upon release due to its biblical allegories and depiction of violence, and polarized audiences."
Fincher,None
Norton?,None
Anderson,None
Wachowski,"Lana Wachowski (born June 21, 1965, formerly known as Larry Wachowski) and Lilly Wachowski (born December 29, 1967, formerly known as Andy Wachowski) are American film and television directors, writers and producers. The sisters are both trans women.Collectively known as the Wachowskis (), the sisters have worked as a writing and directing team through most of their careers. They made their directing debut in 1996 with Bound, and achieved fame with their second film The Matrix (1999), a major box office success for which they won the Saturn Award for Best Director. They wrote and directed its two sequels, The Matrix Reloaded and The Matrix Revolutions (both in 2003), and were involved in the writing and production of other works in the Matrix franchise.Following the commercial success of the Matrix series, the Wachowskis wrote and produced the 2005 film V for Vendetta (an adaptation of the graphic novel by Alan Moore and David Lloyd), and in 2008 released the film Speed Racer, a live-action adaptation of the Japanese anime series. Their next film, Cloud Atlas, based on the novel by David Mitchell and co-written and co-directed by Tom Tykwer, was released in 2012. Their film Jupiter Ascending and the Netflix series Sense8, which they co-created with J. Michael Straczynski, debuted in 2015; the second season of Sense8 ended the series in 2018 and was Lana's first major creative undertaking without Lilly.Since the series finale of Sense8, the Wachowskis have been working separately on different projects: Lilly directed, wrote, and executive-produced several episodes of Showtime's Work in Progress (2019) with creators Abby McEnany and Tim Mason, while Lana filmed The Matrix Resurrections, written with Mitchell and Aleksandar Hemon, which was released in December 2021."
Kitchell,"Kitchell is a surname. Notable people with the surname include:Aaron Kitchell (1744–1820), U.S. Representative and SenatorAbdul Kitchell (born 1916), Hong Kong international lawn bowlerAlma Kitchell (1893–1996), American concert singerHudson Mindell Kitchell (1862–1944), American artistIva Kitchell (1908–1983), concert dancerSonya Kitchell (born 1989), American jazz singer-songwriterWebster Kitchell (1931–2009), theologianWickliffe Kitchell (1789–1869), American politician and lawyer"
Mamet,"David Alan Mamet (; born November 30, 1947) is an American playwright, filmmaker, and author. He won a Pulitzer Prize and received Tony nominations for his plays Glengarry Glen Ross (1984) and Speed-the-Plow (1988). He first gained critical acclaim for a trio of off-Broadway 1970s plays: The Duck Variations, Sexual Perversity in Chicago, and American Buffalo. His plays Race and The Penitent, respectively, opened on Broadway in 2009 and previewed off-Broadway in 2017.Feature films that Mamet both wrote and directed include House of Games (1987), Homicide (1991), The Spanish Prisoner (1997), and his biggest commercial success, Heist (2001). His screenwriting credits include The Postman Always Rings Twice (1981), The Verdict (1982), The Untouchables (1987), Hoffa (1992), Wag the Dog (1997), and Hannibal (2001). Mamet himself wrote the screenplay for the 1992 adaptation of Glengarry Glen Ross, and wrote and directed the 1994 adaptation of his play Oleanna (1992). He was the executive producer and a frequent writer for the TV show The Unit (2006–2009).Mamet's books include: On Directing Film (1991), a commentary and dialogue about film-making; The Old Religion (1997), a novel about the lynching of Leo Frank; Five Cities of Refuge: Weekly Reflections on Genesis, Exodus, Leviticus, Numbers and Deuteronomy (2004), a Torah commentary with Rabbi Lawrence Kushner; The Wicked Son (2006), a study of Jewish self-hatred and antisemitism; Bambi vs. Godzilla, a commentary on the movie business; The Secret Knowledge: On the Dismantling of American Culture (2011), a commentary on cultural and political issues; and Three War Stories (2013), a trio of novellas about the physical and psychological effects of war."
Farrelly,"Peter John Farrelly (born December 17, 1956) is an American film director, screenwriter, producer and novelist. Along with his brother Bobby, the Farrelly brothers are mostly famous for directing and producing quirky comedy and romantic comedy films such as Dumb and Dumber; Shallow Hal; Me, Myself and Irene; There's Something About Mary; and the 2007 remake of The Heartbreak Kid. On his own in 2018 Farrelly co-wrote and directed the comedy-drama Green Book, which won the Audience Award at the Toronto International Film Festival in 2018. For his work on the film, he also won the Golden Globe Award for Best Screenplay and the Academy Awards for Best Picture and Best Original Screenplay."
Weitz,"Weitz is a German surname. Notable people with the surname include:Brian Weitz (born 1979), American musicianBruce Weitz (born 1943), American actorChris Weitz (born 1969), Academy Award nominated producer, writer and directorDavid A. Weitz (born 1951), American physicistEduard Weitz (born 1946), Israeli Olympic weightlifterJeffrey Weitz, contemporary Canadian biochemistJohn Weitz, (1923–2002), American fashion designer, historian and novelistJulie Weitz (born 1979), American virtual artistKristine Weitz (born 1962), American singer and songwriterMargaret Weitz (born 1929), American cultural scientistMark Weitz (born 1945), keyboard playerMorris Weitz (1916-1981), American aestheticianPaul J. Weitz (1932–2017), American astronautPaul Weitz (filmmaker) (born 1965), American filmmakerPerry Weitz, contemporary American lawyerYechiam Weitz (born 1951), Israeli historianYosef Weitz (1890–1972), director of the Land and Afforestation Department of the Jewish National Fund"
Hackford,"Taylor Edwin Hackford (born December 31, 1944) is an American film director and former president of the Directors Guild of America. He won the Academy Award for Best Live Action Short Film for Teenage Father (1979). Hackford went on to direct a number of highly regarded feature films, most notably An Officer and a Gentleman (1982) and Ray (2004), the latter of which saw him nominated for the Academy Award for Best Director and the Academy Award for Best Picture."
Shyamalan,"Manoj Nelliyattu ""M. Night"" Shyamalan ( SHAH-mə-lahn; born August 6, 1970) is an Indian-American filmmaker and actor. He is best known for making original films with contemporary supernatural plots and twist endings. He was born in Mahé, India, and raised in Penn Valley, Pennsylvania. The cumulative gross of his films exceeds $3.3 billion globally.He made his directorial debut in 1992 with his first movie Praying with Anger. His second movie was the comedy-drama film Wide Awake (1998). His best-received films include the supernatural thriller The Sixth Sense (1999), the superhero thriller Unbreakable (2000), the science fiction thriller Signs (2002), and the period-piece thriller The Village (2004). For The Sixth Sense, Shyamalan received nominations for the Academy Award for Best Director and the Academy Award for Best Original Screenplay. Afterward, Shyamalan released a series of poorly received but sometimes financially successful films, including  the dark fantasy Lady in the Water (2006), the eco-thriller The Happening (2008), The Last Airbender (2010) (an adaptation based on the first season of the Nickelodeon animated television series Avatar: The Last Airbender), and the science fiction film After Earth (2013).Following the financial failure of After Earth, Shyamalan's career was revived with the release of the found footage horror film The Visit (2015), the psychological thriller Split (2016), and the superhero thriller Glass (2019). With a total budget of $34 million between them, these three films earned a combined box office of $625 million. Glass is the third and final chapter of his Eastrail 177 trilogy, which commenced in 2000. His latest feature film was the supernatural thriller Old, which was released in 2021 and grossed $90 million on a budget of $18 million.In addition to his directorial work, Shyamalan was story creator and a producer for the horror film Devil (2010). Shyamalan was also called in for an uncredited rewrite for the teen film She's All That (1999) and also served as a writer for the film Stuart Little (1999). He is also one of the executive producers and occasional director of Wayward Pines and the critically acclaimed series Servant, for which he also serves as showrunner.Shyamalan is also known for setting and shooting his films in and around Philadelphia, Pennsylvania along with nearby Reading, Pennsylvania. Most of his commercially successful films were co-produced and released by Walt Disney Studios' Touchstone and Hollywood Pictures and Universal imprints. In 2008, Shyamalan was honored with the Padma Shri award by the Government of India."
Ratner,None
Reynolds,None
Kasdan,"Lawrence Edward Kasdan (born January 14, 1949) is an American filmmaker. He is the co-writer of the Star Wars films The Empire Strikes Back (1980), Return of the Jedi (1983), The Force Awakens (2015), and Solo: A Star Wars Story (2018). He co-wrote Raiders of the Lost Ark (1981) and The Bodyguard (1992), and is the writer-director of Body Heat (1981), The Big Chill (1983), Silverado (1985), The Accidental Tourist (1988), and Dreamcatcher (2004). He is known for updating old Hollywood genres—film noir, science-fiction, westerns—in a classical dramatic style with quick-witted dialogue, but dealing with contemporary social themes. As a director, he has made various personal films that examine characters and generations.Kasdan has been nominated for four Academy Awards: as a producer for Best Picture nominee The Accidental Tourist, for which he was also nominated for Best Adapted Screenplay, and for Best Original Screenplay for both The Big Chill and Grand Canyon (1991). He has often collaborated with his wife, Meg Kasdan, his brother, Mark Kasdan, and his two sons: Jonathan Kasdan and Jake Kasdan. He frequently casts Kevin Kline and William Hurt in his films."
Leder,"The German word Leder means and corresponds to English word leather. As a surname, it may refer to:Johann Heinrich Leder, established the Lichte porcelain (GmbH) in Lichte ThuringiaHerbert J. LederMimi Leder, film directorPhilip LederNirenberg and Leder experiment, named after himMarc J. Leder, American businessman and Republican donorStephan Hermlin, born Rudolf LederOther uses include:Leder, a fictional character in Mother 3."
Anderson,None
Scott,None
Jackson,None
Scorsese,"Martin Charles Scorsese (; Italian: [skorˈseːze, -se]; born November 17, 1942) is an American film director, producer, and screenwriter. He is the recipient of many accolades, including an Academy Award, three Primetime Emmy Awards, a Grammy Award, four British Academy Film Awards, three Golden Globe Awards, and two Directors Guild of America Awards. Scorsese has received various honors including the AFI Life Achievement Award in 1997, the Kennedy Center Honor in 2007, and the BAFTA Fellowship in 2012. Five of his films have been inducted into the National Film Registry by the Library of Congress as ""culturally, historically or aesthetically significant"". Scorsese received an MA from New York University's Steinhardt School of Culture, Education, and Human Development in 1968. His directorial debut, Who's That Knocking at My Door (1967), was accepted into the Chicago Film Festival. In the 1970s and 1980s decades, Scorsese emerged as one of the major figures of the New Hollywood era. Scorsese's films, much influenced by his Italian-American background and upbringing in New York City, center on macho-posturing insecure men and explore crime, machismo, nihilism, and Catholic concepts of guilt and redemption. His trademark styles include extensive use of slow motion and freeze frames, graphic depictions of extreme violence, and liberal use of profanity.His 1973 crime film Mean Streets, dealing with machismo and violence, and exploring Catholic concepts of guilt and redemption, was a blueprint for his filmmaking styles. Scorsese won the Palme d'Or at Cannes with his 1976 psychological thriller Taxi Driver, which starred Robert De Niro, who became associated with Scorsese through eight more films including New York, New York (1977), Raging Bull (1980) The King of Comedy (1982), Goodfellas (1990), and Casino (1995). In the 2000s and 2010s decades, Scorsese garnered critical acclaim and box office success with a series of collaborations with Leonardo DiCaprio. These films include Gangs of New York (2002), The Aviator (2004), The Departed (2006), Shutter Island (2010) and The Wolf of Wall Street (2013). Returning to his familiar territory of crime films, Scorsese collaborated with De Niro again on The Irishman (2019). Scorsese's other film work includes the black comedy After Hours (1985), the romantic drama The Age of Innocence (1993), the children's adventure drama Hugo (2011), and the religious epics The Last Temptation of Christ (1988), Kundun (1997) and Silence (2016). In addition to film, Scorsese has directed episodes for some television series including Boardwalk Empire (2011-2015), and Vinyl (2016), and the documentaries Public Speaking (2010), and Pretend It's a City (2021). He is also known for several rock music documentaries including The Last Waltz (1978), No Direction Home (2005), Shine a Light (2008), and George Harrison: Living in the Material World (2011). An advocate for film preservation and restoration, he founded three nonprofit organizations: the Film Foundation in 1990, the World Cinema Foundation in 2007, and the African Film Heritage Project in 2017."
Mitchell,None
Lahti,"Lahti (Finnish pronunciation: [ˈlɑhti]; Swedish: Lahtis) is a city and municipality in Finland. It is the capital of the region of Päijänne Tavastia (Päijät-Häme) and its growing region is one of the main economic hubs of Finland. Lahti is situated on a bay at the southern end of lake Vesijärvi about 100 kilometres (60 mi) north-east of the capital city Helsinki, 38 kilometres (24 mi) south-west of the Heinola town and 74 kilometres (46 mi) east of Hämeenlinna, the capital of the region of Tavastia Proper (Kanta-Häme). It is also situated at the intersection of Highway 4 (between Helsinki and Jyväskylä) and Highway 12 (between Tampere and Kouvola), which are the most significant main roads of Lahti.In English, the Finnish word Lahti literally means bay. Lahti is also dubbed the ""Chicago of Finland"" due to the early industries of both cities, when they were known as ""slaughterhouse cities"". Also, the troubled history of both cities in the field of crime has been seen as one of the similarities.Lahti is a long-time pioneering city in environmental sustainability, dating back to as early as 1990 and before. The European Commission has named Lahti as the European Green Capital of 2021.The coat of arms of the city depicts a train wheel surrounded by flames."
Avildsen,"Ashley ""Ash"" Avildsen (born November 5, 1981) is an American film director, screenwriter, producer, and the founder and CEO of Sumerian Records and Sumerian Films. The son of director John G. Avildsen, he wrote and directed the films What Now (2015) and American Satan (2017). Avildsen also played a lead role in What Now and is responsible for numerous nationwide tours such as Summer Slaughter, All Stars Tour, Thrash and Burn, and more."
Rodriguez,None
Kastner,"Jean-Guy ""John"" Kastner (born 12 August 1969) is a Canadian musician and composer born in Beaconsfield, Quebec. He is the singer for Montreal hardcore punk band the Asexuals as well as singer-guitarist for Montreal alternative band Doughboys and alternative band All Systems Go!. He is also the manager and former rhythm guitarist for the band Men Without Hats."
Chandrasekhar,"Subrahmanyan Chandrasekhar  (pronunciation) (19 October 1910 – 21 August 1995) was an Indian-American astrophysicist who spent his professional life in the United States. He shared the 1983 Nobel Prize for Physics with William A. Fowler for ""...theoretical studies of the physical processes of importance to the structure and evolution of the stars"". His mathematical treatment of stellar evolution yielded many of the current theoretical models of the later evolutionary stages of massive stars and black holes. The Chandrasekhar limit is named after him.Chandrasekhar worked on a wide variety of problems in physics during his lifetime, contributing to the contemporary understanding of stellar structure, white dwarfs, stellar dynamics, stochastic process, radiative transfer, the quantum theory of the hydrogen anion, hydrodynamic and hydromagnetic stability, turbulence, equilibrium and the stability of ellipsoidal figures of equilibrium, general relativity, mathematical theory of black holes and theory of colliding gravitational waves. At the University of Cambridge, he developed a theoretical model explaining the structure of white dwarf stars that took into account the relativistic variation of mass with the velocities of electrons that comprise their degenerate matter. He showed that the mass of a white dwarf could not exceed 1.44 times that of the Sun – the Chandrasekhar limit. Chandrasekhar revised the models of stellar dynamics first outlined by Jan Oort and others by considering the effects of fluctuating gravitational fields within the Milky Way on stars rotating about the galactic centre. His solution to this complex dynamical problem involved a set of twenty partial differential equations, describing a new quantity he termed ""dynamical friction"", which has the dual effects of decelerating the star and helping to stabilize clusters of stars. Chandrasekhar extended this analysis to the interstellar medium, showing that clouds of galactic gas and dust are distributed very unevenly.Chandrasekhar studied at Presidency College, Madras (now Chennai) and the University of Cambridge.  A long-time professor at the University of Chicago, he did some of his studies at the Yerkes Observatory, and served as editor of The Astrophysical Journal from 1952 to 1971. He was on the faculty at Chicago from 1937 until his death in 1995 at the age of 84, and was the Morton D. Hull Distinguished Service Professor of Theoretical Astrophysics."
Weisman,"Weißmann (Weissmann, Weiszmann, Waismann) is a German surname meaning ""white man"". Common variants in spelling are Weismann, Weissman, Weisman, Waismann, and Vaisman."
Roach,"F. Hoffmann-La Roche AG, commonly known as Roche, is a Swiss multinational healthcare company that operates worldwide under two divisions: Pharmaceuticals and Diagnostics. Its holding company, Roche Holding AG, has shares listed on the SIX Swiss Exchange. The company headquarters are located in Basel. Roche is the largest pharmaceutical company in the world, and the leading provider of cancer treatments globally.The company controls the American biotechnology company Genentech, which is a wholly owned affiliate, and the Japanese biotechnology company Chugai Pharmaceuticals, as well as the United States-based companies Ventana and Foundation Medicine. Roche's revenues during fiscal year 2020 were 58.32 billion Swiss francs. Descendants of the founding Hoffmann and Oeri families own slightly over half of the bearer shares with voting rights (a pool of family shareholders 45%, and Maja Oeri a further 5% apart), with Swiss pharma firm Novartis owning a further third of its shares. Roche is one of the few companies increasing their dividend every year, for 2020 as the 34th consecutive year. F. Hoffmann-La Roche is a full member of the European Federation of Pharmaceutical Industries and Associations (EFPIA)."
Peterson,None
