Silverman,"Sarah Kate Silverman (born December 1, 1970) is an American comedian, actress, and writer. Her comedy addresses social taboos and controversial topics, including racism, sexism, homophobia, politics, and religion, sometimes having her comic character endorse them in a satirical or deadpan fashion. She has won two Primetime Emmy Awards for her work on television.Silverman was a writer and performer on Saturday Night Live, and she starred in and produced The Sarah Silverman Program, which ran from 2007 to 2010 on Comedy Central, for which she was nominated for a Primetime Emmy Award for Outstanding Lead Actress in a Comedy Series. She released an autobiography The Bedwetter in 2010. She also appeared in other television programs, such as Mr. Show and V.I.P. and starred in films, including Who's the Caboose? (1997), School of Rock (2003), Wreck-It Ralph (2012),  A Million Ways to Die in the West (2014) and Ralph Breaks the Internet (2018). In 2015, she starred in the drama I Smile Back, for which she was nominated for a Screen Actors Guild Award for Outstanding Performance by a Female Actor in a Leading Role.During the 2016 election, she became increasingly politically active; she initially campaigned for Bernie Sanders but later spoke in support of Hillary Clinton at the 2016 Democratic National Convention. She hosted the Hulu streaming television late-night talk show I Love You, America with Sarah Silverman from 2017 until late 2018."
Kornbluth,"Cyril M. Kornbluth (July 2, 1923 – March 21, 1958) was an American science fiction author and a member of the Futurians. He used a variety of pen-names, including Cecil Corwin, S. D. Gottesman, Edward J. Bellin, Kenneth Falconer, Walter C. Davies, Simon Eisner, Jordan Park, Arthur Cooke, Paul Dennis Lavond, and Scott Mariner. The ""M"" in Kornbluth's name may have been in tribute to his wife, Mary Byers; Kornbluth's colleague and collaborator Frederik Pohl confirmed Kornbluth's lack of any actual middle name in at least one interview."
Fincher,None
Sonnenfeld,"Barry Sonnenfeld  (born April 1, 1953) is an American filmmaker and television director. He originally worked as a cinematographer for the Coen brothers before directing films such as The Addams Family (1991) and its sequel Addams Family Values (1993), Get Shorty (1995), the Men in Black trilogy (1997–2012), and Wild Wild West (1999)."
Skolnik,"Merrill Skolnik (November 6, 1927-January 27, 2022) was an American researcher in the area of radar systems and the author or editor of a number of standard texts in the field. He is best known for his introductory text ""Introduction to Radar Systems"" and for editing the ""Radar Handbook"". From 1965 to his retirement in 1996, he worked for the Naval Research Laboratory (NRL) in the US.  Earlier in his career, he worked with the Institute for Defense Analyses, MIT Lincoln Laboratory, and the Johns Hopkins Radiation Laboratory, among other organizations. He is a Fellow of the IEEE and was editor of the Proceedings of the IEEE. In 2000, he was the first recipient of the IEEE Dennis J. Picard Medal for Radar Technologies and Applications. In 1986, he was elected a member of the National Academy of Engineering for contributions to the advancement of radar, and for leadership in radar engineering research and development."
Morris,None
Paxton,None
Gordon,None
Zemeckis,"Robert Lee Zemeckis (born May 14, 1951) is an American film director, producer, and screenwriter. He first came to public attention as the director of the action-adventure romantic comedy Romancing the Stone (1984), the science-fiction comedy Back to the Future film trilogy (1985–90), and the live-action/animated comedy Who Framed Roger Rabbit (1988). He subsequently directed the satirical black comedy Death Becomes Her (1992) and then diversified into more dramatic fare, including Forrest Gump (1994), for which he won the Academy Award for Best Director and the film won Best Picture. He has directed films across a wide variety of genres, for both adults and families.Zemeckis is regarded as an innovator in visual effects. His exploration of state-of-the-art special effects includes the early use of insertion of computer graphics into live-action footage in Back to the Future Part II (1989) and Forrest Gump, the insertion of hand-drawn animation into live-action footage in Who Framed Roger Rabbit, and the pioneering performance capture techniques seen in The Polar Express (2004), Monster House (2006), Beowulf (2007), A Christmas Carol (2009), and Welcome to Marwen (2018). Though interest in Zemeckis has at times been solely limited to his work with special effects, his work has been praised by several film critics, including David Thomson, who wrote that ""no other contemporary director has used special effects to more dramatic and narrative purpose."""
Green,"Green is the color between cyan and yellow on the visible spectrum. It is evoked by light which has a dominant wavelength of roughly 495–570 nm. In subtractive color systems, used in painting and color printing, it is created by a combination of yellow and cyan; in the RGB color model, used on television and computer screens, it is one of the additive primary colors, along with red and blue, which are mixed in different combinations to create all other colors. By far the largest contributor to green in nature is chlorophyll, the chemical by which plants photosynthesize and convert sunlight into chemical energy. Many creatures have adapted to their green environments by taking on a green hue themselves as camouflage. Several minerals have a green color, including the emerald, which is colored green by its chromium content.During post-classical and early modern Europe, green was the color commonly associated with wealth, merchants, bankers and the gentry, while red was reserved for the nobility. For this reason, the costume of the Mona Lisa by Leonardo da Vinci and the benches in the British House of Commons are green while those in the House of Lords are red. It also has a long historical tradition as the color of Ireland and of Gaelic culture. It is the historic color of Islam, representing the lush vegetation of Paradise. It was the color of the banner of Muhammad, and is found in the flags of nearly all Islamic countries.In surveys made in American, European, and Islamic countries, green is the color most commonly associated with nature, life, health, youth, spring, hope, and envy. In the European Union and the United States, green is also sometimes associated with toxicity and poor health, but in China and most of Asia, its associations are very positive, as the symbol of fertility and happiness. Because of its association with nature, it is the color of the environmental movement. Political groups advocating environmental protection and social justice describe themselves as part of the Green movement, some naming themselves Green parties. This has led to similar campaigns in advertising, as companies have sold green, or environmentally friendly, products. Green is also the traditional color of safety and permission; a green light means go ahead, a green card permits permanent residence in the United States."
Hawks,"Hawks are birds of prey of the family Accipitridae. Hawks are widely distributed and vary greatly in size. The subfamily Accipitrinae includes goshawks, sparrowhawks, sharp-shinned hawks and others. This subfamily are mainly woodland birds with long tails and high visual acuity. They hunt by dashing suddenly from a concealed perch.In America, members of the Buteo group are also called hawks; this group is called buzzards in other parts of the world. Generally, buteos have broad wings and sturdy builds. They are relatively larger-winged, shorter-tailed and fly further distances in open areas than accipiters. Buteos descend or pounce on their prey rather than hunting in a fast horizontal pursuit.The terms accipitrine hawk and buteonine hawk are used to distinguish between the types in regions where hawk applies to both. The term ""true hawk""  is sometimes used for the accipitrine hawks in regions where buzzard is preferred for the buteonine hawks.All these groups are members of the family Accipitridae, which includes the hawks and buzzards as well as kites, harriers and eagles. To confuse things further, some authors use ""hawk"" generally for any small to medium Accipitrid that is not an eagle.The common names of some birds include the term ""hawk"", reflecting traditional usage rather than taxonomy. For example, some people may call an osprey a ""fish hawk"" or a peregrine falcon a ""duck hawk""."
Linklater,None
Atkins,None
Hoblit,"Gregory King Hoblit (born November 27, 1944) is an American film director, television director and television producer. He is best known for directing the films Primal Fear, Fallen, Frequency, Hart's War, Fracture, and Untraceable. He has won nine Primetime Emmy Awards for directing and producing Hill Street Blues, NYPD Blue, L.A. Law, Hooperman and the television film Roe vs. Wade.Hoblit was born in Abilene, Texas, the son of Elizabeth Hubbard King and Harold Foster Hoblit, an FBI agent. Much of Hoblit's work is oriented towards police, attorneys and legal cases.Hoblit has directed and produced the pilot and series of such acclaimed television series such as NYPD Blue, L.A. Law and Hill Street Blues. He also wrote an episode of the latter series. Hoblit received Primetime Emmy Awards for his directing of the pilot episodes of Hooperman and L.A. Law.He was married to actress Debrah Farentino from 1994 to 2009. They have one child together."
Besson,"Luc Paul Maurice Besson (French: [lyk bɛsɔ̃]; born 18 March 1959) is a French film director, screenwriter, and producer. He directed or produced the films Subway (1985), The Big Blue (1988), and La Femme Nikita (1990). Besson is associated with the Cinéma du look film movement. He has been nominated for a César Award for Best Director and Best Picture for his films Léon: The Professional (1994) and the English-language The Messenger: The Story of Joan of Arc (1999). He won Best Director and Best French Director for his sci-fi action film The Fifth Element (1997). He wrote and directed the 2014 sci-fi action film Lucy and the 2017 space opera film Valerian and the City of a Thousand Planets.Near the beginning of his career, in 1980 he founded his own production company, Les Films du Loup, later renamed as Les Films du Dauphin. These were superseded in 2000 when he co-founded EuropaCorp film company with his longtime collaborator, Pierre-Ange Le Pogam. As writer, director, or producer, Besson has been involved in the creation of more than 50 films."
Guest,None
Nelson,None
Huang,"Carl Gustav Jung ( YUUNG; born Karl Gustav Jung, German: [kaʁl ˈjʊŋ]; 26 July 1875 – 6 June 1961) was a Swiss psychiatrist and psychoanalyst who founded analytical psychology. Jung's work has been influential in the fields of psychiatry, anthropology, archaeology, literature, philosophy, psychology, and religious studies. Jung worked as a research scientist at the famous Burghölzli hospital, under Eugen Bleuler. During this time, he came to the attention of Sigmund Freud, the founder of psychoanalysis. The two men conducted a lengthy correspondence and collaborated, for a while, on a joint vision of human psychology.Freud saw the younger Jung as the heir he had been seeking to take forward his ""new science"" of psychoanalysis and to this end secured his appointment as President of his newly founded International Psychoanalytical Association. Jung's research and personal vision, however, made it impossible for him to follow his older colleague's doctrine and a schism became inevitable. This division was personally painful for Jung and resulted in the establishment of Jung's analytical psychology as a comprehensive system separate from psychoanalysis.Among the central concepts of analytical psychology is individuation—the lifelong psychological process of differentiation of the self out of each individual's conscious and unconscious elements. Jung considered it to be the main task of human development. He created some of the best known psychological concepts, including synchronicity, archetypal phenomena, the collective unconscious, the psychological complex and extraversion and introversion.Jung was also an artist, craftsman, builder and a prolific writer. Many of his works were not published until after his death and some are still awaiting publication."
Green,"Green is the color between cyan and yellow on the visible spectrum. It is evoked by light which has a dominant wavelength of roughly 495–570 nm. In subtractive color systems, used in painting and color printing, it is created by a combination of yellow and cyan; in the RGB color model, used on television and computer screens, it is one of the additive primary colors, along with red and blue, which are mixed in different combinations to create all other colors. By far the largest contributor to green in nature is chlorophyll, the chemical by which plants photosynthesize and convert sunlight into chemical energy. Many creatures have adapted to their green environments by taking on a green hue themselves as camouflage. Several minerals have a green color, including the emerald, which is colored green by its chromium content.During post-classical and early modern Europe, green was the color commonly associated with wealth, merchants, bankers and the gentry, while red was reserved for the nobility. For this reason, the costume of the Mona Lisa by Leonardo da Vinci and the benches in the British House of Commons are green while those in the House of Lords are red. It also has a long historical tradition as the color of Ireland and of Gaelic culture. It is the historic color of Islam, representing the lush vegetation of Paradise. It was the color of the banner of Muhammad, and is found in the flags of nearly all Islamic countries.In surveys made in American, European, and Islamic countries, green is the color most commonly associated with nature, life, health, youth, spring, hope, and envy. In the European Union and the United States, green is also sometimes associated with toxicity and poor health, but in China and most of Asia, its associations are very positive, as the symbol of fertility and happiness. Because of its association with nature, it is the color of the environmental movement. Political groups advocating environmental protection and social justice describe themselves as part of the Green movement, some naming themselves Green parties. This has led to similar campaigns in advertising, as companies have sold green, or environmentally friendly, products. Green is also the traditional color of safety and permission; a green light means go ahead, a green card permits permanent residence in the United States."
Solondz,"Todd Solondz (; born October 15, 1959) is an American filmmaker and playwright known for his style of dark, socially conscious satire. Solondz's work has received critical acclaim for its commentary on the ""dark underbelly of middle class American suburbia,"" a reflection of his own background in New Jersey. His work includes Welcome to the Dollhouse (1995), Happiness (1998), Storytelling (2001),  Palindromes (2004), Life During Wartime (2009), Dark Horse (2011), and Wiener-Dog (2016)."
Penn,"A pen is a common writing instrument that applies ink to a surface, usually paper, for writing or drawing. Early pens such as reed pens, quill pens, dip pens and ruling pens held a small amount of ink on a nib or in a small void or cavity which had to be periodically recharged by dipping the tip of the pen into an inkwell. Today, such pens find only a small number of specialized uses, such as in illustration and calligraphy. Reed pens, quill pens and dip pens, which were used for writing, have been replaced by ballpoint pens, rollerball pens, fountain pens and felt or ceramic tip pens. Ruling pens, which were used for technical drawing and cartography, have been replaced by technical pens such as the Rapidograph. All of these modern pens contain internal ink reservoirs, such that they do not need to be dipped in ink while writing."
Peirce,"Charles Sanders Peirce ( PURSS; September 10, 1839 – April 19, 1914) was an American philosopher, logician, mathematician and scientist who is sometimes known as ""the father of pragmatism"". He was known as a somewhat unusual character.Educated as a chemist and employed as a scientist for thirty years, Peirce made major contributions to logic, a subject that, for him, encompassed much of what is now called epistemology and the philosophy of science. He saw logic as the formal branch of semiotics, of which he is a founder, which foreshadowed the debate among logical positivists and proponents of philosophy of language that dominated 20th-century Western philosophy. Additionally, he defined the concept of abductive reasoning, as well as rigorously formulated mathematical induction and deductive reasoning. As early as 1886, he saw that logical operations could be carried out by electrical switching circuits. The same idea was used decades later to produce digital computers.In 1934, the philosopher Paul Weiss called Peirce ""the most original and versatile of American philosophers and America's greatest logician""."
Capra,"Frank Vincent Zappa (December 21, 1940 – December 4, 1993) was an American musician, singer, composer, songwriter and bandleader. His work is characterized by nonconformity, free-form improvisation, sound experiments, musical virtuosity and satire of American culture. In a career spanning more than 30 years, Zappa composed rock, pop, jazz, jazz fusion, orchestral  and musique concrète works, and produced almost all of the 60-plus albums that he released with his band the Mothers of Invention and as a solo artist. Zappa also directed feature-length films and music videos, and designed album covers. He is considered one of the most innovative and stylistically diverse musicians of his generation.As a self-taught composer and performer, Zappa had diverse musical influences that led him to create music that was sometimes difficult to categorize. While in his teens, he acquired a taste for 20th-century classical modernism, African-American rhythm and blues, and doo-wop music. He began writing classical music in high school, while at the same time playing drums in rhythm-and-blues bands, later switching to electric guitar. His 1966 debut album with the Mothers of Invention, Freak Out!, combined songs in conventional rock and roll format with collective improvisations and studio-generated sound collages. He continued this eclectic and experimental approach whether the fundamental format was rock, jazz, or classical.Zappa's output is unified by a conceptual continuity he termed ""Project/Object"", with numerous musical phrases, ideas, and characters reappearing across his albums. His lyrics reflected his iconoclastic views of established social and political processes, structures and movements, often humorously so, and he has been described as the ""godfather"" of comedy rock. He was a strident critic of mainstream education and organized religion, and a forthright and passionate advocate for freedom of speech, self-education, political participation and the abolition of censorship. Unlike many other rock musicians of his generation, he disapproved of recreational drug use, but supported decriminalization and regulation.Zappa was a highly productive and prolific artist with a controversial critical standing; supporters of his music admired its compositional complexity, while critics found it lacking emotional depth. He had greater commercial success outside the US, particularly in Europe. Though he worked as an independent artist, Zappa mostly relied on distribution agreements he had negotiated with the major record labels. He remains a major influence on musicians and composers. His many honors include his 1995 induction into the Rock and Roll Hall of Fame and the 1997 Grammy Lifetime Achievement Award."
Sena,None
Davis,"Davids is an unusual patronymic surname and a variant of Davidis. The name is mostly found in Great Britain and in the Netherlands. Davids is derived from the Hebrew word for ""beloved"". The name was popularised by the story of King David, who is regarded as the greatest of the early kings of Israel and founder of the Davidic line.The surname first migrated to England after the Norman conquest of 1066. The surname was first found in Sussex where bearers of the name were Lords of the manor of Peasmarsh in that shire, and were descendend from Robert, count of Eu, in Normandy.The name may refer to: Aäron Davids, chief rabbi of RotterdamEdgar Davids, Dutch footballerFadlu Davids, South African soccer strikerFaiek Davids was a South African first class cricketer in the 1980sHendrik Jan Davids, Dutch tennis  playerHenry Davids, South African cricketerHenry Davids (fencer), British fencerLance Davids, South African footballerLorenzo Davids, Dutch footballerNeil Davids, English footballerSharice Davids, American politician"
Reeves,None
Kelly,"Kelly's of Cornwall is a manufacturer of ice cream based in Bodmin, Cornwall. It was founded in the 19th century in St Austell and ran as a family business for over 100 years. It is now owned by the conglomerate Froneri based in Yorkshire. The company has achieved national prominence in the UK with its television advertising that promotes the Cornish language.From June 2013 to June 2014, Kelly's produced around 14½ million litres of clotted ice cream. During the same period, the company announced that it was the sixth largest ice cream manufacturer in Britain and forecast projected sales at £23 million for 2016."
Scott,None
Verhoeven,"Paul Verhoeven (Dutch: [ˈpʌu̯l vərˈɦuvə(n)]; born 18 July 1938) is a Dutch director and screenwriter active in the Netherlands, France and the United States. His blending of graphic violence and sexual content with social satire are trademarks of both his drama and science fiction films. After receiving attention for the TV series Floris in his native Netherlands, Verhoeven got his film breakthrough with romantic drama Turkish Delight (1973), starring frequent collaborator Rutger Hauer. The film was nominated for Academy Award for Best Foreign Film and later received the award for Best Dutch Film of the Century at the Netherlands Film Festival. Verhoeven later directed successful Dutch films including the period drama Keetje Tippel (1975), the war film Soldier of Orange (1977), the teen drama Spetters (1980) and the psychological thriller The Fourth Man (1983). In 1985, Verhoeven made his first Hollywood film Flesh and Blood and later had a successful career in the United States, directing science fiction films such as RoboCop (1987), Total Recall (1990), Starship Troopers (1997) and Hollow Man (2000), as well as the erotic thriller Basic Instinct (1992).He later returned to Europe, making the Dutch war film Black Book (2006), French psychological thriller Elle (2016), and most recently, the religious drama Benedetta (2021), all receiving positive reviews. Black Book and Elle were both nominated for BAFTA Award for Best Film Not in the English Language and Elle won Golden Globe Award for Best Foreign Language Film and César Award for Best Film. Black Book was also voted by the Dutch public, in 2008, as the best Dutch film ever made. In contrast, he won the Golden Raspberry Awards for Worst Picture and Worst Director for Showgirls (1995); he is one of the few people to have accepted their Golden Raspberry awards in person, and was the first person to go to the ceremony to receive it. Showgirls was a notorious box office flop in its initial theatrical release,  but later enjoyed huge success in home video market and became a cult classic. Verhoeven's films altogether received a total of nine Academy Award nominations, mainly for editing and effects."
Parker,"Parked is a 2011 Irish drama film written by Ciaran Creagh and directed by Darragh Byrne about homelessness, friendship, and the will to survive adversity, whilst still retaining poise. It premiered at the 2010 Torino Film Festival"
Mehta,"Mehta is an Indian surname and may be derived from the Sanskrit word ""महित"", meaning 'Great', or 'Highly praised', or from the Tamil word ""Mehthagu"", which means ""Worthy of respect"", or ""Your Excellency"". It is often used to denote the Chief, Head or Thakur of a village or locality. It is found among several Indian communities, including Punjabis, Hindus, Jains, Parsis, Sindhis, and Sikhs. Among Hindus, it is used mostly by Brahmins, Rajputs and some Baniyas including Punjabi Khatris."
Lee,None
