Aland Islands,"Åland (Finnish: Ahvenanmaa: [ˈɑhʋenɑnˌmːɑː]; Swedish: [ˈǒːland] (listen); Finland Swedish: [ˈoːlɑnd]) is an autonomous and demilitarised region of Finland since 1920 by a decision of the League of Nations. It is the smallest region of Finland by area and population, with a size of 1,580 km², and a population of 30,129, constituting 0.51% of its land area and 0.54% of its population. Its only official language is Swedish and Mariehamn is the capital city.Åland is situated in an archipelago, called the Åland Islands, at the entrance to the Gulf of Bothnia in the Baltic Sea belonging to Finland. It comprises Fasta Åland on which 90% of the population resides and a further ±6,500 skerries and islands to its east. Of Åland's thousands of islands, about 60-80 are inhabited. Fasta Åland is separated from the coast of Roslagen in Sweden by 38 kilometres (24 mi) of open water to the west. In the east, the Åland archipelago is contiguous with the Finnish archipelago. Åland's only land border is located on the uninhabited skerry of Märket, which it shares with Sweden. From Mariehamn, there is a ferry distance of about 160 kilometres (99 mi) to Turku, a coastal city of mainland Finland, and also to Stockholm, the capital of Sweden.Åland's autonomous status means that those provincial powers normally exercised by representatives of the central Finnish government are largely exercised by its own government. The current demilitarised, neutral position of Åland dates back to the days of the Paris Peace Treaty after the Åland War in the 1850s. 2021 marked the 100th anniversary of the autonomous status."
Albania,"Albania ( (listen) a(w)l-BAY-nee-ə; Albanian: Shqipëri or Shqipëria), officially the Republic of Albania (Albanian: Republika e Shqipërisë), is a country in Southeastern Europe. It is located on the Adriatic and Ionian Sea within the Mediterranean Sea and shares land borders with Montenegro to the northwest, Kosovo to the northeast, North Macedonia to the east and Greece to the south. Tirana is its capital and largest city, followed by Durrës, Vlorë and Shkodër.Albania displays varied climatic, geological, hydrological, and morphological conditions, defined in an area of 28,748 km2 (11,100 sq mi). It possesses significant diversity with the landscape ranging from the snow-capped mountains in the Albanian Alps as well as the Korab, Skanderbeg, Pindus and Ceraunian Mountains to the hot and sunny coasts of the Albanian Adriatic and Ionian Sea along the Mediterranean Sea.Albania has been inhabited by different civilisations over time, such as the Illyrians, Thracians, Greeks, Romans, Byzantines, Venetians and Ottomans. The Albanians established the autonomous Principality of Arbër in the 12th century. The Kingdom of Albania and Principality of Albania formed between the 13th and 14th centuries. Prior to the Ottoman conquest of Albania in the 15th century, the Albanian resistance to Ottoman expansion into Europe led by Gjergj Kastrioti Skanderbeg won them acclaim over most of Europe. Albania remained under Ottoman rule for nearly five centuries, during which many Albanians (known  as Arnauts) attained high-ranking offices in the empire, especially in the Southern Balkans and Egypt. Between the 18th and 19th centuries, cultural developments, widely attributed to Albanians having gathered both spiritual and intellectual strength, conclusively led to the Albanian Renaissance. After the defeat of the Ottomans in the Balkan Wars, the modern nation state of Albania declared independence in 1912. In the 20th century, the Kingdom of Albania was invaded by Italy which formed Greater Albania before becoming a protectorate of Nazi Germany. Enver Hoxha formed the People's Socialist Republic of Albania after World War II, modeled under the terms of Hoxhaism. The Revolutions of 1991 concluded the fall of communism in Albania and eventually the establishment of the current Republic of Albania.Albania is a unitary parliamentary constitutional republic and a developing country with an upper-middle income economy dominated by the service sector, followed by manufacturing. It went through a process of transition following the end of communism in 1990, from centralised planning to a market-based economy. Albania provides universal health care and free primary and secondary education to its citizens. Albania is a member of the United Nations, World Bank, UNESCO, NATO, WTO, COE, OSCE, and OIC. It is an official candidate for membership in the European Union since 2014. It is one of the founding members of the Energy Community, including the Organization of the Black Sea Economic Cooperation and Union for the Mediterranean."
Andorra,"Andorra, officially the Principality of Andorra, is a sovereign landlocked microstate on the Iberian Peninsula, in the eastern Pyrenees, bordered by France to the north and Spain to the south. Believed to have been created by Charlemagne, Andorra was ruled by the count of Urgell until 988, when it was transferred to the Roman Catholic Diocese of Urgell. The present principality was formed by a charter in 1278. It is headed by two co-princes: the Bishop of Urgell in Catalonia, Spain and the President of France. Its capital and largest city is Andorra la Vella.Andorra is the sixth-smallest state in Europe, with an area of 468 square kilometres (181 sq mi) and a population of approximately 77,006. The Andorran people are a Romance ethnic group of originally Catalan descent. Andorra is the world's 16th-smallest country by land and 11th-smallest by population. Its capital, Andorra la Vella, is the highest capital city in Europe, at an elevation of 1,023 metres (3,356 feet) above sea level. The official language is Catalan, but Spanish, Portuguese, and French are also commonly spoken.Tourism in Andorra sees an estimated 10.2 million visitors annually. Andorra is not a member state of the European Union, but the euro is its official currency. It has been a member of the United Nations since 1993. In 2013, Andorra had the highest life expectancy in the world at 81 years, according to the Global Burden of Disease Study; in 2019, it had the 23rd-highest at 81.9 years, according to the United Nations Development Programme."
Armenia,"Armenia, officially the Republic of Armenia, is a landlocked country located in the Armenian Highlands of Western Asia. It is a part of the Caucasus region; and is bordered by Turkey to the west, Georgia to the north, the Lachin corridor under a Russian peacekeeping force, and Azerbaijan to the east, and Iran and the Azerbaijani exclave of Nakhchivan to the south. Yerevan is the capital and largest city.Armenia is a unitary, multi-party, democratic nation-state with an ancient cultural heritage. The first Armenian state of Urartu was established in 860 BC, and by the 6th century BC it was replaced by the Satrapy of Armenia. The Kingdom of Armenia reached its height under Tigranes the Great in the 1st century BC and became the first state in the world to adopt Christianity as its official religion, in 301. The ancient Armenian kingdom was split between the Byzantine and Sasanian Empires around the early 5th century. Under the Bagratuni dynasty, the Bagratid Kingdom of Armenia was restored in the 9th century. Declining due to the wars against the Byzantines, the kingdom fell in 1045 and Armenia was soon after invaded by the Seljuk Turks. An Armenian principality and later a kingdom Cilician Armenia was located on the coast of the Mediterranean Sea between the 11th and 14th centuries.Between the 16th and 19th centuries, the traditional Armenian homeland composed of Eastern Armenia and Western Armenia came under the rule of the Ottoman and Persian empires, repeatedly ruled by either of the two over the centuries. By the 19th century, Eastern Armenia had been conquered by the Russian Empire, while most of the western parts of the traditional Armenian homeland remained under Ottoman rule. During World War I, 1.5 million Armenians living in their ancestral lands in the Ottoman Empire were systematically exterminated in the Armenian genocide. In 1918, following the Russian Revolution, all non-Russian countries declared their independence after the Russian Empire ceased to exist, leading to the establishment of the First Republic of Armenia. By 1920, the state was incorporated into the Transcaucasian Socialist Federative Soviet Republic, and in 1922 became a founding member of the Soviet Union. In 1936, the Transcaucasian state was dissolved, transforming its constituent states, including the Armenian Soviet Socialist Republic, into full Union republics. The modern Republic of Armenia became independent in 1991 during the dissolution of the Soviet Union.Armenia is a developing country and ranks 81st on the Human Development Index (2018). Its economy is primarily based on industrial output and mineral extraction. While Armenia is geographically located in the South Caucasus, it is generally considered geopolitically European. Since Armenia aligns itself in many respects geopolitically with Europe, the country is a member of numerous European organizations including the Council of Europe, the Eastern Partnership, Eurocontrol, the Assembly of European Regions, and the European Bank for Reconstruction and Development. Armenia is also a member of certain regional groups throughout Eurasia, including the Asian Development Bank, the Collective Security Treaty Organization, the Eurasian Union, and the Eurasian Development Bank. Armenia supports the de facto independent Artsakh, which was proclaimed in 1991. Armenia also recognises the Armenian Apostolic Church, the world's oldest national church, as the country's primary religious establishment. The unique Armenian alphabet was created by Mesrop Mashtots in 405 AD."
Austria,"Australia, officially the Commonwealth of Australia, is a sovereign transcontinental country comprising the mainland of the Australian continent, the island of Tasmania, and numerous smaller islands. With an area of 7,617,930 square kilometres (2,941,300 sq mi), Australia is the largest country by area in Oceania and the world's sixth-largest country. Australia is the oldest, flattest, and driest inhabited continent, with the least fertile soils. It is a megadiverse country, and its size gives it a wide variety of landscapes and climates, with deserts in the centre, tropical rainforests in the north-east, and mountain ranges in the south-east.Indigenous Australians have inhabited the continent for approximately 65,000 years. The European maritime exploration of Australia commenced in the early 17th century with the arrival of Dutch explorers. In 1770, Australia's eastern half was claimed by Great Britain and initially settled through penal transportation to the colony of New South Wales from 26 January 1788, a date which became Australia's national day. The European population grew steadily in subsequent decades, and by the time of an 1850s gold rush, most of the continent had been explored by European settlers and an additional five self-governing crown colonies established. On 1 January 1901, the six colonies federated, forming the Commonwealth of Australia. Australia has since maintained a stable liberal democratic political system and wealthy market economy.Politically, Australia is a federal parliamentary constitutional monarchy, comprising six states and ten territories. Australia's population of nearly 26 million is highly urbanised and heavily concentrated on the eastern seaboard. Canberra is the nation's capital, while the five largest cities are Sydney, Melbourne, Brisbane, Perth, and Adelaide. Australia's demography has been shaped by centuries of immigration, with immigrants accounting for 30% of the country's population, the highest proportion among major Western nations. Australia's abundant natural resources and well-developed international trade relations are crucial to the country's economy, which generates its income from various sources including services, mining exports, banking, manufacturing, agriculture and international education.Australia is a highly developed country with a high-income economy; it has the world's thirteenth-largest economy, tenth-highest per capita income and eighth-highest Human Development Index. Australia is a regional power, and has the world's thirteenth-highest military expenditure. Australia ranks highly in quality of life, democracy, health, education, economic freedom, civil liberties, safety, and political rights, with all its major cities faring exceptionally in global comparative livability surveys. It is a member of international groupings including the United Nations, the G20, the OECD, the WTO, ANZUS, AUKUS, Five Eyes, the Quad, APEC, the Pacific Islands Forum, the Pacific Community and the Commonwealth of Nations."
Azerbaijan,"Azerbaijan (UK:  (listen), US: ; Azerbaijani: Azərbaycan [ɑːzæɾbɑjˈdʒɑn]), officially the Azerbaijan Republic or the Republic of Azerbaijan, is a transcontinental country located at the boundary of Eastern Europe and Western Asia. It is a part of the South Caucasus region, and is bounded by the Caspian Sea to the east, Russia (Republic of Dagestan) to the north, Georgia to the northwest, Armenia and Turkey to the west, and Iran to the south. Baku is the capital and largest city.The Azerbaijan Democratic Republic proclaimed its independence from the Transcaucasian Democratic Federative Republic in 1918 and became the first secular democratic Muslim-majority state, taking its name from the adjacent region of northwestern Iran for political reasons. In 1922, the country was incorporated into the Soviet Union as the Azerbaijan SSR.The modern Republic of Azerbaijan proclaimed its independence on 30 August 1991, shortly before the dissolution of the Soviet Union in the same year. In September 1991, the ethnic Armenian majority of the Nagorno-Karabakh region formed self-proclaimed Republic of Artsakh. The region and seven surrounding districts are internationally recognized as part of Azerbaijan, while negotiations on the resolution of Nagorno-Karabakh conflict are facilitated by the OSCE. Nagorno-Karabakh became de facto independent with the end of the First Nagorno-Karabakh War in 1994.Following the 2020 Nagorno-Karabakh war, the seven districts and parts of Nagorno-Karabakh were returned to Azerbaijani control.Azerbaijan is a unitary semi-presidential republic. It is one of six independent Turkic states and an active member of the Turkic Council and the TÜRKSOY community. Azerbaijan has diplomatic relations with 182 countries and holds membership in 38 international organizations, including the United Nations, the Council of Europe, the Non-Aligned Movement, the OSCE, and the NATO PfP program. It is one of the founding members of GUAM, the CIS, and the OPCW. Azerbaijan is also an observer state of the WTO.The vast majority of the country's population (97%) is Muslim, but the constitution does not declare an official religion and all major political forces in the country are secularist. Azerbaijan is a developing country and ranks 88th on the Human Development Index. It has a high rate of economic development, literacy, and a low rate of unemployment. The ruling party, the New Azerbaijan Party, in power since 1993, has been accused of authoritarian leadership and the deterioration of the country's human rights record, including increasing restrictions on civil liberties, particularly on press freedom and political repression."
Belarus,"Belarus, officially the Republic of Belarus, and historically Byelorussia, is a landlocked country in Eastern Europe. It is bordered by Russia to the east and northeast, Ukraine to the south, Poland to the west, and Lithuania and Latvia to the northwest. Covering an area of 207,600 square kilometres (80,200 sq mi) and with a population of 9.3 million, Belarus is the 13th-largest and the 20th-most populous country in Europe. The country is administratively divided into seven regions. Minsk is the capital and largest city.Until the 20th century, different states at various times controlled the lands of modern-day Belarus, including Kievan Rus', the Principality of Polotsk, the Grand Duchy of Lithuania, the Polish–Lithuanian Commonwealth, and the Russian Empire. In the aftermath of the Russian Revolution in 1917, different states arose competing for legitimacy amidst the Civil War, ultimately ending in the rise of the Byelorussian SSR, which became a founding constituent republic of the Soviet Union in 1922. After the Polish-Soviet War, Belarus lost almost half of its territory to Poland. Much of the borders of Belarus took their modern shape in 1939, when some lands of the Second Polish Republic were reintegrated into it after the Soviet invasion of Poland, and were finalized after World War II. During World War II, military operations devastated Belarus, which lost about a quarter of its population and half of its economic resources. The republic was redeveloped in the post-war years. In 1945, the Byelorussian SSR became a founding member of the United Nations, along with the Soviet Union.The parliament of the republic proclaimed the sovereignty of Belarus on 27 July 1990, and during the dissolution of the Soviet Union, Belarus declared independence on 25 August 1991. Following the adoption of a new constitution in 1994, Alexander Lukashenko was elected Belarus's first president in the country's first and only free election post-independence, serving as president ever since. Lukashenko's government is authoritarian with a poor human rights record due to widespread human rights abuses. Lukashenko has continued a number of Soviet-era policies, such as state ownership of large sections of the economy. Belarus is the only country in Europe officially using the death penalty. In 2000, Belarus and Russia signed a treaty for greater cooperation, forming the Union State.Belarus is a developing country, ranking 53rd in the Human Development Index. It has been a member of the United Nations since its founding and has joined the CIS, the CSTO, the EAEU, the OSCE, and the Non-Aligned Movement. It has shown no aspirations of joining the European Union but nevertheless maintains a bilateral relationship with the bloc and also participates in two EU projects, the Baku Initiative and the Eastern Partnership. Belarus suspended its participation in the latter on 28 June 2021, after the EU imposed more sanctions against the country."
Belgium,"Belgium, officially the Kingdom of Belgium, is a country in Western Europe. The country is bordered by the Netherlands to the north, Germany to the east, Luxembourg to the southeast, France to the southwest, and the North Sea to the northwest. It covers an area of 30,689 km2 (11,849 sq mi) and has a population of more than 11.5 million, making it the 22nd most densely populated country in the world and the 6th most densely populated country in Europe, with a density of 376 per square kilometre (970/sq mi). The capital and largest city is Brussels; other major cities are Antwerp, Ghent, Charleroi, Liège, Bruges, Namur, and Leuven.Belgium is a sovereign state and a federal constitutional monarchy with a parliamentary system. Its institutional organization is complex and is structured on both regional and linguistic grounds. It is divided into three highly autonomous regions: the Flemish Region (Flanders) in the north, the Walloon Region (Wallonia) in the south, and the Brussels-Capital Region. Brussels is the smallest and most densely populated region, as well as the richest region in terms of GDP per capita.Belgium is home to two main linguistic communities: the Dutch-speaking Flemish Community, which constitutes about 60 percent of the population, and the French-speaking Community, which constitutes about 40 percent of the population. A small German-speaking Community, numbering around one percent, exists in the East Cantons. The Brussels-Capital Region is officially bilingual in French and Dutch, although French is the dominant language. Belgium's linguistic diversity and related political conflicts are reflected in its complex system of governance, made up of six different governments.The country as it exists today was established following the 1830 Belgian Revolution, when it seceded from the Netherlands, which had itself only existed since 1815.  The name chosen for the new state is derived from the Latin word Belgium, used in Julius Caesar's ""Gallic Wars"", to describe a nearby region in the period around 55 BCE. Belgium is part of an area known as the Low Countries, historically a somewhat larger region than the Benelux group of states, as it also included parts of northern France. Since the Middle Ages, its central location near several major rivers has meant that the area has been relatively prosperous, connected commercially and politically to its bigger neighbours. Belgium has also been the battleground of European powers, earning the moniker the ""Battlefield of Europe"", a reputation strengthened in the 20th century by both world wars.Belgium participated in the Industrial Revolution and, during the course of the 20th century, possessed a number of colonies in Africa. Between 1888 and 1908, Leopold II, king of Belgium, perpetrated one of the largest massacres in human history in the Congo Free State, which was his private estate, and not yet a colony of Belgium. Estimates of the death toll are disputed but millions of people, a significant part of the population, died for the sake of rubber and ivory exports.The second half of the 20th century was marked by rising tensions between the Dutch-speaking and the French-speaking citizens  fuelled by differences in language and culture and the unequal economic development of Flanders and Wallonia. This continuing antagonism has led to several far-reaching reforms, resulting in a transition from a unitary to a federal arrangement during the period from 1970 to 1993. Despite the reforms, tensions between the groups have remained, if not increased; there is significant separatism particularly among the Flemish; controversial language laws exist such as the municipalities with language facilities; and the formation of a coalition government took 18 months following the June 2010 federal election, a world record. Unemployment in Wallonia is more than double that of Flanders, which boomed after the Second World War.Belgium is one of the six founding countries of the European Union and its capital, Brussels, hosts the official seats of the European Commission, the Council of the European Union, and the European Council, as well as one of two seats of the European Parliament (the other being Strasbourg). Belgium is also a founding member of the Eurozone, NATO, OECD, and WTO, and a part of the trilateral Benelux Union and the Schengen Area. Brussels hosts the headquarters of many major international organizations such as NATO.Belgium is a developed country, with an advanced high-income economy. It has very high standards of living, quality of life, healthcare, education, and is categorized as ""very high"" in the Human Development Index. It also ranks as one of the safest or most peaceful countries in the world."
