Honorius,None
Gildo,"Gildas (Breton: Gweltaz; c. 500 – c. 570) — also known as Gildas the Wise or Gildas Sapiens — was a 6th-century British monk best known for his scathing religious polemic De Excidio et Conquestu Britanniae, which recounts the history of the Britons before and during the coming of the Saxons. He is one of the best-documented figures of the Christian church in the British Isles during the sub-Roman period, and was renowned for his Biblical knowledge and literary style. In his later life, he emigrated to Brittany where he founded a monastery known as St Gildas de Rhuys."
Marcus,None
Gratian,"Gratian (; Latin: Flavius Gratianus; 18 April 359 – 25 August 383) was emperor of the western part of the Roman Empire from 367 to 383. The eldest son of Valentinian I, Gratian accompanied his father on several campaigns along the Rhine and Danube frontiers and was raised to the rank of augustus in 367. Upon the death of Valentinian in 375, Gratian took over government of the west while his half-brother Valentinian II was also acclaimed emperor in Pannonia. Gratian governed the western provinces of the empire, while his uncle Valens was already the emperor over the east.Gratian subsequently led a campaign across the Rhine, attacked the Lentienses, and forced the tribe to surrender. That same year, the eastern emperor Valens was killed fighting the Goths at the Battle of Adrianople, which led to Gratian elevating Theodosius to replace him in 379. Gratian favoured Nicene Christianity over traditional Roman religion, issuing the Edict of Thessalonica, refusing the office of pontifex maximus, and removing the Altar of Victory from the Roman Senate's Curia Julia. The city of Cularo on the Isère river in Roman Gaul was renamed Latin: Gratianopolis after him, which later evolved to Grenoble.In 383, faced with rebellion by the usurper Magnus Maximus, Gratian marched his army towards Lutetia (Paris). His army deserted him. He fled to Lyon and was later murdered."
Konstantin (III.),"Alexander II (Russian: Алекса́ндр II Никола́евич, tr. Aleksándr II Nikoláyevich, IPA: [ɐlʲɪˈksandr ftɐˈroj nʲɪkɐˈlajɪvʲɪtɕ]; 29 April 1818 – 13 March 1881) was Emperor of Russia, King of Congress Poland and Grand Duke of Finland from 2 March 1855 until his assassination.Alexander's most significant reform as emperor was the emancipation of Russia's serfs in 1861, for which he is known as Alexander the Liberator (Russian: Алекса́ндр Освободи́тель, tr. Aleksándr Osvobodytel, IPA: [ɐlʲɪˈksandr ɐsvəbɐˈdʲitʲɪlʲ]). The tsar was responsible for other reforms, including reorganizing the judicial system, setting up elected local judges, abolishing corporal punishment, promoting local self-government through the zemstvo system, imposing universal military service, ending some privileges of the nobility, and promoting university education. After an assassination attempt in 1866, Alexander adopted a somewhat more reactionary stance until his death.Alexander pivoted towards foreign policy and sold Alaska to the United States in 1867, fearing the remote colony would fall into British hands if there were another war. He sought peace, moved away from bellicose France when Napoleon III fell in 1871, and in 1872 joined with Germany and Austria in the League of the Three Emperors that stabilized the European situation. Despite his otherwise pacifist foreign policy, he fought a brief war with the Ottoman Empire in 1877–78, leading to the independence of the Bulgarian, Montenegrin, Romanian and Serbian states, pursued further expansion into Siberia and the Caucasus, and conquered Turkestan, also approving plans leading to the Circassian genocide. Although disappointed by the results of the Congress of Berlin in 1878, Alexander abided by that agreement. Among his greatest domestic challenges was an uprising in Poland in 1863, to which he responded by stripping that land of its separate constitution and incorporating it directly into Russia. Alexander was proposing additional parliamentary reforms to counter the rise of nascent revolutionary and anarchistic movements when he was assassinated in 1881."
Priscus Attalus,"Priscus Attalus (died after 416) was twice Roman usurper (in 409-10 and in 414–15), against Emperor Honorius, with Visigothic support.  He was the last non-Christian pretender to the Roman imperial office.  Priscus Attalus was a Greek from Asia whose father had moved to Italy under Valentinian I. Attalus was an important senator in Rome, who served as praefectus urbi in 409. He was twice proclaimed emperor by the Visigoths, in an effort to impose their terms on the ineffectual Emperor Honorius, in Ravenna.He held the title of Emperor in Rome for a few months 409–410, and later in Burdigala again for a few months in 414–415. The first reign ended when Alaric believed it was hampering his negotiations with Honorius, and the second ended after he was abandoned by the Visigoths and eventually captured by Honorius's men. Attalus was obliged to participate in the triumph Honorius celebrated in the streets of Rome in 416, before finishing his days exiled in the Aeolian Islands."
Maximus,None
Jovinus,"Jovinus is a Roman cognomen, most often used for a 5th-century Roman usurper emperor.  This article is about the Roman usurper. For the saint, see Saint Jovinus. For the Frankish duke, see Jovinus of Provence. For the 4th century Roman general and consul of Gaul whose sarcophage is in Reims see Jovinus (consul).Jovinus was a Gallo-Roman senator and claimed to be Roman Emperor (411–413 AD).Following the defeat of the usurper known as Constantine III, Jovinus was proclaimed emperor at Mainz in 411, a puppet supported by Gundahar, king of the Burgundians, and Goar, king of the Alans. Jovinus kept his position in Gaul for two years, long enough to issue coinage that showed him wearing the imperial diadem. He was supported by a number of local Gallo-Roman nobles who had survived Constantine's defeat.Under the pretext of Jovinus' imperial authority, Gundahar and his Burgundians established themselves on the left bank of the Rhine (the Roman side) between the river Lauter and the Nahe. Here they founded a kingdom with the old Romanized Gaulish settlement of Borbetomagus (Worms) as its capital.Jovinus' end came after the Visigoths under Ataulf left Italy (at Priscus Attalus' advice), ostensibly to join him, carrying with them as hostages the ex-emperor Attalus and Galla Placidia, Honorius' half-sister. Then Ataulf attacked and killed Sarus, who had also come to support Jovinus. Jovinus, offended at this act, then failed to consult Ataulf when he elevated his brother Sebastianus as co-emperor. Insulted, Ataulf allied his Visigoths with Honorius, and they defeated Jovinus' troops. Sebastianus was executed. Jovinus fled for his life, but was besieged and captured in Valentia (Valence, Drôme) and taken to Narbo (Narbonne), where Caius Posthumus Dardanus, the praetorian prefect (governor) in Gaul, who had remained loyal to Honorius, had him executed. Jovinus' and Sebastianus' heads were afterwards sent to Honorius and mounted on the walls of Ravenna (before being passed on to Carthage, where they were put on permanent display with the heads of four other usurpers)."
Heraclianus,"Heraclianus (Ancient Greek: Ἡρακλειανὸς, Herakleianòs; died 7 March 413) was a provincial governor and a usurper of the Roman Empire (412–413) opposed to Emperor Honorius, who had originally brought him to power. Heraclianus helped put down a rebellion by Priscus Attalus. However, he decided to stage his own rebellion and during his invasion of the Italian peninsula, was either defeated in battle or captured and executed."
Constantius III.,"Constantius III (in Latin: Flavius Constantius) was Roman emperor of the West in 421, from 8 February until his death on 2 September. He earned his position as Emperor due to his capability as a general under Honorius, achieving the rank of magister militum by 411. That same year, he suppressed the revolt of Constantine III, a Roman general who had declared himself emperor. Constantius then went on to lead campaigns against various barbarian groups in Hispania and Gaul, recovering much of both for the Western Roman Empire. Constantius married Honorius's sister Galla Placidia in 417, a sign of his ascendant status, and was proclaimed co-emperor by Honorius on 8 February 421. He reigned for seven months before dying on 2 September 421."
Johannes,"Johannes is a Medieval Latin form of the personal name that usually appears as ""John"" in English language contexts. It is a variant of the Greek and Classical Latin variants (Ιωάννης, Ioannes), itself derived from the Hebrew name Yehochanan, meaning ""Yahweh is gracious"". The name became popular in Northern Europe, especially in Germany because of Christianity. Common German variants for Johannes are Johann, Hannes, Hans (diminutized to Hänschen or Hänsel, as known from ""Hansel and Gretel"", a fairy tale by the Grimm brothers), Jens (from Danish) and Jan (from Dutch, and found in many countries). In the Netherlands, Johannes was without interruption the most common masculine birth name until 1989. Common English variants for Johannes are Johan, John and Johnny."
Valentinian III.,None
Vortigern,"Vortigern (; Old Welsh: Guorthigirn, Guorthegern; Welsh: Gwrtheyrn; Old English: Wyrtgeorn; Old Breton: Gurdiern, Gurthiern; Irish: Foirtchern; Latin: Vortigernus, Vertigernus, Uuertigernus, etc.), also spelled Vortiger, Vortigan, Voertigern and Vortigen, was a 5th-century warlord in Britain, known perhaps as a king of the Britons or at least connoted as such in the writings of Bede. His existence is contested by scholars and information about him is obscure.He may have been the ""superbus tyrannus"" said to have invited Hengist and Horsa to aid him in fighting the Picts and the Scots. However, they revolted, killing his son in the process and forming the Kingdom of Kent. It is said that he took refuge in North Wales, and that his grave was in Dyfed or the Llŷn Peninsula. Gildas later denigrated Vortigern for his misjudgement and also blamed him for the loss of Britain. He is cited at the beginning of the genealogy of the early Kings of Powys."
Pirrus,"Neoptolemus (; Ancient Greek: Νεοπτόλεμος, romanized: Neoptólemos, lit. 'new warrior'), also called Pyrrhus (; Πύρρος, Pýrrhos, 'red', for his red hair), was the son of the warrior Achilles and the princess Deidamia, and brother of Oneiros in Greek mythology, and also the mythical progenitor of the ruling dynasty of the Molossians of ancient Epirus.In Cypria, Achilles sails to Scyros after a failed expedition to Troy, marries princess Deidamia and has Neoptolemus, until Achilles is called to arms again. In a non-Homeric version of the story, Achilles' mother Thetis foretold many years before Achilles' birth that there would be a great war. She saw that her only son was to die if he fought in the war. She sought a place for him to avoid fighting in the Trojan War, disguising him as a woman in the court of Lycomedes, the king of Scyros. During that time, he had an affair with the princess, Deidamea, who then gave birth to Neoptolemos. Neoptolemos was originally called Pyrrhos, because his father had taken Pyrrha, the female version of that name, while disguised as a woman. The Greeks captured the Trojan seer, Helenus, and forced him to tell them under what conditions they could take Troy. Helenos revealed to them that they could defeat Troy if they could acquire the poisonous arrows of Heracles (then in Philoctetes' possession); steal the Palladium (which led to the building of the famous wooden horse of Troy); and put Achilles' son in the war.In response to the prophecy, the Greeks took steps to retrieve the arrows of Heracles and bring Neoptolemos to Troy. Odysseus was sent to retrieve Neoptolemos, then a mere teenager, from Scyros.  The two then went to Lemnos to retrieve Philoctetes. Years earlier, on the way to Troy, Philoctetes was bitten by a snake on Chryse Island. Agamemnon had advised that he be left behind because the wound was festering and smelled bad. This retrieval is the plot of Philoctetes, a play by Sophocles. Euripides, in his play Hekabe (also known as Hecuba), has a moving scene (ll 566–575) which shows Neoptolemos as a compassionate young man who kills Polyxena, Hekabe's daughter with ambivalent feelings and in the least painful way.Neoptolemos was held by some to be brutal. He killed six men on the field of battle. During and after the war, he killed Priam, Eurypylus, Polyxena, Polites and Astyanax (Hector and Andromache's infant son) among others, captured Helenos, and made Andromache, then a widow, his concubine. The ghost of Achilles appeared to the survivors of the war, demanding Polyxena, the Trojan princess, be sacrificed before anybody could leave. Neoptolemos did so. With Andromache, Helenos and Phoenix, Neoptolemos sailed to the Epirot Islands and then became the King of Epirus. With the enslaved Andromache, Neoptolemos was the father of Molossos and through him, according to the myth, an ancestor of Olympias, the mother of Alexander the Great. According to Hyginus, his son with Andromache was Amphialos:[123] CXXIII. NEOPTOLEMUSNeoptolemus, son of Achilles and Deidamia, begat Amphialus by captive Andromache, daughter of Ēëtion. But after he heard that Hermione his betrothed had been given to Orestes in marriage, he went to Lacedaemon and demanded her from Menelaus. Menelaus did not wish to go back on his word, and took Hermione from Orestes and gave her to Neoptolemus. Orestes, thus insulted, slew Neoptolemus as he was sacrificing to Delphi, and recovered Hermione. The bones of Neoptolemus were scattered through the land of Ambracia, which is in the district of Epirus.Although Neoptolemus is often depicted thus, the play Philoctetes by Sophocles shows him being a much kinder man, who honours his promises and shows remorse when he is made to trick Philoctetes. Two accounts deal with Neoptolemos' death. He was either killed after he attempted to take Hermione from Orestes as her father Menelaus promised, or after he denounced Apollo, the murderer of his father. In the first case, he was killed by Orestes. In the second, revenge was taken by the Delphic priests of Apollo.After his death his kingdom was portioned out and Helenos (who later married Andromache) took part of it. ""Helenus, a son of Priam, was king over these Greek cities of Epirus, having succeeded to the throne and bed of Pyrrhus..."""
Petronius Maximus,"Petronius Maximus (c. 397 – 31 May 455) was Roman emperor of the West for two and a half months in 455. A wealthy senator and a prominent aristocrat, he was instrumental in the murders of the Western Roman magister militum, Aëtius, and the Western Roman emperor, Valentinian III.Maximus secured the throne the day after Valentinian's death by ensuring the backing of the senate and by bribing the palace officials. He strengthened his position by forcing Valentinian's widow to marry him and forcing Valentinian's daughter to marry his son. He cancelled the betrothal of his new wife's daughter to the son of the Vandal king Genseric. This infuriated both his stepdaughter and Genseric, who sent a fleet to Rome. Maximus failed to obtain troops from the Visigoths and he fled as the Vandals arrived, became detached from his retinue and bodyguard in the confusion, and was killed. The Vandals thoroughly sacked Rome."
Avitus,"A virus is a submicroscopic infectious agent that replicates only inside the living cells of an organism. Viruses infect all life forms, from animals and plants to microorganisms, including bacteria and archaea.Since Dmitri Ivanovsky's 1892 article describing a non-bacterial pathogen infecting tobacco plants and the discovery of the tobacco mosaic virus by Martinus Beijerinck in 1898, more than 9,000 virus species have been described in detail of the millions of types of viruses in the environment. Viruses are found in almost every ecosystem on Earth and are the most numerous type of biological entity. The study of viruses is known as virology, a subspeciality of microbiology.  When infected, a host cell is often forced to rapidly produce thousands of copies of the original virus. When not inside an infected cell or in the process of infecting a cell, viruses exist in the form of independent particles, or virions, consisting of (i) the genetic material, i.e., long molecules of DNA or RNA that encode the structure of the proteins by which the virus acts; (ii) a protein coat, the capsid, which surrounds and protects the genetic material; and in some cases (iii) an outside envelope of lipids. The shapes of these virus particles range from simple helical and icosahedral forms to more complex structures. Most virus species have virions too small to be seen with an optical microscope and are one-hundredth the size of most bacteria.The origins of viruses in the evolutionary history of life are unclear: some may have evolved from plasmids—pieces of DNA that can move between cells—while others may have evolved from bacteria. In evolution, viruses are an important means of horizontal gene transfer, which increases genetic diversity in a way analogous to sexual reproduction. Viruses are considered by some biologists to be a life form, because they carry genetic material, reproduce, and evolve through natural selection, although they lack the key characteristics, such as cell structure, that are generally considered necessary criteria for defining life. Because they possess some but not all such qualities, viruses have been described as ""organisms at the edge of life"", and as replicators.Viruses spread in many ways. One transmission pathway is through disease-bearing organisms known as vectors: for example, viruses are often transmitted from plant to plant by insects that feed on plant sap, such as aphids; and viruses in animals can be carried by blood-sucking insects. Many viruses, including influenza viruses, SARS-CoV-2, chickenpox, smallpox, and measles, spread in the air by coughing and sneezing. Norovirus and rotavirus, common causes of viral gastroenteritis, are transmitted by the faecal–oral route, passed by hand-to-mouth contact or in food or water. The infectious dose of norovirus required to produce infection in humans is fewer than 100 particles. HIV is one of several viruses transmitted through sexual contact and by exposure to infected blood. The variety of host cells that a virus can infect is called its ""host range"". This can be narrow, meaning a virus is capable of infecting few species, or broad, meaning it is capable of infecting many.Viral infections in animals provoke an immune response that usually eliminates the infecting virus. Immune responses can also be produced by vaccines, which confer an artificially acquired immunity to the specific viral infection. Some viruses, including those that cause HIV/AIDS, HPV infection, and viral hepatitis, evade these immune responses and result in chronic infections. Several classes of antiviral drugs have been developed."
Majorian,"Majorian (Latin: Julius Valerius Maiorianus; c. 420 – 7 August 461) was the western Roman emperor from 457 to 461. A prominent general of the Roman army, Majorian deposed Emperor Avitus in 457 and succeeded him. Majorian was the last emperor to make a concerted effort to restore the Western Roman Empire with its own forces. Possessing little more than Italy, Dalmatia, and some territory in northern Gaul, Majorian campaigned rigorously for three years against the Empire's enemies.  His successors until the fall of the Empire, in 476/480, were actually instruments of their barbarian generals, or emperors chosen and controlled by the Eastern Roman court.After defeating a Vandal attack on Italy, Majorian launched a campaign against the Visigothic Kingdom in southern Gaul. Defeating king Theodoric II at the Battle of Arelate, Majorian forced the Goths to abandon their possessions in Septimania and Hispania and return to federate status. Majorian then attacked the Burgundian Kingdom, defeating them at the Siege of Lugdunum, expelling them from the Rhone valley and reducing them to federate status.In 460, Majorian left Gaul to consolidate his hold on Hispania. His generals launched a campaign against the Suebic Kingdom in northwest Hispania, defeating them at the battles of Lucus Augusti and Scallabis and reducing them to federate status as well. His fleet for his planned campaign to recover Africa from the Vandals was destroyed due to treachery.Majorian sought to reform the imperial administration in order to make it more efficient and just. The powerful general Ricimer deposed and killed Majorian, who had become unpopular with the senatorial aristocracy because of his reforms.To historian Edward Gibbon, Majorian ""presents the welcome discovery of a great and heroic character, such as sometimes arise, in a degenerate age, to vindicate the honour of the human species""."
Marcellus,None
Libius Severus,"Libius Severus (died 465), sometimes enumerated as Severus III, was Roman emperor of the West from 461 to his death in 465.A Roman senator from Lucania, Severus was one of the last Western emperors, with no effective power (the real power was in the hands of the magister militum Ricimer) and unable to solve the many problems affecting the empire; the sources describe him as a pious Christian."
Aegidius,"Aegidius (died 464 or 465) was ruler of the short-lived Kingdom of Soissons from 461 to 464/465 AD. Before his ascension, he became magister militum per Gallias (Master of the Soldiers for Gaul) serving under Majorian, in 458 AD. An ardent supporter of Majorian, Aegidius rebelled against Ricimer when he assassinated Majorian and replaced him with Libius Severus; Aegidius may have pledged his allegiance to Leo I, the Eastern Roman Emperor. Aegidius repeatedly threatened to invade Italy and dethrone Libius Severus, but never actually launched such an invasion; historians have suggested he was unwilling to launch an invasion due to the pressure of the Visigoths, or else because it would leave Gaul exposed. Aegidius launched several campaigns against the Visigoths and the Burgundians, recapturing Lyons from the Burgundians in 458, and routing the Visigoths at the Battle of Orleans. He died suddenly after a major victory against the Visigoths; ancient historians say that he was assassinated, but do not give the name of the assassin, whereas modern historians believe it is possible that he died a natural death. After his death he was succeeded by his son Syagrius, who would be the second and last ruler of the Kingdom of Soissons."
Anthemius,"Procopius Anthemius (died 11 July 472) was western Roman emperor from 467 to 472.Perhaps the last capable Western Roman Emperor, Anthemius attempted to solve the two primary military challenges facing the remains of the Western Roman Empire: the resurgent Visigoths, under Euric, whose domain straddled the Pyrenees; and the unvanquished Vandals, under Geiseric, in undisputed control of North Africa. Anthemius was killed by Ricimer, his own general of Gothic descent, who contested power with him."
Arvandus,"Arvandus was a Gaul who rose through the hierarchy of Imperial Roman society to twice be appointed Praetorian prefect of Gaul.  On the first occasion, 461, he was appointed by Emperor Libius Severus. This appointment ended when Severus died in 465. Two years later, in 467, he was appointed by Anthemius.His friend and chronicler, Sidonius Apollinaris, records that his first term was successful and he himself well liked. However, in his second term he found himself widely hated, and in 468 was removed from office and brought to Rome in chains. Here he was accused by envoys from a commission of influential Gauls of committing treason. The envoys brought with them a letter which Arvandus' secretary attested had been dictated by Arvandus.  In it, Arvandus set out to dissuade Euric, king of the Visigoths, from concluding peace with the Western Roman Emperor, urging that instead he should attack the Britons north of the Loire. The letter asserted that the Law of Nations called for a division of Gaul between the Visigoths and Burgundians.Riothamus, King of the Britons, was allied to Roman Emperor Anthemius, so this was tantamount to declaring war on the Emperor. Arvandus was put on trial for treason. The trial should have been overseen by Sidonius, but Sidonius chose to resign his position instead, and plead for clemency on behalf of his friend. At his trial, Arvandus was found guilty and was stripped on the spot of all the privileges pertaining to his prefecture, and consigned to the common jail to await execution.Cassiodorus asserts that Arvandus' intention was to divide the empire and seize the throne: It may be that Arvandus was hoping to obtain the throne with aid from the Gauls and the Visigoths, in the manner of the previous attempt by Avitus. If so, Arvandus was disappointed; he received no support from the Gallic aristocracy. Possibly this was a result of his undistinguished birth, but the great majority of the Gauls would have learned from Avitus' example, and realized that the day for such adventures was long past.Cassiodorius reports that Sidonius and his friends were successful in saving Arvandus from the death penalty. ""At the order of Anthemius, Arvandus, who had attempted to become emperor, was sent into exile"" (""Arabundus imperium temptans iussu Anthemii exilio deportatur"")."
