Honorius,NoneRomanus,"The Romani (also spelled Romany , ), colloquially known as the Roma, are an Indo-Aryan ethnic group, traditionally nomadic itinerants. Most of the Romani people live in Europe, and diaspora populations also live in the Americas.In the English language, the Romani people are widely known by the exonym Gypsies (or Gipsies), which is considered pejorative by many Romani people due to its connotations of illegality and irregularity as well as its historical use as a racial slur. In many other languages, regarding cognates of the word, such as French: Tzigane, Spanish: gitano, Italian: zingaro, Portuguese: cigano, and Romanian: țigan this perception is either very small or non-existent. At the first World Romani Congress in 1971, its attendees unanimously voted to reject the use of all exonyms for the Romani people, including Gypsy, due to their aforementioned negative and stereotypical connotations.Linguistic and genetic evidence suggests that the Roma originated in the northern regions of the Indian subcontinent; in particular, the Rajasthan, Haryana, and Punjab regions of modern-day India. They are dispersed, but their most concentrated populations are located in Europe, especially Central, Eastern and Southern Europe (including Southern France), as well as Western Asia (mainly Turkey). The Romani people arrived in West Asia and Europe around the 14th century.Since the 19th century, some Romani people have also migrated to the Americas. There are an estimated one million Roma in the United States and 800,000 in Brazil, most of whose ancestors emigrated in the 19th century from Eastern Europe. Brazil also includes a notable Romani community descended from people deported by the Portuguese Empire during the Portuguese Inquisition. In migrations since the late 19th century, Romani people have also moved to other countries in South America and to Canada. Though often confused with them, the Romani people are culturally different from Irish Travellers and the Yenish people, two groups who may be related to each other. The Romani language is divided into several dialects, which together are estimated to have more than two million speakers. Many Romani people are native speakers of the dominant language in their country of residence or of mixed languages combining the dominant language with a dialect of Romani; those varieties are sometimes called Para-Romani."
Olybrius,"Anicius Olybrius (died 2 November 472) was Roman emperor from July 472 until his death later that same year; his rule as augustus in the western Roman Empire was not recognised as legitimate by the ruling augustus in the eastern Roman Empire, Leo I (r. 457–474). He was in reality a puppet ruler raised to power by Ricimer, the magister militum of Germanic descent, and was mainly interested in religion, while the actual power was held by Ricimer and his nephew Gundobad."
Glycerius,"Glycerius (fl. 470s) was Roman emperor of the West from 473 to 474. He served as comes domesticorum (commander of the palace guard) during the reign of Olybrius, until Olybrius died in November 472. After a four-month interregnum, Glycerius was proclaimed Western Emperor in March 473 by the magister militum (master of soldiers) and power behind the throne Gundobad. Very few of the events of his reign are known other than that during his reign an attempted invasion of Italy by the Visigoths was repelled, diverting them to Gaul. Glycerius also prevented an invasion by the Ostrogoths through gifts.Glycerius was not recognized by the Eastern Roman emperor Leo I, who instead nominated Julius Nepos as Emperor and sent him with an army to invade the Western Empire. Glycerius was without allies, because Gundobad had left to rule the Burgundians, and therefore was forced to abdicate on 24 June 474. He was appointed Bishop of Salona, which position he held until his death. He died some time after 474, possibly 480. He may have had a role in the assassination of Julius Nepos in 480."
Julius Nepos,"Julius Nepos (died 9 May 480), also known as just Nepos, ruled as Roman emperor of the West from 24 June 474 to 28 August 475. After losing power in Italy, Nepos retreated to his home province of Dalmatia, from which he continued to claim the western imperial title, with recognition from the Eastern Roman Empire, until he was murdered in 480. Though that distinction is most often awarded to Nepos' successor in Italy, Romulus Augustulus (r. 475–476), Nepos is regarded by some historians as the last western Roman emperor, being the last widely recognised claimant to the position.A native of Dalmatia, Nepos began his career as the semi-autonomous governor of the province, succeeding his uncle Marcellinus, a prominent general, as magister militum ('master of troops') of Dalmatia. After the death of the western emperor  Anthemius (r. 467–472), who had been appointed by the eastern emperor Leo I (r. 457–474), as well as Anthemius' successor Olybrius (r. 472), Leo sought to assert his authority in the west, granting Nepos command of an army in December 473 to attack Italy and depose Glycerius (r. 473–474), who had been proclaimed emperor by the Burgundian king Gundobad. Nepos left for Italy in the spring of 474, backed by Leo's successor Zeno, and landed with his army at Portus, near Rome. Nepos swiftly deposed Glycerius and was crowned western emperor in Rome on 24 June 474. He was the last emperor to be crowned in the city until Charlemagne in the ninth century. Whether the original intention of the invasion was to install Nepos as western emperor is unclear, but in any event, he was quickly recognised as the legitimate western emperor by Zeno.Nepos worked to restore the prestige and authority of the western empire, though mostly unsuccessfully. He may have repelled a Visigothic attack on Italy and managed to once more reduce the Burgundians into foederati. Nepos focused most of his attention on reasserting imperial control and authority in Gaul, but the western empire could no longer project enough strength to halt Visigothic conquests in the region. The failure to defeat the Visigoths in Gaul and Zeno's brief overthrowal in Constantinople by the usurper Basiliscus, weakened Nepos' already shaky position in Italy. In 475, Nepos' newly appointed magister militum Orestes revolted and marched on Ravenna, capital of the western empire. Unable to deal with Orestes' forces, Nepos fled back to Dalmatia and two months later, Orestes proclaimed his young son Romulus Augustulus as emperor.Although no longer in control of Italy, Nepos never renounced his claim to the western empire and continued to be recognised as the legitimate western emperor by the eastern empire. In 476, the barbarian general Odoacer deposed Romulus Augustulus and became the first king of Italy. Nepos repeatedly petitioned Zeno, who by then had defeated Basiliscus, for help in regaining control of Italy, though all he achieved was nominal recognition by Odoacer, who minted coins in Nepos' name but otherwise mostly ignored him. In 480, Nepos was murdered by two of his generals, Ovida and Viator, perhaps in Diocletian's Palace, possibly while planning an expedition of his own to recover Italy."
Romulus Augustulus,"Romulus Augustus (c. 465 – after 511?), nicknamed Augustulus, was Roman emperor of the West from 31 October 475 until 4 September 476. Romulus was placed on the imperial throne by his father, the magister militum Orestes, and, at that time, still a minor, was little more than a figurehead for his father. After Romulus ruled for just ten months, the barbarian general Odoacer defeated and killed Orestes and deposed Romulus. As Odoacer did not proclaim any successor, Romulus is typically regarded as the last Western Roman emperor, his deposition marking the end of the Western Roman Empire as a political entity. The deposition of Romulus Augustulus is also sometimes used by historians to mark the transition from antiquity to the medieval period.Very few records survive of Romulus' reign. There are no known policies, laws or inscriptions of significance of the emperor, which leaves the impression that he was a shadowy and relatively inconsequential figure. The nickname 'Augustulus' means ""little Augustus"" and was a derisive nickname referencing his young age. Romulus' immediate family, including his father and possibly his mother, and maybe both his paternal and maternal grandparents, were from the Roman province of Pannonia, and many of his family members had military backgrounds.Romulus came to power through usurpation of his predecessor, Julius Nepos (r. 474–475 in Italy) in 475. Nepos fled to Dalmatia and continued to claim the imperial title in exile, which hampered Romulus' legitimacy and ensured that he was never recognised by the eastern Roman emperor Zeno. In 476, the barbarian foederati (ally troops) in Italy demanded Italian lands to settle on, which was refused by Orestes. Under their leader Odoacer, the foederati defeated and killed Orestes and deposed Romulus, whereafter Odoacer became the first king of Italy and accepted emperor Zeno as his nominal suzerain.Romulus's life was spared by Odoacer, and he was allowed to retire to the castellum Lucullanum, a great fortress in Campania, located in Naples. Little certain information is known concerning Romulus's life in exile. He might have played a role in founding a monastery at castellum Lucullanum in the 480s or 490s, dedicated to Saint Severinus of Noricum. Romulus could have been alive as late as 507 or 511 when Theodoric the Great, Odoacer's successor, wrote a letter to a ""Romulus"" concerning a pension. Romulus was likely dead before the mid-530s, as accounts of the eastern Roman invasion of Italy at that time do not mention him."
