Icelandair,"Icelandair is the flag carrier airline of Iceland, headquartered at Keflavík International Airport near the capital city Reykjavik.It is part of the Icelandair Group and operates to destinations on both sides of the Atlantic Ocean from its main hub at Keflavík International Airport. The geographical position of Iceland is convenient for one-stop transatlantic flights, which is one pillar of the airline's business strategy, along with traffic to, from, and within the country."
Indian Airlines,None
IndiGo,None
InterSky,"InterSky, legally Intersky Luftfahrt GmbH, was an Austrian airline headquartered in Bregenz, which operated scheduled services from its base at Friedrichshafen Airport, Germany, to major cities in Germany, Austria and Switzerland, as well as seasonal holiday flights to the Mediterranean from other airports. The airline ceased operations on the evening of 5 November 2015 due to financial difficulties."
Iran Air,"The National Airline of Iran, branded as Iran Air (Persian: هواپیمايی ملی ایران, romanized: Havâpeymâyi-e Melli-e Irân), is the flag carrier of Iran, which is headquartered at Mehrabad Airport in Tehran. As of 2018, it operates scheduled services to 71 destinations in Asia and Europe. Iran Air's main bases are Tehran International Airport and Mehrabad Airport, both situated in Tehran, the capital of Iran.Domestically, Iran Air is commonly known as Homa, which is the name of a mythical Persian griffin, and also the acronym of Iran National Airlines in the Persian language. The airline's cargo division, Iran Air Cargo, operates scheduled  services internationally using one cargo aircraft."
JAL Japan Airlines,"Japan Airlines Co., Ltd. (日本航空株式会社, Nihon Kōkū Kabushiki-gaisha), (formerly Japan Air Lines), also known as JAL (Jaru) or Nikkō (日航), is an international airline and Japan's flag carrier and second largest airline as of 2021, headquartered in Shinagawa, Tokyo. Its main hubs are Tokyo's Narita International Airport and Haneda Airport, as well as Osaka's Kansai International Airport and Itami Airport. JAL group companies include Japan Airlines, J-Air, Japan Air Commuter, Japan Transocean Air, and Ryukyu Air Commuter for domestic feeder services, and JAL Cargo for cargo and mail services.JAL group operations include scheduled and non-scheduled international and domestic passenger and cargo services to 220 destinations in 35 countries worldwide, including codeshares. The group has a fleet of 279 aircraft. In the fiscal year ended 31 March 2009, the airline group carried over 52 million passengers and over 1.1 million tons of cargo and mail. Japan Airlines, J-Air, JAL Express, and Japan Transocean Air are members of the Oneworld airline alliance network.JAL was established in 1951 and became the national airline of Japan in 1953. After over three decades of service and expansion, the airline was fully privatised in 1987. In 2002, the airline merged with Japan Air System, Japan's third-largest airline, and became the sixth-largest airline in the world by passengers carried. Japan Airlines is currently an official sponsor of Japan Football Association, Japan national football team, Shimizu S-Pulse, and Consadole Sapporo. All Nippon Airways, the largest airline in Japan, is JAL's main competitor."
Jazeera Airways,"Jazeera Airways K.S.C (Arabic: طيران الجزيرة) is a Kuwaiti airline with its head office on the grounds of Kuwait International Airport in Al Farwaniyah Governorate, Kuwait. It operates scheduled services in the Middle East, Nepal, Pakistan, India, Sri Lanka and Europe.  Its main base is Kuwait International Airport. The airline has grown since its launch to become Kuwait's second national airline.Jazeera Airways is one of the largest operators at Kuwait airport, having handled a quarter of all aircraft movements and passengers at the airport during July 2009.According to the July 2009 report issued by Kuwait Directorate General for Civil Aviation's, Jazeera Airways had the largest number of aircraft movement in the month with 1834 take-offs and landings, overpassing the second-largest carrier in aircraft movement by 4% ."
Jet Airways,"Jet Airways (India) Ltd is an Indian international airline currently based in Delhi NCR with a training and developmental centre in Mumbai. It was one of the largest airlines in India, with a 21.2% passenger market share in February 2016. It operated over 300 flights daily to 74 destinations worldwide from its erstwhile main hub at Chhatrapati Shivaji International Airport and secondary hubs at Chennai International Airport, Indira Gandhi International Airport, New Delhi (new primary hub), Kempegowda International Airport, Bengaluru, and Netaji Subhas Chandra Bose International Airport, Kolkata.Incorporated in April 1992 as a limited liability company, the airline began operations as an air taxi operator in 1993. It began full-fledged operations in 1995 with international flights added in 2004. The airline went public in 2005 and in 2007, when it acquired Air Sahara. With its competitors, mainly SpiceJet and IndiGo, lowering ticket fares in the following years, it was forced to follow suit, hurting overall performance resulting in steep financial losses. It dropped to second place behind IndiGo in October 2017, with a passenger market share of 17.8%. The downward slide continued and resulted in bankruptcy in 2019. Before the founding of Vistara, it was the only other full-service airline of India apart from Air India. It ceased operations in April 2019, but is slated to restart operations in early 2022."
Jet Star,"Star Jet was a steel roller coaster that operated at Casino Pier in Seaside Heights, New Jersey from 2002 until it was swept into the Atlantic Ocean by Hurricane Sandy in 2012."
Jet2.com,"Jet2.com Limited, also known simply as Jet2, is a British low-cost leisure airline offering scheduled and charter flights from the United Kingdom. As of 2019, it is the third-largest scheduled airline in the UK, behind EasyJet and British Airways. Its headquarters are located at Leeds Bradford Airport, with further bases at Alicante-Elche, Belfast–International, East Midlands, Edinburgh, Glasgow, London–Stansted, Manchester, Newcastle, Birmingham, Bristol, Palma de Mallorca and Tenerife–South. The company holds a United Kingdom Civil Aviation Authority Type A Operating Licence to carry passengers, cargo and mail on aircraft with 20 or more seats. Jet2.com also offers a charter service through its Jet2charters brand."
JetBlue Airways,"JetBlue Airways is a major American low cost airline, and the seventh largest airline in North America by passengers carried. JetBlue Airways is headquartered in the Long Island City neighborhood of the New York City borough of Queens; it also maintains corporate offices in Utah and Florida.In 2020, it ranked #394 financially on the Fortune 500 list of the largest United States corporations by total revenue. JetBlue operates over 1,000 flights daily and serves 100 domestic and international network destinations in the U.S., Mexico, the Caribbean, Central America, South America, and Europe. JetBlue is not a member of any of the three major airline alliances but it has codeshare agreements with 21 airlines, including member airlines of Oneworld, SkyTeam, Star Alliance, and unaffiliated airlines."
JetLite,"Jaitelys are originally from Pir Panjal region of Jammu and Kashmir but are now found in Amritsar, Lahore, Rawalpindi and other areas of erstwhile west Punjab, Uttarakhand and some in Jammu region, but now are spread all over northern India. Jaitleys are part of Punjati Saraswat Brahmins of Punjab region. Mostly the gotra of Jaitly is Vatsa gotra from the sage Brahmarishi Bhrigu sections of gotra.There are several other ways of spelling the name, including Jaiteley, Jaitli, Jetly, Jatley and Jetli.The early 20th century book by H. A. Rose, A Glossary of the Tribes and Castes of the Punjab and North-West Frontier Province, summarized the variety of families and tribes of Vedic origin at the time. The late 19th century book by Jogendra N. Bhattacharya, ""Hindu Castes and Sects"" also gives the historical details of this Brahmin family.Jaitly family history shows they have also remained as great astrologers . their family tree has traces of pandit Billu Mishr and Pandit Chittu Mishr of serving in the court room of Maharaja Ranjeet singh . This family of astrologers has a great continuing legacy till date and are based in Delhi ."
Kenia Airways,"Nairobi ( ny-ROH-bee) is the capital and the largest city of Kenya. The name comes from the Maasai phrase Enkare Nairobi, which translates to ""cool water"", a reference to the Nairobi River which flows through the city. The city proper had a population of 4,397,073 in the 2019 census, while the metropolitan area has a population of 9,354,580. The city is popularly referred to as the Green City in the Sun.Nairobi was founded in 1899 by the colonial authorities in British East Africa, as a rail depot on the Uganda - Kenya Railway. The town quickly grew to replace Mombasa as the capital of Kenya in 1907. After independence in 1963, Nairobi became the capital of the Republic of Kenya. During Kenya's colonial period, the city became a centre for the colony's coffee, tea and sisal industry. The city lies in the south central part of Kenya, at an elevation of 1,795 metres (5,889 ft).According to the 2019 census, in the administrative area of Nairobi, 4,397,073 inhabitants lived within 696 km2 (269 sq mi).Nairobi is home of the Kenyan Parliament Buildings and hosts thousands of Kenyan businesses and over 100 major international companies and organizations, including the United Nations Environment Programme (UN Environment) and the United Nations Office at Nairobi (UNON). Nairobi is an established hub for business and culture. The Nairobi Securities Exchange (NSE) is one of the largest in Africa and the second-oldest exchange on the continent. It is Africa's fourth-largest exchange in terms of trading volume, capable of making 10 million trades a day. It also has the Nairobi National Park with a large game reserve. Nairobi is currently under the Nairobi Metropolitan Service."
Kingfisher Airlines,"Kingfisher Airlines Limited was an airline group based in India. It was established in 2003 and started its commercial operations in 2005. Through its parent company United Breweries Group, it had a 50% stake in low-cost carrier Kingfisher Red.Until December 2011, Kingfisher Airlines had the second largest share in India's domestic air travel market. However, the airline ran into continuous losses since its inception, ran high debts and finally closed its operations on 20 October 2012. Its chairman Vijay Mallya subsequently fled to London to allegedly hide from creditors."
KLM Royal Dutch Airlines,None
Korean Air,"Korean Air Co., Ltd. (Korean: 주식회사 대한항공; Hanja: 株式會社 大韓航空; RR: Jusikhoesa Daehan Hanggong), operating as Korean Air (Korean Air Lines before 1984), is the largest airline and flag carrier of South Korea based on fleet size, international destinations and international flights. The airline's global headquarters is located in Seoul,  South Korea. The present-day Korean Air was established on March 1, 1969, after the Hanjin Group acquired government-owned Korean Air Lines, which had operated since June 1962. Even though Korean Air is owned by Hanjin Group, KAL is controlled by majority of Hanjin KAL Corporation. The owner family of Hanjin Group is still the airline's largest and controlling, shareholder; Cho Won-tae (Walter Cho), its current chairman and CEO, is the third generation of the family to lead the airline. As of 5 June 2020, Hanjin KAL holds 29.27% of Korean Air shares. Korean Air is a founding member of the airline alliance SkyTeam and SkyTeam Cargo.Korean Air's international passenger division and related subsidiary cargo division together serve 126 cities in 44 countries, while its domestic division serves 13 destinations. It is among the top 20 airlines in the world in terms of passengers carried and is also one of the top-ranked international cargo airlines. Incheon International Airport Terminal 2 serves as Korean Air's international hub. Korean Air also maintains a satellite headquarters campus at Incheon. The majority of Korean Air's pilots, ground staff, and flight attendants are based in Seoul. The airline had approximately 20,540 employees as of December 2014."
Kullaflyg,"Kullaflyg was an airline based in Ängelholm/Helsingborg, Sweden. They lease aircraft and pilots from the sister company Braathens Regional. Their own staff works partly as ground personnel and as cabin crew on the aircraft. As all subsidiaries of Sverigeflyg, Kullaflyg uses the callsign and codes of Braathens Regional.In 2016, the Kullaflyg brand was, together with several other domestic airline brands, merged into the new BRA Braathens Regional Airlines."
Kulula Air,"Kulula.com (stylized as kulula.com) and commonly referred to as  Kulula is a South African low-cost airline, operating on major domestic routes from O. R. Tambo International Airport and Lanseria International Airport, both serving the city of Johannesburg. The airline's headquarters are located at Bonaero Park, Kempton Park, Ekurhuleni, Gauteng. The name 'Kulula' comes from the Nguni languages of Zulu and Xhosa, meaning It's easy."
Kuwait Airways,"Kuwait Airways (Arabic: الخطوط الجوية الكويتية, al-Ḫuṭūṭ al-Jawiyyah al-Kuwaītiyyah) is the national carrier of Kuwait, with its head office on the grounds of Kuwait International Airport, Al Farwaniyah Governorate. It operates scheduled international services throughout the Middle East, to the Indian subcontinent, Europe, Southeast Asia and North America, from its main base at Kuwait International Airport."
LAN Airlines,"LATAM Airlines Chile (formerly LAN Airlines / LAN-Chile) is an airline based in Santiago, Chile, and is one of the founders of LATAM Airlines Group, Latin America's largest airline holding company. The main hub is Comodoro Arturo Merino Benítez International Airport (Santiago), with secondary hubs in El Dorado (Bogotá), Jorge Chávez (Lima), Mariscal Sucre (Quito), and José Joaquín de Olmedo (Guayaquil) airports.LAN was the flag carrier of Chile until its privatization in the 1990s, is the predominant airline in Chile, Ecuador and Peru, and the second-largest carrier in Colombia, through its local subsidiaries. LAN is the largest airline in Latin America, serving Latin America, Northern America, the Caribbean, Oceania, Asia, and Europe. The carrier was a member of the Oneworld airline alliance from 2000 to 2020.LATAM Airlines Group was formed after the takeover by LAN of Brazilian TAM Linhas Aéreas, which was completed on June 22, 2012. In August 2015, it was announced that the two airlines would fully rebrand as LATAM, with one livery to be applied on all aircraft by 2018. Currently, LATAM Chile and LATAM Brazil continue to work as separate companies, under LATAM Airlines Group acting as the executive management. LATAM Airlines Group is currently the largest airline corporation in Latin America."
Lauda Air,"Lauda Air Luftfahrt GmbH, branded as Lauda Air, was an Austrian airline headquartered at Vienna International Airport in Schwechat.  It was owned by Niki Lauda during much of its existence, later becoming a charter airline subsidiary for leisure operations of Austrian Airlines. On 6 April 2013, Lauda Air ceased to exist and was replaced by Austrian myHoliday, a new brand name that is used for flights and leisure offers provided by Austrian Airlines."
LIAT,"A lie is an assertion that is believed to be false, typically used with the purpose of deceiving someone. The practice of communicating lies is called lying. A person who communicates a lie may be termed a liar. Lies may serve a variety of instrumental, interpersonal, or psychological functions for the individuals who use them. Generally, the term ""lie"" carries a negative connotation, and depending on the context a person who communicates a lie may be subject to social, legal, religious, or criminal sanctions. Although people in many cultures believe that deception can be detected by observing nonverbal behaviors (e.g. not making eye contact, fidgeting, stuttering) research indicates that people overestimate both the significance of such cues and their ability to make accurate judgements about deception. More generally, people's ability to make truth judgments is affected by biases towards accepting incoming information and interpreting feelings as evidence of truth. People don't always check incoming assertions against their memory."
LOT Polish Airlines,"LOT Polish Airlines, legally incorporated as Polskie Linie Lotnicze LOT S.A. (Polish pronunciation: [lɔt], flight), is the flag carrier of Poland. Established in 1928, LOT was a founding member of IATA and remains one of the world's oldest airlines in operation. With a fleet of 75 aircraft as of 2021, LOT Polish Airlines is the 18th largest operator in Europe with over 120 destinations across Europe, Asia and North America.The airline was founded on 29 December 1928 by the Polish government during the Second Polish Republic as a self-governing limited liability corporation, taking over existing domestic airlines Aerolot (founded in 1922) and Aero (founded in 1925), and began operations on 1 January 1929. The first aircraft used by LOT were Junkers F.13 and Fokker F.VII with the inaugural international service to Vienna, Austria, beginning on 2 August 1929.Most of the destinations originate from its hub at Warsaw Chopin Airport. Since 2018, LOT has maintained a secondary international hub at Budapest Ferenc Liszt International Airport in Hungary where it operates regularly scheduled flights to New York and Seoul. LOT Charters is the airline's wholly owned subsidiary which offers charter flights using LOT's mainline fleet on behalf of Polish tour operators. LOT has been a member of Star Alliance since 2003."
LTU Iinternational Airways,None
Lufthansa,"Lufthansa (German pronunciation: [ˈlʊft.hanza]) is Germany's flag carrier and the country's largest airline. When combined with its subsidiaries, it is the second-largest airline in Europe in terms of passengers carried. The name is derived from the German word Luft meaning ""air"" and Hansa for the Hanseatic League. Lufthansa is one of the five founding members of Star Alliance, the world's largest airline alliance, formed in 1997. The company slogan is 'Say yes to the world.'Besides its own services, and owning subsidiary passenger airlines Austrian Airlines, Swiss International Air Lines, Brussels Airlines, and Eurowings (referred to in English by Lufthansa as its Passenger Airline Group), Deutsche Lufthansa AG owns several aviation-related companies, such as Lufthansa Technik and LSG Sky Chefs, as part of the Lufthansa Group. In total, the group has over 700 aircraft, making it one of the largest airline fleets in the world.Lufthansa's registered office and corporate headquarters are in Cologne. The main operations base, called Lufthansa Aviation Center, is at Lufthansa's primary hub at Frankfurt Airport, and its secondary hub is at Munich Airport where a secondary Flight Operations Centre is maintained."
Luxair,"Luxair, legally Luxair S.A., Société Luxembourgeoise de Navigation Aérienne, is the flag carrier airline of Luxembourg with its headquarters and hub at Luxembourg Airport. It operates scheduled services to destinations in Europe, North Africa, the Mediterranean and Middle East with additional charter and seasonal services. It is Luxembourg's only passenger-carrying airline offering regular, non-charter service."
Malaysia Airlines,"Malaysia Airlines Berhad (MAB; Malay: Penerbangan Malaysia Berhad), formerly known as Malaysian Airline System (MAS; Sistem Penerbangan Malaysia), and branded as Malaysia Airlines, is the flag carrier airline of Malaysia and a member of the Oneworld airline alliance. (The MAS initials are still being kept by subsidiaries MAS Kargo and MAS Wings.) The company headquarters are located at Kuala Lumpur International Airport. In August 2014, the Malaysian government's sovereign wealth fund Khazanah Nasional—which then owned 69.37% of the airline—announced its intention to purchase remaining ownership from minority shareholders and delist the airline from Malaysia's stock exchange, thereby renationalising the airline. It operates primarily from Kuala Lumpur International Airport and from secondary hubs in Kota Kinabalu and Kuching to destinations throughout Asia, Oceania, and Europe.Malaysia Airlines owns two subsidiary airlines: Firefly and MASwings. Firefly operates scheduled flights from its two home bases Penang International Airport and Subang International Airport. The airline focuses on tertiary cities. MASwings focuses on inter-Borneo flights. Malaysia Airlines has a freighter fleet operated by sister company MASkargo, which manages freighter flights and aircraft cargo-hold capacity for all Malaysia Airlines' passenger flights.Malaysia Airlines traces its history to Malayan Airways Limited, which was founded in Singapore in the 1930s and flew its first commercial flight in 1947. It was then renamed as Malaysian Airways after the formation of the Malaysia in 1963. In 1966, after the separation of Singapore, the airline was renamed Malaysia–Singapore Airlines (MSA), before its assets were divided in 1972 to form two separate national airlines—Malaysian Airline System (MAS, since renamed as Malaysia Airlines) and Singapore Airlines.Despite numerous awards from the aviation industry, being crowned the ""World's 5-Star Airline"" by Skytrax multiple times (2009, 2012 and 2013) and recognition from the World Travel Awards as 'Asia's Leading Airline' (2010, 2011 and 2013), the airline struggled to cut costs to cope with the rise of low-cost carriers in the region since the early 2000s. In 2013, the airline initiated a turnaround plan after large losses beginning in 2011 and cut routes to prominent, but unprofitable, long-haul destinations, such as the Americas (Los Angeles and Buenos Aires) and South Africa. Malaysia Airlines also began an internal restructuring and intended to sell units such as engineering and pilot training."
Malev Hungarian Airlines,"MALÉV Ltd. (Hungarian: Malév Zrt.), which did business as MALÉV Hungarian Airlines (Hungarian: Magyar Légiközlekedési Vállalat, abbreviated MALÉV, pronounced [ˈmɒleːv]), was the flag carrier of Hungary from 1946 until 2012. Its head office was in Budapest, with its main hub at Budapest Ferenc Liszt International Airport. The airline flew to over 50 cities in 34 countries with a fleet of 22 aircraft. Malév joined the Oneworld alliance on 29 March 2007. On 3 February 2012, Malév ceased operations and on 14 February 2012 was declared insolvent by the Metropolitan Court of Budapest."
Malmo Aviation,"Braathens Regional Aviation was a Norwegian-owned Swedish airline headquartered in Malmö operating aircraft wet-leasing services together with its sister airline Braathens Regional Airways for BRA Braathens Regional Airlines.Previously it was known under the name Malmö Aviation and operated domestic routes in Sweden from its hub at Stockholm-Bromma Airport until February 2016, when its operations merged with Sverigeflyg to form BRA Braathens Regional Airlines. In the process the airline changed its name to the current Braathens Regional Aviation and ceased its own network-operations. In 2020 the airline ceased all operations."
Martinair,"Martinair (legally Martinair Holland N.V.) is a Dutch cargo airline headquartered and based at Amsterdam Airport Schiphol and a subsidiary of Air France–KLM. The airline was founded in 1958 by Martin Schröder. Since 2011, Martinair has operated entirely as a cargo airline with scheduled services to 20 destinations worldwide and additional charter flights. Prior to that date, passenger flights were also operated."
Meridiana fly,None
Middle East Airlines - Air Liban,"Middle East Airlines – Air Liban S.A.L. (Arabic: طيران الشرق الأوسط ـ الخطوط الجوية اللبنانية Ṭayyarān al-Sharq al-Awsaṭ – al-Khuṭūṭ al-jawiyyah al-lubnāniyyah), more commonly known as Middle East Airlines (MEA) (Arabic: طيران الشرق الأوسط Ṭayyarān al-Sharq al-Awsaṭ), is the national flag-carrier airline of Lebanon, with its head office in Beirut, near Beirut–Rafic Hariri International Airport. It operates scheduled international flights to Asia, Europe, the Middle East, and Africa from its base at Rafic Hariri International Airport.Middle East Airlines (MEA) is a member of the SkyTeam airline alliance. MEA expressed its interest in becoming a SkyTeam associate member in early 2006 at a press conference in New York.On 28 February 2011, the airline signed the partnership agreement with SkyTeam at a ceremony in Beirut, and officially joined the alliance on 28 June 2012, becoming its 17th member and the second member airline in the Middle East."
