Monarch Airlines,"Monarch Airlines, also known as Monarch, was  a British charter and scheduled airline founded by Bill Hodgson and Don Peacock and financed by the Swiss Sergio Mantegazza family. The company later became a low-cost airline in 2004 before abandoning charter flying completely. The airline's headquarters were at Luton, and it had operating bases at Birmingham, Leeds/Bradford, Gatwick and Manchester.When Monarch entered administration in 2017, it was the biggest airline collapse in UK history up to that point, leaving nearly 100,000 passengers and holidaymakers stranded. However, on 23 September 2019, Thomas Cook also collapsed, leaving 150,000 people stranded, and went on to become the largest UK airline ever to collapse.  The airline held a United Kingdom Civil Aviation Authority (CAA) Type A Operating Licence. This license allowed Monarch to carry passengers, cargo, and mail on aircraft with 20 or more seats."
Montenegro Airlines,"Montenegro Airlines a.d. (Serbo-Croatian: Montenegro erlajns / Монтенегро ерлајнс) was the flag carrier of Montenegro, headquartered in Podgorica. It operated scheduled and charter services throughout Europe from its hub at Podgorica Airport with a second base maintained at Tivat Airport. The airline was liquidated from 26 December 2020 due to accumulating heavy losses.In February 2021, the government of Montenegro launched a new flag carrier, Air Montenegro."
Nas Air,None
NextJet,None
NIKI,None
Nok Air,"Nok Air (SET: NOK, Thai: นกแอร์, derived from nok (นก), the Thai word for bird) is a  low-cost airline in Thailand operating mostly domestic services out of Bangkok's Don Mueang International Airport. Thai Airways owns the fourth-largest stake in the airline."
Norwegian Air Shuttle,"Norwegian Air Shuttle ASA (OSE: NAS), trading as Norwegian, is a Norwegian low-cost airline and Norway's largest airline. It is the fourth largest low-cost carrier in Europe behind Wizz Air, easyJet and Ryanair, the second-largest airline in Scandinavia, and the ninth-largest airline in Europe in terms of passenger numbers. It offers a high-frequency domestic flight schedule within Scandinavia and Finland, and to business destinations such as London, as well as to holiday destinations in the Mediterranean and the Canary Islands, transporting over 30 million people in 2016. The airline is known for its distinctive livery of white with a red nose, with portraits of high achievers on the tail fins of its aircraft.Norwegian's flights are operated by itself as well as fully owned subsidiaries, including Norwegian Air Sweden and Norwegian Air Norway. Each airline holds a unique air operator's certificate (AOC) but shares branding, corporate identity, and commercial functions with the rest of the Group.Until December 2019, Norwegian also owned and operated Norwegian Air Argentina, which operated domestic flights within the country. Until January 2021, Norwegian's former long-haul subsidiaries Norwegian Air UK and Norwegian Long Haul operated long-haul flights on behalf of the company, after which both subsidiaries were put into liquidation when long-haul operations were ended due to the COVID-19 pandemic. Until April 2021, Norwegian utilised Ireland-based Norwegian Air International for European-based operations outside of Norway or Sweden."
Olympic Air,"Olympic Air S.A. (Greek: Ολυμπιακή) is a regional airline, a subsidiary of the Greek carrier Aegean Airlines. It was formed as part of the privatization of the former Greek national carrier Olympic Airlines, a company that carried the name Olympic Airways from 1957 to the beginning of the 21st century. Olympic Air commenced limited operations on 29 September 2009, after Olympic Airlines ceased all operations, the full-scale opening of the company taking place two days later on 1 October 2009. Its main hubs are Thessaloniki International Airport and Athens International Airport. Rhodes International Airport serves as a small secondary hub. The airline's headquarters are in Building 57 at Athens International Airport in Spata, and its registered seat is in Koropi, Kropia, East Attica.The airline uses the IATA code OA that it inherited from Olympic Airlines, and the ICAO code OAL. The airline was launched using the ICAO code NOA, but has been reported to have bought the OAL code used by Olympic Airlines.On 22 February 2010, Olympic Air and its main competitor Aegean Airlines announced they had reached an agreement to merge their operations, phasing out the Olympic brand. After an inquiry by the European competitions commission, it was announced on 26 January 2011 that the merger was blocked citing anti-competitive concerns. However, the sale to Aegean Airlines was approved by the EU Competition Commission on 10 October 2013, and the airline is now a subsidiary of Aegean Airlines. It operates 10 Bombardier Dash 8 aircraft and 2 ATR 42, its former fleet of A320 and A319 aircraft having been sold during the various processes covered above."
Oman Air,"Oman Air (Arabic: الطيران العماني) is the national airline of Oman. Based at Muscat International Airport in Seeb, Muscat, it operates domestic and international passenger services, as well as regional air taxi and charter flights."
Onur Air,"Onur Air (Turkish: Onur Air Taşımacılık AŞ, often styled OnurAir or Onurair) is a low-cost airline with its headquarters in the Technical Hangar B at Istanbul Atatürk Airport in Yeşilköy, Istanbul, Turkey. It operates mostly domestic scheduled services, as well as charter flights out of its base at Istanbul Airport. As of December 2021, it was forced to suspend all operations until further notice."
Ostfriesische Lufttransport GmbH,OLT Express Germany (formerly OLT Ostfriesische Lufttransport GmbH or OLT) was an airline based in Bremen in Germany. The company moved to Bremen from Emden in February 2012. It operated regional scheduled and charter flights linking northern Germany to other parts of the country and Bremen to other European destinations. Its main base was Bremen Airport.
Pacific Wings,"Pacific Wings Airline was an American commuter airline headquartered in Mesa, Arizona, United States in Greater Phoenix. The airline operated flights under the brands New Mexico Airlines in New Mexico, GeorgiaSkies in Georgia, TennesseeSkies in Tennessee, and KentuckySkies in Kentucky, as well as under the Pacific Wings name in Hawaii. The airline was closed in 2014."
Pakistan International Airlines,"Pakistan International Airlines (Urdu: پاکستان انٹرنیشنل ایئرلائنز; abbreviated PIA, Urdu: پی‌آئی‌اے) is an international airline that serves as the national flag carrier of Pakistan under the administrative control of the Secretary to the Government of Pakistan for Aviation. Its central hub is Karachi's Jinnah International Airport, while Allama Iqbal International Airport in Lahore, and Islamabad International Airport serve as secondary hubs.PIA was founded on 29 October 1946 as Orient Airways, and was initially based in Calcutta, British India, before shifting operations to the newly independent state of Pakistan in 1947. Orient Airways was nationalised to form the Pakistan International Airlines Corporation (PIAC). The new airline commenced international services in 1955 to London, via Cairo and Rome. PIA became the first Asian airline to operate jet aircraft with the induction of the Boeing 707 into commercial service on 7 March 1960, and later in 1964 became the first non-Communist airline to fly to China. The airline played a vital role in the establishment of  Emirates Airline in 1985. In 2004, PIA become the launch customer of the Boeing 777-200LR. On 10 November 2005 PIA used the Boeing 777-200LR to complete the world's longest nonstop flight by a commercial airliner. This flight lasted 22 hours and 22 minutes on the eastbound route between Hong Kong and London.PIA is Pakistan's largest airline and operates a fleet of 29 aircraft. The airline operates nearly 100 flights daily, servicing 18 domestic destinations and 25 international destinations across Asia, Europe, the Middle East and North America. In addition to commercial flight operations, PIA also owns The Roosevelt Hotel in New York City, and the Sofitel Paris Scribe Hotel in Paris. The airline operates a frequent flier programme, PIA Awards +, and has several codeshare and interline agreements. However, it is not part of any airline alliance.On 30 June 2020, PIA was banned from flying in European airspace for six months, starting on 1 July 2020, after EASA determined that the airline was not capable of certifying and overseeing its operators and aircraft in accordance with applicable international standards. This decision was made soon after it was revealed that at least a third of all pilot's licenses issued in Pakistan were not genuine. By 9 July 2020, the airline was also banned by the United Kingdom and the United States."
Paramount Airways,"Paramount Airways was an airline based in Chennai, India. It operated scheduled services, mainly targeting business travellers until it ceased operations in 2010. Its hub was Chennai International Airport and was the first airline in India to launch the New Generation Embraer 170/190 Family series aircraft. The airline started operations in October 2005 with the company headquartered in Madurai. It operated to regional destinations in south and eastern India until early 2010."
Pegasus Airlines,"Pegasus Airlines (Turkish: Pegasus Hava Taşımacılığı A.Ş.) (BİST: PGSUS) is a Turkish low-cost carrier headquartered in the Kurtköy area of Pendik, Istanbul with bases at several Turkish airports."
Peninsula Airways,"Peninsula Airways, operated as PenAir, was a U.S.-based regional airline headquartered in Anchorage, Alaska. It was Alaska's second-largest commuter airline operating scheduled passenger service, as well as charter and medevac services throughout the state. Its main base was Ted Stevens Anchorage International Airport. PenAir had a code sharing agreement in place with Alaska Airlines with its flights operated in the state of Alaska."
Philippine Airlines,"Philippine Airlines (PAL), a trade name of PAL Holdings, Inc. (PSE: PAL), also known historically (until 1970) as Philippine Air Lines, is the flag carrier of the Philippines. Headquartered at the PNB Financial Center in Pasay, the airline was founded in 1941 and is the first and oldest commercial airline in Asia operating under its original name.The primary hub of Philippine Airlines is Ninoy Aquino International Airport, Manila. It also operates three secondary hubs: Mactan–Cebu International Airport, Cebu; Francisco Bangoy International Airport, Davao; and Clark International Airport which covers portions of the cities of Angeles and Mabalacat within the Clark Freeport Zone in the province of Pampanga. Its subsidiary PAL Express operates only regional routes while PAL operates both domestic (Cebu, Davao, General Santos, Kalibo, Manila and Zamboanga) and international routes. The airline operates both narrowbody and widebody fleets of Airbus aircraft and a widebody fleet of Boeing aircraft."
Pluna,"PLUNA Líneas Aéreas Uruguayas S.A. was the flag carrier of Uruguay. It was headquartered in Carrasco, Montevideo and operated scheduled services within South America, as well as scheduled cargo and charter services from its hub at Carrasco International Airport.On 5 July 2012, only two days after the carrier's employees went on strike amid mounting financial difficulties, the Uruguayan government decided to close the airline down and to liquidate it. The carrier was wholly owned by the government at the time of its closure."
Qantas Airways,None
Qatar Airways,"Qatar Airways Company Q.C.S.C. (Arabic: القطرية, al-Qaṭariya), operating as Qatar Airways, is the state-owned flag carrier of Qatar. Headquartered in the Qatar Airways Tower in Doha, the airline operates a hub-and-spoke network, flying to over 150 international destinations across Africa, Asia, Europe, the Americas, and Oceania from its base at Hamad International Airport, using a fleet of more than 200 aircraft. Qatar Airways Group employs more than 43,000 people. The carrier has been a member of the Oneworld alliance since October 2013 (2013-10), the first Persian Gulf carrier to sign with one of the three major airline alliances."
Regional Express Airlines,"Regional Express Pty. Ltd., trading as Rex Airlines (and as Regional Express on regional routes), is an Australian airline based in Mascot, New South Wales. It operates scheduled regional and domestic services. It is Australia's largest regional airline outside the Qantas group of companies,  with a growing domestic network, which launched on 1 March 2021, and serves all 6 states across Australia. It is the primary subsidiary of Regional Express Holdings."
Robin Hood Aviation,"Robin Hood Aviation was an Austrian airline, operating from its homebase Graz and from Linz to Zurich. It operated also charter flights. Majority owners were the Austrian entrepreneurs Dr. Helmut Rieder and Dr. Raimund Pammer (founders of Efkon Group)."
Rossiya Airlines,"Rossiya Airlines (Russian: АО Авиакомпания „Россия“, tr. AO Aviakompaniya „Rossiya“), sometimes branded as Rossiya—Russian Airlines (Russian: Россия — Российские авиалинии, tr. Rossiya — Rossyskiye avialinii),  is one of the oldest and largest air carriers of the Russian Federation. It was founded on May 7, 1934. It is a part of Aeroflot Group. Rossiya is the largest and the base carrier of Pulkovo Airport (Saint Petersburg)."
Royal Air Maroc,"Royal Air Maroc (French pronunciation: ​[ʁwajal ɛʁ maʁɔk]; Arabic: الخطوط الملكية المغربية, al-Khuṭūṭu l-Malakiyyatu l-Maghribiyyah, literally Royal Moroccan Lines or Royal Moroccan Airlines; Berber languages: ⴰⵎⵓⵏⵉ ⴰⵢⵍⴰⵍ ⴰⴳⵍⴷⴰⵏ ⵏ ⴰⵎⵓⵔⴰⴽⵓⵛ, Amuni Aylal Ageldan n Amurakuc), more commonly known as RAM, is the Moroccan national carrier, as well as the country's largest airline.RAM is wholly owned by the Moroccan Government, and has its headquarters on the grounds of Casablanca-Anfa Airport. It joined the Oneworld alliance in 2020. From its base at Mohammed V International Airport, the carrier operates a domestic network in Morocco, scheduled international flights to Africa, Asia, Europe, and North and South America, and occasional charter flights that include Hajj services."
Royal Brunei Airlines,"Royal Brunei (RB) Airlines Sdn Bhd (Malay: Penerbangan DiRaja Brunei, Jawi: ڤنربڠن دراج بروني‎) is the national flag carrier airline of Brunei Darussalam, headquartered in the RB Campus in Bandar Seri Begawan. It is wholly owned by the government of Brunei. Its hub is Brunei International Airport in Berakas, just to the north of Bandar Seri Begawan, the capital of Brunei.Formed in 1974 with an initial fleet of two Boeing 737-200 aircraft, serving Singapore, Hong Kong, Kota Kinabalu and Kuching, Royal Brunei Airlines now operates to 32 destinations in Southeast Asia, the Middle East, Europe, and Oceania. Its fleet and type numbers increased dramatically in the 1990s."
Royal Jordanian Airline,"Royal Jordanian Airlines (Arabic: الملكيَّة الأردنيَّة‎; transliterated: Al-Malakiyyah al-'Urduniyyah), formerly known as Alia Royal Jordanian Airlines, is the flag carrier airline of Jordan with its head office in the capital, Amman. The airline operates scheduled international services over four continents from its main base at Queen Alia International Airport, with over 500 flights per week and at least 110 daily departures. It joined the Oneworld airline alliance in 2007."
Ryanair,"Ryanair DAC is an Irish ultra low-cost carrier founded in 1984. It is headquartered in Swords, Dublin, Republic of Ireland and has its primary operational bases at Dublin and London Stansted airports. It forms the largest part of the Ryanair Holdings family of airlines and has Ryanair UK, Buzz, Lauda Europe, and Malta Air as sister airlines. In 2016, Ryanair was the largest European budget airline by scheduled passengers flown, and it carried more international passengers than any other airline.Ryanair Group operates more than 400 Boeing 737-800 aircraft, with a single 737-700 used as a charter aircraft, as a backup, and for pilot training. The airline has been characterized by its rapid expansion, a result of the deregulation of the aviation industry in Europe in 1997 and the success of its low-cost business model. Ryanair's route network serves 40 countries in Europe, North Africa (Morocco), and the Middle East (Israel, Jordan and Turkey).The company has often been criticised for its poor working conditions, heavy use of extra charges, bad customer service, and tendency to intentionally generate controversy in order to gain free publicity."
S7 Airlines,None
SAS Scandinavian Airlines,"Scandinavian Airlines, more commonly known and styled as SAS, is the flag carrier of Denmark, Norway, and Sweden. SAS is an abbreviation of the company's full name, Scandinavian Airlines System or legally Scandinavian Airlines System Denmark-Norway-Sweden. Part of the SAS Group and headquartered at the SAS Frösundavik Office Building in Solna, Sweden, the airline operates 180 aircraft to 90 destinations (as of December 2019). The airline's main hub is at Copenhagen-Kastrup Airport, with connections to 109 destinations around the world. Stockholm Arlanda Airport (with 106 destinations) is the second largest hub and Oslo Airport, Gardermoen being the third major hub of SAS. Minor hubs also exist at Bergen Airport, Flesland, Göteborg Landvetter Airport, Stavanger Airport, Sola, and Trondheim Airport, Værnes. SAS Cargo is an independent, wholly owned subsidiary of Scandinavian Airlines and its main office is at Copenhagen Airport.In 2017, SAS carried 28.6 million passengers, achieving revenues of 40 billion Swedish kronor. This makes it the eighth-largest airline in Europe and the largest in Denmark and Sweden. The SAS fleet is composed of 180 aircraft consisting of Airbus A319, Airbus A320, Airbus A320neo, Airbus A321, Airbus A330, Airbus A350, and Boeing 737 Next Generation aircraft. SAS also wet leases Airbus A320neo, ATR 72, and Bombardier CRJ900 aircraft.The airline was founded in 1946 as a consortium to pool the transatlantic operations of Swedish airline Svensk Interkontinental Lufttrafik, Norway's Det Norske Luftfartselskap and Det Danske Luftfartselskab of Denmark. The consortium was extended to cover European and domestic cooperation two years later. In 1951, all the airlines were merged to create SAS. SAS has been described as ""an icon of Norwegian–Swedish–Danish cooperation"". On 27 June 2018, the Norwegian government announced that it had sold all its shares in SAS.In 1997, SAS was a founding member of one of the major airline alliances, Star Alliance."
SATA International,"Azores Airlines, previously known as SATA Internacional, is a Portuguese airline based in the municipality of Ponta Delgada, on the island of São Miguel in the autonomous archipelago of the Azores. A subsidiary of SATA Air Açores, the airline operates as the international arm of the regional network, connecting the archipelago with Europe and North America, from its hub at João Paulo II Airport."
Saudi Arabian Airlines,None
Shenzhen Airlines,"Shenzhen Airlines (Chinese: 深圳航空; pinyin: Shēnzhèn Hángkōng) is an airline headquartered in Shenzhen Bao'an International Airport in Bao'an District, Shenzhen, Guangdong. It has been a member of Star Alliance since 2012, and is currently one of two Chinese airlines that is part of the airline alliance.The carrier operates a total of 137 domestic airport-pairs involving 58 Chinese airports, plus nine international routes. In 2010, the airline carried 16.5 million passengers, up 9% on the previous year."
Silk Air,"SilkAir (Singapore) Private Limited, operating as SilkAir, was a Singaporean regional airline with its head office in Changi, Singapore. It was a wholly owned subsidiary of Singapore Airlines and operated scheduled passenger services from Singapore to 28 cities in 13 countries in Southeast Asia, the Indian Subcontinent, East Asia, and Northern Australia. As the regional wing of Singapore Airlines, it served the short to medium-haul destinations in the Singapore Airlines Group network.On 18 May 2018, Singapore Airlines announced that the SilkAir fleet would undergo a major cabin product upgrade from 2020 before being fully merged into the parent company. As part of the merger, SilkAir's website was discontinued and integrated into Singapore Airlines' website on 31 March 2019 with the airline itself folded into SIA by the end of January 2021."
Singapore Airlines,"Singapore Airlines (abbreviation: SIA) is the flag carrier airline of Singapore with its hub at Singapore Changi Airport. The airline is notable for using the Singapore Girl as its central figure in corporate branding. It has been ranked as the world's best airline by Skytrax four times and topped Travel & Leisure's best airline rankings for more than 20 years.Singapore Airlines Group has more than 20 subsidiaries, including many airline-related subsidiaries. SIA Engineering Company handles maintenance, repair, and overhaul (MRO) business across nine countries, with a portfolio of 27 joint ventures, including with Boeing and Rolls-Royce. Singapore Airlines Cargo operates SIA's freighter fleet and manages the cargo-hold capacity in SIA's passenger aircraft. Scoot, a wholly owned subsidiary, operates as a low-cost carrier.Singapore Airlines was the launch customer for the Airbus A380 — the world's largest passenger aircraft — as well as the Boeing 787-10 and the ultra-long-range version of the Airbus A350-900. It ranks amongst the top 15 carriers worldwide in terms of revenue passenger kilometers, and is ranked tenth in the world for international passengers carried. Singapore Airlines was voted as the Skytrax World's Best Airline Cabin Crew 2019. The airline also won the second and fourth positions as the World's Best Airlines and World's Cleanest Airlines respectively for 2019."
Sky Express,"Sky Express, legal name Cretan Aeronautical Operations (Greek: Κρητικές Αεροπορικές Εκμεταλλεύσεις Kritikés Aeroporikés Ekmetallefsis), is a Greek airline headquartered in Athens International Airport. It was established in 2005 and operates a number of flights, serving 35 domestic and eight international destinations."
Sky Work Airlines,"SkyWork Airlines was a Swiss airline with its head office in Belp near Bern and its base at Bern Airport. It primarily operated scheduled flights to destinations across Europe, with additional charter operations throughout the summer months. The airline declared bankruptcy on 29 August 2018 and ceased all operations the same day."
Smartwings,"Smartwings, a.s. (formerly Travel Service, a.s.) is a low-cost leisure Czech airline, with its head office on the property of Václav Havel Airport Prague in Ruzyně, 6th district, Prague. It is the biggest airline in the Czech Republic and it operates scheduled and chartered flights, mainly to leisure destinations, and also wet and dry leases its aircraft to other airlines. It also owns 98% of Czech Airlines, and has subsidiaries in Poland, Hungary and Slovakia."
South African Airways,None
Southwest Airlines,"Southwest Airlines Co., typically referred to as Southwest, is one of the major airlines of the United States and the world's largest low-cost carrier. It is headquartered in Dallas, Texas and has scheduled service to 121 destinations in the United States and 10 additional countries. As of 2018, Southwest carried more domestic passengers than any other United States airline.The airline was established on March 15, 1967, by Herb Kelleher and Rollin King as Air Southwest Co. and adopted its current name, Southwest Airlines Co., in 1971, when it began operating as an intrastate airline wholly within the state of Texas, first flying between Dallas, Houston, and San Antonio. It began regional interstate service in 1979, expanding nationwide in the following decades. Southwest currently serves airports in 45 states and multiple Central American destinations.Southwest's business model is distinct from other US airlines as it uses a rolling hub and point-to-point network and allows free checked baggage. It exclusively uses Boeing 737 jets in its fleet.The airline has nearly 60,000 employees and operates about 4,000 departures a day during peak travel season."
Spanair,"Spanair S.A. was a Spanish airline, with its head office in the Spanair Building in L'Hospitalet de Llobregat, near Barcelona. Until 2009, it was a subsidiary of the SAS Group; the same parent company in control of Scandinavian Airlines and held slightly under 20% of the company. Spanair provided a scheduled passenger network within Spain and Europe, with an extension to West Africa.  Worldwide charters were also flown for tour companies. Its main hub was Barcelona El Prat Airport, with focus cities at Madrid–Barajas Airport and Palma de Mallorca Airport. The airline had 3,161 employees and was a Star Alliance member from 2003 until its demise."
