Adria Airways,"Adria Airways d.o.o. (formerly Inex-Adria Aviopromet and later Inex-Adria Airways) was the flag carrier of Slovenia, operating scheduled and charter services to European destinations. The company's head office was at Ljubljana Jože Pučnik Airport in Zgornji Brnik, Cerklje na Gorenjskem, near Ljubljana. On 30 September 2019, the airline declared bankruptcy and ceased all operations."
Aegean Airlines,None
Aer Arann,"Stobart Air, legally incorporated as Stobart Air Unlimited Company, was an Irish regional airline headquartered in Dublin. It operated scheduled services under the brands Aer Lingus Regional, BA CityFlyer and KLM Cityhopper on behalf of their respective owners. Stobart Air had operating bases in Cork, Dublin and Belfast for Aer Lingus Regional. It ceased operations on 12 June 2021.Established as Aer Arann in 1970, a major refinancing in 2014 was associated with a name change to Stobart Air. Aer Arann (styled as Aer Arann Regional) was a regional airline based in Dublin, Ireland. The airline operated scheduled services on behalf of Aer Lingus Regional. The airline had three bases in Cork, Dublin and Shannon which operated under the Aer Lingus Regional brand. On 19 March 2014, Aer Arann announced that it would be changing its corporate name to Stobart Air by the end of 2014."
Aer Lingus,"Aer Lingus ( air LING-gəs; an anglicisation of the Irish aerloingeas [ˌeːɾˠˈl̪ˠɪɲɟəsˠ], meaning ""Air Fleet"") is the flag carrier of Ireland. Founded by the Irish Government, it was privatised between 2006 and 2015 and it is now a wholly owned subsidiary of International Airlines Group (IAG). The airline's head office is on the grounds of Dublin Airport in Cloghran, County Dublin.Formed in 1936, Aer Lingus is a former member of the Oneworld airline alliance, which it left on 31 March 2007. After the takeover by IAG, it was expected that Aer Lingus would re-enter Oneworld, however, at a press briefing on 15 November 2017 the airline's then CEO Stephen Kavanagh stated that the airline has ""no plans to join Oneworld"". The airline has codeshares with Oneworld, Star Alliance and SkyTeam members, as well as interline agreements with Etihad Airways, JetBlue Airways and United Airlines. Aer Lingus has a hybrid business model, operating a mixed fare service on its European routes and full service, two-class flights on transatlantic routes.Ryanair owned over 29% of Aer Lingus stock and the Irish state owned over 25% before being bought out by IAG in 2015. The state had previously held an 85% shareholding until the Government's decision to float the company on the Dublin and London stock exchanges on 2 October 2006. The principal group companies include Aer Lingus Limited, Aer Lingus Beachey Limited, Aer Lingus (Ireland) Limited and Dirnan Insurance Company Limited, all of which are wholly owned.On 26 May 2015, after months of negotiations on a possible IAG takeover, the Irish government agreed to sell its 25% stake in the company. Ryanair retained a 30% stake in Aer Lingus which it agreed to sell to IAG on 10 July 2015 for €2.55 per share. In August 2015, Aer Lingus' shareholders officially accepted IAG's takeover offer. IAG subsequently assumed control of Aer Lingus on 2 September 2015."
Aero,"The atmosphere of Earth, commonly known as air, is the layer of gases retained by Earth's gravity that surrounds the planet and forms its planetary atmosphere. The atmosphere of Earth protects life on Earth by creating pressure allowing for liquid water to exist on the Earth's surface, absorbing ultraviolet solar radiation, warming the surface through heat retention (greenhouse effect), and reducing temperature extremes between day and night (the diurnal temperature variation).By mole fraction (i.e., by number of molecules), dry air contains 78.08% nitrogen, 20.95% oxygen, 0.93% argon, 0.04% carbon dioxide, and small amounts of other gases. Air also contains a variable amount of water vapor, on average around 1% at sea level, and 0.4% over the entire atmosphere. Air composition, temperature, and atmospheric pressure vary with altitude. Within the atmosphere, air suitable for use in photosynthesis by terrestrial plants and breathing of terrestrial animals is found only in Earth's troposphere.Earth's early atmosphere consisted of gases in the solar nebula, primarily hydrogen. The atmosphere changed significantly over time, affected by many factors such as volcanism, life, and weathering. Recently, human activity has also contributed to atmospheric changes, such as global warming, ozone depletion and acid deposition.The atmosphere has a mass of about 5.15×1018 kg, three quarters of which is within about 11 km (6.8 mi; 36,000 ft) of the surface. The atmosphere becomes thinner with increasing altitude, with no definite boundary between the atmosphere and outer space. The Kármán line, at 100 km (62 mi) or 1.57% of Earth's radius, is often used as the border between the atmosphere and outer space. Atmospheric effects become noticeable during atmospheric reentry of spacecraft at an altitude of around 120 km (75 mi). Several layers can be distinguished in the atmosphere, based on characteristics such as temperature and composition.The study of Earth's atmosphere and its processes is called atmospheric science (aerology), and includes multiple subfields, such as climatology and atmospheric physics. Early pioneers in the field include Léon Teisserenc de Bort and Richard Assmann.  The study of historic atmosphere is called paleoclimatology."
Aero Republica,"Copa Airlines Colombia is a commercial passenger airline founded and registered under the corporate name of AeroRepública S.A. in November 1992, and is the second airline in Colombia for international passengers carried after Avianca and the third in total traffic. It covers national and international destinations from the El Dorado International Airport in Bogotá and from the main cities of Colombia. As of October 5, 2010, the airline used the trade name of Copa Airlines Colombia.The national operations of Copa Airlines Colombia were replaced by a new low-cost airline subsidized by its parent company Copa Holdings known as Wingo, in December 2016."
Aeroflot Russian Airlines,"PJSC Aeroflot – Russian Airlines (Russian: ПАО ""Аэрофло́т — Росси́йские авиали́нии"", PAO Aeroflot — Rossiyskiye avialinii), commonly known as Aeroflot (English:   or  (listen); Russian: Аэрофлот, transl. ""air fleet"", pronounced [ɐɛrɐˈfɫot]), is the flag carrier and largest airline of the Russian Federation. The airline was founded in 1923, making Aeroflot one of the oldest active airlines in the world. Aeroflot is headquartered in the Central Administrative Okrug, Moscow, with its hub being Sheremetyevo International Airport. Before the 2022 Russian invasion of Ukraine, the airline flew to 146 destinations in 52 countries, excluding codeshared services. The number of destinations was significantly reduced after many countries banned Russian aircraft; of 8 March 2022, Aeroflot flies only to destinations in Russia and Belarus.From its inception to the early 1990s, Aeroflot was the flag carrier and a state-owned enterprise of the Soviet Union (USSR). During this time, Aeroflot grew its fleet to over five thousand domestically made aircraft and expanded to operate a domestic and international flight network of over three thousand destinations throughout the Soviet Union and the globe, making the airline the largest in the world at the time. In addition to passenger flights, Aeroflot also committed to freight operations and serving the state through transportation and military assistance. Following the dissolution of the USSR, the carrier was restructured into an open joint-stock company and embarked on a radical transformation process. Aeroflot shrank the fleet dramatically while at the same time purchasing Western aircraft and newer domestic models and focusing on expanding its international market share before moving to boost its domestic market share.By the end of 2017, Aeroflot controlled roughly 40% of the air market in Russia. Aeroflot owns Rossiya Airlines – an airline based in Saint Petersburg, Pobeda – a low-cost carrier, and 51% of airline Aurora, based in the Russian Far East. Altogether, Aeroflot and its subsidiaries own 359 aircraft as of 31 December 2019, composed mainly of Airbus, Boeing, and domestic models such as the Sukhoi Superjet 100. Aeroflot also formerly had a cargo subsidiary named Aeroflot-Cargo, though the branch later merged with the parent airline.Aeroflot became a member of SkyTeam in April 2006, making it the first carrier in the former Soviet Union to do so. As of March 2020, the Russian Government owns 51% of Aeroflot through the Federal Agency for State Property Management, with the rest of the shares being free-floating."
Aeroline GmbH,"Sylt Air GmbH is an airline based at Sylt-Ost, Germany, operating chartered and scheduled flights from Sylt Airport."
Aerolineas Argentinas,"Aerolíneas Argentinas, formally Aerolíneas Argentinas S.A., is Argentina's largest airline and the country's flag carrier. The airline was created in 1949 from the merger of four companies and started operations in December 1950 (1950-12). A consortium led by Iberia took control of the airline in 1990, and Grupo Marsans acquired the company and its subsidiaries in 2001, following a period of severe financial difficulties that put the airline on the brink of closure. The company has been run by the Argentine government since late 2008, when the country regained control of the airline after it was taken over from the Spanish owners. As of December 2014, Aerolíneas Argentinas was state-owned. It has its headquarters in Buenos Aires. SkyTeam membership was achieved in late August 2012 (2012-08); the airline's cargo division became a member of SkyTeam Cargo in November 2013 (2013-11).Aerolíneas Argentinas and its former sister company Austral Líneas Aéreas operates from two hubs, both located in Buenos Aires: Aeroparque Jorge Newbery and Ministro Pistarini International Airport. Its narrow body fleet, used on domestic and regional routes, consists of Boeing 737-700, 737-800 and 737 MAX 8, whereas intercontinental and transoceanic services are flown on the wide body Airbus A330-200."
Aeromar,"Transportes Aeromar, S.A. de C.V, doing business as Aeromar, is a Mexican airline that operates scheduled domestic services in Mexico and international services to the United States, Guatemala, and Honduras. Its main base is Mexico City International Airport."
Aeromexico,"Aerovías de México, S.A. de C.V. (lit. 'Airways of Mexico, Public Limited') operating as Aeroméxico (pronounced [a.eɾoˈmexiko]; stylized as AEROMEXICO), is the flag carrier airline of Mexico, based in Mexico City. It operates scheduled services to more than 90 destinations in Mexico; North, South and Central America; the Caribbean, Europe and Asia. Its main base and hub is in Mexico City, with secondary hubs in Guadalajara and Monterrey. The headquarters is in the financial district on Paseo de la Reforma, formerly in its own building overlooking the Diana the Huntress Fountain, but moved down the street in 2017 to the Torre MAPFRE tower across from the Mexican Stock Exchange while the old building is demolished and replaced with a much taller new tower.Grupo Aeroméxico includes Aeroméxico, Aeroméxico Connect (regional subsidiary), and Aeroméxico Contigo (product on select U.S.-Mexico routes). The group currently holds the No. 2 place in domestic market share behind Volaris, with 24.2%; and No. 1 place in international market share with 15.8%, in the 12 months ending March 2020, becoming Mexico's largest international airline group. Aeroméxico is one of the four founding members of the SkyTeam airline alliance, along with Air France, Delta Air Lines and Korean Air.Aeroméxico works closely with the U.S. carrier Delta Air Lines, which owns part of Aeroméxico and in 2015 announced its intention to acquire up to 49%. On 8 May 2017 a joint commercial agreement (JCA), came into effect, whereby the airlines share information, costs, and revenues on all their flights between the United States and Mexico.In 2016, the company flew 19.703 million passengers (up 5.0% vs. previous year), of which 13.047 million domestic (+3.7%) and 6.656 million international (+7.6%). It flew 34.776 million revenue passenger kilometers (RPKs), had 43.362 million available seat kilometers (ASKs), and an 80.3% load factor."
Aerosur,"Compañía Boliviana de Transporte Aéreo Privado Aerosur, S.A. (shortened and styled AeroSur) was a privately owned airline from Bolivia, which served as the country's flag carrier since 1998, along with state-owned Boliviana de Aviación. Headquartered in Santa Cruz de la Sierra, it operated a network of domestic and international scheduled passenger flights with its hub at the city's Viru Viru International Airport. As of 2010, the airline had 1200 employees."
Aerosvit,"AeroSvit Airlines private stock company (Ukrainian: Приватне акціонерне товариство «Авіакомпанія АероСвіт»), operating as AeroSvit — Ukrainian Airlines / АероСвіт, was a Ukrainian private airline. Its head office was on the grounds of the Boryspil International Airport in Boryspil.Aerosvit Airlines was a member of IATA and an IATA IOSA certified carrier. Its main base was the Boryspil Airport. The airline was established in March 1994 and started operations in April the same year with international flights from Kyiv in co-operation with Air Ukraine. At December 2012, Aerosvit was the largest carrier in Ukraine. Bankruptcy procedures began in January 2013, and in February 2013, AeroSvit ceased operations."
Afriqiyah Airways,"Afriqiyah Airways (Arabic: الخطوط الجوية الأفريقية Al-Khuṭūṭ al-Jawwiyyah al-Afrīqiyyah) is a state-owned airline based in Tripoli, Libya. Before the 17 February 2011 revolution, it operated domestic services between Tripoli and Benghazi, and international scheduled services to over 25 countries in Europe, Africa, Asia and the Middle East; since the end of the war, it has been seeking to rebuild its business. Afriqiyah Airways' main base is technically Tripoli International Airport, although it has been closed since 2014 and flights are operating as much as possible from other airports."
Aigle Azur,"Aigle Azur was a French airline based and headquartered at Paris Orly Airport. The airline operated scheduled flights from France to 21 destinations across Europe, Africa, and the Middle East, with a fleet of Airbus A320 family and A330 aircraft. The airline filed for bankruptcy and was placed in receivership on 2 September 2019. Takeover bids were received, but none proved viable and the airline was liquidated by the court on 27 September 2019."
Air Algerie,"Air Algérie SpA (Arabic: الخطوط الجوية الجزائرية, al-Khuṭūṭu l-Jawwiyyatu l-Jazāā’iriyyah; Berber languages: Aeriverdan idzayriyen) is the national airline of Algeria, with its head office in the Immeuble El-Djazair in Algiers. With flights operating from Houari Boumedienne Airport, Air Algérie operates scheduled international services to 39 destinations in 28 countries in Europe, North America, Africa, Asia, and the Middle East, as well as domestic services to 32 airports. As of December 2013, Air Algérie was 100% owned by the government of Algeria.Air Algérie is in the process of aligning its codeshare agreements, frequent flyer programs, and airport lounge agreements with each of the SkyTeam carriers in order to meet SkyTeam's membership application requirements. The company reported that they applied to join Star Alliance or SkyTeam and also began working in partnership with Lufthansa."
Air Alps,"Air Alps, (stylized as Air A!ps, previously operating as KLM Alps, legally AAA-Air Alps Aviation), was an Austrian regional airline based in Innsbruck."
Air Arabia,"Air Arabia (Arabic: العربية للطيران al-ʿArabiyya aṭ-Ṭayarān) is an Emirati low-cost airline with its head office in the A1 Building Sharjah Freight Center, Sharjah International Airport. The airline operates scheduled services to 170 destinations in the Middle East, North Africa, the Indian subcontinent, Central Asia and Europe to 22 countries from Sharjah, 28 destinations in 9 countries from Casablanca, Fez, Nador and Tangier, 11 destinations in 8 countries from Ras Al Khaimah, and 6 destinations in 4 countries from Alexandria. Air Arabia's main base is Sharjah International Airport. There is also a hub in Ras Al Khaimah, Abu Dhabi and focus cities in Alexandria and Casablanca."
Air Astana,None
Air Austral,None
Air Bosna,B&H Airlines d.o.o. was the flag carrier of Bosnia and Herzegovina with its head office in Sarajevo. It operated scheduled and charter passenger services as well as small cargo services from its home base at Sarajevo International Airport. It ceased operating in June 2015
Air Botswana,"Air Botswana Corporation is Botswana's state-owned national flag carrier, with its headquarters located in Gaborone. It operates scheduled domestic and regional flights from its main base at Sir Seretse Khama International Airport. Air Botswana has been loss-making for several years, and there have been various attempts to privatise the company, and frequent changes to the corporation's management and board, so far without reducing the losses."
Air Caledonie International,"Société Aircalin, also known as Air Calédonie International, is the flag carrier of the French collectivity of New Caledonia, with its headquarters in Nouméa. It operates scheduled services from its main base at La Tontouta International Airport to destinations across Oceania and Asia, including Japan, and additionally operates domestic services in Wallis and Futuna. The airline is 99% owned by the Government of New Caledonia, with the remaining 1% held by minority owners, including the airline's employees."
Air Canada,"Air Canada is the flag carrier and the largest airline of Canada by fleet size and passengers carried. Air Canada maintains its headquarters in Saint-Laurent, Montreal, Quebec. The airline, founded in 1937, provides scheduled and charter air transport for passengers and cargo to 207 destinations worldwide. It is a founding member of the Star Alliance. Air Canada's major hubs are at Montréal–Trudeau International Airport (YUL), Toronto Pearson International Airport (YYZ) and Vancouver International Airport (YVR). The airline's regional service is Air Canada Express.Canada's national airline originated from the Canadian federal government's 1936 creation of Trans-Canada Air Lines (TCA), which began operating its first transcontinental flight routes in 1938. In 1965, TCA was renamed Air Canada following government approval. After the deregulation of the Canadian airline market in the 1980s, the airline was privatized in 1988. On 4 January 2000, Air Canada acquired its largest rival, Canadian Airlines. In 2003, the airline filed for bankruptcy protection and in the following year emerged and reorganized under the holding company ACE Aviation Holdings Inc. In 2017, Air Canada flew 48 million passengers, as the airline celebrated its 80th anniversary. In 2021, the Government of Canada acquired 6.4% of Air Canada as a part of a COVID-19 related assistance package, and has not ruled out further investment.Air Canada has a fleet of Airbus A330, Boeing 777, and Boeing 787 Dreamliner wide-body aircraft on long-haul routes and uses the Airbus A320 family aircraft (including the A320 and A321 variants), Boeing 737 MAX 8, and Airbus A220-300 aircraft on short-haul routes. The carrier's operating divisions include Air Canada Cargo, Air Canada Express, Air Canada Jetz (private jet charters), and Air Canada Rouge (leisure airline). Its subsidiary, Air Canada Vacations, provides vacation packages to over 90 destinations. Together with its regional partners, the airline operates on average more than 1,613 scheduled flights daily."
Air Canada Jazz,"Jazz Aviation LP, commonly shortened to Jazz, is a Canadian regional airline based at Halifax Stanfield International Airport in Enfield, Halifax Regional Municipality, Nova Scotia, and is a wholly owned subsidiary of Chorus Aviation.  Jazz Aviation provides regional and charter airline services in Canada and the United States, primarily under contract to Air Canada using the brand name Air Canada Express, and also as Jazz Charters.It is Canada's third-largest airline in terms of fleet size (but not in terms of passengers carried annually, number of employees, or destinations served). Its Air Canada Express operations serve 79 destinations in Canada and the United States. Under a capacity purchase agreement, Air Canada sets the Jazz route network and flight schedule, and purchases all of Jazz's seat capacity based on predetermined rates. Its main base is Halifax Stanfield International Airport, with hubs at Toronto Pearson International Airport, Victoria International Airport, Vancouver International Airport, Montréal–Pierre Elliott Trudeau International Airport, and Calgary International Airport.Prior to April 2011, Air Canada's regional operations were branded as Air Canada Jazz.  Following the award of a contract to Sky Regional Airlines, the Air Canada Express brand was introduced as an umbrella for all regional operations.  The Jazz brand is now entirely managed by Jazz Aviation LP."
Air Caraibes,"Air Caraïbes (French pronunciation: ​[kaʁaib]) is a French airline based in the French West Indies, with its headquarters in Les Abymes in Guadeloupe. The airline's main base of operations is at Pointe-à-Pitre International Airport in Guadeloupe, with a focus city at Martinique Aimé Césaire International Airport, near Fort-de-France in Martinique. It operates scheduled and charter services in the West Indies, as well as transatlantic flights based at Paris Orly Airport in Metropolitan France."
Air Chathams,"Air Chathams Limited is an airline based in the Chatham Islands, New Zealand. It was established in 1984 and operates scheduled passenger services between the Chatham Islands and mainland New Zealand along with routes between Auckland and Whakatāne, and Auckland and Whanganui. Its main base is Chatham Islands / Tuuta Airport."
Air China,"Air China Limited (Chinese: 中国国际航空公司) is the flag carrier of the People's Republic of China and one of the ""Big Three"" mainland Chinese airlines (alongside China Southern Airlines and China Eastern Airlines). Air China's headquarters are in Shunyi District, Beijing. Air China's flight operations are based primarily at Beijing Capital International Airport. In 2017, the airline carried 102 million domestic and international passengers with an average load factor of 81%. The airline joined Star Alliance in 2007, alongside Shanghai Airlines."
Air Europa,"Air Europa Líneas Aéreas, S.A.U., branded as Air Europa is the third-largest Spanish airline after Iberia, as its subsidiary, and Vueling. The airline is headquartered in Llucmajor, Mallorca, Spain, and has its main hub at Adolfo Suárez Madrid–Barajas Airport with secondary focus cities at Palma de Mallorca Airport and Tenerife North Airport. Air Europa flies to over 44 destinations around Spain, Europe, South America, North America, the Caribbean, Morocco, and Tunisia. Since September 2007, Air Europa has been a member of the Skyteam alliance."
Air France,None
Air Greenland,None
Air India,"Air India is the flag carrier airline of India, headquartered at New Delhi. It is owned by Talace Private Limited, a Special-Purpose Vehicle (SPV) of Tata Sons, after Air India Limited's former owner, the Government of India, completed the sale. Air India operates a fleet of Airbus and Boeing aircraft serving 102 domestic and international destinations. The airline has its hub at Indira Gandhi International Airport, New Delhi, alongside several focus cities across India. Air India is the largest international carrier out of India with an 18.6% market share. Over 60 international destinations are served by Air India across four continents. The airline became the 27th member of Star Alliance on 11 July 2014.The airline was founded by J. R. D. Tata as Tata Airlines in 1932; Tata himself flew its first single-engine de Havilland Puss Moth, carrying air mail from Karachi's Drigh Road Aerodrome to Bombay's Juhu aerodrome and later continuing to Madras (currently Chennai). After World War II, it became a public limited company and was renamed as Air India. On 21 February 1960, it took delivery of its first Boeing 707 named Gauri Shankar and became the first Asian airline to induct a jet aircraft in its fleet. In 2000–01, attempts were made to privatise Air India and from 2006 onwards, it suffered losses after its merger with Indian Airlines. Another privatisation attempt was launched in 2017, which concluded with ownership of the airline and associated properties reverting to the Tatas in 2022.Air India also operates flights to domestic and Asian destinations through its subsidiary Air India Express. Air India's mascot is the Maharajah (Emperor) and the logo consists of a flying swan with the wheel of Konark inside it."
Air Inuit,"Air Inuit (Inuktitut: ᐃᓄᐃᑦ ᖃᖓᑦᑕᔪᖏᑦ) is an airline based in the Montreal borough of Saint-Laurent, Quebec, Canada. It operates domestic passenger services and charter and cargo services in Nunavik, Labrador and Nunavut. Its main base is Kuujjuaq Airport."
Air Italy,None
