Gregor Kathstede,"Krefeld ( KRAY-feld, -⁠felt, German: [ˈkʁeːfɛlt] (listen); Limburgish: Krieëvel [ˈkʀiə˦vəl]), also spelled Crefeld until 1925 (though the spelling was still being used in British papers throughout the Second World War), is a city in North Rhine-Westphalia, Germany. It is located northwest of Düsseldorf, its center lying just a few kilometers to the west of the river Rhine; the borough of Uerdingen is situated directly on the Rhine. Because of its economic past, Krefeld is often referred to as the ""Velvet and Silk City"". It is accessed by the autobahns A57 (Cologne–Nijmegen) and A44 (Aachen–Düsseldorf–Dortmund–Kassel).Krefeld's residents now speak Hochdeutsch, or standard German, but the native dialect is a Low Franconian variety, sometimes locally called Krefelder Plattdeutsch, Krieewelsch Platt, Plattdeutsch, or sometimes simply Platt. The Uerdingen line isogloss, separating general dialectical areas in Germany and neighboring Germanic-speaking countries, runs through and is named after Krefeld's Uerdingen district, originally an independent municipality."
Dagmar Szabados,"Bernd Wiegand (born 23 February 1957) is a German independent politician. Until 2011, he was a member of the Social Democratic Party of Germany. He is the mayor of Halle (Saale) since 1 December 2012 after gaining 19.88% of the votes in the first round and 52.92% in the second round. On 27 October 2019, Wiegand was reelected after gaining 61.42% of the votes in the second round."
Lutz Trümper,Lutz Trümper (born 1 October 1955) is a German politician for the Social Democratic Party of Germany (SPD) and Lord mayor of the city of Magdeburg.
Dieter Salomon,"Dieter Salomon (born 9 August 1960 in Melbourne, Australia) is a German politician and was mayor of Freiburg im Breisgau for two terms from 2002 until 2018. He is a member of the Alliance '90/The Greens."
Klaus Wehling,The Schwarzwaldpokal is a competition in Nordic combined. It is held since 1967 and since 1984 part of the FIS Nordic Combined World Cup.
Bernd Saxe,"The following is a timeline of the history of the city of Lübeck, Schleswig-Holstein, Germany."
Andreas Bausewein,Andreas Bausewein (born 5 May 1973) is a German politician (Social Democratic Party) and mayor of Erfurt.
Roland Methling,"Tessin (Tessin bei Rostock) is a town in the Rostock district, in Mecklenburg-Western Pomerania, Germany. It is situated on the river Recknitz, 22 km east of Rostock."
Alfred Vanderpuije,"Alfred Oko Vanderpuije (born 4 November 1955) is a Ghanaian educationist and politician who currently serves as a member of parliament. He is currently the member of parliament for Ablekuma South Constituency in the Greater Accra Region of Ghana.His Dutch surname reflects his Euro-African descent. The ancestors of Vanderpuije originally came from Sint-Maartensdijk on the former island of Tholen in the Netherlands. His ancestor, Jacobus van der Puije was Governor of the Dutch Gold Coast in 1780."
Samuel Sarpong,"Samuel Sarpong is a Ghanaian politician and a former Ashanti Regional Minister of Ghana. Prior to heading the Ashanti Region, he was the Central Regional Minister. Former Kumasi Metropolitan Chief Executive.He is a member of the National Democratic Congress in Ghana."
Giorgos Kaminis,Georgios Kaminis (Greek: Γεώργιος Καμίνης; born 15 July 1954) is a Greek parliamentarian and professor of constitutional law. He was the Greek Ombudsman from April 2003 until September 2010 and Mayor of Athens from 2011 until 2019.
Vasilis Papageorgopoulos,"Vasilis Papageorgopoulos (Greek: Βασίλης Παπαγεωργόπουλος; born June 27, 1947) is a retired Greek sprinter, former mayor of Thessaloniki and convicted felon. He won two medals at the European Indoor Championships as well as the bronze medal in the 100 metres at the 1971 European Championships in Athletics. He was named the 1971 Greek Athlete of the Year."
Alvaro Arzú,"Álvaro Enrique Arzú Yrigoyen (Spanish: [ˈalbaɾo enˈɾike aɾˈsu iɾiˈɡoʎen];  14 March 1946 – 27 April 2018) was a Guatemalan politician who was the 32nd President of Guatemala from 14 January 1996 until 14 January 2000. He was elected Mayor of Guatemala City on six occasions: in 1982, when he declined taking office because of a coup d'état; in 1986; in 2003, after serving as president; in 2007; in 2011, and in 2015, for a term that would see him die in office."
Mamadou Wasco Camara,None
Jean Yves Jason,"Muscadin Jean Yves Jason (born May 21, 1964) is a Haitian politician and Professor who served as Mayor of Port-au-Prince, the capital of Haiti from 2008 to 2012. Jason was Mayor of Port-au-Prince at the time of the city's destruction during the 2010 Haiti earthquake, which left the City Hall and most of the city government buildings in ruins.A member of Rassemblement des Citoyens Patriotes (RCP), Jason previously served as Head of Cabinet of Manno Charlemagne [city of Port-au-Prince] (June 1995-August 1996)"
Ricardo Alvarez,"Ricardo Álvarez Barragán (born 21 November 1981) is a Mexican professional boxer. His brothers are welterweights Ramón Álvarez, WBC Middleweight Champion Canelo Álvarez and former WBA World Light Middleweight Champion Rigoberto Álvarez."
István Tarlós,"István Tarlós (Hungarian pronunciation: [ˈiʃtvaːn ˈtɒrloːʃ]; 26 May 1948) is a Hungarian politician who served as the Mayor of Budapest from 2010 to 2019. Previously he served as the Mayor of the Third District (Óbuda-Békásmegyer) of the city between 1990 and 2006 (as an independent candidate). Since 2006 he was the Chairman of the Fidesz–Christian Democratic People's Party (KDNP) Fraction-Alliance in the General Assembly of the Municipality of Budapest, and served as the political leader of the initiative ""Social Referendum 2008""."
Shraddha Jadhav,"Shraddha Jadhav (born c.1964) is a Shiv Sena politician from Mumbai, Maharashtra.She served as the mayor from 1 December 2009 to 8 March 2012 of the city of Mumbai, the capital of the Indian state of Maharashtra, and chief of Brihanmumbai Municipal Corporation (BMC), the country's richest municipal body. She was elected to Brihanmumbai Municipal Corporation for six consecutive terms from 1992 to 2017."
Kanwar Sain,"Kanwar Sain, also spelt as Rai Bahadur Kanwar Sain OBE (1899–1979) was a civil engineer from Haryana state in India. He was the chief engineer in the Bikaner state who came up with idea of Rajasthan Canal. He also successfully implemented Ganga canal project.  He was considered a doyen of irrigation engineering of his time. He was born in 1899 in Tohana in Hisar district (Haryana). He was educated at D.A.V. College, Lahore. He graduated as a civil engineer from Thomason College of Civil Engineering, Roorkee (now, IIT Roorkee) in the year 1927 with hons. He was awarded Padma Bhushan in 1956. He has written a book called -Reminiscences of an engineer.He was chairman of Central Water and Power Commission, Ministry of Irrigation and Power, Government of India.Kanwar sain and Karpov (1967) presented enveloping curves for Indian rivers."
SK Nataraj,"The Mayor of Bengaluru is the first citizen of the Indian city of Bengaluru. The Mayor is the Chief of Bruhat Bengaluru Mahanagara Palike. The role of Mayor is largely ceremonial. The Mayor also plays a functional role in deliberating over the discussions in the Corporation. The term of the Mayor is set for 5 years as per the Bruhat Bengaluru Mahanagara Palike Act of 2020, during the erstwhile act of Karnataka Municipal Corporations Act of 1976 the term was fixed for 1 year."
Rajendra Desai,"Rajendra Desai is former Mayor of Surat, India and a senior Bhartiya Janata Party politician. He served as the city Mayor from 2010 to 2013.Then he was the municipal councillor from Athwa-Nanpura ward."
Bikash Ranjan Bhattacharya,"Bikash Ranjan Bhattacharya or Bikash Bhattacharya (Bengali: বিকাশরঞ্জন ভট্টাচার্য্য) is an Indian politician. He is currently serving as a Member of Parliament, Rajya Sabha from the Communist Party of India (Marxist). He served as Mayor of Kolkata from 2005 to 2010, heading the Kolkata municipal corporation, led by the Left Front (West Bengal) in the state of West Bengal. He is also an eminent advocate practicing in the Calcutta High Court and has appeared in various landmark cases."
M Subramaniam,"Subramaniam, Subrahmanyam, Subramanyam or Subramanian (Tamil: சுப்பிரமணியம்; Telugu: సుబ్రహ్మణ్యం) is a South Indian male given name. Due to the South Indian tradition of using patronymic surnames it may also be a surname for males and females. The etymology of the name is from Sanskrit; however, a common translation is ""dear to Brahamam"", or ""of good deeds."" An alternative proposed translation is derived from merging two common Sanskrit words supri-ya (सु), meaning ""good"" or ""dear,"" and man-ya, meaning jewel; the name translates loosely as ""worthy jewel"". Subramaniam is one of the many names of the Hindu god Karthikeya, also known as Kumara or Murugan.In Telugu, Subrahmanyam or Subramanyam is the transliteration of the name (closer to the Sanskrit root word)."
Kanaji Thakor,"Kanaji Shankarji Thakor  was an Indian politician who served as the mayor of the city of Ahmedabad, in the state of Gujarat, India from 23 April 2008 to 30 October 2010. He is affiliated with Bharatiya Janata Party.He is appointed as Member of Election Parliamentary Board of Gujarat State By Bharatiya Janata Party"
Banda Karthika Reddy,"Banda Karthika Reddy (born 17 August 1977) is an Indian politician and Former Mayor of Greater Hyderabad Municipal Corporation, Telangana, India. She is the first Mayor of Greater Hyderabad Municipal Corporation  in 2009 and is a member of the Bharatiya Janata Party."
Mohansingh Rajpal,"Roll ball is a game played between two teams and is a unique combination of roller skates, basketball, handball, and throwball. It is played on ""roller shoes"" with each team consisting of twelve players, six on the field and six in reserve. The main objective of the game is to score maximum goals within a stipulated time. The main feature of Roll Ball is that the ball is held in one or both hands, when passing to the other players, with the ball repeatedly bounced on the ground."
Ravindra Patani,"Ala Vaikunthapurramuloo (pronounced [ala vaɪ̯kuṇʈʰapuramu loː]) (transl. There in Vaikunthapuram), also known as AVPL, is a 2020 Indian Telugu-language action drama film written and directed by Trivikram Srinivas, and produced by Allu Aravind and S. Radha Krishna under their banners Geetha Arts and Haarika & Hassine Creations respectively. The film stars Allu Arjun and Pooja Hegde, alongside Tabu, Jayaram, Sushanth, and Nivetha Pethuraj. Samuthirakani, Murali Sharma, Navdeep, Sunil, Sachin Khedekar, Harsha Vardhan, and Rajendra Prasad play other supporting roles.In the film, a man named Bantu grows up with hate and neglection from his father Valmiki, until he discovers the latter swapped him as an infant, and his biological father is an affluent businessman, Ramachandra. Bantu enters Ramachandra's house, Vaikuntapuram, to protect his biological family when it is threatened by an influential man. The idea of swapping infants was earlier attempted in Vedantam Raghavaiah's Inti Guttu (1958), starring N. T. Rama Rao and Savitri.Production of the film began in April 2019, and wrapped up within December 2019. It was filmed across Hyderabad, with songs being shot in overseas. The film features soundtrack composed by S. Thaman, while cinematography and editing were handled by P. S. Vinod and Naveen Nooli, respectively. After premiering in the United States on 11 January 2020, the film was released theatrically on 12 January, coinciding with Sankranti, along with its Malayalam dubbed version titled Angu Vaikuntapurathu while it's Tamil dubbed version titled Vaikundapuram was released in 2020. The Hindi dubbed version was directly premiered on television on 13 February 2022.The film opened to positive reviews, with critics praising Allu Arjun and Murali Sharma's performances, Trivikram's writing and direction and Thaman's music and film's score. The film was commercially successful and with a gross ₹262.05 crore (US$35 million), it ended up as one of the highest-grossing Telugu films, and also one of the highest grossing Indian films in 2020. It also became one of the highest-grossing Telugu films in the United States, collecting more than $3 million upon release. According to box-office tracking portal Box Office Mojo, the film has grossed US$28.47 million, making it the fifty-third highest-grossing film of 2020 worldwide. The film won ten South Indian International Movie Awards, including Best Film – Telugu."
Jyoti Khandelwal,"Jyoti Khandelwal is an Indian National Congress politician who was elected mayor of Jaipur Municipal Corporation in 2009. In those elections, she defeated Suman Sharma of the Bharatiya Janata Party by 13,500 votes.In her tenure she has courted many controversies, often sparring with opposition councillors. During her tenure as Mayor, she criticized the Congress led state government for sheltering ""corrupt"".In 2019, Khandelwal became the first woman candidate in 48 years to contest the Lok Sabha election from Jaipur. According to her, she enjoys popular women support in Jaipur because of her active involvement with the women in social, cultural and religious events in the city."
Dr Shiv Kumar Tamer,"The 2021 Assam Legislative Assembly election was the 15th quinquennial legislative assembly election held in the Indian state of Assam from March 27 to April 6 in three phases, to elect 126 MLAs to the 15th Assam Legislative Assembly. The votes were counted and the result declared on Sunday, 2 May. The term of the previous Fourteenth Legislative Assembly of Assam ended on 31 May 2021.The election saw the incumbent BJP-led National Democratic Alliance (NDA) retaining power with 75 seats, which marks the first time a non-INC alliance winning consecutive terms in the state. The Mahajot led by INC won 50 seats, increasing its tally from 26 in 2016. Jailed activist and Raijor Dal founder and President Akhil Gogoi contested the election as an independent candidate and won the Sibsagar seat by a margin of 11,875 votes."
Archana Dehankar,"Sanjay Bhende (born 18 October 1970) is the Chairman of Nagpur Nagarik Sahakari Bank Ltd, Nagpur. He was BJP State Executive member since 2013–2015. He is now Chief of BJP Offices in Maharashtra State.His name was selected by BJP committee for Nagpur Graduate Council election after Nitin Gadkari elected as Member Lok Sabha."
Dinesh Sharma,"Dinesh Sharma is an Indian politician serving as the Deputy Chief Minister of Uttar Pradesh. He was previously the mayor of Lucknow, the state capital. A university professor by profession, he is a member of the Bharatiya Janata Party and he has held various posts in the party."
Krishna Murari Moghe,"Krishna Murari Moghe (born 2 December 1947) is an Indian politician. He was elected as 14th Mayor of Indore from December 2009 until his resignation in February 2015, he is currently serving as the housing board minister of Madhya Pradesh  He served as State Secretary of BJP. He served as Member of Parliament from Khargone from 2004 to 2007. He is chairman of the All India Council of Mayors."
GhanShyam Kumar,Ghanshyam Das Birla (10 April 1894 – 11 June 1983) was an Indian businessman and member of the Birla Family.
Anjula Singh Mahaur,None
Nayana Gholap,None
Yogesh Behl,"Boogie Woogie was an Indian dance competition television series created and directed by Naved Jaffrey, Ashu Jain  and Ravi Behl for Sony Entertainment Television and Sony Entertainment Television Asia. Debuting in 1996, the show was judged by Indian film actor and Television host Javed Jaffrey who was the permanent judge, while his brother Naved, also the director and producer of the show, co hosted the show along with film actor Ravi Behl. The early episodes were shot in Mehta Industrial Estate in Andheri, Mumbai and later, was also shot at other film studios in Mumbai including Natraj, Filmalaya, Filmistaan, Famous, Film City among others. It is the oldest dance reality show on Indian TV and it has become the longest show in India. In the earlier seasons, the judges assigned various themes to episodes, including Bollywood, Horror, Friendship among others. It was also co-hosted by Kadambari Shantshri Desai in season 1 and 2.The popularity of the dance show has led to the creation of special championship shows, such as Kids' Championships, Teen Championships, Mothers Championships and Celebrity Championships, in which various Indian celebrities, such as Mithun Chakraborty, Juhi Chawla, Esha Deol, Dia Mirza, Govinda, Vivek Oberoi and Ritesh Deshmukh have participated.Boogie Woogie was among the first shows to start special dance championships catering to different age groups. In the first two seasons, these championships would be one to two episode long and the one winner would be decided at the end of every episode.However, the videos of the seasons are currently not fully available."
Balakrishna Shukla,"NTR: Kathanayakudu (transl. NTR: The Hero) is a 2019 Indian Telugu-language biographical film, based on the real life and acting career of N. T. Rama Rao. It was produced by Nandamuri Balakrishna, Sai Korrapati Ranganatha, Vishnu Vardhan Induri under NBK Films, Vaaraahi Chalana Chitram, Vibri Media banners and directed by Krish Jagarlamudi. The film stars Nandamuri Balakrishna, as his father N. T. Rama Rao, Vidya Balan in Basava Ramatarakam's role in her debut Telugu movie and music is composed by M. M. Keeravani. The film has a sequel, NTR: Mahanayakudu, that showcases the political journey of Rama Rao."
Krishna Gaur,"Krishna Gaur is an Indian politician. She was elected to the Madhya Pradesh Legislative Assembly from Govindpura in the 2018 Madhya Pradesh Legislative Assembly election as a member of the Bharatiya Janata Party. She defeated her nearest rival, Girish Sharma of Indian National Congress by 46,359 votes. She is the first woman ever to be elected as an MLA from Bhopal. She was also the mayor of Bhopal and the chairperson of the Madhya Pradesh State Tourism Corporation."
n/k,None
Ashjok Vaity,None
Kaushalendra Singh,Kaushalendra Singh (born 1 July 1974) is an Indian politician and former mayor of Varanasi. Singh is a member of the Bharatiya Janata Party and was elected to office in 2006 and served till 2012.
Sandhya Vyas,"Karmaphal Daata Shani (transl. ""Shani, the divine judge of deeds"") is an Indian mythological television series, which aired from 7 November 2016 to 9 March 2018 on Colors TV. The series was produced by Swastik Productions of Siddharth Kumar Tewary."
Rama Khalkho,None
n/k,None
Jitendr Nath Singh,None
Shawet Malik,None
Vijaya Rahatkar,"The Maharashtra State Commission for Woman was established on January 25, 1993, under the Maharashtra Act, no XV of 1993. The Commission consists of Chairperson; six non-official members; a Member-Secretary and Director General of Police as Ex officio member. The Government has sanctioned staff strength of thirty-nine for the Commission.The office of Chairperson fell vacant after Vijaya Rahatkar resigned from the post."
Aruna Vakase,None
Thenmozhi Gopinathan,"Madurai City Corporation is the civic body which administers the city of Madurai in Tamil Nadu, India. Madurai is one of the oldest living cities in the world. Formed on 1 May 1971 as the first Municipal Corporation in Tamil Nadu post independence, it is the third largest municipal corporation in Tamil Nadu in population and revenue. It is the sixth largest in Tamil Nadu by area after Greater Chennai Corporation, Coimbatore Corporation, Tirunelveli Municipal Corporation, Tiruchirappalli Municipal Corporation, and Tiruppur Municipal Corporation. The annual budget of Madurai Corporation for 2021-22 is Rs.437 crores. It consists of a Council and an Executive wings. The council is headed by the Mayor while the Executive wing is headed by the Commissioner. It consists of 100 wards organised into five zones, viz East, North, Central, South and West."
Prabhat Sahu,"Kishore Sahu (22 November 1915 – 22 August 1980) was an Indian actor, film director, screenwriter, and producer. He appeared in 22 films between 1937 and 1980, and he directed 20 films between 1942 and 1974.His directorial venture Kuwara Baap was one of the winners for the BFJA - Best Indian Films Award for best film for 1943. His film Raja has been called ""a milestone of art and skill in motion pictures"". His film Veer Kunal was a huge box office success. He directed Dilip Kumar with Kamini Kaushal in Nadiya Ke Paar, which became the sixth highest grossing Indian film of 1948. His 1954 film Mayurpankh was entered into the 1954 Cannes Film Festival, where it was nominated for the Grand Prize of the Festival.Sawan Aya Re did well commercially, with Baburao Patel of Filmindia remarking in the 9 May 1949 edition that Sahu's estimate had risen due to the ""original treatment"" he gave to an ""otherwise ordinary"" story. He was also known for the Meena Kumari starrer, Dil Apna Aur Preet Parai (1960).He had four children, Vimal Sahu, Naina Sahu, Mamta Sahu, and Rohit Sahu. His wife Preeti was a Kumaoni Brahmin.Before marrying Preeti, he was briefly married to his Punar Milan (1940) co-star Snehprabha Pradhan before the relationship ended in 1943 after a court battle."
n/k,None
n/k,None
n/k,None
Sri Gopal Mukherjee,"Pranab Kumar Mukherjee (11 December 1935 – 31 August 2020) was an Indian politician who served as the 13th president of India from 2012 until 2017. In a political career spanning five decades, Mukherjee was a senior leader in the Indian National Congress and occupied several ministerial portfolios in the Government of India. Prior to his election as President, Mukherjee was Union Finance Minister from 2009 to 2012. He was awarded India's highest civilian honour, the Bharat Ratna, in 2019, by his successor as president, Ram Nath Kovind.Mukherjee got his break in politics in 1969 when the then Prime Minister Indira Gandhi helped him get elected to the Rajya Sabha, the upper house of Parliament of India, on a Congress ticket. Following a meteoric rise, he became one of Gandhi's most trusted lieutenants and a minister in her cabinet in 1973. Mukherjee's service in a number of ministerial capacities culminated in his first stint as Finance Minister of India in 1982–84. He was also the Leader of the House in the Rajya Sabha from 1980 to 1985.Mukherjee was sidelined from Congress during the premiership of Rajiv Gandhi. Mukherjee had viewed himself and not the inexperienced Rajiv, as the rightful successor to Indira following her assassination in 1984. Mukherjee lost out in the ensuing power struggle. He formed his own party, the Rashtriya Samajwadi Congress, which merged with Congress in 1989 after reaching a consensus with Rajiv Gandhi. After Rajiv Gandhi's assassination in 1991, Mukherjee's political career was revived when Prime Minister P. V. Narasimha Rao appointed him Planning Commission head in 1991 and foreign minister in 1995. Following this, as elder statesman of Congress, Mukherjee was the principal architect of Sonia Gandhi's ascent to the party's presidency in 1998.When the Congress-led United Progressive Alliance (UPA) came to power in 2004, Mukherjee won a Lok Sabha (the popularly elected lower house of Parliament) seat for the first time. From then until his resignation in 2012, he held a number of key cabinet portfolios in Prime Minister Manmohan Singh's government – Defence (2004–06), External Affairs (2006–09), and Finance (2009–12) – apart from heading several Groups of Ministers (GoMs) and being Leader of the House in the Lok Sabha. After securing the UPA's nomination for the country's presidency in July 2012, Mukherjee comfortably defeated P. A. Sangma in the race to the Rashtrapati Bhavan (the Indian presidential residence), winning 70 percent of the electoral-college vote.In 2017, Mukherjee decided not to run for re-election and to retire from politics after leaving the presidency due to ""health complications relating to old age."" His term expired on 25 July 2017. He was succeeded as President by Ram Nath Kovind. In June 2018, Mukherjee became the first former President of India to address a Rashtriya Swayamsevak Sangh (RSS) event."
