Jaime Nebot,"Jaime José Nebot Saadi (born October 22, 1946) is an Ecuadorian lawyer and politician. He formerly served as mayor of Guayaquil, which is Ecuador'slargest city. He is affiliated with the Social Christian Party (PSC) and the Madera de Guerrero Civic Movement. Nebot ran twice for president of Ecuador, in 1992 losing against Sixto Duran-Ballén, and in 1996 losing against Abdalá Bucaram."
Augusto Barrera,Adrián Augusto Barrera Guarderas is an Ecuadorian doctor and politician who served as the Metropolitan Mayor of Quito from 2009 to 2014.
Abdul Azim Wazir,"Abdul Azim Wazir was the governor of Cairo  in Egypt, and he was governor of Damietta Governorate, he is a professor of criminal law and the former dean of the Faculty of Law Mansoura University."
Adel Labib,"Adel Labib (Arabic: عادل لبيب) is the former governor of Alexandria,and Beheira Governorate, and the current governor of Qena Governorate since 4 August 2011. He was appointed as the minister of local development in the interim government of Egypt. He was later removed as Minister of Local Development in 2015."
n/k,None
n/k,None
Norman Quijano,"Norman Noel Quijano González (born 2 November 1946) is a Salvadoran politician and former Mayor of San Salvador, under the Nationalist Republican Alliance ticket, serving from 1 May 2009 until his resignation on 15 August 2013 in order to run as a presidential candidate. He was succeeded by Gloria Calderón de Oñate while the presidential campaign was taking place. After the election, he returned to the mayor office to resume his duties.He served as the President of the Legislative Assembly of El Salvador from May 2018 to November 2019."
n/k,None
Edgar Savisaar,"Edgar Savisaar (born 31 May 1950) is an Estonian politician, one of the founding members of Popular Front of Estonia and the Centre Party. He has served as the acting Prime Minister of Estonia, Minister of the Interior, Minister of Economic Affairs and Communications and mayor of Tallinn."
Kuma Demeksa,"Kuma Demeksa (Oromo: Kumaa Dammaqsaa; born 1958) is an Ethiopian politician. Since 24 April 2015 he has been Ethiopian Ambassador to Germany. From 2008 to 2013 he was mayor of Addis Ababa; previous positions include President of the Oromia Region (1995–2001), and Minister of Defense (2005–2008). He was one of the founders, as well as a current member, of the Oromo Peoples' Democratic Organization (OPDO), which is part of the ruling coalition, the Ethiopian People's Revolutionary Democratic Front (EPRDF)."
Jussi Pajunen,"Jussi Ilmari Pajunen (born 5 September 1954 in Helsinki) is a Finnish politician of the National Coalition Party and former city manager of Helsinki.Prior to this appointment, Mr. Pajunen held many municipal positions of trust. He served as a member of the City Council in 1997 - 2005 and became a member of the City Board in 1999. In 2003 he assumed the position of Chairman of the City Board, holding it until his appointment as City Manager of Helsinki.Before assuming his duties as City Manager of Helsinki, Jussi Pajunen worked as Managing Director and as Chairman of the Board of the family firm Edvard Pajunen Ltd.With 40,000 employees, the City of Helsinki is the biggest employer in Finland. Following the Nordic welfare model, Finnish local authorities have an exceptionally wide range of responsibilities. The prime responsibility of the Mayor is the management of the city's approximately 4.5 billion euro budget.Under Mr Pajunen's leadership, Helsinki has been developed as a global business hub and centre of knowledge, basing its attractiveness on being Fun and Functional.  Mayor Pajunen was closely involved in Helsinki's bid to become World Design Capital in 2012 under the theme Open Helsinki. He continues to advocate for greater openness in the city administration and a strengthened sense of community within the city.Jussi Pajunen has a B.Sc and M.Sc from the Helsinki School of Economics and MBA from INSEAD in France. He speaks Finnish, Swedish, English, and French fluently. In 2011, he was awarded an honorary doctorate from the Aalto University School of Economics. He carries the honorary title of Ylipormestari (Finnish) / Överborgmästare (Swedish).Mr Pajunen was earlier a member of the Liberal Party and a small group known as Reform Party Liberals. He moved to the larger National Coalition Party in 1996.Jussi Pajunen is married and has five grown-up children."
Bertrand Delanoë,"Bertrand Delanoë (French: [bɛʁ.tʁɑ̃ də.la.nɔ.e] (listen); born 30 May 1950) is a French retired politician who served as Mayor of Paris from 2001 to 2014. A member of the Socialist Party (PS), he previously served in the National Assembly from 1981 to 1986 and Senate from 1995 until 2001."
Jean-Claude Gaudin,"Jean-Claude Gaudin (born 8 October 1939) is a French politician for The Republicans. He served as the Mayor of Marseille from 1995 to 2020.He was a member of the National Assembly of France from Bouches-du-Rhône from 1978 to 1989 and has been a member of the French Senate from 1989 to 1995 and again from 1998. From 1995 to 1997, he served as Minister of Territorial Development in Alain Juppé's Second Cabinet.He served as Vice-President of the Senate from 1998 to 2011; as Vice-President of UMP 2002–2007 and as one of several Vice-Presidents for UMP 2013–2014."
Gérard Collomb,"Gérard Collomb (born 20 June 1947) is a French politician who served as Mayor of Lyon from 2001 to 2017 and again from 2018 until 2020. A member of La République En Marche! (LREM) since he left the Socialist Party (PS) in 2017, he was Minister of the Interior in the first and second government of Prime Minister Édouard Philippe from 2017 to 2018. Disagreements with President Emmanuel Macron led Collomb to resign and return as Mayor of Lyon. He has been a councillor for both the City of Lyon and Lyon Metropolis since 2020."
Pierre Cohen,"Pierre Cohen (born 20 March 1950) is a member of the National Assembly of France.  He represents the Haute-Garonne department,  and is a member of the Socialist, Radical, Citizen and Miscellaneous Left group."
Christian Estrosi,"Christian Paul Gilbert Estrosi (born 1 July 1955) is a French sportsman and politician who has served as Mayor of Nice since 2017, previously holding the office from 2008 to 2016. A former professional motorcyclist, he served as a government minister under Presidents Jacques Chirac and Nicolas Sarkozy. Estrosi also served as President of the Regional Council of Provence-Alpes-Côte d'Azur from 2015 to 2017 and First Deputy Mayor of Nice from 2016 until 2017. He is a former member of The Republicans, which he left in 2021 to join Horizons."
Jean-Marc Ayrault,Jean-Marc Ayrault (French: [ʒɑ̃maʁk eʁo]; born 25 January 1950) is a French politician who served as Prime Minister of France from 15 May 2012 to 31 March 2014. He later was Minister of Foreign Affairs from 2016 to 2017. He previously was Mayor of Nantes from 1989 to 2012 and led the Socialist Party group in the National Assembly from 1997 to 2012.
Roland Rie,This article lists of American films released in 2007.
Hélène Mandroux-Colas,"Hélène Mandroux-Colas (born 1 December 1940) is a French politician. A member of the Socialist Party (PS) since 1982, her career in Montpellier debuted in Georges Frêche's municipal administration. Frêche gave her important responsibilities such as finances, municipal staff, legal affairs since 1995, and vice-mayor from 2001. She became mayor of Montpellier in 2004, following the resignation of Frêche, who could not cumulate the job as mayor with his new role as President of the Languedoc-Roussillon Region. She defeated her UMP opponent Jacques Domergue in a three-way runoff during the 2008 French municipal elections.Within the party, she was a supporter of Ségolène Royal at the Reims Congress, and became one of Royal's major regional allies with Gérard Collomb and Jean-Noël Guérini. Despite being close to Frêche in the past, she has recently distanced herself from him following his notoriously controversial remarks. On 28 January 2010, following controversial comments made by Frêche about Laurent Fabius, Martine Aubry asked Mandroux to form a list supported by the party for the 2010 regional elections. Her list received the endorsement of the PS against Frêche's dissident list, but did not prevent Frêche from retaining the presidency of the region."
Alain Juppé,"Alain Marie Juppé (French pronunciation: ​[alɛ̃ maʁi ʒype]; born 15 August 1945) is a French politician. A member of The Republicans, he was Prime Minister of France from 1995 to 1997 under President Jacques Chirac, during which period he faced major strikes that paralysed the country and became very unpopular. He left office after the victory of the left in the snap 1997 elections. He had previously served as Minister of Foreign Affairs from 1993 to 1995, and as Minister of the Budget and Spokesman for the Government from 1986 to 1988. He was President of the political party Union for a Popular Movement (UMP) from 2002 to 2004 and mayor of Bordeaux from 1995 to 2004.After the ghost jobs affair in December 2004, Juppé suspended his political career until he was re-elected as mayor of Bordeaux in October 2006. He served briefly as Minister of State for Ecology and Sustainable Development in 2007, but resigned in June 2007 after failing in his bid to be re-elected in the 2007 legislative election. He was Minister of Defence and Veterans Affairs from 2010 to 2011 and Minister of Foreign Affairs from 2011 to 2012.He announced in 2015 his intention to contest his party's primary election ahead of the 2017 presidential election. He came in second place in the first open primary of the right and centre, and in the run-off, he lost to François Fillon.At the beginning of 2019, he accepted a nomination to become a member of the French Constitutional Council and subsequently announced that he would be resigning as mayor of Bordeaux."
Martine Aubry,"Martine Louise Marie Aubry (French pronunciation: ​[maʁtin obʁi]; née Delors; born 8 August 1950) is a French politician. She was the First Secretary of the French Socialist Party (Parti Socialiste, or PS) from November 2008 to April 2012, and has been the Mayor of Lille (Nord) since March 2001; she is also the first female to hold this position. Her father, Jacques Delors, served as Minister of Finance under President François Mitterrand and was also President of the European Commission.Aubry joined the PS in 1974, and was appointed Minister of Labour by Prime Minister Édith Cresson in 1991, but lost her position in 1993 after the Right won the legislative elections. However, she became Minister of Social Affairs when Lionel Jospin was appointed Prime Minister in 1997. She is mostly known for having pushed the popular 35-hour workweek law, known as the ""Loi Aubry"", reducing the nominal length of the normal full-time working week from 39 to 35 hours, and the law that created Couverture maladie universelle (Universal health care coverage).Aubry stepped down from her Cabinet post in 2001 to be elected Mayor of Lille in place of Pierre Mauroy. Aubry subsequently lost her seat in the National Assembly in the general election of 2002. In March 2008, she was re-elected Mayor of Lille, with 66.55% of the votes.In November 2008, Aubry was elected to lead the Socialist Party, narrowly defeating Ségolène Royal. While Royal disputed the results, the Socialist Party declared on November 25, 2008, that Aubry had won the contested election. On 28 June 2011, Martine Aubry announced she would seek the Socialist nomination to run in the 2012 presidential election, ultimately losing to François Hollande, her predecessor as First Secretary."
Daniel Delaveau,"Daniel Delaveau (born 22 December 1952 in Châlette-sur-Loing, Loiret) is a French politician and former Mayor of Rennes. He is a member of the Socialist Party.He was born in a working-class family, and was active in Catholic youth organizations before joining the Unified Socialist Party in the 1970s and the PS in 1974. In 1989, he was elected mayor of the Rennes suburb of Saint-Jacques-de-la-Lande and in 1994 he joined the department general council as councillor for Rennes-Sud-Ouest. In September 2007, he was designated by his party to lead the left-wing list (Socialist Party, PCF, PRG, UDB) in the March 2008 Rennes municipal election. In the 2008 local elections, he was elected Mayor of Rennes, succeeding PS incumbent Edmond Hervé, with 60.40% of the votes in the runoff.In December 2012, he announced he would not run for the next municipal election, in March 2014. His former deputy mayor, Nathalie Appéré (Socialist Party), won that election on March 30, 2014."
Giorgi Ugulava,"Giorgi ""Gigi"" Ugulava (Georgian: გიგი უგულავა) (born August 15, 1975) is a Georgian politician and the former Mayor of Tbilisi (2005–2013). He was one of the former leaders of the United National Movement (UNM) party and former close ally of the former President of Georgia Mikheil Saakashvili. On 10 February 2020, he was sentenced to 3 years in prison . However, on May 15, President Salome Zourabichvili pardoned Ugulava."
Klaus Wowereit,"Klaus Wowereit (born 1 October 1953) is a German politician of the Social Democratic Party (SPD) and was the Governing Mayor of Berlin from 21 October 2001 to 11 December 2014. In 2001 state elections his party won a plurality of the votes, 29.7%. He served as President of the Bundesrat (the fourth highest office in Germany) in 2001/02. His SPD-led coalition was re-elected in the 2006 elections; after the 2011 elections the SPD's coalition partner changed from the Left to the Christian Democratic Union. He was also sometimes mentioned as a possible SPD candidate for the Chancellorship of Germany (Kanzlerkandidatur), but that never materialized."
Olaf Scholz,None
Christian Ude,Christian Ude (born 26 October 1947 in Munich) is a German politician who served as mayor of Munich from 1993 to 2014. He is a member of the German Social Democratic Party.
Jürgen Roters,"Jürgen Roters (born 15 January 1949 in Coesfeld, North Rhine-Westphalia) is a German politician and member of the Social Democratic Party of Germany (SPD), as well as a former middle-distance runner. He was mayor of Cologne from 2009 to 2015. Roters studied law from 1968 until 1974, is married and has three children."
Petra Roth,"Petra Roth (born 9 May 1944 in Bremen) is a German politician of the Christian Democratic Union (CDU). She was the mayor of Frankfurt am Main from 1995 to 2012. In addition she twice served as president of the Deutscher Städtetag, resuming her previous post there in 2009. The group is the head organization and lobby group for all German cities vis-à-vis the Cabinet of Germany, the German Bundestag, the Bundesrat of Germany, the European Union (EU) and many organizations."
Wolfgang Schuster,"Wolfgang Schuster (born 5 September 1949 in Ulm) is the former Lord Mayor of Stuttgart, Germany, from January 1997 until January 2013. He was the successor to Manfred Rommel and he is a member of the CDU."
Ullrich Sierau,"Ullrich Sierau (born 6 March 1956, Halle an der Saale, East Germany) is a German politician from the Social Democratic Party of Germany and, since 15 June 2014, for the third time, has been the lord mayor of Dortmund. After retaining this position already from 21 October 2009 to 18 January 2010, he was re-elected in an election on May 9, 2010 repeat election of the mayor elections in 2009 for mayor of Dortmund. His term would last until 2016. In the local elections in North Rhine-Westphalia in 2014, Sierau approached again, reaching a vote share of 43.7%. When carried out in the June 15, 2014 runoff he, then reached 51.6% of the vote, his opposition candidate Annette Littmann from the Christian Democratic Union of Germany, who received 32.0% in the first ballot, subjected to 48.4%."
Reinhard Paß,"Reinhard Tristan Eugen Heydrich (; German: [ˈʁaɪnhaʁt ˈtʁɪstan ˈʔɔʏɡn̩ ˈhaɪdʁɪç] (listen); 7 March 1904 – 4 June 1942) was a high-ranking German SS and police official during the Nazi era and a principal architect of the Holocaust. He was chief of the Reich Security Main Office (including the Gestapo, Kripo, and SD). He was also Stellvertretender Reichsprotektor (Deputy/Acting Reich-Protector) of Bohemia and Moravia. He served as president of the International Criminal Police Commission (ICPC, later known as Interpol) and chaired the January 1942 Wannsee Conference which formalised plans for the ""Final Solution to the Jewish Question""—the deportation and genocide of all Jews in German-occupied Europe.Many historians regard Heydrich as the darkest figure within the Nazi regime; Adolf Hitler described him as ""the man with the iron heart"". He was the founding head of the Sicherheitsdienst (Security Service, SD), an intelligence organisation charged with seeking out and neutralising resistance to the Nazi Party via arrests, deportations, and murders. He helped organise Kristallnacht, a series of coordinated attacks against Jews throughout Nazi Germany and parts of Austria on 9–10 November 1938. The attacks were carried out by SA stormtroopers and civilians and presaged the Holocaust. Upon his arrival in Prague, Heydrich sought to eliminate opposition to the Nazi occupation by suppressing Czech culture and deporting and executing members of the Czech resistance. He was directly responsible for the Einsatzgruppen, the special task forces that travelled in the wake of the German armies and murdered more than two million people by mass shooting and gassing, including 1.3 million Jews.Heydrich was mortally wounded in Prague on 27 May 1942 as a result of Operation Anthropoid. He was ambushed by a team of Czech and Slovak soldiers who had been sent by the Czechoslovak government-in-exile to kill the Reich-Protector; the team was trained by the British Special Operations Executive. Heydrich died from his injuries a week later. Nazi intelligence falsely linked the Czech and Slovak soldiers and resistance partisans to the villages of Lidice and Ležáky. Both villages were razed; the men and boys age 14 and above were shot, and most of the women and children were deported and murdered in Nazi concentration camps."
Jens Böhrnsen,"Jens Böhrnsen (born 12 June 1949) is a German politician of the SPD who served as President of the Senate and Mayor of Bremen from 2005 to 2015. From 1 November 2009 until 31 October  2010 he was President of the Bundesrat. As such, he was acting head of state of Germany from the resignation of President Horst Köhler on 31 May 2010 until the election of Christian Wulff on 30 June 2010. Böhrnsen resigned in 2015 after his party sustained losses in state parliament election.Böhrnsen is a lawyer by profession and served as a judge in Bremen from 1978 to 1995, when he became a full-time politician."
Stephan Weil,None
Burkhard Jung,"Burkhard Jung (born 7 March 1958 in Siegen) is a German politician of the Social Democratic Party (SPD) who has been the 21st lord mayor (Oberbürgermeister) of Leipzig (Saxony) since March 29, 2006. In addition, he has been president of the Association of German Cities since 2019; he is the first representative of an East German city in that office."
Helma Orosz,"Helma Orosz ([ˈoros]; born 11 May 1953, in Görlitz) is a German politician and member of the CDU. She was the Saxon State Minister for Social Affairs between 2003 and 2008 and Oberbürgermeister (Lord Mayor) of Dresden from 2008 to 2015."
Ulrich Maly,"Dr. Ulrich Maly (born 8 August 1960) is a German politician, a member of the Social Democratic Party of Germany who served as Mayor of Nuremberg from 2002 till 2020."
Adolf Sauerland,"On 24 July 2010, a crowd disaster at the 2010 Love Parade electronic dance music festival in Duisburg, North Rhine-Westphalia, Germany, caused the deaths of 21 people from suffocation as attendees sought to escape a ramp leading to the festival area. At least 500 more were injured.The Love Parade was a free-access music festival and parade that originated in 1989 in Berlin. The parade featured stages, but also had floats with music, DJs and dancers moving through the audience. The Love Parade in Duisburg was the first time that the festival had been held in a closed-off area. Between 200,000 and 1.4 million people were reported to be attending the event and 3,200 police were on hand.As a consequence of the disaster, the organizer of the festival announced that no further Love Parades would be held and that the festival was permanently cancelled. Criminal charges were brought against ten employees of the city of Duisburg and of the company that organized the event, but eventually rejected by the court due to the prosecutors' failure to establish evidence for the alleged acts of negligence and their causal connection to the deaths. On 18 April 2017 the Oberlandesgericht Düsseldorf stated that it would be reopening court proceedings for prosecution of 10 people involved in planning the event, accusing them of negligent homicide and mayhem. The first hearing of the trial was held on 8 December 2017. The trial was discontinued in May 2020, because it was adjudged that no individual did such a great wrong that ten years of trial were not already enough punishment."
Peter Jung,None
Peter Clausen,Peter Clausen (born 13 April 1964) is a Danish former cyclist. He competed in two events at the 1988 Summer Olympics.
Peter Kurz,Peter Kurz (born 1962) is a German politician of the Social Democratic Party of Germany (SPD). He is the Lord mayor of Mannheim.
Heinz Fenrich,"Heinz Fenrich (born 9 February 1945, in Unteröwisheim, (today Kraichtal))  is a German Christian Democratic Union politician who most notably served as the lord mayor (Oberbürgermeister) of Karlsruhe from 1998 to 2013.Fenrich received the Order of Merit of Baden-Württemberg in 2005 and the Order of Merit of the Federal Republic of Germany in 2013."
Helmut Müller,Helmut Müller (born 31 May 1952 in Heidelberg) is a German politician of the Christian Democratic Union (CDU). He has been the mayor of Wiesbaden from 2007 to 2013.
Markus Lewe,"Münster ( MUUN-stər, German: [ˈmʏnstɐ] (listen); Low German: Mönster) is an independent city (Kreisfreie Stadt) in North Rhine-Westphalia, Germany. It is in the northern part of the state and is considered to be the cultural centre of the Westphalia region. It is also a state district capital. Münster was the location of the Anabaptist rebellion during the Protestant Reformation and the site of the signing of the Treaty of Westphalia ending the Thirty Years' War in 1648. Today it is known as the bicycle capital of Germany.Münster gained the status of a Großstadt (major city) with more than 100,000 inhabitants in 1915. As of 2014, there are 300,000 people living in the city, with about 61,500 students, only some of whom are recorded in the official population statistics as having their primary residence in Münster. Münster is a part of the metropolitan region (Euregio) with more than 1,000,000 inhabitants (Enschede, Hengelo, Gronau, Osnabrück)."
Kurt Gribl,"Kurt Gribl (born 29 August 1964 Augsburg, Germany) is a former Mayor of Augsburg, Bavaria, an office he held from 1 May 2008 to 30 April 2020. He is a member of the Christian Social Union of Bavaria."
Frank Baranowski,"Svenja Schulze (born 29 September 1968) is a German politician of the Social Democratic Party (SPD). She serves as Minister for Economic Cooperation and Development in the cabinet of Olaf Scholz. Schulz has been serving as member of the German Bundestag since 2021, representing North Rhine-Westphalia. Schulze served as the Minister for the Environment, Nature Conservation and Nuclear Safety in the fourth coalition government of Chancellor Angela Merkel from 2018 to 2021. From 15 July 2010 to 30 June 2017, she was Minister for Innovation, Science and Research in the state government of North Rhine-Westphalia."
Marcel Philipp,"Next.e.GO Mobile SE is a German manufacturer of electric vehicles and sustainable mobility systems based in Aachen. It was founded in 2015 as e.GO Mobile AG by RWTH Aachen-professor Günther Schuh. Schuh co-founded the electric van company StreetScooter in 2010, which was acquired by Deutsche Post AG in 2014."
Gert Hoffmann,"Gert Günther Hoffmann (21 February 1929 – 17 November 1997) was a German actor and director. He achieved fame in German film and television as a voice actor in dubbing.He was the official voice of Sean Connery in the German language, as well as of Paul Newman, William Shatner in Star Trek (both TOS and most of the theatrical films) and Patrick Macnee in The Avengers for German TV."
Barbara Ludwig,"Barbara Goette (26 July 1908 – 23 October 1997) was an academic who lived in Germany and then Australia. From 1935 to 1943, she was the private secretary of Ludwig Roselius, creator of Böttcherstraße and Café HAG, and financier of Focke-Wulf."
